{
  "type": "FeatureCollection",
  "features": [
    {
      "type": "Feature",
      "geometry": null,
      "properties": {
        "upid": "UNP-1",
        "n_intervenciones": 1,
        "nombre_up": "I.E. Liceo Departamental",
        "nombre_up_detalle": "Principal",
        "nombre_centro_gestor": "Secretaría de Educación",
        "direccion": "Kr 37 a 8 38",
        "tipo_equipamiento": "Instituciones Educativas",
        "clase_up": "Obras equipamientos",
        "comuna_corregimiento": "COMUNA 19",
        "comuna_corregimiento_2": null,
        "barrio_vereda": "Eucaristico",
        "barrio_vereda_2": null,
        "identificador": "Frente de Obra Ejecutada 2024 - P. Participativo 2024",
        "bpin": 2023760010039,
        "lat": null,
        "lon": null,
        "intervenciones": [
          {
            "intervencion_id": "UNP-1-01",
            "referencia_proceso": [
              "4143.010.32.0469-2024",
              "4143.010.32.0724-2024"
            ],
            "referencia_contrato": [
              "4143.010.26. 1314-2024",
              "4143.010.26.1.1317-2024"
            ],
            "url_proceso": "https://community.secop.gov.co/Public/Tendering/ContractNoticePhases/View?PPI=CO1.PPI.31482960&isFromPublicArea=True&isModal=False",
            "bpin": 2023760010039,
            "estado": "Terminado",
            "tipo_intervencion": "Adecuaciones",
            "fuente_financiacion": "Presupuesto Participativo",
            "presupuesto_base": 412000000,
            "ano": 2024,
            "avance_obra": 100.0,
            "fecha_inicio": "2024-05-09T00:00:00",
            "fecha_fin": "2025-01-15T00:00:00",
            "fecha_inicio_std": "2024-05-09T00:00:00",
            "fecha_fin_std": "2025-01-15T00:00:00",
            "frente_activo": "No aplica",
            "fuera_rango": null
          }
        ],
        "presupuesto_base": 412000000,
        "avance_obra": 100.0
      }
    },
    {
      "type": "Feature",
      "geometry": null,
      "properties": {
        "upid": "UNP-2",
        "n_intervenciones": 4,
        "nombre_up": "Biblioteca Pública Centro Cultural Nuevo Latir - Certificada",
        "nombre_up_detalle": "Sede Principal",
        "nombre_centro_gestor": "Secretaría de Educación",
        "direccion": "Cl. 76 No. 28 - 20 hasta 27",
        "tipo_equipamiento": "Instituciones Educativas",
        "clase_up": "Obras equipamientos",
        "comuna_corregimiento": "COMUNA 14",
        "comuna_corregimiento_2": null,
        "barrio_vereda": "Alfonso Bonilla Aragón",
        "barrio_vereda_2": null,
        "identificador": "Salas de Bilingüismo",
        "bpin": 26005338,
        "lat": null,
        "lon": null,
        "intervenciones": [
          {
            "intervencion_id": "UNP-2-01",
            "referencia_proceso": null,
            "referencia_contrato": null,
            "url_proceso": null,
            "bpin": 26005338,
            "estado": "En alistamiento",
            "tipo_intervencion": "Adecuaciones",
            "fuente_financiacion": "Ingresos libre destinación",
            "presupuesto_base": 821120550,
            "ano": 2025,
            "avance_obra": 0.0,
            "fecha_inicio": 2025,
            "fecha_fin": "2025-12-31T00:00:00",
            "fecha_inicio_std": "2025-01-01T00:00:00",
            "fecha_fin_std": "2025-12-31T00:00:00",
            "frente_activo": "No aplica",
            "fuera_rango": null
          },
          {
            "intervencion_id": "UNP-2-02",
            "referencia_proceso": "4148.010.32.1.0979-2025",
            "referencia_contrato": "4148.010.26.1.1418-2025",
            "url_proceso": "https://community.secop.gov.co/Public/Tendering/OpportunityDetail/Index?noticeUID=CO1.NTC.8534337&isFromPublicArea=True&isModal=False",
            "bpin": 2024760010215,
            "estado": "En alistamiento",
            "tipo_intervencion": "Mantenimiento",
            "fuente_financiacion": "Empréstito",
            "presupuesto_base": 473537361,
            "ano": 2025,
            "avance_obra": 0.0,
            "fecha_inicio": "15-11-2025",
            "fecha_fin": "28-02-2026",
            "fecha_inicio_std": "2025-11-15T00:00:00",
            "fecha_fin_std": "2026-02-28T00:00:00",
            "frente_activo": "No aplica",
            "fuera_rango": null
          },
          {
            "intervencion_id": "UNP-2-03",
            "referencia_proceso": "4148.010.32.1.0424-2025",
            "referencia_contrato": "4148.010.26.1.0522-2025",
            "url_proceso": "https://community.secop.gov.co/Public/Tendering/OpportunityDetail/Index?noticeUID=CO1.NTC.7857151&isFromPublicArea=True&isModal=False",
            "bpin": 2024760010215,
            "estado": "Terminado",
            "tipo_intervencion": "Mantenimiento",
            "fuente_financiacion": "Ingresos libre destinación",
            "presupuesto_base": 55890341,
            "ano": 2025,
            "avance_obra": 100.0,
            "fecha_inicio": "13-05-2025",
            "fecha_fin": "15-12-2025",
            "fecha_inicio_std": "2025-05-13T00:00:00",
            "fecha_fin_std": "2025-12-15T00:00:00",
            "frente_activo": "No aplica",
            "fuera_rango": null
          },
          {
            "intervencion_id": "UNP-2-04",
            "referencia_proceso": "4148.010.32.1.0442-2025",
            "referencia_contrato": "4148.010.26.1.0519-2025",
            "url_proceso": "https://community.secop.gov.co/Public/Tendering/OpportunityDetail/Index?noticeUID=CO1.NTC.7813144&isFromPublicArea=True&isModal=False",
            "bpin": 2024760010215,
            "estado": "Terminado",
            "tipo_intervencion": "Mantenimiento",
            "fuente_financiacion": "Ingresos libre destinación",
            "presupuesto_base": 6451612,
            "ano": 2025,
            "avance_obra": 100.0,
            "fecha_inicio": "03-04-2025",
            "fecha_fin": "30-11-2025",
            "fecha_inicio_std": "2025-04-03T00:00:00",
            "fecha_fin_std": "2025-11-30T00:00:00",
            "frente_activo": "No aplica",
            "fuera_rango": null
          }
        ],
        "presupuesto_base": 1356999864,
        "avance_obra": 4.59
      }
    },
    {
      "type": "Feature",
      "geometry": null,
      "properties": {
        "upid": "UNP-3",
        "n_intervenciones": 1,
        "nombre_up": "Parque Colinas del Sur",
        "nombre_up_detalle": "• Recuperación Ambiental y Paisajística de Parques y Zonas Verdes. • Estrategias Educativas. • Interventoría a la Recuperación Ambiental y Paisajística.",
        "nombre_centro_gestor": "Departamento Administrativo de Gestión del Medio Ambiente",
        "direccion": "Carrera 74 Bis con Trasversal 2a Bis",
        "tipo_equipamiento": "Parques y zonas verdes",
        "clase_up": "Espacio Público",
        "comuna_corregimiento": "COMUNA 18",
        "comuna_corregimiento_2": null,
        "barrio_vereda": "Colinas del Sur",
        "barrio_vereda_2": null,
        "identificador": "Parque",
        "bpin": 2024760010279,
        "lat": null,
        "lon": null,
        "intervenciones": [
          {
            "intervencion_id": "UNP-3-01",
            "referencia_proceso": "4133.010.32.1.1601-2026",
            "referencia_contrato": "4133.010.27.1.021-2026",
            "url_proceso": "https://community.secop.gov.co/Public/Tendering/OpportunityDetail/Index?noticeUID=CO1.NTC.8535730&isFromPublicArea=True&isModal=False",
            "bpin": 2024760010279,
            "estado": "Suspendido",
            "tipo_intervencion": "Mantenimiento",
            "fuente_financiacion": "Ingresos libre destinación",
            "presupuesto_base": 117853593,
            "ano": 2025,
            "avance_obra": 0.0,
            "fecha_inicio": "2025-08-01T00:00:00",
            "fecha_fin": "2025-12-15T00:00:00",
            "fecha_inicio_std": "2025-08-01T00:00:00",
            "fecha_fin_std": "2025-12-15T00:00:00",
            "frente_activo": "No aplica",
            "fuera_rango": null
          }
        ],
        "presupuesto_base": 117853593,
        "avance_obra": 0.0
      }
    },
    {
      "type": "Feature",
      "geometry": null,
      "properties": {
        "upid": "UNP-4",
        "n_intervenciones": 3,
        "nombre_up": "Biblioteca Pública Centro de Emprendimiento Cultural Comuna 13 - Certificada",
        "nombre_up_detalle": "Sede Principal",
        "nombre_centro_gestor": "Secretaría de Cultura",
        "direccion": "Cr. 28 D No.70-91",
        "tipo_equipamiento": "Bibliotecas",
        "clase_up": "Obras equipamientos",
        "comuna_corregimiento": "COMUNA 13",
        "comuna_corregimiento_2": null,
        "barrio_vereda": "El Pondaje",
        "barrio_vereda_2": null,
        "identificador": "Mantenimiento Bibliotecas",
        "bpin": 2024760010215,
        "lat": null,
        "lon": null,
        "intervenciones": [
          {
            "intervencion_id": "UNP-4-01",
            "referencia_proceso": "4148.010.32.1.0979-2025",
            "referencia_contrato": "4148.010.26.1.1418-2025",
            "url_proceso": "https://community.secop.gov.co/Public/Tendering/OpportunityDetail/Index?noticeUID=CO1.NTC.8534337&isFromPublicArea=True&isModal=False",
            "bpin": 2024760010215,
            "estado": "En alistamiento",
            "tipo_intervencion": "Mantenimiento",
            "fuente_financiacion": "Empréstito",
            "presupuesto_base": 414672799,
            "ano": 2025,
            "avance_obra": 0.0,
            "fecha_inicio": "15-11-2025",
            "fecha_fin": "28-02-2026",
            "fecha_inicio_std": "2025-11-15T00:00:00",
            "fecha_fin_std": "2026-02-28T00:00:00",
            "frente_activo": "No aplica",
            "fuera_rango": null
          },
          {
            "intervencion_id": "UNP-4-02",
            "referencia_proceso": "4148.010.32.1.0424-2025",
            "referencia_contrato": "4148.010.26.1.0522-2025",
            "url_proceso": "https://community.secop.gov.co/Public/Tendering/OpportunityDetail/Index?noticeUID=CO1.NTC.7857151&isFromPublicArea=True&isModal=False",
            "bpin": 2024760010215,
            "estado": "Terminado",
            "tipo_intervencion": "Mantenimiento",
            "fuente_financiacion": "Ingresos libre destinación",
            "presupuesto_base": 98543220,
            "ano": 2025,
            "avance_obra": 100.0,
            "fecha_inicio": "13-05-2025",
            "fecha_fin": "15-12-2025",
            "fecha_inicio_std": "2025-05-13T00:00:00",
            "fecha_fin_std": "2025-12-15T00:00:00",
            "frente_activo": "No aplica",
            "fuera_rango": null
          },
          {
            "intervencion_id": "UNP-4-03",
            "referencia_proceso": "4148.010.32.1.0442-2025",
            "referencia_contrato": "4148.010.26.1.0519-2025",
            "url_proceso": "https://community.secop.gov.co/Public/Tendering/OpportunityDetail/Index?noticeUID=CO1.NTC.7813144&isFromPublicArea=True&isModal=False",
            "bpin": 2024760010215,
            "estado": "Terminado",
            "tipo_intervencion": "Mantenimiento",
            "fuente_financiacion": "Ingresos libre destinación",
            "presupuesto_base": 6451612,
            "ano": 2025,
            "avance_obra": 100.0,
            "fecha_inicio": "03-04-2025",
            "fecha_fin": "30-11-2025",
            "fecha_inicio_std": "2025-04-03T00:00:00",
            "fecha_fin_std": "2025-11-30T00:00:00",
            "frente_activo": "No aplica",
            "fuera_rango": null
          }
        ],
        "presupuesto_base": 519667631,
        "avance_obra": 20.2
      }
    },
    {
      "type": "Feature",
      "geometry": null,
      "properties": {
        "upid": "UNP-5",
        "n_intervenciones": 2,
        "nombre_up": "Parque Obrero",
        "nombre_up_detalle": "Sede Principal",
        "nombre_centro_gestor": "Secretaría de Cultura",
        "direccion": "Obrero",
        "tipo_equipamiento": "Infraestructura cultural",
        "clase_up": "Obras equipamientos",
        "comuna_corregimiento": "COMUNA 09",
        "comuna_corregimiento_2": null,
        "barrio_vereda": "Obrero",
        "barrio_vereda_2": null,
        "identificador": "Obras Fase Ii para la Implementación del Recorrido Patrimonial del Complejo Musical- Dancístico de la Salsa en el Barrio Obrero",
        "bpin": 2024760010006,
        "lat": null,
        "lon": null,
        "intervenciones": [
          {
            "intervencion_id": "UNP-5-01",
            "referencia_proceso": null,
            "referencia_contrato": null,
            "url_proceso": "Pendiente",
            "bpin": 2024760010006,
            "estado": "En alistamiento",
            "tipo_intervencion": "Obra nueva",
            "fuente_financiacion": "Empréstito",
            "presupuesto_base": 39000000000,
            "ano": 2026,
            "avance_obra": 0.0,
            "fecha_inicio": "01-03-2026",
            "fecha_fin": "2027-10-31T00:00:00",
            "fecha_inicio_std": "2026-03-01T00:00:00",
            "fecha_fin_std": "2027-10-31T00:00:00",
            "frente_activo": "No aplica",
            "fuera_rango": null
          },
          {
            "intervencion_id": "UNP-5-02",
            "referencia_proceso": "4148.010.32.1.0737-2024",
            "referencia_contrato": "4148.010.26.1.0837-2024",
            "url_proceso": "https://community.secop.gov.co/Public/Tendering/OpportunityDetail/Index?noticeUID=CO1.NTC.6243231&isFromPublicArea=True&isModal=False",
            "bpin": 2024760010006,
            "estado": "En ejecución",
            "tipo_intervencion": "Obra nueva",
            "fuente_financiacion": "Ingresos libre destinación",
            "presupuesto_base": 11571833911,
            "ano": 2024,
            "avance_obra": 38.0,
            "fecha_inicio": "24-06-2024",
            "fecha_fin": "30-04-2026",
            "fecha_inicio_std": "2024-06-24T00:00:00",
            "fecha_fin_std": "2026-04-30T00:00:00",
            "frente_activo": "Frente activo",
            "fuera_rango": null
          }
        ],
        "presupuesto_base": 50571833911,
        "avance_obra": 8.7
      }
    },
    {
      "type": "Feature",
      "geometry": null,
      "properties": {
        "upid": "UNP-6",
        "n_intervenciones": 2,
        "nombre_up": "Parque Cultural Parque Pacífico",
        "nombre_up_detalle": "Sede Principal",
        "nombre_centro_gestor": "Secretaría de Cultura",
        "direccion": "Avenida 2n entre Calle 26 y Calle 32n",
        "tipo_equipamiento": "Eco parques",
        "clase_up": "Obras equipamientos",
        "comuna_corregimiento": "COMUNA 02",
        "comuna_corregimiento_2": null,
        "barrio_vereda": "Berlin",
        "barrio_vereda_2": null,
        "identificador": "Construcción de Obra Fase Ii Parque de Artesanias, Bebidas y Comidas - Plataforma Cultural Parque Pacifico",
        "bpin": 2023760010179,
        "lat": null,
        "lon": null,
        "intervenciones": [
          {
            "intervencion_id": "UNP-6-01",
            "referencia_proceso": null,
            "referencia_contrato": null,
            "url_proceso": "Pendiente",
            "bpin": 2023760010179,
            "estado": "En alistamiento",
            "tipo_intervencion": "Obra nueva",
            "fuente_financiacion": "Empréstito",
            "presupuesto_base": 16000000000,
            "ano": 2026,
            "avance_obra": 0.0,
            "fecha_inicio": "01-04-2026",
            "fecha_fin": "2027-10-31T00:00:00",
            "fecha_inicio_std": "2026-04-01T00:00:00",
            "fecha_fin_std": "2027-10-31T00:00:00",
            "frente_activo": "No aplica",
            "fuera_rango": null
          },
          {
            "intervencion_id": "UNP-6-02",
            "referencia_proceso": "4148.010.32.1.083-2022",
            "referencia_contrato": "4148.010.26.1.083-2022",
            "url_proceso": "https://community.secop.gov.co/Public/Tendering/OpportunityDetail/Index?noticeUID=CO1.NTC.2901902&isFromPublicArea=True&isModal=False",
            "bpin": 2020760010823,
            "estado": "En ejecución",
            "tipo_intervencion": "Obra nueva",
            "fuente_financiacion": "Ingresos libre destinación",
            "presupuesto_base": 27386700133,
            "ano": 2024,
            "avance_obra": 76.0,
            "fecha_inicio": "15-07-2022",
            "fecha_fin": "20-10-2025",
            "fecha_inicio_std": "2022-07-15T00:00:00",
            "fecha_fin_std": "2025-10-20T00:00:00",
            "frente_activo": "Frente activo",
            "fuera_rango": null
          }
        ],
        "presupuesto_base": 43386700133,
        "avance_obra": 47.97
      }
    },
    {
      "type": "Feature",
      "geometry": null,
      "properties": {
        "upid": "UNP-7",
        "n_intervenciones": 5,
        "nombre_up": "Biblioteca Pública Daniel Guillard - Certificada",
        "nombre_up_detalle": "Sede Principal",
        "nombre_centro_gestor": "Secretaría de Cultura",
        "direccion": "Cra. 26t #72w23",
        "tipo_equipamiento": "Bibliotecas",
        "clase_up": "Obras equipamientos",
        "comuna_corregimiento": "COMUNA 13",
        "comuna_corregimiento_2": null,
        "barrio_vereda": "Los Lagos",
        "barrio_vereda_2": null,
        "identificador": "Mantenimiento Climatización Bibliotecas",
        "bpin": 2024760010215,
        "lat": null,
        "lon": null,
        "intervenciones": [
          {
            "intervencion_id": "UNP-7-01",
            "referencia_proceso": "4148.010.32.1.0442-2025",
            "referencia_contrato": "4148.010.26.1.0519-2025",
            "url_proceso": "https://community.secop.gov.co/Public/Tendering/OpportunityDetail/Index?noticeUID=CO1.NTC.7813144&isFromPublicArea=True&isModal=False",
            "bpin": 2024760010215,
            "estado": "Terminado",
            "tipo_intervencion": "Mantenimiento",
            "fuente_financiacion": "Ingresos libre destinación",
            "presupuesto_base": 6451612,
            "ano": 2025,
            "avance_obra": 100.0,
            "fecha_inicio": "03-04-2025",
            "fecha_fin": "30-11-2025",
            "fecha_inicio_std": "2025-04-03T00:00:00",
            "fecha_fin_std": "2025-11-30T00:00:00",
            "frente_activo": "No aplica",
            "fuera_rango": null
          },
          {
            "intervencion_id": "UNP-7-02",
            "referencia_proceso": "4148.010.32.1.0424-2025",
            "referencia_contrato": "4148.010.26.1.0522-2025",
            "url_proceso": "https://community.secop.gov.co/Public/Tendering/OpportunityDetail/Index?noticeUID=CO1.NTC.7857151&isFromPublicArea=True&isModal=False",
            "bpin": 2024760010215,
            "estado": "Terminado",
            "tipo_intervencion": "Mantenimiento",
            "fuente_financiacion": "Ingresos libre destinación",
            "presupuesto_base": 6861959,
            "ano": 2025,
            "avance_obra": 100.0,
            "fecha_inicio": "13-05-2025",
            "fecha_fin": "15-12-2025",
            "fecha_inicio_std": "2025-05-13T00:00:00",
            "fecha_fin_std": "2025-12-15T00:00:00",
            "frente_activo": "No aplica",
            "fuera_rango": null
          },
          {
            "intervencion_id": "UNP-7-03",
            "referencia_proceso": "4148.010.32.1.0864-2024",
            "referencia_contrato": "4148.010.26.1.0900-2024",
            "url_proceso": "https://community.secop.gov.co/Public/Tendering/OpportunityDetail/Index?noticeUID=CO1.NTC.6340585&isFromPublicArea=True&isModal=False",
            "bpin": 2024760010215,
            "estado": "Terminado",
            "tipo_intervencion": "Mantenimiento",
            "fuente_financiacion": "Ingresos libre destinación",
            "presupuesto_base": 2161764,
            "ano": 2024,
            "avance_obra": 100.0,
            "fecha_inicio": "26-09-2024",
            "fecha_fin": "30-01-2025",
            "fecha_inicio_std": "2024-09-26T00:00:00",
            "fecha_fin_std": "2025-01-30T00:00:00",
            "frente_activo": "No aplica",
            "fuera_rango": null
          },
          {
            "intervencion_id": "UNP-7-04",
            "referencia_proceso": "4148.010.32.1.0924-2025",
            "referencia_contrato": "4148.010.26.1.0912-2025",
            "url_proceso": "https://community.secop.gov.co/Public/Tendering/OpportunityDetail/Index?noticeUID=CO1.NTC.8222732&isFromPublicArea=True&isModal=False",
            "bpin": 2024760010215,
            "estado": "Terminado",
            "tipo_intervencion": "Mantenimiento",
            "fuente_financiacion": "Ingresos libre destinación",
            "presupuesto_base": 3021429,
            "ano": 2025,
            "avance_obra": 100.0,
            "fecha_inicio": "24-07-2025",
            "fecha_fin": "15-12-2025",
            "fecha_inicio_std": "2025-07-24T00:00:00",
            "fecha_fin_std": "2025-12-15T00:00:00",
            "frente_activo": "No aplica",
            "fuera_rango": null
          },
          {
            "intervencion_id": "UNP-7-05",
            "referencia_proceso": "4148.010.32.1.0924-2025",
            "referencia_contrato": "4148.010.26.1.0912-2025",
            "url_proceso": "https://community.secop.gov.co/Public/Tendering/OpportunityDetail/Index?noticeUID=CO1.NTC.8222732&isFromPublicArea=True&isModal=False",
            "bpin": 2024760010215,
            "estado": "Terminado",
            "tipo_intervencion": "Mantenimiento",
            "fuente_financiacion": "Ingresos libre destinación",
            "presupuesto_base": 3880000,
            "ano": 2025,
            "avance_obra": 100.0,
            "fecha_inicio": "24-07-2025",
            "fecha_fin": "15-12-2025",
            "fecha_inicio_std": "2025-07-24T00:00:00",
            "fecha_fin_std": "2025-12-15T00:00:00",
            "frente_activo": "No aplica",
            "fuera_rango": null
          }
        ],
        "presupuesto_base": 22376764,
        "avance_obra": 100.0
      }
    },
    {
      "type": "Feature",
      "geometry": null,
      "properties": {
        "upid": "UNP-8",
        "n_intervenciones": 3,
        "nombre_up": "Biblioteca Pública Antonio José Escobar",
        "nombre_up_detalle": "Sede Principal",
        "nombre_centro_gestor": "Secretaría de Cultura",
        "direccion": "Carrera 15 a # 52 - 118",
        "tipo_equipamiento": "Bibliotecas",
        "clase_up": "Obras equipamientos",
        "comuna_corregimiento": "COMUNA 08",
        "comuna_corregimiento_2": null,
        "barrio_vereda": "Chapinero",
        "barrio_vereda_2": null,
        "identificador": "Estudios y Diseños Bibliotecas Pública Antonio José Escobar",
        "bpin": 2024760010215,
        "lat": null,
        "lon": null,
        "intervenciones": [
          {
            "intervencion_id": "UNP-8-01",
            "referencia_proceso": "4148.010.32.1.0925-2025",
            "referencia_contrato": "4148.010.26.1.0923-2025",
            "url_proceso": "https://community.secop.gov.co/Public/Tendering/OpportunityDetail/Index?noticeUID=CO1.NTC.8222844&isFromPublicArea=True&isModal=False",
            "bpin": 2024760010215,
            "estado": "Terminado",
            "tipo_intervencion": "Estudios y diseños",
            "fuente_financiacion": "Ingresos libre destinación",
            "presupuesto_base": 61260605,
            "ano": 2025,
            "avance_obra": 100.0,
            "fecha_inicio": "25-07-2025",
            "fecha_fin": "31-10-2025",
            "fecha_inicio_std": "2025-07-25T00:00:00",
            "fecha_fin_std": "2025-10-31T00:00:00",
            "frente_activo": "No aplica",
            "fuera_rango": null
          },
          {
            "intervencion_id": "UNP-8-02",
            "referencia_proceso": "4148.010.32.1.0424-2025",
            "referencia_contrato": "4148.010.26.1.0522-2025",
            "url_proceso": "https://community.secop.gov.co/Public/Tendering/OpportunityDetail/Index?noticeUID=CO1.NTC.7857151&isFromPublicArea=True&isModal=False",
            "bpin": 2024760010215,
            "estado": "Terminado",
            "tipo_intervencion": "Mantenimiento",
            "fuente_financiacion": "Ingresos libre destinación",
            "presupuesto_base": 20381594,
            "ano": 2025,
            "avance_obra": 100.0,
            "fecha_inicio": "13-05-2025",
            "fecha_fin": "15-12-2025",
            "fecha_inicio_std": "2025-05-13T00:00:00",
            "fecha_fin_std": "2025-12-15T00:00:00",
            "frente_activo": "No aplica",
            "fuera_rango": null
          },
          {
            "intervencion_id": "UNP-8-03",
            "referencia_proceso": "4148.010.32.1.0442-2025",
            "referencia_contrato": "4148.010.26.1.0519-2025",
            "url_proceso": "https://community.secop.gov.co/Public/Tendering/OpportunityDetail/Index?noticeUID=CO1.NTC.7813144&isFromPublicArea=True&isModal=False",
            "bpin": 2024760010215,
            "estado": "Terminado",
            "tipo_intervencion": "Mantenimiento",
            "fuente_financiacion": "Ingresos libre destinación",
            "presupuesto_base": 4838709,
            "ano": 2025,
            "avance_obra": 100.0,
            "fecha_inicio": "03-04-2025",
            "fecha_fin": "30-11-2025",
            "fecha_inicio_std": "2025-04-03T00:00:00",
            "fecha_fin_std": "2025-11-30T00:00:00",
            "frente_activo": "No aplica",
            "fuera_rango": null
          }
        ],
        "presupuesto_base": 86480908,
        "avance_obra": 100.0
      }
    },
    {
      "type": "Feature",
      "geometry": null,
      "properties": {
        "upid": "UNP-9",
        "n_intervenciones": 10,
        "nombre_up": "Biblioteca Pública San Pedro Claver",
        "nombre_up_detalle": "Sede Principal",
        "nombre_centro_gestor": "Secretaría de Cultura",
        "direccion": "Cra. 7p con Cl. 73 Esquina",
        "tipo_equipamiento": "Bibliotecas",
        "clase_up": "Obras equipamientos",
        "comuna_corregimiento": "La Castellana",
        "comuna_corregimiento_2": null,
        "barrio_vereda": "Corregimiento La Leonera",
        "barrio_vereda_2": null,
        "identificador": "Mantenimiento Bibliotecas",
        "bpin": 2024760010215,
        "lat": null,
        "lon": null,
        "intervenciones": [
          {
            "intervencion_id": "UNP-9-01",
            "referencia_proceso": "4148.010.32.1.0424-2025",
            "referencia_contrato": "4148.010.26.1.0522-2025",
            "url_proceso": "https://community.secop.gov.co/Public/Tendering/OpportunityDetail/Index?noticeUID=CO1.NTC.7857151&isFromPublicArea=True&isModal=False",
            "bpin": 2024760010215,
            "estado": "Terminado",
            "tipo_intervencion": "Mantenimiento",
            "fuente_financiacion": "Ingresos libre destinación",
            "presupuesto_base": 6732651,
            "ano": 2025,
            "avance_obra": 100.0,
            "fecha_inicio": "13-05-2025",
            "fecha_fin": "15-12-2025",
            "fecha_inicio_std": "2025-05-13T00:00:00",
            "fecha_fin_std": "2025-12-15T00:00:00",
            "frente_activo": "No aplica",
            "fuera_rango": null
          },
          {
            "intervencion_id": "UNP-9-02",
            "referencia_proceso": "4148.010.32.1.0424-2025",
            "referencia_contrato": "4148.010.26.1.0522-2025",
            "url_proceso": "https://community.secop.gov.co/Public/Tendering/OpportunityDetail/Index?noticeUID=CO1.NTC.7857151&isFromPublicArea=True&isModal=False",
            "bpin": 2024760010215,
            "estado": "Terminado",
            "tipo_intervencion": "Mantenimiento",
            "fuente_financiacion": "Ingresos libre destinación",
            "presupuesto_base": 282870,
            "ano": 2025,
            "avance_obra": 100.0,
            "fecha_inicio": "13-05-2025",
            "fecha_fin": "15-12-2025",
            "fecha_inicio_std": "2025-05-13T00:00:00",
            "fecha_fin_std": "2025-12-15T00:00:00",
            "frente_activo": "No aplica",
            "fuera_rango": null
          },
          {
            "intervencion_id": "UNP-9-03",
            "referencia_proceso": "4148.010.32.1.0424-2025",
            "referencia_contrato": "4148.010.26.1.0522-2025",
            "url_proceso": "https://community.secop.gov.co/Public/Tendering/OpportunityDetail/Index?noticeUID=CO1.NTC.7857151&isFromPublicArea=True&isModal=False",
            "bpin": 2024760010215,
            "estado": "Terminado",
            "tipo_intervencion": "Mantenimiento",
            "fuente_financiacion": "Ingresos libre destinación",
            "presupuesto_base": 3847057,
            "ano": 2025,
            "avance_obra": 100.0,
            "fecha_inicio": "13-05-2025",
            "fecha_fin": "15-12-2025",
            "fecha_inicio_std": "2025-05-13T00:00:00",
            "fecha_fin_std": "2025-12-15T00:00:00",
            "frente_activo": "No aplica",
            "fuera_rango": null
          },
          {
            "intervencion_id": "UNP-9-04",
            "referencia_proceso": "4148.010.32.1.0424-2025",
            "referencia_contrato": "4148.010.26.1.0522-2025",
            "url_proceso": "https://community.secop.gov.co/Public/Tendering/OpportunityDetail/Index?noticeUID=CO1.NTC.7857151&isFromPublicArea=True&isModal=False",
            "bpin": 2024760010215,
            "estado": "Terminado",
            "tipo_intervencion": "Mantenimiento",
            "fuente_financiacion": "Ingresos libre destinación",
            "presupuesto_base": 30110812,
            "ano": 2025,
            "avance_obra": 100.0,
            "fecha_inicio": "13-05-2025",
            "fecha_fin": "15-12-2025",
            "fecha_inicio_std": "2025-05-13T00:00:00",
            "fecha_fin_std": "2025-12-15T00:00:00",
            "frente_activo": "No aplica",
            "fuera_rango": null
          },
          {
            "intervencion_id": "UNP-9-05",
            "referencia_proceso": "4148.010.32.1.0424-2025",
            "referencia_contrato": "4148.010.26.1.0522-2025",
            "url_proceso": "https://community.secop.gov.co/Public/Tendering/OpportunityDetail/Index?noticeUID=CO1.NTC.7857151&isFromPublicArea=True&isModal=False",
            "bpin": 2024760010215,
            "estado": "Terminado",
            "tipo_intervencion": "Mantenimiento",
            "fuente_financiacion": "Ingresos libre destinación",
            "presupuesto_base": 16372595,
            "ano": 2025,
            "avance_obra": 100.0,
            "fecha_inicio": "13-05-2025",
            "fecha_fin": "15-12-2025",
            "fecha_inicio_std": "2025-05-13T00:00:00",
            "fecha_fin_std": "2025-12-15T00:00:00",
            "frente_activo": "No aplica",
            "fuera_rango": null
          },
          {
            "intervencion_id": "UNP-9-06",
            "referencia_proceso": "4148.010.32.1.0424-2025",
            "referencia_contrato": "4148.010.26.1.0522-2025",
            "url_proceso": "https://community.secop.gov.co/Public/Tendering/OpportunityDetail/Index?noticeUID=CO1.NTC.7857151&isFromPublicArea=True&isModal=False",
            "bpin": 2024760010215,
            "estado": "Terminado",
            "tipo_intervencion": "Mantenimiento",
            "fuente_financiacion": "Ingresos libre destinación",
            "presupuesto_base": 4442036,
            "ano": 2025,
            "avance_obra": 100.0,
            "fecha_inicio": "13-05-2025",
            "fecha_fin": "15-12-2025",
            "fecha_inicio_std": "2025-05-13T00:00:00",
            "fecha_fin_std": "2025-12-15T00:00:00",
            "frente_activo": "No aplica",
            "fuera_rango": null
          },
          {
            "intervencion_id": "UNP-9-07",
            "referencia_proceso": "4148.010.32.1.0864-2024",
            "referencia_contrato": "4148.010.26.1.0900-2024",
            "url_proceso": "https://community.secop.gov.co/Public/Tendering/OpportunityDetail/Index?noticeUID=CO1.NTC.6340585&isFromPublicArea=True&isModal=False",
            "bpin": 2024760010215,
            "estado": "Terminado",
            "tipo_intervencion": "Mantenimiento",
            "fuente_financiacion": "Ingresos libre destinación",
            "presupuesto_base": 2161764,
            "ano": 2024,
            "avance_obra": 100.0,
            "fecha_inicio": "26-09-2024",
            "fecha_fin": "30-01-2025",
            "fecha_inicio_std": "2024-09-26T00:00:00",
            "fecha_fin_std": "2025-01-30T00:00:00",
            "frente_activo": "No aplica",
            "fuera_rango": null
          },
          {
            "intervencion_id": "UNP-9-08",
            "referencia_proceso": "4148.010.32.1.0442-2025",
            "referencia_contrato": "4148.010.26.1.0519-2025",
            "url_proceso": "https://community.secop.gov.co/Public/Tendering/OpportunityDetail/Index?noticeUID=CO1.NTC.7813144&isFromPublicArea=True&isModal=False",
            "bpin": 2024760010215,
            "estado": "Terminado",
            "tipo_intervencion": "Mantenimiento",
            "fuente_financiacion": "Ingresos libre destinación",
            "presupuesto_base": 4838709,
            "ano": 2025,
            "avance_obra": 100.0,
            "fecha_inicio": "03-04-2025",
            "fecha_fin": "30-11-2025",
            "fecha_inicio_std": "2025-04-03T00:00:00",
            "fecha_fin_std": "2025-11-30T00:00:00",
            "frente_activo": "No aplica",
            "fuera_rango": null
          },
          {
            "intervencion_id": "UNP-9-09",
            "referencia_proceso": "4148.010.32.1.0442-2025",
            "referencia_contrato": "4148.010.26.1.0519-2025",
            "url_proceso": "https://community.secop.gov.co/Public/Tendering/OpportunityDetail/Index?noticeUID=CO1.NTC.7813144&isFromPublicArea=True&isModal=False",
            "bpin": 2024760010215,
            "estado": "Terminado",
            "tipo_intervencion": "Mantenimiento",
            "fuente_financiacion": "Ingresos libre destinación",
            "presupuesto_base": 6451612,
            "ano": 2025,
            "avance_obra": 100.0,
            "fecha_inicio": "03-04-2025",
            "fecha_fin": "30-11-2025",
            "fecha_inicio_std": "2025-04-03T00:00:00",
            "fecha_fin_std": "2025-11-30T00:00:00",
            "frente_activo": "No aplica",
            "fuera_rango": null
          },
          {
            "intervencion_id": "UNP-9-10",
            "referencia_proceso": "4148.010.32.1.0442-2025",
            "referencia_contrato": "4148.010.26.1.0519-2025",
            "url_proceso": "https://community.secop.gov.co/Public/Tendering/OpportunityDetail/Index?noticeUID=CO1.NTC.7813144&isFromPublicArea=True&isModal=False",
            "bpin": 2024760010215,
            "estado": "Terminado",
            "tipo_intervencion": "Mantenimiento",
            "fuente_financiacion": "Ingresos libre destinación",
            "presupuesto_base": 3225806,
            "ano": 2025,
            "avance_obra": 100.0,
            "fecha_inicio": "03-04-2025",
            "fecha_fin": "30-11-2025",
            "fecha_inicio_std": "2025-04-03T00:00:00",
            "fecha_fin_std": "2025-11-30T00:00:00",
            "frente_activo": "No aplica",
            "fuera_rango": null
          }
        ],
        "presupuesto_base": 78465912,
        "avance_obra": 100.0
      }
    },
    {
      "type": "Feature",
      "geometry": null,
      "properties": {
        "upid": "UNP-10",
        "n_intervenciones": 3,
        "nombre_up": "Biblioteca Pública del Deporte y la Recreación - Certificada",
        "nombre_up_detalle": "Sede Principal",
        "nombre_centro_gestor": "Secretaría de Cultura",
        "direccion": "Cra. 34 con Cl. 5b",
        "tipo_equipamiento": "Bibliotecas",
        "clase_up": "Obras equipamientos",
        "comuna_corregimiento": "COMUNA 19",
        "comuna_corregimiento_2": null,
        "barrio_vereda": "San Fernando",
        "barrio_vereda_2": null,
        "identificador": "Mantenimiento Bibliotecas",
        "bpin": 2024760010215,
        "lat": null,
        "lon": null,
        "intervenciones": [
          {
            "intervencion_id": "UNP-10-01",
            "referencia_proceso": "4148.010.32.1.0424-2025",
            "referencia_contrato": "4148.010.26.1.0522-2025",
            "url_proceso": "https://community.secop.gov.co/Public/Tendering/OpportunityDetail/Index?noticeUID=CO1.NTC.7857151&isFromPublicArea=True&isModal=False",
            "bpin": 2024760010215,
            "estado": "Terminado",
            "tipo_intervencion": "Mantenimiento",
            "fuente_financiacion": "Ingresos libre destinación",
            "presupuesto_base": 2579206,
            "ano": 2025,
            "avance_obra": 100.0,
            "fecha_inicio": "13-05-2025",
            "fecha_fin": "15-12-2025",
            "fecha_inicio_std": "2025-05-13T00:00:00",
            "fecha_fin_std": "2025-12-15T00:00:00",
            "frente_activo": "No aplica",
            "fuera_rango": null
          },
          {
            "intervencion_id": "UNP-10-02",
            "referencia_proceso": "4148.010.32.1.0424-2025",
            "referencia_contrato": "4148.010.26.1.0522-2025",
            "url_proceso": "https://community.secop.gov.co/Public/Tendering/OpportunityDetail/Index?noticeUID=CO1.NTC.7857151&isFromPublicArea=True&isModal=False",
            "bpin": 2024760010215,
            "estado": "Terminado",
            "tipo_intervencion": "Mantenimiento",
            "fuente_financiacion": "Ingresos libre destinación",
            "presupuesto_base": 24152542,
            "ano": 2025,
            "avance_obra": 100.0,
            "fecha_inicio": "13-05-2025",
            "fecha_fin": "15-12-2025",
            "fecha_inicio_std": "2025-05-13T00:00:00",
            "fecha_fin_std": "2025-12-15T00:00:00",
            "frente_activo": "No aplica",
            "fuera_rango": null
          },
          {
            "intervencion_id": "UNP-10-03",
            "referencia_proceso": "4148.010.32.1.0442-2025",
            "referencia_contrato": "4148.010.26.1.0519-2025",
            "url_proceso": "https://community.secop.gov.co/Public/Tendering/OpportunityDetail/Index?noticeUID=CO1.NTC.7813144&isFromPublicArea=True&isModal=False",
            "bpin": 2024760010215,
            "estado": "Terminado",
            "tipo_intervencion": "Mantenimiento",
            "fuente_financiacion": "Ingresos libre destinación",
            "presupuesto_base": 4838709,
            "ano": 2025,
            "avance_obra": 100.0,
            "fecha_inicio": "03-04-2025",
            "fecha_fin": "30-11-2025",
            "fecha_inicio_std": "2025-04-03T00:00:00",
            "fecha_fin_std": "2025-11-30T00:00:00",
            "frente_activo": "No aplica",
            "fuera_rango": null
          }
        ],
        "presupuesto_base": 31570457,
        "avance_obra": 100.0
      }
    },
    {
      "type": "Feature",
      "geometry": null,
      "properties": {
        "upid": "UNP-11",
        "n_intervenciones": 1,
        "nombre_up": "Biblioteca Publica Isaias Gamboa",
        "nombre_up_detalle": "Sede Principal",
        "nombre_centro_gestor": "Secretaría de Cultura",
        "direccion": "Cl. 32a Norte No. 3an - 05",
        "tipo_equipamiento": "Bibliotecas",
        "clase_up": "Obras equipamientos",
        "comuna_corregimiento": "COMUNA 04",
        "comuna_corregimiento_2": null,
        "barrio_vereda": "Berlín",
        "barrio_vereda_2": null,
        "identificador": "Mantenimiento Bibliotecas",
        "bpin": 2024760010215,
        "lat": null,
        "lon": null,
        "intervenciones": [
          {
            "intervencion_id": "UNP-11-01",
            "referencia_proceso": "4148.010.32.1.0424-2025",
            "referencia_contrato": "4148.010.26.1.0522-2025",
            "url_proceso": "https://community.secop.gov.co/Public/Tendering/OpportunityDetail/Index?noticeUID=CO1.NTC.7857151&isFromPublicArea=True&isModal=False",
            "bpin": 2024760010215,
            "estado": "Terminado",
            "tipo_intervencion": "Mantenimiento",
            "fuente_financiacion": "Ingresos libre destinación",
            "presupuesto_base": 8666586,
            "ano": 2025,
            "avance_obra": 100.0,
            "fecha_inicio": "13-05-2025",
            "fecha_fin": "15-12-2025",
            "fecha_inicio_std": "2025-05-13T00:00:00",
            "fecha_fin_std": "2025-12-15T00:00:00",
            "frente_activo": "No aplica",
            "fuera_rango": null
          }
        ],
        "presupuesto_base": 8666586,
        "avance_obra": 100.0
      }
    },
    {
      "type": "Feature",
      "geometry": null,
      "properties": {
        "upid": "UNP-12",
        "n_intervenciones": 2,
        "nombre_up": "Centro Cultural Brisas de Mayo, Comuna 20",
        "nombre_up_detalle": "Sede Principal",
        "nombre_centro_gestor": "Secretaría de Cultura",
        "direccion": "Cra. 54 Oeste No.10-28",
        "tipo_equipamiento": "Bibliotecas",
        "clase_up": "Obras equipamientos",
        "comuna_corregimiento": "COMUNA 20",
        "comuna_corregimiento_2": null,
        "barrio_vereda": "Brisas de Mayo",
        "barrio_vereda_2": null,
        "identificador": "Mantenimiento Transporte Vertical y Ascensor Centenario",
        "bpin": 2024760010215,
        "lat": null,
        "lon": null,
        "intervenciones": [
          {
            "intervencion_id": "UNP-12-01",
            "referencia_proceso": "4148.010.32.1.0864-2024",
            "referencia_contrato": "4148.010.26.1.0900-2024",
            "url_proceso": "https://community.secop.gov.co/Public/Tendering/OpportunityDetail/Index?noticeUID=CO1.NTC.6340585&isFromPublicArea=True&isModal=False",
            "bpin": 2024760010215,
            "estado": "Terminado",
            "tipo_intervencion": "Mantenimiento",
            "fuente_financiacion": "Ingresos libre destinación",
            "presupuesto_base": 2161764,
            "ano": 2024,
            "avance_obra": 100.0,
            "fecha_inicio": "26-09-2024",
            "fecha_fin": "30-01-2025",
            "fecha_inicio_std": "2024-09-26T00:00:00",
            "fecha_fin_std": "2025-01-30T00:00:00",
            "frente_activo": "No aplica",
            "fuera_rango": null
          },
          {
            "intervencion_id": "UNP-12-02",
            "referencia_proceso": "4148.010.32.1.0864-2024",
            "referencia_contrato": "4148.010.26.1.0900-2024",
            "url_proceso": "https://community.secop.gov.co/Public/Tendering/OpportunityDetail/Index?noticeUID=CO1.NTC.6340585&isFromPublicArea=True&isModal=False",
            "bpin": 2024760010215,
            "estado": "Terminado",
            "tipo_intervencion": "Mantenimiento",
            "fuente_financiacion": "Ingresos libre destinación",
            "presupuesto_base": 2161764,
            "ano": 2024,
            "avance_obra": 100.0,
            "fecha_inicio": "26-09-2024",
            "fecha_fin": "30-01-2025",
            "fecha_inicio_std": "2024-09-26T00:00:00",
            "fecha_fin_std": "2025-01-30T00:00:00",
            "frente_activo": "No aplica",
            "fuera_rango": null
          }
        ],
        "presupuesto_base": 4323528,
        "avance_obra": 100.0
      }
    },
    {
      "type": "Feature",
      "geometry": null,
      "properties": {
        "upid": "UNP-13",
        "n_intervenciones": 2,
        "nombre_up": "Zona Verde del Barrio Ciudad Jardin",
        "nombre_up_detalle": "• Intervención en Obra Civil • Implementación del Componente Ambiental. • Limpieza Final • Adecuación Paisajística • Estrategia Educativa",
        "nombre_centro_gestor": "Departamento Administrativo de Gestión del Medio Ambiente",
        "direccion": "Cra 66 y Cra 65b entre Calle 13b y Calle 13 e Esq",
        "tipo_equipamiento": "Parques y zonas verdes",
        "clase_up": "Espacio Público",
        "comuna_corregimiento": "COMUNA 17",
        "comuna_corregimiento_2": null,
        "barrio_vereda": "Urbanización Ciudad Jardín",
        "barrio_vereda_2": null,
        "identificador": "Parque",
        "bpin": 2024760010125,
        "lat": null,
        "lon": null,
        "intervenciones": [
          {
            "intervencion_id": "UNP-13-01",
            "referencia_proceso": "4133.010.32.1.1651-2042",
            "referencia_contrato": "4133.010.27.1.035-2042",
            "url_proceso": "https://community.secop.gov.co/Public/Tendering/OpportunityDetail/Index?noticeUID=CO1.NTC.8535730&isFromPublicArea=True&isModal=False",
            "bpin": 2024760010125,
            "estado": "Suspendido",
            "tipo_intervencion": "Mantenimiento",
            "fuente_financiacion": "Ingresos libre destinación",
            "presupuesto_base": 77823158,
            "ano": 2025,
            "avance_obra": 0.0,
            "fecha_inicio": "2025-08-01T00:00:00",
            "fecha_fin": "2025-12-15T00:00:00",
            "fecha_inicio_std": "2025-08-01T00:00:00",
            "fecha_fin_std": "2025-12-15T00:00:00",
            "frente_activo": "No aplica",
            "fuera_rango": null
          },
          {
            "intervencion_id": "UNP-13-02",
            "referencia_proceso": "4133.010.32.1.1651-2047",
            "referencia_contrato": "4133.010.27.1.035-2047",
            "url_proceso": "https://community.secop.gov.co/Public/Tendering/OpportunityDetail/Index?noticeUID=CO1.NTC.8535730&isFromPublicArea=True&isModal=False",
            "bpin": 2024760010125,
            "estado": "Suspendido",
            "tipo_intervencion": "Mantenimiento",
            "fuente_financiacion": "Ingresos libre destinación",
            "presupuesto_base": 77823158,
            "ano": 2025,
            "avance_obra": 0.0,
            "fecha_inicio": "2025-08-01T00:00:00",
            "fecha_fin": "2025-12-15T00:00:00",
            "fecha_inicio_std": "2025-08-01T00:00:00",
            "fecha_fin_std": "2025-12-15T00:00:00",
            "frente_activo": "No aplica",
            "fuera_rango": null
          }
        ],
        "presupuesto_base": 155646316,
        "avance_obra": 0.0
      }
    },
    {
      "type": "Feature",
      "geometry": null,
      "properties": {
        "upid": "UNP-14",
        "n_intervenciones": 1,
        "nombre_up": "Jardines de la Semana de la Biodiversidad",
        "nombre_up_detalle": "• Limpieza y Retiro de Prado y Arvenses (malezas) • Jornadas de Jardinería • Jornadas Control Hormiga Arriera • Jornadas Control Caracol Africano",
        "nombre_centro_gestor": "Departamento Administrativo de Gestión del Medio Ambiente",
        "direccion": "Zona Verde Rio Cali",
        "tipo_equipamiento": "Parques y zonas verdes",
        "clase_up": "Espacio Público",
        "comuna_corregimiento": "COMUNA 02",
        "comuna_corregimiento_2": null,
        "barrio_vereda": "Normandia Sebastian de Belalcazar",
        "barrio_vereda_2": null,
        "identificador": "Jardines",
        "bpin": 0,
        "lat": null,
        "lon": null,
        "intervenciones": [
          {
            "intervencion_id": "UNP-14-01",
            "referencia_proceso": "4133.010.32.1.1602-2025",
            "referencia_contrato": "4133.010.27.1.025-2025",
            "url_proceso": "https://www.secop.gov.co/CO1BusinessLine/Tendering/ContractNoticeView/Index?prevCtxLbl=Buscar+procesos&prevCtxUrl=https%3a%2f%2fwww.secop.gov.co%3a443%2fCO1BusinessLine%2fTendering%2fContractNoticeManagement%2fIndex&notice=CO1.NTC.8535603",
            "bpin": 0,
            "estado": "Terminado",
            "tipo_intervencion": "Mantenimiento",
            "fuente_financiacion": "Ingresos libre destinación",
            "presupuesto_base": 1053287778,
            "ano": 2025,
            "avance_obra": 100.0,
            "fecha_inicio": "2025-08-01T00:00:00",
            "fecha_fin": "2025-12-15T00:00:00",
            "fecha_inicio_std": "2025-08-01T00:00:00",
            "fecha_fin_std": "2025-12-15T00:00:00",
            "frente_activo": "No aplica",
            "fuera_rango": null
          }
        ],
        "presupuesto_base": 1053287778,
        "avance_obra": 100.0
      }
    },
    {
      "type": "Feature",
      "geometry": null,
      "properties": {
        "upid": "UNP-15",
        "n_intervenciones": 1,
        "nombre_up": "Paque Monumento el Ancla",
        "nombre_up_detalle": null,
        "nombre_centro_gestor": "Departamento Administrativo de Gestión del Medio Ambiente",
        "direccion": null,
        "tipo_equipamiento": "Parques y zonas verdes",
        "clase_up": "Espacio Público",
        "comuna_corregimiento": null,
        "comuna_corregimiento_2": null,
        "barrio_vereda": null,
        "barrio_vereda_2": null,
        "identificador": "Parque",
        "bpin": 2024760010125,
        "lat": null,
        "lon": null,
        "intervenciones": [
          {
            "intervencion_id": "UNP-15-01",
            "referencia_proceso": "4133.010.32.1.1651-2025",
            "referencia_contrato": "4133.010.27.1.035-2025",
            "url_proceso": "https://community.secop.gov.co/Public/Tendering/OpportunityDetail/Index?noticeUID=CO1.NTC.8535730&isFromPublicArea=True&isModal=False",
            "bpin": 2024760010125,
            "estado": "Suspendido",
            "tipo_intervencion": "Mantenimiento",
            "fuente_financiacion": "Ingresos libre destinación",
            "presupuesto_base": 0,
            "ano": 2025,
            "avance_obra": 0.0,
            "fecha_inicio": "2025-08-01T00:00:00",
            "fecha_fin": "2025-12-15T00:00:00",
            "fecha_inicio_std": "2025-08-01T00:00:00",
            "fecha_fin_std": "2025-12-15T00:00:00",
            "frente_activo": "No aplica",
            "fuera_rango": null
          }
        ],
        "presupuesto_base": 0,
        "avance_obra": 0.0
      }
    },
    {
      "type": "Feature",
      "geometry": null,
      "properties": {
        "upid": "UNP-16",
        "n_intervenciones": 1,
        "nombre_up": "Separador Vial Omar Torrijos",
        "nombre_up_detalle": null,
        "nombre_centro_gestor": "Departamento Administrativo de Gestión del Medio Ambiente",
        "direccion": null,
        "tipo_equipamiento": "Parques y zonas verdes",
        "clase_up": "Espacio Público",
        "comuna_corregimiento": null,
        "comuna_corregimiento_2": null,
        "barrio_vereda": null,
        "barrio_vereda_2": null,
        "identificador": "Separador Vial",
        "bpin": 2024760010125,
        "lat": null,
        "lon": null,
        "intervenciones": [
          {
            "intervencion_id": "UNP-16-01",
            "referencia_proceso": "4133.010.32.1.1651-2025",
            "referencia_contrato": "4133.010.27.1.035-2025",
            "url_proceso": "https://community.secop.gov.co/Public/Tendering/OpportunityDetail/Index?noticeUID=CO1.NTC.8535730&isFromPublicArea=True&isModal=False",
            "bpin": 2024760010125,
            "estado": "Suspendido",
            "tipo_intervencion": "Mantenimiento",
            "fuente_financiacion": "Ingresos libre destinación",
            "presupuesto_base": 0,
            "ano": 2025,
            "avance_obra": 0.0,
            "fecha_inicio": "2025-08-01T00:00:00",
            "fecha_fin": "2025-12-15T00:00:00",
            "fecha_inicio_std": "2025-08-01T00:00:00",
            "fecha_fin_std": "2025-12-15T00:00:00",
            "frente_activo": "No aplica",
            "fuera_rango": null
          }
        ],
        "presupuesto_base": 0,
        "avance_obra": 0.0
      }
    },
    {
      "type": "Feature",
      "geometry": null,
      "properties": {
        "upid": "UNP-17",
        "n_intervenciones": 2,
        "nombre_up": "Mantenimiento Infraestructura",
        "nombre_up_detalle": "Comisaria de Familia Octava - Villacolombia",
        "nombre_centro_gestor": "Secretaría de Seguridad y Justicia",
        "direccion": "Carrera 12e No. 49-00",
        "tipo_equipamiento": "CAD",
        "clase_up": "Obras equipamientos",
        "comuna_corregimiento": "COMUNA 08",
        "comuna_corregimiento_2": null,
        "barrio_vereda": "Villa Colombia",
        "barrio_vereda_2": null,
        "identificador": "Mantenimiento de la Infraestructura de los Despachos de Acceso a la Justicia del Distrito de Santiago de Cali.",
        "bpin": 2024760010271,
        "lat": null,
        "lon": null,
        "intervenciones": [
          {
            "intervencion_id": "UNP-17-01",
            "referencia_proceso": "4161.010.32.1.1106.2025",
            "referencia_contrato": "4161.010.26.1.1133.2025",
            "url_proceso": "https://community.secop.gov.co/Public/Tendering/OpportunityDetail/Index?noticeUID=CO1.NTC.8428443&isFromPublicArea=True&isModal=False",
            "bpin": 2024760010271,
            "estado": "Terminado",
            "tipo_intervencion": "Mantenimiento",
            "fuente_financiacion": "Ingresos libre destinación",
            "presupuesto_base": 49134391,
            "ano": 2025,
            "avance_obra": 100.0,
            "fecha_inicio": "45870",
            "fecha_fin": 46022,
            "fecha_inicio_std": "2025-08-01T00:00:00",
            "fecha_fin_std": "2025-12-31T00:00:00",
            "frente_activo": "No aplica",
            "fuera_rango": null
          },
          {
            "intervencion_id": "UNP-17-02",
            "referencia_proceso": "4161.010.32.1.1106.2025",
            "referencia_contrato": "4161.010.26.1.1133.2025",
            "url_proceso": "https://community.secop.gov.co/Public/Tendering/OpportunityDetail/Index?noticeUID=CO1.NTC.8428443&isFromPublicArea=True&isModal=False",
            "bpin": 2024760010271,
            "estado": "Terminado",
            "tipo_intervencion": "Mantenimiento",
            "fuente_financiacion": "Ingresos libre destinación",
            "presupuesto_base": 54365754,
            "ano": 2024,
            "avance_obra": 100.0,
            "fecha_inicio": "1/08/2025",
            "fecha_fin": "2025-12-31T00:00:00",
            "fecha_inicio_std": "2025-01-08T00:00:00",
            "fecha_fin_std": "2025-12-31T00:00:00",
            "frente_activo": "No aplica",
            "fuera_rango": null
          }
        ],
        "presupuesto_base": 103500145,
        "avance_obra": 100.0
      }
    },
    {
      "type": "Feature",
      "geometry": null,
      "properties": {
        "upid": "UNP-18",
        "n_intervenciones": 1,
        "nombre_up": "Estaciones de Policia",
        "nombre_up_detalle": "Estacion de Policia Nueva Floresta.",
        "nombre_centro_gestor": "Secretaría de Seguridad y Justicia",
        "direccion": "Calle 44 # 24b-00",
        "tipo_equipamiento": "Estaciones de policia",
        "clase_up": "Obras equipamientos",
        "comuna_corregimiento": "COMUNA 12",
        "comuna_corregimiento_2": null,
        "barrio_vereda": "Nueva Floresta",
        "barrio_vereda_2": null,
        "identificador": "Adecuaciones de la Infraestructura de las Estaciones de Policía",
        "bpin": 2020760010516,
        "lat": null,
        "lon": null,
        "intervenciones": [
          {
            "intervencion_id": "UNP-18-01",
            "referencia_proceso": "4161.010.32.1.1248.2024",
            "referencia_contrato": "4161.010.26.1.1248.2024",
            "url_proceso": "https://community.secop.gov.co/Public/Tendering/OpportunityDetail/Index?noticeUID=CO1.NTC.6447173&isFromPublicArea=True&isModal=False",
            "bpin": 2020760010516,
            "estado": "Terminado",
            "tipo_intervencion": "Mantenimiento",
            "fuente_financiacion": "Ingresos libre destinación",
            "presupuesto_base": 636029231,
            "ano": 2024,
            "avance_obra": 100.0,
            "fecha_inicio": "7/11/2024",
            "fecha_fin": "31/07/2025",
            "fecha_inicio_std": "2024-07-11T00:00:00",
            "fecha_fin_std": "2025-07-31T00:00:00",
            "frente_activo": "No aplica",
            "fuera_rango": null
          }
        ],
        "presupuesto_base": 636029231,
        "avance_obra": 100.0
      }
    },
    {
      "type": "Feature",
      "geometry": null,
      "properties": {
        "upid": "UNP-19",
        "n_intervenciones": 5,
        "nombre_up": "Mantenimiento Infraestructura",
        "nombre_up_detalle": "Casa de Justicia Alfonso Lopez.",
        "nombre_centro_gestor": "Secretaría de Seguridad y Justicia",
        "direccion": "Calle 73 # 26r-00",
        "tipo_equipamiento": "Casa de Justicia",
        "clase_up": "Obras equipamientos",
        "comuna_corregimiento": "COMUNA 14",
        "comuna_corregimiento_2": null,
        "barrio_vereda": "Alfonso López",
        "barrio_vereda_2": null,
        "identificador": "Intervencion Casas de Justicia",
        "bpin": 2020760010568,
        "lat": null,
        "lon": null,
        "intervenciones": [
          {
            "intervencion_id": "UNP-19-01",
            "referencia_proceso": "4161.010.32.1.1175.2024",
            "referencia_contrato": "4161.010.26.1.1175.2024",
            "url_proceso": "https://community.secop.gov.co/Public/Tendering/OpportunityDetail/Index?noticeUID=CO1.NTC.6377705&isFromPublicArea=True&isModal=False",
            "bpin": 2020760010568,
            "estado": "Terminado",
            "tipo_intervencion": "Adecuaciones",
            "fuente_financiacion": "Ingresos libre destinación",
            "presupuesto_base": 254950318,
            "ano": 2024,
            "avance_obra": 100.0,
            "fecha_inicio": "10/09/2024",
            "fecha_fin": "2024-12-20T00:00:00",
            "fecha_inicio_std": "2024-09-10T00:00:00",
            "fecha_fin_std": "2024-12-20T00:00:00",
            "frente_activo": "No aplica",
            "fuera_rango": null
          },
          {
            "intervencion_id": "UNP-19-02",
            "referencia_proceso": "4161.010.32.1.1175.2024",
            "referencia_contrato": "4161.010.26.1.1175.2024",
            "url_proceso": "https://community.secop.gov.co/Public/Tendering/OpportunityDetail/Index?noticeUID=CO1.NTC.6377705&isFromPublicArea=True&isModal=False",
            "bpin": 2020760010568,
            "estado": "Terminado",
            "tipo_intervencion": "Adecuaciones",
            "fuente_financiacion": "Ingresos libre destinación",
            "presupuesto_base": 341472451,
            "ano": 2024,
            "avance_obra": 100.0,
            "fecha_inicio": "10/09/2024",
            "fecha_fin": "2024-12-20T00:00:00",
            "fecha_inicio_std": "2024-09-10T00:00:00",
            "fecha_fin_std": "2024-12-20T00:00:00",
            "frente_activo": "No aplica",
            "fuera_rango": null
          },
          {
            "intervencion_id": "UNP-19-03",
            "referencia_proceso": null,
            "referencia_contrato": null,
            "url_proceso": "https://community.secop.gov.co/Public/Tendering/OpportunityDetail/Index?noticeUID=CO1.NTC.6377705&isFromPublicArea=True&isModal=False",
            "bpin": 2020760010568,
            "estado": "Terminado",
            "tipo_intervencion": "Adecuaciones",
            "fuente_financiacion": "Ingresos libre destinación",
            "presupuesto_base": 269262709,
            "ano": 2024,
            "avance_obra": 100.0,
            "fecha_inicio": "45545",
            "fecha_fin": 45646,
            "fecha_inicio_std": "2024-09-10T00:00:00",
            "fecha_fin_std": "2024-12-20T00:00:00",
            "frente_activo": "No aplica",
            "fuera_rango": null
          },
          {
            "intervencion_id": "UNP-19-04",
            "referencia_proceso": "4161.010.32.1.1106.2025",
            "referencia_contrato": "4161.010.26.1.1133.2025",
            "url_proceso": "https://community.secop.gov.co/Public/Tendering/OpportunityDetail/Index?noticeUID=CO1.NTC.8428443&isFromPublicArea=True&isModal=False",
            "bpin": 2024760010271,
            "estado": "Terminado",
            "tipo_intervencion": "Mantenimiento",
            "fuente_financiacion": "Ingresos libre destinación",
            "presupuesto_base": 229685490,
            "ano": 2024,
            "avance_obra": 100.0,
            "fecha_inicio": "1/08/2025",
            "fecha_fin": "2025-12-31T00:00:00",
            "fecha_inicio_std": "2025-01-08T00:00:00",
            "fecha_fin_std": "2025-12-31T00:00:00",
            "frente_activo": "No aplica",
            "fuera_rango": null
          },
          {
            "intervencion_id": "UNP-19-05",
            "referencia_proceso": "4161.010.32.1.1106.2025",
            "referencia_contrato": "4161.010.26.1.1133.2025",
            "url_proceso": "https://community.secop.gov.co/Public/Tendering/OpportunityDetail/Index?noticeUID=CO1.NTC.8428443&isFromPublicArea=True&isModal=False",
            "bpin": 2024760010271,
            "estado": "Terminado",
            "tipo_intervencion": "Mantenimiento",
            "fuente_financiacion": "Ingresos libre destinación",
            "presupuesto_base": 225108768,
            "ano": 2025,
            "avance_obra": 100.0,
            "fecha_inicio": "45870",
            "fecha_fin": 46022,
            "fecha_inicio_std": "2025-08-01T00:00:00",
            "fecha_fin_std": "2025-12-31T00:00:00",
            "frente_activo": "No aplica",
            "fuera_rango": null
          }
        ],
        "presupuesto_base": 1320479736,
        "avance_obra": 100.0
      }
    },
    {
      "type": "Feature",
      "geometry": null,
      "properties": {
        "upid": "UNP-20",
        "n_intervenciones": 4,
        "nombre_up": "Estaciones de Policia",
        "nombre_up_detalle": "Sub Estacion de Policia el Saladito.",
        "nombre_centro_gestor": "Secretaría de Seguridad y Justicia",
        "direccion": "Km.14 Vía Al Mar Corregimiento el Saladito",
        "tipo_equipamiento": "Estaciones de policia",
        "clase_up": "Obras equipamientos",
        "comuna_corregimiento": "El Saladito",
        "comuna_corregimiento_2": null,
        "barrio_vereda": "El Saladito",
        "barrio_vereda_2": null,
        "identificador": "Adecuaciones de la Infraestructura de las Estaciones de Policía",
        "bpin": 2020760010516,
        "lat": null,
        "lon": null,
        "intervenciones": [
          {
            "intervencion_id": "UNP-20-01",
            "referencia_proceso": "4161.010.32.1.1248.2024",
            "referencia_contrato": "4161.010.26.1.1248.2024",
            "url_proceso": "https://community.secop.gov.co/Public/Tendering/OpportunityDetail/Index?noticeUID=CO1.NTC.6447173&isFromPublicArea=True&isModal=False",
            "bpin": 2020760010516,
            "estado": "Terminado",
            "tipo_intervencion": "Mantenimiento",
            "fuente_financiacion": "Ingresos libre destinación",
            "presupuesto_base": 499316231,
            "ano": 2024,
            "avance_obra": 100.0,
            "fecha_inicio": "7/11/2024",
            "fecha_fin": "31/07/2025",
            "fecha_inicio_std": "2024-07-11T00:00:00",
            "fecha_fin_std": "2025-07-31T00:00:00",
            "frente_activo": "No aplica",
            "fuera_rango": null
          },
          {
            "intervencion_id": "UNP-20-02",
            "referencia_proceso": "4161.010.32.1.1248.2024",
            "referencia_contrato": "4161.010.26.1.1248.2024",
            "url_proceso": "https://community.secop.gov.co/Public/Tendering/OpportunityDetail/Index?noticeUID=CO1.NTC.6447173&isFromPublicArea=True&isModal=False",
            "bpin": 2020760010516,
            "estado": "Terminado",
            "tipo_intervencion": "Mantenimiento",
            "fuente_financiacion": "Ingresos libre destinación",
            "presupuesto_base": 395534018,
            "ano": 2024,
            "avance_obra": 100.0,
            "fecha_inicio": "7/11/2024",
            "fecha_fin": "31/07/2025",
            "fecha_inicio_std": "2024-07-11T00:00:00",
            "fecha_fin_std": "2025-07-31T00:00:00",
            "frente_activo": "No aplica",
            "fuera_rango": null
          },
          {
            "intervencion_id": "UNP-20-03",
            "referencia_proceso": "4161.010.32.1.1248.2024",
            "referencia_contrato": "4161.010.26.1.1248.2024",
            "url_proceso": "https://community.secop.gov.co/Public/Tendering/OpportunityDetail/Index?noticeUID=CO1.NTC.6447173&isFromPublicArea=True&isModal=False",
            "bpin": 2020760010516,
            "estado": "Terminado",
            "tipo_intervencion": "Mantenimiento",
            "fuente_financiacion": "Ingresos libre destinación",
            "presupuesto_base": 402294131,
            "ano": 2024,
            "avance_obra": 100.0,
            "fecha_inicio": "7/11/2024",
            "fecha_fin": "31/07/2025",
            "fecha_inicio_std": "2024-07-11T00:00:00",
            "fecha_fin_std": "2025-07-31T00:00:00",
            "frente_activo": "No aplica",
            "fuera_rango": null
          },
          {
            "intervencion_id": "UNP-20-04",
            "referencia_proceso": null,
            "referencia_contrato": null,
            "url_proceso": "https://community.secop.gov.co/Public/Tendering/OpportunityDetail/Index?noticeUID=CO1.NTC.6447173&isFromPublicArea=True&isModal=False",
            "bpin": 2020760010516,
            "estado": "Terminado",
            "tipo_intervencion": "Mantenimiento",
            "fuente_financiacion": "Ingresos libre destinación",
            "presupuesto_base": 391486261,
            "ano": 2024,
            "avance_obra": 100.0,
            "fecha_inicio": "45603",
            "fecha_fin": 45869,
            "fecha_inicio_std": "2024-11-07T00:00:00",
            "fecha_fin_std": "2025-07-31T00:00:00",
            "frente_activo": "No aplica",
            "fuera_rango": null
          }
        ],
        "presupuesto_base": 1688630641,
        "avance_obra": 100.0
      }
    },
    {
      "type": "Feature",
      "geometry": null,
      "properties": {
        "upid": "UNP-21",
        "n_intervenciones": 1,
        "nombre_up": "Mantenimiento Infraestructura",
        "nombre_up_detalle": "Casa de Justicia Alfonso Lopez.",
        "nombre_centro_gestor": "Secretaría de Seguridad y Justicia",
        "direccion": "Calle 73 # 7g-28",
        "tipo_equipamiento": "CAD",
        "clase_up": "Obras equipamientos",
        "comuna_corregimiento": "COMUNA 07",
        "comuna_corregimiento_2": null,
        "barrio_vereda": "Alfonso López",
        "barrio_vereda_2": null,
        "identificador": "Mantenimiento de la Infraestructura de los Despachos de Acceso a la Justicia del Distrito de Santiago de Cali.",
        "bpin": 2024760010271,
        "lat": null,
        "lon": null,
        "intervenciones": [
          {
            "intervencion_id": "UNP-21-01",
            "referencia_proceso": "4161.010.32.1.1106.2025",
            "referencia_contrato": "4161.010.26.1.1133.2025",
            "url_proceso": "https://community.secop.gov.co/Public/Tendering/OpportunityDetail/Index?noticeUID=CO1.NTC.8428443&isFromPublicArea=True&isModal=False",
            "bpin": 2024760010271,
            "estado": "Terminado",
            "tipo_intervencion": "Mantenimiento",
            "fuente_financiacion": "Ingresos libre destinación",
            "presupuesto_base": 19131296,
            "ano": 2024,
            "avance_obra": 100.0,
            "fecha_inicio": "1/08/2025",
            "fecha_fin": "2025-12-31T00:00:00",
            "fecha_inicio_std": "2025-01-08T00:00:00",
            "fecha_fin_std": "2025-12-31T00:00:00",
            "frente_activo": "No aplica",
            "fuera_rango": null
          }
        ],
        "presupuesto_base": 19131296,
        "avance_obra": 100.0
      }
    },
    {
      "type": "Feature",
      "geometry": null,
      "properties": {
        "upid": "UNP-22",
        "n_intervenciones": 1,
        "nombre_up": "I.E. Siete de Agosto",
        "nombre_up_detalle": "Principal",
        "nombre_centro_gestor": "Secretaría de Educación",
        "direccion": "Cl 72 11 C 27",
        "tipo_equipamiento": "Instituciones Educativas",
        "clase_up": "Obras equipamientos",
        "comuna_corregimiento": "COMUNA 07",
        "comuna_corregimiento_2": null,
        "barrio_vereda": "Siete de Agosto",
        "barrio_vereda_2": null,
        "identificador": "Salas de Bilingüismo",
        "bpin": 26005338,
        "lat": null,
        "lon": null,
        "intervenciones": [
          {
            "intervencion_id": "UNP-22-01",
            "referencia_proceso": null,
            "referencia_contrato": null,
            "url_proceso": null,
            "bpin": 26005338,
            "estado": "En alistamiento",
            "tipo_intervencion": "Adecuaciones",
            "fuente_financiacion": "Ingresos libre destinación",
            "presupuesto_base": 821120550,
            "ano": 2025,
            "avance_obra": 0.0,
            "fecha_inicio": 2025,
            "fecha_fin": "2025-12-31T00:00:00",
            "fecha_inicio_std": "2025-01-01T00:00:00",
            "fecha_fin_std": "2025-12-31T00:00:00",
            "frente_activo": "No aplica",
            "fuera_rango": null
          }
        ],
        "presupuesto_base": 821120550,
        "avance_obra": 0.0
      }
    },
    {
      "type": "Feature",
      "geometry": null,
      "properties": {
        "upid": "UNP-23",
        "n_intervenciones": 1,
        "nombre_up": "Adecuacion Comisaria de Familia de Salomia",
        "nombre_up_detalle": "Comisaria de Familia de Salomia",
        "nombre_centro_gestor": "Secretaría de Seguridad y Justicia",
        "direccion": "Calle 47 # 4d-03",
        "tipo_equipamiento": "Casa de Justicia",
        "clase_up": "Obras equipamientos",
        "comuna_corregimiento": "COMUNA 04",
        "comuna_corregimiento_2": null,
        "barrio_vereda": "Salomia",
        "barrio_vereda_2": null,
        "identificador": "Adecuación de la Infraestructura Física del Despacho de la Comisaría de Familia de Salomia",
        "bpin": 2024760010271,
        "lat": null,
        "lon": null,
        "intervenciones": [
          {
            "intervencion_id": "UNP-23-01",
            "referencia_proceso": "4161.010.32.1.1452.2025",
            "referencia_contrato": "x",
            "url_proceso": "https://www.secop.gov.co/CO1BusinessLine/Tendering/ProcedureEdit/View?docUniqueIdentifier=CO1.REQ.9079503&prevCtxUrl=https%3a%2f%2fwww.secop.gov.co%2fCO1BusinessLine%2fTendering%2fBuyerDossierWorkspace%2fIndex%3fallWords2Search%3dsalomia%26createDateFrom%3d15%2f04%2f2025+21%3a47%3a00%26createDateTo%3d15%2f10%2f2025+21%3a47%3a00%26filteringState%3d0%26sortingState%3dLastModifiedDESC%26showAdvancedSearch%3dTrue%26showAdvancedSearchFields%3dFalse%26advSrchFolderCode%3dALL%26selectedDossier%3dCO1.BDOS.8842456%26selectedRequest%3dCO1.REQ.9079503%26&prevCtxLbl=Procesos+de+la+Entidad+Estatal",
            "bpin": 2024760010271,
            "estado": "Terminado",
            "tipo_intervencion": "Adecuaciones",
            "fuente_financiacion": "Ingresos libre destinación",
            "presupuesto_base": 0,
            "ano": 2024,
            "avance_obra": 100.0,
            "fecha_inicio": "Pendiente",
            "fecha_fin": "Pendiente",
            "fecha_inicio_std": null,
            "fecha_fin_std": null,
            "frente_activo": "No aplica",
            "fuera_rango": null
          }
        ],
        "presupuesto_base": 0,
        "avance_obra": 100.0
      }
    },
    {
      "type": "Feature",
      "geometry": null,
      "properties": {
        "upid": "UNP-24",
        "n_intervenciones": 1,
        "nombre_up": "UTS Presbítero",
        "nombre_up_detalle": "Presbítero",
        "nombre_centro_gestor": "Secretaría de Bienestar Social",
        "direccion": "Cra 8 # 51 N 35 - Olaya Herrera",
        "tipo_equipamiento": "UTS",
        "clase_up": "Obras equipamientos",
        "comuna_corregimiento": "COMUNA 04",
        "comuna_corregimiento_2": null,
        "barrio_vereda": "Olaya Herrera",
        "barrio_vereda_2": null,
        "identificador": "Mantenimiento Correctivo UTS",
        "bpin": 2020760010134,
        "lat": null,
        "lon": null,
        "intervenciones": [
          {
            "intervencion_id": "UNP-24-01",
            "referencia_proceso": "4146.010.32.1.1158.2024",
            "referencia_contrato": "4146.010.26.1.1741.2024",
            "url_proceso": "Pendiente",
            "bpin": 2020760010134,
            "estado": "Terminado",
            "tipo_intervencion": "Mantenimiento",
            "fuente_financiacion": "Ingresos libre destinación",
            "presupuesto_base": 420754176,
            "ano": 2025,
            "avance_obra": 100.0,
            "fecha_inicio": "2024-11-08T00:00:00",
            "fecha_fin": "2025-06-10T00:00:00",
            "fecha_inicio_std": "2024-11-08T00:00:00",
            "fecha_fin_std": "2025-06-10T00:00:00",
            "frente_activo": "No aplica",
            "fuera_rango": null
          }
        ],
        "presupuesto_base": 420754176,
        "avance_obra": 100.0
      }
    },
    {
      "type": "Feature",
      "geometry": null,
      "properties": {
        "upid": "UNP-25",
        "n_intervenciones": 1,
        "nombre_up": "UTS las Garzas",
        "nombre_up_detalle": "Las Garzas",
        "nombre_centro_gestor": "Secretaría de Bienestar Social",
        "direccion": "Cra. 2 #67-39 - Guayacanes",
        "tipo_equipamiento": "UTS",
        "clase_up": "Obras equipamientos",
        "comuna_corregimiento": "COMUNA 05",
        "comuna_corregimiento_2": null,
        "barrio_vereda": "Guayacanes",
        "barrio_vereda_2": null,
        "identificador": "Mantenimiento Correctivo UTS",
        "bpin": 2020760010134,
        "lat": null,
        "lon": null,
        "intervenciones": [
          {
            "intervencion_id": "UNP-25-01",
            "referencia_proceso": "4146.010.32.1.1158.2024",
            "referencia_contrato": "4146.010.26.1.1154.2024",
            "url_proceso": "Pendiente",
            "bpin": 2020760010134,
            "estado": "Terminado",
            "tipo_intervencion": "Mantenimiento",
            "fuente_financiacion": "Ingresos libre destinación",
            "presupuesto_base": 263636028,
            "ano": 2025,
            "avance_obra": 100.0,
            "fecha_inicio": "2024-11-13T00:00:00",
            "fecha_fin": "2025-06-10T00:00:00",
            "fecha_inicio_std": "2024-11-13T00:00:00",
            "fecha_fin_std": "2025-06-10T00:00:00",
            "frente_activo": "No aplica",
            "fuera_rango": null
          }
        ],
        "presupuesto_base": 263636028,
        "avance_obra": 100.0
      }
    },
    {
      "type": "Feature",
      "geometry": null,
      "properties": {
        "upid": "UNP-26",
        "n_intervenciones": 1,
        "nombre_up": "UTS San Marino - Azulejos",
        "nombre_up_detalle": "San Marino - Azulejos",
        "nombre_centro_gestor": "Secretaría de Bienestar Social",
        "direccion": "Calle 69 #7c-04 - San Marino",
        "tipo_equipamiento": "UTS",
        "clase_up": "Obras equipamientos",
        "comuna_corregimiento": "COMUNA 07",
        "comuna_corregimiento_2": null,
        "barrio_vereda": "San Marino",
        "barrio_vereda_2": null,
        "identificador": "Mantenimiento Correctivo UTS",
        "bpin": 2020760010134,
        "lat": null,
        "lon": null,
        "intervenciones": [
          {
            "intervencion_id": "UNP-26-01",
            "referencia_proceso": "4146.010.32.1.1158.2024",
            "referencia_contrato": "4146.010.26.1.1154.2024",
            "url_proceso": "Pendiente",
            "bpin": 2020760010134,
            "estado": "Terminado",
            "tipo_intervencion": "Mantenimiento",
            "fuente_financiacion": "Ingresos libre destinación",
            "presupuesto_base": 682855544,
            "ano": 2025,
            "avance_obra": 100.0,
            "fecha_inicio": "2024-11-13T00:00:00",
            "fecha_fin": "2025-06-10T00:00:00",
            "fecha_inicio_std": "2024-11-13T00:00:00",
            "fecha_fin_std": "2025-06-10T00:00:00",
            "frente_activo": "No aplica",
            "fuera_rango": null
          }
        ],
        "presupuesto_base": 682855544,
        "avance_obra": 100.0
      }
    },
    {
      "type": "Feature",
      "geometry": null,
      "properties": {
        "upid": "UNP-27",
        "n_intervenciones": 1,
        "nombre_up": "UTS Colibri",
        "nombre_up_detalle": "Colibri",
        "nombre_centro_gestor": "Secretaría de Bienestar Social",
        "direccion": "Calle 18 # 8 a 15 - Sucre",
        "tipo_equipamiento": "UTS",
        "clase_up": "Obras equipamientos",
        "comuna_corregimiento": "COMUNA 09",
        "comuna_corregimiento_2": null,
        "barrio_vereda": "Sucre",
        "barrio_vereda_2": null,
        "identificador": "Mantenimiento Correctivo UTS",
        "bpin": 2020760010134,
        "lat": null,
        "lon": null,
        "intervenciones": [
          {
            "intervencion_id": "UNP-27-01",
            "referencia_proceso": "4146.010.32.1.1158.2024",
            "referencia_contrato": "4146.010.26.1.1154.2024",
            "url_proceso": "Pendiente",
            "bpin": 2020760010134,
            "estado": "Terminado",
            "tipo_intervencion": "Mantenimiento",
            "fuente_financiacion": "Ingresos libre destinación",
            "presupuesto_base": 335746392,
            "ano": 2025,
            "avance_obra": 100.0,
            "fecha_inicio": "2024-11-13T00:00:00",
            "fecha_fin": "2025-06-10T00:00:00",
            "fecha_inicio_std": "2024-11-13T00:00:00",
            "fecha_fin_std": "2025-06-10T00:00:00",
            "frente_activo": "No aplica",
            "fuera_rango": null
          }
        ],
        "presupuesto_base": 335746392,
        "avance_obra": 100.0
      }
    },
    {
      "type": "Feature",
      "geometry": null,
      "properties": {
        "upid": "UNP-28",
        "n_intervenciones": 1,
        "nombre_up": "UTS la Selva",
        "nombre_up_detalle": "La Selva",
        "nombre_centro_gestor": "Secretaría de Bienestar Social",
        "direccion": "Calle 14 #47-04 - la Selva",
        "tipo_equipamiento": "UTS",
        "clase_up": "Obras equipamientos",
        "comuna_corregimiento": "COMUNA 10",
        "comuna_corregimiento_2": null,
        "barrio_vereda": "La Selva",
        "barrio_vereda_2": null,
        "identificador": "Mantenimiento Correctivo UTS",
        "bpin": 2020760010134,
        "lat": null,
        "lon": null,
        "intervenciones": [
          {
            "intervencion_id": "UNP-28-01",
            "referencia_proceso": "4146.010.32.1.1158.2024",
            "referencia_contrato": "4146.010.26.1.1741.2024",
            "url_proceso": "Pendiente",
            "bpin": 2020760010134,
            "estado": "Terminado",
            "tipo_intervencion": "Mantenimiento",
            "fuente_financiacion": "Ingresos libre destinación",
            "presupuesto_base": 179516560,
            "ano": 2025,
            "avance_obra": 100.0,
            "fecha_inicio": "2024-11-08T00:00:00",
            "fecha_fin": "2025-06-10T00:00:00",
            "fecha_inicio_std": "2024-11-08T00:00:00",
            "fecha_fin_std": "2025-06-10T00:00:00",
            "frente_activo": "No aplica",
            "fuera_rango": null
          }
        ],
        "presupuesto_base": 179516560,
        "avance_obra": 100.0
      }
    },
    {
      "type": "Feature",
      "geometry": null,
      "properties": {
        "upid": "UNP-29",
        "n_intervenciones": 1,
        "nombre_up": "UTS Santa Helena",
        "nombre_up_detalle": "Santa Helena",
        "nombre_centro_gestor": "Secretaría de Bienestar Social",
        "direccion": "Cra. 100 a Oeste 2 1 - Altos de Santa Helena",
        "tipo_equipamiento": "UTS",
        "clase_up": "Obras equipamientos",
        "comuna_corregimiento": "COMUNA 18",
        "comuna_corregimiento_2": null,
        "barrio_vereda": "Altos de Santa Helena",
        "barrio_vereda_2": null,
        "identificador": "Mantenimiento Correctivo UTS",
        "bpin": 2020760010134,
        "lat": null,
        "lon": null,
        "intervenciones": [
          {
            "intervencion_id": "UNP-29-01",
            "referencia_proceso": "4146.010.32.1.1158.2024",
            "referencia_contrato": "4146.010.26.1.1741.2024",
            "url_proceso": "Pendiente",
            "bpin": 2020760010134,
            "estado": "Terminado",
            "tipo_intervencion": "Mantenimiento",
            "fuente_financiacion": "Ingresos libre destinación",
            "presupuesto_base": 179710196,
            "ano": 2025,
            "avance_obra": 100.0,
            "fecha_inicio": "2024-11-08T00:00:00",
            "fecha_fin": "2025-06-10T00:00:00",
            "fecha_inicio_std": "2024-11-08T00:00:00",
            "fecha_fin_std": "2025-06-10T00:00:00",
            "frente_activo": "No aplica",
            "fuera_rango": null
          }
        ],
        "presupuesto_base": 179710196,
        "avance_obra": 100.0
      }
    },
    {
      "type": "Feature",
      "geometry": null,
      "properties": {
        "upid": "UNP-30",
        "n_intervenciones": 1,
        "nombre_up": "UTS Titiribí",
        "nombre_up_detalle": "Titiribí",
        "nombre_centro_gestor": "Secretaría de Bienestar Social",
        "direccion": "Calle 27 # 42b -15 - Villa del Sur",
        "tipo_equipamiento": "UTS",
        "clase_up": "Obras equipamientos",
        "comuna_corregimiento": "COMUNA 11",
        "comuna_corregimiento_2": null,
        "barrio_vereda": "Villa del Sur",
        "barrio_vereda_2": null,
        "identificador": "Mantenimiento Correctivo UTS",
        "bpin": 2020760010134,
        "lat": null,
        "lon": null,
        "intervenciones": [
          {
            "intervencion_id": "UNP-30-01",
            "referencia_proceso": "4146.010.32.1.1158.2024",
            "referencia_contrato": "4146.010.26.1.1741.2024",
            "url_proceso": "Pendiente",
            "bpin": 2020760010134,
            "estado": "Terminado",
            "tipo_intervencion": "Mantenimiento",
            "fuente_financiacion": "Ingresos libre destinación",
            "presupuesto_base": 915956707,
            "ano": 2025,
            "avance_obra": 100.0,
            "fecha_inicio": "2024-11-08T00:00:00",
            "fecha_fin": "2025-06-10T00:00:00",
            "fecha_inicio_std": "2024-11-08T00:00:00",
            "fecha_fin_std": "2025-06-10T00:00:00",
            "frente_activo": "No aplica",
            "fuera_rango": null
          }
        ],
        "presupuesto_base": 915956707,
        "avance_obra": 100.0
      }
    },
    {
      "type": "Feature",
      "geometry": null,
      "properties": {
        "upid": "UNP-31",
        "n_intervenciones": 1,
        "nombre_up": "UTS mi Bosquesito",
        "nombre_up_detalle": "Mi Bosquesito",
        "nombre_centro_gestor": "Secretaría de Bienestar Social",
        "direccion": "Calle 57 #24 a - 03 - Nueva Floresta",
        "tipo_equipamiento": "UTS",
        "clase_up": "Obras equipamientos",
        "comuna_corregimiento": "COMUNA 12",
        "comuna_corregimiento_2": null,
        "barrio_vereda": "Nueva Floresta",
        "barrio_vereda_2": null,
        "identificador": "Mantenimiento Correctivo UTS",
        "bpin": 2020760010134,
        "lat": null,
        "lon": null,
        "intervenciones": [
          {
            "intervencion_id": "UNP-31-01",
            "referencia_proceso": "4146.010.32.1.1158.2024",
            "referencia_contrato": "4146.010.26.1.1741.2024",
            "url_proceso": "Pendiente",
            "bpin": 2020760010134,
            "estado": "Terminado",
            "tipo_intervencion": "Mantenimiento",
            "fuente_financiacion": "Ingresos libre destinación",
            "presupuesto_base": 263385143,
            "ano": 2025,
            "avance_obra": 100.0,
            "fecha_inicio": "2024-11-08T00:00:00",
            "fecha_fin": "2025-06-10T00:00:00",
            "fecha_inicio_std": "2024-11-08T00:00:00",
            "fecha_fin_std": "2025-06-10T00:00:00",
            "frente_activo": "No aplica",
            "fuera_rango": null
          }
        ],
        "presupuesto_base": 263385143,
        "avance_obra": 100.0
      }
    },
    {
      "type": "Feature",
      "geometry": null,
      "properties": {
        "upid": "UNP-32",
        "n_intervenciones": 1,
        "nombre_up": "UTS Eduardo Santos",
        "nombre_up_detalle": "Eduardo Santos",
        "nombre_centro_gestor": "Secretaría de Bienestar Social",
        "direccion": "Punto de Apropiación Digital C.a.l.i 12 - el Paraíso",
        "tipo_equipamiento": "UTS",
        "clase_up": "Obras equipamientos",
        "comuna_corregimiento": "COMUNA 12",
        "comuna_corregimiento_2": null,
        "barrio_vereda": "El Paraíso",
        "barrio_vereda_2": null,
        "identificador": "Mantenimiento Correctivo UTS",
        "bpin": 2020760010134,
        "lat": null,
        "lon": null,
        "intervenciones": [
          {
            "intervencion_id": "UNP-32-01",
            "referencia_proceso": "4146.010.32.1.1158.2024",
            "referencia_contrato": "4146.010.26.1.1741.2024",
            "url_proceso": "Pendiente",
            "bpin": 2020760010134,
            "estado": "Terminado",
            "tipo_intervencion": "Mantenimiento",
            "fuente_financiacion": "Ingresos libre destinación",
            "presupuesto_base": 200402714,
            "ano": 2025,
            "avance_obra": 100.0,
            "fecha_inicio": "2024-11-08T00:00:00",
            "fecha_fin": "2025-06-10T00:00:00",
            "fecha_inicio_std": "2024-11-08T00:00:00",
            "fecha_fin_std": "2025-06-10T00:00:00",
            "frente_activo": "No aplica",
            "fuera_rango": null
          }
        ],
        "presupuesto_base": 200402714,
        "avance_obra": 100.0
      }
    },
    {
      "type": "Feature",
      "geometry": null,
      "properties": {
        "upid": "UNP-33",
        "n_intervenciones": 1,
        "nombre_up": "Adecuación del Espacio Publico (sentencia Relocalización)",
        "nombre_up_detalle": "Pendiente Aportar Al Fideicomiso",
        "nombre_centro_gestor": "Secretaría de Vivienda Social y Habitat",
        "direccion": "Calle 72p entre Carrera 26 L y Transversal 72w",
        "tipo_equipamiento": "Canchas",
        "clase_up": "Obras equipamientos",
        "comuna_corregimiento": "COMUNA 13",
        "comuna_corregimiento_2": null,
        "barrio_vereda": "Charco Azul y El Pondaje",
        "barrio_vereda_2": null,
        "identificador": null,
        "bpin": 2024760010167,
        "lat": null,
        "lon": null,
        "intervenciones": [
          {
            "intervencion_id": "UNP-33-01",
            "referencia_proceso": null,
            "referencia_contrato": null,
            "url_proceso": null,
            "bpin": 2024760010167,
            "estado": "En alistamiento",
            "tipo_intervencion": "Adecuaciones",
            "fuente_financiacion": "Empréstito",
            "presupuesto_base": 596240746,
            "ano": 2025,
            "avance_obra": 0.0,
            "fecha_inicio": null,
            "fecha_fin": null,
            "fecha_inicio_std": null,
            "fecha_fin_std": null,
            "frente_activo": "No aplica",
            "fuera_rango": null
          }
        ],
        "presupuesto_base": 596240746,
        "avance_obra": 0.0
      }
    },
    {
      "type": "Feature",
      "geometry": null,
      "properties": {
        "upid": "UNP-34",
        "n_intervenciones": 1,
        "nombre_up": "UTS Laguna Azul",
        "nombre_up_detalle": "Laguna Azul",
        "nombre_centro_gestor": "Secretaría de Bienestar Social",
        "direccion": "Calle 72p Carrera 26 L - el Pondaje",
        "tipo_equipamiento": "UTS",
        "clase_up": "Obras equipamientos",
        "comuna_corregimiento": "COMUNA 13",
        "comuna_corregimiento_2": null,
        "barrio_vereda": "El Pondaje",
        "barrio_vereda_2": null,
        "identificador": "Mantenimiento Correctivo UTS",
        "bpin": 2020760010134,
        "lat": null,
        "lon": null,
        "intervenciones": [
          {
            "intervencion_id": "UNP-34-01",
            "referencia_proceso": "4146.010.32.1.1158.2024",
            "referencia_contrato": "4146.010.26.1.1154.2024",
            "url_proceso": "Pendiente",
            "bpin": 2020760010134,
            "estado": "Terminado",
            "tipo_intervencion": "Mantenimiento",
            "fuente_financiacion": "Ingresos libre destinación",
            "presupuesto_base": 178148487,
            "ano": 2025,
            "avance_obra": 100.0,
            "fecha_inicio": "2024-11-13T00:00:00",
            "fecha_fin": "2025-06-10T00:00:00",
            "fecha_inicio_std": "2024-11-13T00:00:00",
            "fecha_fin_std": "2025-06-10T00:00:00",
            "frente_activo": "No aplica",
            "fuera_rango": null
          }
        ],
        "presupuesto_base": 178148487,
        "avance_obra": 100.0
      }
    },
    {
      "type": "Feature",
      "geometry": null,
      "properties": {
        "upid": "UNP-35",
        "n_intervenciones": 1,
        "nombre_up": "UTS Nuevo Latir",
        "nombre_up_detalle": "Nuevo Latir",
        "nombre_centro_gestor": "Secretaría de Bienestar Social",
        "direccion": "Cl 73 No. 28 - 26 - Bonilla Aragón",
        "tipo_equipamiento": "UTS",
        "clase_up": "Obras equipamientos",
        "comuna_corregimiento": "COMUNA 14",
        "comuna_corregimiento_2": null,
        "barrio_vereda": "Bonilla Aragón",
        "barrio_vereda_2": null,
        "identificador": "Mantenimiento Correctivo UTS",
        "bpin": 2020760010134,
        "lat": null,
        "lon": null,
        "intervenciones": [
          {
            "intervencion_id": "UNP-35-01",
            "referencia_proceso": "4146.010.32.1.1158.2024",
            "referencia_contrato": "4146.010.26.1.1741.2024",
            "url_proceso": "Pendiente",
            "bpin": 2020760010134,
            "estado": "Terminado",
            "tipo_intervencion": "Mantenimiento",
            "fuente_financiacion": "Ingresos libre destinación",
            "presupuesto_base": 146160869,
            "ano": 2025,
            "avance_obra": 100.0,
            "fecha_inicio": "2024-11-08T00:00:00",
            "fecha_fin": "2025-06-10T00:00:00",
            "fecha_inicio_std": "2024-11-08T00:00:00",
            "fecha_fin_std": "2025-06-10T00:00:00",
            "frente_activo": "No aplica",
            "fuera_rango": null
          }
        ],
        "presupuesto_base": 146160869,
        "avance_obra": 100.0
      }
    },
    {
      "type": "Feature",
      "geometry": null,
      "properties": {
        "upid": "UNP-36",
        "n_intervenciones": 1,
        "nombre_up": "UTS Semillas de Paz",
        "nombre_up_detalle": "Semillas de Paz",
        "nombre_centro_gestor": "Secretaría de Bienestar Social",
        "direccion": "Cra. 47 Calle 56 G – 56 I - Llano Verde",
        "tipo_equipamiento": "UTS",
        "clase_up": "Obras equipamientos",
        "comuna_corregimiento": "COMUNA 15",
        "comuna_corregimiento_2": null,
        "barrio_vereda": "Llano verde",
        "barrio_vereda_2": null,
        "identificador": "Mantenimiento Correctivo UTS",
        "bpin": 2020760010134,
        "lat": null,
        "lon": null,
        "intervenciones": [
          {
            "intervencion_id": "UNP-36-01",
            "referencia_proceso": "4146.010.32.1.1158.2024",
            "referencia_contrato": "4146.010.26.1.1154.2024",
            "url_proceso": "Pendiente",
            "bpin": 2020760010134,
            "estado": "Terminado",
            "tipo_intervencion": "Mantenimiento",
            "fuente_financiacion": "Ingresos libre destinación",
            "presupuesto_base": 312313437,
            "ano": 2025,
            "avance_obra": 100.0,
            "fecha_inicio": "2024-11-13T00:00:00",
            "fecha_fin": "2025-06-10T00:00:00",
            "fecha_inicio_std": "2024-11-13T00:00:00",
            "fecha_fin_std": "2025-06-10T00:00:00",
            "frente_activo": "No aplica",
            "fuera_rango": null
          }
        ],
        "presupuesto_base": 312313437,
        "avance_obra": 100.0
      }
    },
    {
      "type": "Feature",
      "geometry": null,
      "properties": {
        "upid": "UNP-37",
        "n_intervenciones": 1,
        "nombre_up": "UTS Calida",
        "nombre_up_detalle": "Calida",
        "nombre_centro_gestor": "Secretaría de Bienestar Social",
        "direccion": "Cra. 47 #calle 57 - Llano Verde",
        "tipo_equipamiento": "UTS",
        "clase_up": "Obras equipamientos",
        "comuna_corregimiento": "COMUNA 15",
        "comuna_corregimiento_2": null,
        "barrio_vereda": "Llano verde",
        "barrio_vereda_2": null,
        "identificador": "Mantenimiento Correctivo UTS",
        "bpin": 2020760010134,
        "lat": null,
        "lon": null,
        "intervenciones": [
          {
            "intervencion_id": "UNP-37-01",
            "referencia_proceso": "4146.010.32.1.1158.2024",
            "referencia_contrato": "4146.010.26.1.1154.2024",
            "url_proceso": "Pendiente",
            "bpin": 2020760010134,
            "estado": "Terminado",
            "tipo_intervencion": "Mantenimiento",
            "fuente_financiacion": "Ingresos libre destinación",
            "presupuesto_base": 387497670,
            "ano": 2025,
            "avance_obra": 100.0,
            "fecha_inicio": "2024-11-13T00:00:00",
            "fecha_fin": "2025-06-10T00:00:00",
            "fecha_inicio_std": "2024-11-13T00:00:00",
            "fecha_fin_std": "2025-06-10T00:00:00",
            "frente_activo": "No aplica",
            "fuera_rango": null
          }
        ],
        "presupuesto_base": 387497670,
        "avance_obra": 100.0
      }
    },
    {
      "type": "Feature",
      "geometry": null,
      "properties": {
        "upid": "UNP-38",
        "n_intervenciones": 1,
        "nombre_up": "UTS Cuna de Campeones",
        "nombre_up_detalle": "Cuna de Campeones",
        "nombre_centro_gestor": "Secretaría de Bienestar Social",
        "direccion": "Diagonal 51# 7-90 Oeste - el Cortijo",
        "tipo_equipamiento": "UTS",
        "clase_up": "Obras equipamientos",
        "comuna_corregimiento": "COMUNA 20",
        "comuna_corregimiento_2": null,
        "barrio_vereda": "El Cortijo",
        "barrio_vereda_2": null,
        "identificador": "Mantenimiento Correctivo UTS",
        "bpin": 2020760010134,
        "lat": null,
        "lon": null,
        "intervenciones": [
          {
            "intervencion_id": "UNP-38-01",
            "referencia_proceso": "4146.010.32.1.1158.2024",
            "referencia_contrato": "4146.010.26.1.1741.2024",
            "url_proceso": "Pendiente",
            "bpin": 2020760010134,
            "estado": "Terminado",
            "tipo_intervencion": "Mantenimiento",
            "fuente_financiacion": "Ingresos libre destinación",
            "presupuesto_base": 282270183,
            "ano": 2025,
            "avance_obra": 100.0,
            "fecha_inicio": "2024-11-08T00:00:00",
            "fecha_fin": "2025-06-10T00:00:00",
            "fecha_inicio_std": "2024-11-08T00:00:00",
            "fecha_fin_std": "2025-06-10T00:00:00",
            "frente_activo": "No aplica",
            "fuera_rango": null
          }
        ],
        "presupuesto_base": 282270183,
        "avance_obra": 100.0
      }
    },
    {
      "type": "Feature",
      "geometry": null,
      "properties": {
        "upid": "UNP-39",
        "n_intervenciones": 1,
        "nombre_up": "UTS la Estrella",
        "nombre_up_detalle": "La Estrella",
        "nombre_centro_gestor": "Secretaría de Bienestar Social",
        "direccion": "Calle 8va Oeste Cra 42b – 02 - Siloé",
        "tipo_equipamiento": "UTS",
        "clase_up": "Obras equipamientos",
        "comuna_corregimiento": "COMUNA 20",
        "comuna_corregimiento_2": null,
        "barrio_vereda": "Siloé",
        "barrio_vereda_2": null,
        "identificador": "Mantenimiento Correctivo UTS",
        "bpin": 2020760010134,
        "lat": null,
        "lon": null,
        "intervenciones": [
          {
            "intervencion_id": "UNP-39-01",
            "referencia_proceso": "4146.010.32.1.1158.2024",
            "referencia_contrato": "4146.010.26.1.1154.2024",
            "url_proceso": "Pendiente",
            "bpin": 2020760010134,
            "estado": "Terminado",
            "tipo_intervencion": "Mantenimiento",
            "fuente_financiacion": "Ingresos libre destinación",
            "presupuesto_base": 306099054,
            "ano": 2025,
            "avance_obra": 100.0,
            "fecha_inicio": "2024-11-13T00:00:00",
            "fecha_fin": "2025-06-10T00:00:00",
            "fecha_inicio_std": "2024-11-13T00:00:00",
            "fecha_fin_std": "2025-06-10T00:00:00",
            "frente_activo": "No aplica",
            "fuera_rango": null
          }
        ],
        "presupuesto_base": 306099054,
        "avance_obra": 100.0
      }
    },
    {
      "type": "Feature",
      "geometry": null,
      "properties": {
        "upid": "UNP-40",
        "n_intervenciones": 1,
        "nombre_up": "UTS Progresando Juntos",
        "nombre_up_detalle": "Progresando Juntos",
        "nombre_centro_gestor": "Secretaría de Bienestar Social",
        "direccion": "Calle 80d # 24f-25 - Valle Grande",
        "tipo_equipamiento": "UTS",
        "clase_up": "Obras equipamientos",
        "comuna_corregimiento": "COMUNA 21",
        "comuna_corregimiento_2": null,
        "barrio_vereda": "Valle Grande",
        "barrio_vereda_2": null,
        "identificador": "Mantenimiento Correctivo UTS",
        "bpin": 2020760010134,
        "lat": null,
        "lon": null,
        "intervenciones": [
          {
            "intervencion_id": "UNP-40-01",
            "referencia_proceso": "4146.010.32.1.1158.2024",
            "referencia_contrato": "4146.010.26.1.1741.2024",
            "url_proceso": "Pendiente",
            "bpin": 2020760010134,
            "estado": "Terminado",
            "tipo_intervencion": "Mantenimiento",
            "fuente_financiacion": "Ingresos libre destinación",
            "presupuesto_base": 170143493,
            "ano": 2025,
            "avance_obra": 100.0,
            "fecha_inicio": "2024-11-08T00:00:00",
            "fecha_fin": "2025-06-10T00:00:00",
            "fecha_inicio_std": "2024-11-08T00:00:00",
            "fecha_fin_std": "2025-06-10T00:00:00",
            "frente_activo": "No aplica",
            "fuera_rango": null
          }
        ],
        "presupuesto_base": 170143493,
        "avance_obra": 100.0
      }
    },
    {
      "type": "Feature",
      "geometry": null,
      "properties": {
        "upid": "UNP-41",
        "n_intervenciones": 1,
        "nombre_up": "UTS Potrero Grande",
        "nombre_up_detalle": "Potrero Grande",
        "nombre_centro_gestor": "Secretaría de Bienestar Social",
        "direccion": "Calle 121 B #28 B-05 - Potrero Grande",
        "tipo_equipamiento": "UTS",
        "clase_up": "Obras equipamientos",
        "comuna_corregimiento": "COMUNA 21",
        "comuna_corregimiento_2": null,
        "barrio_vereda": "Potrero Grande",
        "barrio_vereda_2": null,
        "identificador": "Mantenimiento Correctivo UTS",
        "bpin": 2020760010134,
        "lat": null,
        "lon": null,
        "intervenciones": [
          {
            "intervencion_id": "UNP-41-01",
            "referencia_proceso": "4146.010.32.1.1158.2024",
            "referencia_contrato": "4146.010.26.1.1154.2024",
            "url_proceso": "Pendiente",
            "bpin": 2020760010134,
            "estado": "Terminado",
            "tipo_intervencion": "Mantenimiento",
            "fuente_financiacion": "Ingresos libre destinación",
            "presupuesto_base": 317272309,
            "ano": 2025,
            "avance_obra": 100.0,
            "fecha_inicio": "2024-11-13T00:00:00",
            "fecha_fin": "2025-06-10T00:00:00",
            "fecha_inicio_std": "2024-11-13T00:00:00",
            "fecha_fin_std": "2025-06-10T00:00:00",
            "frente_activo": "No aplica",
            "fuera_rango": null
          }
        ],
        "presupuesto_base": 317272309,
        "avance_obra": 100.0
      }
    },
    {
      "type": "Feature",
      "geometry": null,
      "properties": {
        "upid": "UNP-42",
        "n_intervenciones": 1,
        "nombre_up": "UTS Cariño Remansos",
        "nombre_up_detalle": "Cariño Remansos",
        "nombre_centro_gestor": "Secretaría de Bienestar Social",
        "direccion": "Calle 126 # 26 I 5 - Remansos de Comfandi",
        "tipo_equipamiento": "UTS",
        "clase_up": "Obras equipamientos",
        "comuna_corregimiento": "COMUNA 21",
        "comuna_corregimiento_2": null,
        "barrio_vereda": "Remansos de Comfandi",
        "barrio_vereda_2": null,
        "identificador": "Mantenimiento Correctivo UTS",
        "bpin": 2020760010134,
        "lat": null,
        "lon": null,
        "intervenciones": [
          {
            "intervencion_id": "UNP-42-01",
            "referencia_proceso": "4146.010.32.1.1158.2024",
            "referencia_contrato": "4146.010.26.1.1154.2024",
            "url_proceso": "Pendiente",
            "bpin": 2020760010134,
            "estado": "Terminado",
            "tipo_intervencion": "Mantenimiento",
            "fuente_financiacion": "Ingresos libre destinación",
            "presupuesto_base": 240991290,
            "ano": 2025,
            "avance_obra": 100.0,
            "fecha_inicio": "2024-11-13T00:00:00",
            "fecha_fin": "2025-06-10T00:00:00",
            "fecha_inicio_std": "2024-11-13T00:00:00",
            "fecha_fin_std": "2025-06-10T00:00:00",
            "frente_activo": "No aplica",
            "fuera_rango": null
          }
        ],
        "presupuesto_base": 240991290,
        "avance_obra": 100.0
      }
    },
    {
      "type": "Feature",
      "geometry": null,
      "properties": {
        "upid": "UNP-43",
        "n_intervenciones": 2,
        "nombre_up": "Casa Matria Junambú",
        "nombre_up_detalle": "Casa Matria Junambú",
        "nombre_centro_gestor": "Secretaría de Bienestar Social",
        "direccion": "Calle 10 Norte No. 9n - 07",
        "tipo_equipamiento": null,
        "clase_up": "Interventoria",
        "comuna_corregimiento": "COMUNA 02",
        "comuna_corregimiento_2": null,
        "barrio_vereda": "Juanambú",
        "barrio_vereda_2": null,
        "identificador": "Interventoría Casa Matria Juanambú",
        "bpin": 2024760010189,
        "lat": null,
        "lon": null,
        "intervenciones": [
          {
            "intervencion_id": "UNP-43-01",
            "referencia_proceso": "4146.010.32.1.2317.2025",
            "referencia_contrato": "4146.010.26.1.2317.2025",
            "url_proceso": "https://community.secop.gov.co/Public/Tendering/OpportunityDetail/Index?noticeUID=CO1.NTC.9006237&isFromPublicArea=True&isModal=False",
            "bpin": 2024760010189,
            "estado": "En alistamiento",
            "tipo_intervencion": "Adecuaciones",
            "fuente_financiacion": "Empréstito",
            "presupuesto_base": 558263599,
            "ano": 2026,
            "avance_obra": 0.0,
            "fecha_inicio": "2025-12-31T00:00:00",
            "fecha_fin": "2026-03-29T00:00:00",
            "fecha_inicio_std": "2025-12-31T00:00:00",
            "fecha_fin_std": "2026-03-29T00:00:00",
            "frente_activo": "No aplica",
            "fuera_rango": null
          },
          {
            "intervencion_id": "UNP-43-02",
            "referencia_proceso": null,
            "referencia_contrato": null,
            "url_proceso": "https://community.secop.gov.co/Public/Tendering/OpportunityDetail/Index?noticeUID=CO1.NTC.9006237&isFromPublicArea=True&isModal=False",
            "bpin": 2024760010189,
            "estado": "En alistamiento",
            "tipo_intervencion": "Adecuaciones",
            "fuente_financiacion": "Empréstito",
            "presupuesto_base": 0,
            "ano": 2026,
            "avance_obra": 0.0,
            "fecha_inicio": "2025-12-31T00:00:00",
            "fecha_fin": "2026-03-29T00:00:00",
            "fecha_inicio_std": "2025-12-31T00:00:00",
            "fecha_fin_std": "2026-03-29T00:00:00",
            "frente_activo": "No aplica",
            "fuera_rango": null
          }
        ],
        "presupuesto_base": 558263599,
        "avance_obra": 0.0
      }
    },
    {
      "type": "Feature",
      "geometry": null,
      "properties": {
        "upid": "UNP-44",
        "n_intervenciones": 10,
        "nombre_up": "C.a.l.i. 12",
        "nombre_up_detalle": "C.a.l.i. 12",
        "nombre_centro_gestor": "Secretaría de Desarrollo Territorial y Participación Ciudadana",
        "direccion": "Calle 8 con Carrera 32 Esquina",
        "tipo_equipamiento": "CALIS",
        "clase_up": "Obras equipamientos",
        "comuna_corregimiento": "COMUNA 12",
        "comuna_corregimiento_2": null,
        "barrio_vereda": "Parcelaciones Pance y la María",
        "barrio_vereda_2": null,
        "identificador": "C.a.l.i. 12",
        "bpin": 26005393,
        "lat": null,
        "lon": null,
        "intervenciones": [
          {
            "intervencion_id": "UNP-44-01",
            "referencia_proceso": "4173.010.32.1.839-2025",
            "referencia_contrato": "4173.010.26.1.1268-2025",
            "url_proceso": "https://www.secop.gov.co/CO1BusinessLine/Tendering/ContractNoticeView/Index?prevCtxLbl=Buscar+procesos&prevCtxUrl=https%3a%2f%2fwww.secop.gov.co%3a443%2fCO1BusinessLine%2fTendering%2fContractNoticeManagement%2fIndex&notice=CO1.NTC.8464265",
            "bpin": 26005393,
            "estado": "En ejecución",
            "tipo_intervencion": "Adecuaciones",
            "fuente_financiacion": "Empréstito",
            "presupuesto_base": 324589497,
            "ano": 2025,
            "avance_obra": 88.75,
            "fecha_inicio": "2025-09-29T00:00:00",
            "fecha_fin": "2026-01-31T00:00:00",
            "fecha_inicio_std": "2025-09-29T00:00:00",
            "fecha_fin_std": "2026-01-31T00:00:00",
            "frente_activo": "Frente activo",
            "fuera_rango": null
          },
          {
            "intervencion_id": "UNP-44-02",
            "referencia_proceso": "4173.010.32.1.839-2025",
            "referencia_contrato": "4173.010.26.1.1268-2025",
            "url_proceso": "https://www.secop.gov.co/CO1BusinessLine/Tendering/ContractNoticeView/Index?prevCtxLbl=Buscar+procesos&prevCtxUrl=https%3a%2f%2fwww.secop.gov.co%3a443%2fCO1BusinessLine%2fTendering%2fContractNoticeManagement%2fIndex&notice=CO1.NTC.8464265",
            "bpin": 26005393,
            "estado": "En ejecución",
            "tipo_intervencion": "Adecuaciones",
            "fuente_financiacion": "Empréstito",
            "presupuesto_base": 282747476,
            "ano": 2025,
            "avance_obra": 90.53,
            "fecha_inicio": "2025-10-02T00:00:00",
            "fecha_fin": "2026-01-31T00:00:00",
            "fecha_inicio_std": "2025-10-02T00:00:00",
            "fecha_fin_std": "2026-01-31T00:00:00",
            "frente_activo": "Frente activo",
            "fuera_rango": null
          },
          {
            "intervencion_id": "UNP-44-03",
            "referencia_proceso": "4173.010.32.1.839-2025",
            "referencia_contrato": "4173.010.26.1.1268-2025",
            "url_proceso": "https://www.secop.gov.co/CO1BusinessLine/Tendering/ContractNoticeView/Index?prevCtxLbl=Buscar+procesos&prevCtxUrl=https%3a%2f%2fwww.secop.gov.co%3a443%2fCO1BusinessLine%2fTendering%2fContractNoticeManagement%2fIndex&notice=CO1.NTC.8464265",
            "bpin": 26005393,
            "estado": "En ejecución",
            "tipo_intervencion": "Adecuaciones",
            "fuente_financiacion": "Empréstito",
            "presupuesto_base": 258670109,
            "ano": 2025,
            "avance_obra": 95.41,
            "fecha_inicio": "2025-11-04T00:00:00",
            "fecha_fin": "2026-01-31T00:00:00",
            "fecha_inicio_std": "2025-11-04T00:00:00",
            "fecha_fin_std": "2026-01-31T00:00:00",
            "frente_activo": "Frente activo",
            "fuera_rango": null
          },
          {
            "intervencion_id": "UNP-44-04",
            "referencia_proceso": "4173.010.32.1.839-2025",
            "referencia_contrato": "4173.010.26.1.1268-2025",
            "url_proceso": "https://www.secop.gov.co/CO1BusinessLine/Tendering/ContractNoticeView/Index?prevCtxLbl=Buscar+procesos&prevCtxUrl=https%3a%2f%2fwww.secop.gov.co%3a443%2fCO1BusinessLine%2fTendering%2fContractNoticeManagement%2fIndex&notice=CO1.NTC.8464265",
            "bpin": 26005393,
            "estado": "En ejecución",
            "tipo_intervencion": "Adecuaciones",
            "fuente_financiacion": "Empréstito",
            "presupuesto_base": 298278028,
            "ano": 2025,
            "avance_obra": 81.89,
            "fecha_inicio": "2025-10-15T00:00:00",
            "fecha_fin": "2026-01-31T00:00:00",
            "fecha_inicio_std": "2025-10-15T00:00:00",
            "fecha_fin_std": "2026-01-31T00:00:00",
            "frente_activo": "Frente activo",
            "fuera_rango": null
          },
          {
            "intervencion_id": "UNP-44-05",
            "referencia_proceso": "4173.010.32.1.843-2025",
            "referencia_contrato": "4173.010.26.1.1277-2025",
            "url_proceso": "https://www.secop.gov.co/CO1BusinessLine/Tendering/ContractNoticeView/Index?prevCtxLbl=Buscar+procesos&prevCtxUrl=https%3a%2f%2fwww.secop.gov.co%3a443%2fCO1BusinessLine%2fTendering%2fContractNoticeManagement%2fIndex&notice=CO1.NTC.8578046",
            "bpin": 26005393,
            "estado": "En ejecución",
            "tipo_intervencion": "Adecuaciones",
            "fuente_financiacion": "Empréstito",
            "presupuesto_base": 569248490,
            "ano": 2026,
            "avance_obra": 27.95,
            "fecha_inicio": "2025-11-03T00:00:00",
            "fecha_fin": "2026-02-27T00:00:00",
            "fecha_inicio_std": "2025-11-03T00:00:00",
            "fecha_fin_std": "2026-02-27T00:00:00",
            "frente_activo": "Frente activo",
            "fuera_rango": null
          },
          {
            "intervencion_id": "UNP-44-06",
            "referencia_proceso": "4173.010.32.1.843-2025",
            "referencia_contrato": "4173.010.26.1.1277-2025",
            "url_proceso": "https://www.secop.gov.co/CO1BusinessLine/Tendering/ContractNoticeView/Index?prevCtxLbl=Buscar+procesos&prevCtxUrl=https%3a%2f%2fwww.secop.gov.co%3a443%2fCO1BusinessLine%2fTendering%2fContractNoticeManagement%2fIndex&notice=CO1.NTC.8578046",
            "bpin": 26005393,
            "estado": "En ejecución",
            "tipo_intervencion": "Adecuaciones",
            "fuente_financiacion": "Empréstito",
            "presupuesto_base": 266942678,
            "ano": 2025,
            "avance_obra": 69.85,
            "fecha_inicio": "2025-10-27T00:00:00",
            "fecha_fin": "2026-03-20T00:00:00",
            "fecha_inicio_std": "2025-10-27T00:00:00",
            "fecha_fin_std": "2026-03-20T00:00:00",
            "frente_activo": "Frente activo",
            "fuera_rango": null
          },
          {
            "intervencion_id": "UNP-44-07",
            "referencia_proceso": "4173.010.32.1.843-2025",
            "referencia_contrato": "4173.010.26.1.1277-2025",
            "url_proceso": "https://www.secop.gov.co/CO1BusinessLine/Tendering/ContractNoticeView/Index?prevCtxLbl=Buscar+procesos&prevCtxUrl=https%3a%2f%2fwww.secop.gov.co%3a443%2fCO1BusinessLine%2fTendering%2fContractNoticeManagement%2fIndex&notice=CO1.NTC.8578046",
            "bpin": 26005393,
            "estado": "En alistamiento",
            "tipo_intervencion": "Adecuaciones",
            "fuente_financiacion": "Empréstito",
            "presupuesto_base": 459609292,
            "ano": 2026,
            "avance_obra": 0.0,
            "fecha_inicio": "2026-01-05T00:00:00",
            "fecha_fin": "2026-03-20T00:00:00",
            "fecha_inicio_std": "2026-01-05T00:00:00",
            "fecha_fin_std": "2026-03-20T00:00:00",
            "frente_activo": "No aplica",
            "fuera_rango": null
          },
          {
            "intervencion_id": "UNP-44-08",
            "referencia_proceso": "4173.010.32.1.1246-2025",
            "referencia_contrato": "4173.010.26.1.1357-2025",
            "url_proceso": "https://www.secop.gov.co/CO1BusinessLine/Tendering/ContractNoticeView/Index?prevCtxLbl=Buscar+procesos&prevCtxUrl=https%3a%2f%2fwww.secop.gov.co%3a443%2fCO1BusinessLine%2fTendering%2fContractNoticeManagement%2fIndex&notice=CO1.NTC.8617820",
            "bpin": 26005393,
            "estado": "En ejecución",
            "tipo_intervencion": "Adecuaciones",
            "fuente_financiacion": "Empréstito",
            "presupuesto_base": 2376599289,
            "ano": 2026,
            "avance_obra": 6.8,
            "fecha_inicio": "2025-11-03T00:00:00",
            "fecha_fin": "2026-07-10T00:00:00",
            "fecha_inicio_std": "2025-11-03T00:00:00",
            "fecha_fin_std": "2026-07-10T00:00:00",
            "frente_activo": "Frente activo",
            "fuera_rango": null
          },
          {
            "intervencion_id": "UNP-44-09",
            "referencia_proceso": "4173.010.32.1.843-2025",
            "referencia_contrato": "4173.010.26.1.1277-2025",
            "url_proceso": "https://www.secop.gov.co/CO1BusinessLine/Tendering/ContractNoticeView/Index?prevCtxLbl=Buscar+procesos&prevCtxUrl=https%3a%2f%2fwww.secop.gov.co%3a443%2fCO1BusinessLine%2fTendering%2fContractNoticeManagement%2fIndex&notice=CO1.NTC.8578046",
            "bpin": 26005393,
            "estado": "En ejecución",
            "tipo_intervencion": "Adecuaciones",
            "fuente_financiacion": "Empréstito",
            "presupuesto_base": 721246876,
            "ano": 2025,
            "avance_obra": 55.52,
            "fecha_inicio": "2025-09-29T00:00:00",
            "fecha_fin": "2026-03-20T00:00:00",
            "fecha_inicio_std": "2025-09-29T00:00:00",
            "fecha_fin_std": "2026-03-20T00:00:00",
            "frente_activo": "Frente activo",
            "fuera_rango": null
          },
          {
            "intervencion_id": "UNP-44-10",
            "referencia_proceso": "4173.010.32.1.843-2025",
            "referencia_contrato": "4173.010.26.1.1277-2025",
            "url_proceso": "https://www.secop.gov.co/CO1BusinessLine/Tendering/ContractNoticeView/Index?prevCtxLbl=Buscar+procesos&prevCtxUrl=https%3a%2f%2fwww.secop.gov.co%3a443%2fCO1BusinessLine%2fTendering%2fContractNoticeManagement%2fIndex&notice=CO1.NTC.8578046",
            "bpin": 26005393,
            "estado": "En ejecución",
            "tipo_intervencion": "Adecuaciones",
            "fuente_financiacion": "Empréstito",
            "presupuesto_base": 733474701,
            "ano": 2026,
            "avance_obra": 48.21,
            "fecha_inicio": "2025-09-29T00:00:00",
            "fecha_fin": "2026-02-17T00:00:00",
            "fecha_inicio_std": "2025-09-29T00:00:00",
            "fecha_fin_std": "2026-02-17T00:00:00",
            "frente_activo": "Frente activo",
            "fuera_rango": null
          }
        ],
        "presupuesto_base": 6291406436,
        "avance_obra": 36.5
      }
    },
    {
      "type": "Feature",
      "geometry": null,
      "properties": {
        "upid": "UNP-45",
        "n_intervenciones": 2,
        "nombre_up": null,
        "nombre_up_detalle": null,
        "nombre_centro_gestor": "Secretaría de Bienestar Social",
        "direccion": null,
        "tipo_equipamiento": null,
        "clase_up": null,
        "comuna_corregimiento": null,
        "comuna_corregimiento_2": null,
        "barrio_vereda": null,
        "barrio_vereda_2": null,
        "identificador": null,
        "bpin": 0,
        "lat": null,
        "lon": null,
        "intervenciones": [
          {
            "intervencion_id": "UNP-45-01",
            "referencia_proceso": null,
            "referencia_contrato": null,
            "url_proceso": null,
            "bpin": 0,
            "estado": "En alistamiento",
            "tipo_intervencion": null,
            "fuente_financiacion": null,
            "presupuesto_base": 0,
            "ano": 2024,
            "avance_obra": 0.0,
            "fecha_inicio": null,
            "fecha_fin": null,
            "fecha_inicio_std": null,
            "fecha_fin_std": null,
            "frente_activo": "No aplica",
            "fuera_rango": null
          },
          {
            "intervencion_id": "UNP-45-02",
            "referencia_proceso": null,
            "referencia_contrato": null,
            "url_proceso": null,
            "bpin": 0,
            "estado": "En alistamiento",
            "tipo_intervencion": null,
            "fuente_financiacion": null,
            "presupuesto_base": 0,
            "ano": 2024,
            "avance_obra": 0.0,
            "fecha_inicio": null,
            "fecha_fin": null,
            "fecha_inicio_std": null,
            "fecha_fin_std": null,
            "frente_activo": "No aplica",
            "fuera_rango": null
          }
        ],
        "presupuesto_base": 0,
        "avance_obra": 0.0
      }
    },
    {
      "type": "Feature",
      "geometry": null,
      "properties": {
        "upid": "UNP-46",
        "n_intervenciones": 16,
        "nombre_up": "Cancha Multiple de Baloncesto Alfonso Lopez Ii",
        "nombre_up_detalle": "Recuperacion de Superficie de Cancha Multiple",
        "nombre_centro_gestor": "Secretaría del Deporte y la Recreación",
        "direccion": "Calle 101b y 101d entre Carreras 23a y 23b",
        "tipo_equipamiento": "Infraestructura recreo deportiva",
        "clase_up": "Obras equipamientos",
        "comuna_corregimiento": "COMUNA 10",
        "comuna_corregimiento_2": null,
        "barrio_vereda": "REMANSOS DE COMFANDI",
        "barrio_vereda_2": null,
        "identificador": "Grupo Licitación 2",
        "bpin": 202476000000000000,
        "lat": null,
        "lon": null,
        "intervenciones": [
          {
            "intervencion_id": "UNP-46-01",
            "referencia_proceso": "4162.010.32.1.1058-2025",
            "referencia_contrato": "4162.010.26.1.3229-2025",
            "url_proceso": "https://community.secop.gov.co/Public/Tendering/ContractNoticePhases/View?PPI=CO1.PPI.40365146&isFromPublicArea=True&isModal=False",
            "bpin": 202476000000000000,
            "estado": "En ejecución",
            "tipo_intervencion": "Adecuaciones",
            "fuente_financiacion": "Empréstito",
            "presupuesto_base": 0,
            "ano": 2025,
            "avance_obra": 5.0,
            "fecha_inicio": "10/10/2025",
            "fecha_fin": "2025-12-15T00:00:00",
            "fecha_inicio_std": "2025-10-10T00:00:00",
            "fecha_fin_std": "2025-12-15T00:00:00",
            "frente_activo": "Frente activo",
            "fuera_rango": null
          },
          {
            "intervencion_id": "UNP-46-02",
            "referencia_proceso": "4162.010.32.1.1059-2025",
            "referencia_contrato": "4162.010.26.1.5086-2025",
            "url_proceso": "https://community.secop.gov.co/Public/Tendering/ContractNoticePhases/View?PPI=CO1.PPI.40683615&isFromPublicArea=True&isModal=False",
            "bpin": 202476000000000000,
            "estado": "Terminado",
            "tipo_intervencion": "Adecuaciones",
            "fuente_financiacion": "Empréstito",
            "presupuesto_base": 33872391,
            "ano": 2025,
            "avance_obra": 100.0,
            "fecha_inicio": "1/11/2025",
            "fecha_fin": "2026-03-02T00:00:00",
            "fecha_inicio_std": "2025-01-11T00:00:00",
            "fecha_fin_std": "2026-03-02T00:00:00",
            "frente_activo": "No aplica",
            "fuera_rango": null
          },
          {
            "intervencion_id": "UNP-46-03",
            "referencia_proceso": "4162.010.32.1.1058-2025",
            "referencia_contrato": "4162.010.26.1.3229-2025",
            "url_proceso": "https://community.secop.gov.co/Public/Tendering/ContractNoticePhases/View?PPI=CO1.PPI.40365146&isFromPublicArea=True&isModal=False",
            "bpin": 202476000000000000,
            "estado": "Terminado",
            "tipo_intervencion": "Adecuaciones",
            "fuente_financiacion": "Empréstito",
            "presupuesto_base": 36488947,
            "ano": 2025,
            "avance_obra": 100.0,
            "fecha_inicio": "10/10/2025",
            "fecha_fin": "2025-12-15T00:00:00",
            "fecha_inicio_std": "2025-10-10T00:00:00",
            "fecha_fin_std": "2025-12-15T00:00:00",
            "frente_activo": "No aplica",
            "fuera_rango": null
          },
          {
            "intervencion_id": "UNP-46-04",
            "referencia_proceso": "4162.010.32.1.1058-2025",
            "referencia_contrato": "4162.010.26.1.3229-2025",
            "url_proceso": "https://community.secop.gov.co/Public/Tendering/ContractNoticePhases/View?PPI=CO1.PPI.40365146&isFromPublicArea=True&isModal=False",
            "bpin": 202476000000000000,
            "estado": "En alistamiento",
            "tipo_intervencion": "Adecuaciones",
            "fuente_financiacion": "Empréstito",
            "presupuesto_base": 25874439,
            "ano": 2025,
            "avance_obra": 0.0,
            "fecha_inicio": "10/10/2025",
            "fecha_fin": "2025-12-15T00:00:00",
            "fecha_inicio_std": "2025-10-10T00:00:00",
            "fecha_fin_std": "2025-12-15T00:00:00",
            "frente_activo": "No aplica",
            "fuera_rango": null
          },
          {
            "intervencion_id": "UNP-46-05",
            "referencia_proceso": "4162.010.32.1.1058-2025",
            "referencia_contrato": "4162.010.26.1.3229-2025",
            "url_proceso": "https://community.secop.gov.co/Public/Tendering/ContractNoticePhases/View?PPI=CO1.PPI.40365146&isFromPublicArea=True&isModal=False",
            "bpin": 202476000000000000,
            "estado": "En alistamiento",
            "tipo_intervencion": "Adecuaciones",
            "fuente_financiacion": "Empréstito",
            "presupuesto_base": 40360039,
            "ano": 2025,
            "avance_obra": 0.0,
            "fecha_inicio": "10/10/2025",
            "fecha_fin": "2025-12-15T00:00:00",
            "fecha_inicio_std": "2025-10-10T00:00:00",
            "fecha_fin_std": "2025-12-15T00:00:00",
            "frente_activo": "No aplica",
            "fuera_rango": null
          },
          {
            "intervencion_id": "UNP-46-06",
            "referencia_proceso": "4162.010.32.1.1058-2025",
            "referencia_contrato": "4162.010.26.1.3229-2025",
            "url_proceso": "https://community.secop.gov.co/Public/Tendering/ContractNoticePhases/View?PPI=CO1.PPI.40365146&isFromPublicArea=True&isModal=False",
            "bpin": 202476000000000000,
            "estado": "En alistamiento",
            "tipo_intervencion": "Adecuaciones",
            "fuente_financiacion": "Empréstito",
            "presupuesto_base": 102824465,
            "ano": 2025,
            "avance_obra": 0.0,
            "fecha_inicio": "10/10/2025",
            "fecha_fin": "2025-12-15T00:00:00",
            "fecha_inicio_std": "2025-10-10T00:00:00",
            "fecha_fin_std": "2025-12-15T00:00:00",
            "frente_activo": "No aplica",
            "fuera_rango": null
          },
          {
            "intervencion_id": "UNP-46-07",
            "referencia_proceso": "4162.010.32.1.1058-2025",
            "referencia_contrato": "4162.010.26.1.3229-2025",
            "url_proceso": "https://community.secop.gov.co/Public/Tendering/ContractNoticePhases/View?PPI=CO1.PPI.40365146&isFromPublicArea=True&isModal=False",
            "bpin": 202476000000000000,
            "estado": "En ejecución",
            "tipo_intervencion": "Adecuaciones",
            "fuente_financiacion": "Empréstito",
            "presupuesto_base": 51526733,
            "ano": 2025,
            "avance_obra": 20.0,
            "fecha_inicio": "10/10/2025",
            "fecha_fin": "2025-12-15T00:00:00",
            "fecha_inicio_std": "2025-10-10T00:00:00",
            "fecha_fin_std": "2025-12-15T00:00:00",
            "frente_activo": "Frente activo",
            "fuera_rango": null
          },
          {
            "intervencion_id": "UNP-46-08",
            "referencia_proceso": "4162.010.32.1.1058-2025",
            "referencia_contrato": "4162.010.26.1.3229-2025",
            "url_proceso": "https://community.secop.gov.co/Public/Tendering/ContractNoticePhases/View?PPI=CO1.PPI.40365146&isFromPublicArea=True&isModal=False",
            "bpin": 202476000000000000,
            "estado": "En alistamiento",
            "tipo_intervencion": "Adecuaciones",
            "fuente_financiacion": "Empréstito",
            "presupuesto_base": 71030983,
            "ano": 2025,
            "avance_obra": 0.0,
            "fecha_inicio": "10/10/2025",
            "fecha_fin": "2025-12-15T00:00:00",
            "fecha_inicio_std": "2025-10-10T00:00:00",
            "fecha_fin_std": "2025-12-15T00:00:00",
            "frente_activo": "No aplica",
            "fuera_rango": null
          },
          {
            "intervencion_id": "UNP-46-09",
            "referencia_proceso": "4162.010.32.1.1058-2025",
            "referencia_contrato": "4162.010.26.1.3229-2025",
            "url_proceso": "https://community.secop.gov.co/Public/Tendering/ContractNoticePhases/View?PPI=CO1.PPI.40365146&isFromPublicArea=True&isModal=False",
            "bpin": 202476000000000000,
            "estado": "En alistamiento",
            "tipo_intervencion": "Adecuaciones",
            "fuente_financiacion": "Empréstito",
            "presupuesto_base": 36167824,
            "ano": 2025,
            "avance_obra": 0.0,
            "fecha_inicio": "1/11/2025",
            "fecha_fin": "2026-03-02T00:00:00",
            "fecha_inicio_std": "2025-01-11T00:00:00",
            "fecha_fin_std": "2026-03-02T00:00:00",
            "frente_activo": "No aplica",
            "fuera_rango": null
          },
          {
            "intervencion_id": "UNP-46-10",
            "referencia_proceso": "4162.010.32.1.1058-2025",
            "referencia_contrato": "4162.010.26.1.3229-2025",
            "url_proceso": "https://community.secop.gov.co/Public/Tendering/ContractNoticePhases/View?PPI=CO1.PPI.40365146&isFromPublicArea=True&isModal=False",
            "bpin": 202476000000000000,
            "estado": "Terminado",
            "tipo_intervencion": "Adecuaciones",
            "fuente_financiacion": "Empréstito",
            "presupuesto_base": 48253270,
            "ano": 2025,
            "avance_obra": 100.0,
            "fecha_inicio": "10/10/2025",
            "fecha_fin": "2025-12-15T00:00:00",
            "fecha_inicio_std": "2025-10-10T00:00:00",
            "fecha_fin_std": "2025-12-15T00:00:00",
            "frente_activo": "No aplica",
            "fuera_rango": null
          },
          {
            "intervencion_id": "UNP-46-11",
            "referencia_proceso": "4162.010.32.1.1058-2025",
            "referencia_contrato": "4162.010.26.1.3229-2025",
            "url_proceso": "https://community.secop.gov.co/Public/Tendering/ContractNoticePhases/View?PPI=CO1.PPI.40365146&isFromPublicArea=True&isModal=False",
            "bpin": 202476000000000000,
            "estado": "En alistamiento",
            "tipo_intervencion": "Adecuaciones",
            "fuente_financiacion": "Empréstito",
            "presupuesto_base": 30852145,
            "ano": 2025,
            "avance_obra": 0.0,
            "fecha_inicio": "10/10/2025",
            "fecha_fin": "2025-12-15T00:00:00",
            "fecha_inicio_std": "2025-10-10T00:00:00",
            "fecha_fin_std": "2025-12-15T00:00:00",
            "frente_activo": "No aplica",
            "fuera_rango": null
          },
          {
            "intervencion_id": "UNP-46-12",
            "referencia_proceso": "4162.010.32.1.1058-2025",
            "referencia_contrato": "4162.010.26.1.3229-2025",
            "url_proceso": "https://community.secop.gov.co/Public/Tendering/ContractNoticePhases/View?PPI=CO1.PPI.40365146&isFromPublicArea=True&isModal=False",
            "bpin": 202476000000000000,
            "estado": "En alistamiento",
            "tipo_intervencion": "Adecuaciones",
            "fuente_financiacion": "Empréstito",
            "presupuesto_base": 100177861,
            "ano": 2025,
            "avance_obra": 0.0,
            "fecha_inicio": "10/10/2025",
            "fecha_fin": "2025-12-15T00:00:00",
            "fecha_inicio_std": "2025-10-10T00:00:00",
            "fecha_fin_std": "2025-12-15T00:00:00",
            "frente_activo": "No aplica",
            "fuera_rango": null
          },
          {
            "intervencion_id": "UNP-46-13",
            "referencia_proceso": "4162.010.32.1.1058-2025",
            "referencia_contrato": "4162.010.26.1.3229-2025",
            "url_proceso": "https://community.secop.gov.co/Public/Tendering/ContractNoticePhases/View?PPI=CO1.PPI.40365146&isFromPublicArea=True&isModal=False",
            "bpin": 202476000000000000,
            "estado": "En alistamiento",
            "tipo_intervencion": "Adecuaciones",
            "fuente_financiacion": "Empréstito",
            "presupuesto_base": 94462010,
            "ano": 2025,
            "avance_obra": 0.0,
            "fecha_inicio": "10/10/2025",
            "fecha_fin": "2025-12-15T00:00:00",
            "fecha_inicio_std": "2025-10-10T00:00:00",
            "fecha_fin_std": "2025-12-15T00:00:00",
            "frente_activo": "No aplica",
            "fuera_rango": null
          },
          {
            "intervencion_id": "UNP-46-14",
            "referencia_proceso": "4162.010.32.1.1058-2025",
            "referencia_contrato": "4162.010.26.1.3229-2025",
            "url_proceso": "https://community.secop.gov.co/Public/Tendering/ContractNoticePhases/View?PPI=CO1.PPI.40365146&isFromPublicArea=True&isModal=False",
            "bpin": 202476000000000000,
            "estado": "En alistamiento",
            "tipo_intervencion": "Adecuaciones",
            "fuente_financiacion": "Empréstito",
            "presupuesto_base": 81619437,
            "ano": 2025,
            "avance_obra": 0.0,
            "fecha_inicio": "10/10/2025",
            "fecha_fin": "2025-12-15T00:00:00",
            "fecha_inicio_std": "2025-10-10T00:00:00",
            "fecha_fin_std": "2025-12-15T00:00:00",
            "frente_activo": "No aplica",
            "fuera_rango": null
          },
          {
            "intervencion_id": "UNP-46-15",
            "referencia_proceso": "4162.010.32.1.1058-2025",
            "referencia_contrato": "4162.010.26.1.3229-2025",
            "url_proceso": "https://community.secop.gov.co/Public/Tendering/ContractNoticePhases/View?PPI=CO1.PPI.40365146&isFromPublicArea=True&isModal=False",
            "bpin": 202476000000000000,
            "estado": "En alistamiento",
            "tipo_intervencion": "Adecuaciones",
            "fuente_financiacion": "Empréstito",
            "presupuesto_base": 41487820,
            "ano": 2025,
            "avance_obra": 0.0,
            "fecha_inicio": "10/10/2025",
            "fecha_fin": "2025-12-15T00:00:00",
            "fecha_inicio_std": "2025-10-10T00:00:00",
            "fecha_fin_std": "2025-12-15T00:00:00",
            "frente_activo": "No aplica",
            "fuera_rango": null
          },
          {
            "intervencion_id": "UNP-46-16",
            "referencia_proceso": "4162.010.32.1.1058-2025",
            "referencia_contrato": "4162.010.26.1.3229-2025",
            "url_proceso": "https://community.secop.gov.co/Public/Tendering/ContractNoticePhases/View?PPI=CO1.PPI.40365146&isFromPublicArea=True&isModal=False",
            "bpin": 202476000000000000,
            "estado": "En alistamiento",
            "tipo_intervencion": "Adecuaciones",
            "fuente_financiacion": "Empréstito",
            "presupuesto_base": 42333327,
            "ano": 2025,
            "avance_obra": 0.0,
            "fecha_inicio": "10/10/2025",
            "fecha_fin": "2025-12-15T00:00:00",
            "fecha_inicio_std": "2025-10-10T00:00:00",
            "fecha_fin_std": "2025-12-15T00:00:00",
            "frente_activo": "No aplica",
            "fuera_rango": null
          }
        ],
        "presupuesto_base": 837331691,
        "avance_obra": 15.4
      }
    },
    {
      "type": "Feature",
      "geometry": null,
      "properties": {
        "upid": "UNP-47",
        "n_intervenciones": 4,
        "nombre_up": "Unidad Recreativa Brisas de los Alamos",
        "nombre_up_detalle": "Recuperacion de Superficie de Cancha Multiple",
        "nombre_centro_gestor": "Secretaría del Deporte y la Recreación",
        "direccion": "Calles 47b Norte y 49 Norte, Avenida 2e Norte y 2h Norte",
        "tipo_equipamiento": "Infraestructura recreo deportiva",
        "clase_up": "Obras equipamientos",
        "comuna_corregimiento": "COMUNA 02",
        "comuna_corregimiento_2": null,
        "barrio_vereda": "Brisas de Los Alamos",
        "barrio_vereda_2": null,
        "identificador": "Grupo Licitación 2",
        "bpin": 202476000000000000,
        "lat": null,
        "lon": null,
        "intervenciones": [
          {
            "intervencion_id": "UNP-47-01",
            "referencia_proceso": "4162.010.32.1.1059-2025",
            "referencia_contrato": "4162.010.26.1.5086-2025",
            "url_proceso": "https://community.secop.gov.co/Public/Tendering/ContractNoticePhases/View?PPI=CO1.PPI.40683615&isFromPublicArea=True&isModal=False",
            "bpin": 202476000000000000,
            "estado": "En alistamiento",
            "tipo_intervencion": "Adecuaciones",
            "fuente_financiacion": "Empréstito",
            "presupuesto_base": 371848149,
            "ano": 2025,
            "avance_obra": 0.0,
            "fecha_inicio": "1/11/2025",
            "fecha_fin": "2026-03-02T00:00:00",
            "fecha_inicio_std": "2025-01-11T00:00:00",
            "fecha_fin_std": "2026-03-02T00:00:00",
            "frente_activo": "No aplica",
            "fuera_rango": null
          },
          {
            "intervencion_id": "UNP-47-02",
            "referencia_proceso": "4162.010.32.1.1059-2025",
            "referencia_contrato": "4162.010.26.1.5086-2025",
            "url_proceso": "https://community.secop.gov.co/Public/Tendering/ContractNoticePhases/View?PPI=CO1.PPI.40683615&isFromPublicArea=True&isModal=False",
            "bpin": 202476000000000000,
            "estado": "En alistamiento",
            "tipo_intervencion": "Adecuaciones",
            "fuente_financiacion": "Empréstito",
            "presupuesto_base": 371848149,
            "ano": 2025,
            "avance_obra": 0.0,
            "fecha_inicio": "1/11/2025",
            "fecha_fin": "2026-03-02T00:00:00",
            "fecha_inicio_std": "2025-01-11T00:00:00",
            "fecha_fin_std": "2026-03-02T00:00:00",
            "frente_activo": "No aplica",
            "fuera_rango": null
          },
          {
            "intervencion_id": "UNP-47-03",
            "referencia_proceso": "4162.010.32.1.1059-2025",
            "referencia_contrato": "4162.010.26.1.5086-2025",
            "url_proceso": "https://community.secop.gov.co/Public/Tendering/ContractNoticePhases/View?PPI=CO1.PPI.40683615&isFromPublicArea=True&isModal=False",
            "bpin": 202476000000000000,
            "estado": "En alistamiento",
            "tipo_intervencion": "Adecuaciones",
            "fuente_financiacion": "Empréstito",
            "presupuesto_base": 384109545,
            "ano": 2025,
            "avance_obra": 0.0,
            "fecha_inicio": "1/11/2025",
            "fecha_fin": "2026-03-02T00:00:00",
            "fecha_inicio_std": "2025-01-11T00:00:00",
            "fecha_fin_std": "2026-03-02T00:00:00",
            "frente_activo": "No aplica",
            "fuera_rango": null
          },
          {
            "intervencion_id": "UNP-47-04",
            "referencia_proceso": "4162.010.32.1.1058-2025",
            "referencia_contrato": "4162.010.26.1.3229-2025",
            "url_proceso": "https://community.secop.gov.co/Public/Tendering/ContractNoticePhases/View?PPI=CO1.PPI.40365146&isFromPublicArea=True&isModal=False",
            "bpin": 202476000000000000,
            "estado": "En ejecución",
            "tipo_intervencion": "Adecuaciones",
            "fuente_financiacion": "Empréstito",
            "presupuesto_base": 33019072,
            "ano": 2025,
            "avance_obra": 44.0,
            "fecha_inicio": "10/10/2025",
            "fecha_fin": "2025-12-15T00:00:00",
            "fecha_inicio_std": "2025-10-10T00:00:00",
            "fecha_fin_std": "2025-12-15T00:00:00",
            "frente_activo": "Frente activo",
            "fuera_rango": null
          }
        ],
        "presupuesto_base": 1160824915,
        "avance_obra": 1.25
      }
    },
    {
      "type": "Feature",
      "geometry": null,
      "properties": {
        "upid": "UNP-48",
        "n_intervenciones": 8,
        "nombre_up": "Polideportivo Colseguros los Andes",
        "nombre_up_detalle": "Adecuacion de Juegos Infantiles - Recuperacion de Superficie de Cancha Multiple",
        "nombre_centro_gestor": "Secretaría del Deporte y la Recreación",
        "direccion": "Calles 42 Norte y 43 Norte, Avenidas 3d Norte y 3f Norte",
        "tipo_equipamiento": "Infraestructura recreo deportiva",
        "clase_up": "Obras equipamientos",
        "comuna_corregimiento": "COMUNA 10",
        "comuna_corregimiento_2": null,
        "barrio_vereda": "Colseguros Andes",
        "barrio_vereda_2": null,
        "identificador": "Grupo Licitación 2",
        "bpin": 202476000000000000,
        "lat": null,
        "lon": null,
        "intervenciones": [
          {
            "intervencion_id": "UNP-48-01",
            "referencia_proceso": "4162.010.32.1.1058-2025",
            "referencia_contrato": "4162.010.26.1.3229-2025",
            "url_proceso": "https://community.secop.gov.co/Public/Tendering/ContractNoticePhases/View?PPI=CO1.PPI.40365146&isFromPublicArea=True&isModal=False",
            "bpin": 202476000000000000,
            "estado": "En alistamiento",
            "tipo_intervencion": "Adecuaciones",
            "fuente_financiacion": "Empréstito",
            "presupuesto_base": 22637944,
            "ano": 2025,
            "avance_obra": 0.0,
            "fecha_inicio": "10/10/2025",
            "fecha_fin": "2025-12-15T00:00:00",
            "fecha_inicio_std": "2025-10-10T00:00:00",
            "fecha_fin_std": "2025-12-15T00:00:00",
            "frente_activo": "No aplica",
            "fuera_rango": null
          },
          {
            "intervencion_id": "UNP-48-02",
            "referencia_proceso": "4162.010.32.1.1058-2025",
            "referencia_contrato": "4162.010.26.1.3229-2025",
            "url_proceso": "https://community.secop.gov.co/Public/Tendering/ContractNoticePhases/View?PPI=CO1.PPI.40365146&isFromPublicArea=True&isModal=False",
            "bpin": 202476000000000000,
            "estado": "En alistamiento",
            "tipo_intervencion": "Adecuaciones",
            "fuente_financiacion": "Empréstito",
            "presupuesto_base": 36858013,
            "ano": 2025,
            "avance_obra": 0.0,
            "fecha_inicio": "10/10/2025",
            "fecha_fin": "2025-12-15T00:00:00",
            "fecha_inicio_std": "2025-10-10T00:00:00",
            "fecha_fin_std": "2025-12-15T00:00:00",
            "frente_activo": "No aplica",
            "fuera_rango": null
          },
          {
            "intervencion_id": "UNP-48-03",
            "referencia_proceso": "4162.010.32.1.1058-2025",
            "referencia_contrato": "4162.010.26.1.3229-2025",
            "url_proceso": "https://community.secop.gov.co/Public/Tendering/ContractNoticePhases/View?PPI=CO1.PPI.40365146&isFromPublicArea=True&isModal=False",
            "bpin": 202476000000000000,
            "estado": "En alistamiento",
            "tipo_intervencion": "Adecuaciones",
            "fuente_financiacion": "Empréstito",
            "presupuesto_base": 33833812,
            "ano": 2025,
            "avance_obra": 0.0,
            "fecha_inicio": "10/10/2025",
            "fecha_fin": "2025-12-15T00:00:00",
            "fecha_inicio_std": "2025-10-10T00:00:00",
            "fecha_fin_std": "2025-12-15T00:00:00",
            "frente_activo": "No aplica",
            "fuera_rango": null
          },
          {
            "intervencion_id": "UNP-48-04",
            "referencia_proceso": "4162.010.32.1.1058-2025",
            "referencia_contrato": "4162.010.26.1.3229-2025",
            "url_proceso": "https://community.secop.gov.co/Public/Tendering/ContractNoticePhases/View?PPI=CO1.PPI.40365146&isFromPublicArea=True&isModal=False",
            "bpin": 202476000000000000,
            "estado": "Terminado",
            "tipo_intervencion": "Adecuaciones",
            "fuente_financiacion": "Empréstito",
            "presupuesto_base": 35900857,
            "ano": 2025,
            "avance_obra": 100.0,
            "fecha_inicio": "10/10/2025",
            "fecha_fin": "2025-12-15T00:00:00",
            "fecha_inicio_std": "2025-10-10T00:00:00",
            "fecha_fin_std": "2025-12-15T00:00:00",
            "frente_activo": "No aplica",
            "fuera_rango": null
          },
          {
            "intervencion_id": "UNP-48-05",
            "referencia_proceso": "4162.010.32.1.1058-2025",
            "referencia_contrato": "4162.010.26.1.3229-2025",
            "url_proceso": "https://community.secop.gov.co/Public/Tendering/ContractNoticePhases/View?PPI=CO1.PPI.40365146&isFromPublicArea=True&isModal=False",
            "bpin": 202476000000000000,
            "estado": "Terminado",
            "tipo_intervencion": "Adecuaciones",
            "fuente_financiacion": "Empréstito",
            "presupuesto_base": 32328600,
            "ano": 2025,
            "avance_obra": 100.0,
            "fecha_inicio": "10/10/2025",
            "fecha_fin": "2025-12-15T00:00:00",
            "fecha_inicio_std": "2025-10-10T00:00:00",
            "fecha_fin_std": "2025-12-15T00:00:00",
            "frente_activo": "No aplica",
            "fuera_rango": null
          },
          {
            "intervencion_id": "UNP-48-06",
            "referencia_proceso": "4162.010.32.1.1058-2025",
            "referencia_contrato": "4162.010.26.1.3229-2025",
            "url_proceso": "https://community.secop.gov.co/Public/Tendering/ContractNoticePhases/View?PPI=CO1.PPI.40365146&isFromPublicArea=True&isModal=False",
            "bpin": 202476000000000000,
            "estado": "En alistamiento",
            "tipo_intervencion": "Adecuaciones",
            "fuente_financiacion": "Empréstito",
            "presupuesto_base": 34307266,
            "ano": 2025,
            "avance_obra": 0.0,
            "fecha_inicio": "10/10/2025",
            "fecha_fin": "2025-12-15T00:00:00",
            "fecha_inicio_std": "2025-10-10T00:00:00",
            "fecha_fin_std": "2025-12-15T00:00:00",
            "frente_activo": "No aplica",
            "fuera_rango": null
          },
          {
            "intervencion_id": "UNP-48-07",
            "referencia_proceso": "4162.010.32.1.1059-2025",
            "referencia_contrato": null,
            "url_proceso": "https://community.secop.gov.co/Public/Tendering/ContractNoticePhases/View?PPI=CO1.PPI.40683615&isFromPublicArea=True&isModal=False",
            "bpin": 202476000000000000,
            "estado": "En alistamiento",
            "tipo_intervencion": "Adecuaciones",
            "fuente_financiacion": "Empréstito",
            "presupuesto_base": 371848149,
            "ano": 2025,
            "avance_obra": 0.0,
            "fecha_inicio": "10/10/2025",
            "fecha_fin": "2025-12-15T00:00:00",
            "fecha_inicio_std": "2025-10-10T00:00:00",
            "fecha_fin_std": "2025-12-15T00:00:00",
            "frente_activo": "No aplica",
            "fuera_rango": null
          },
          {
            "intervencion_id": "UNP-48-08",
            "referencia_proceso": "4162.010.32.1.1059-2025",
            "referencia_contrato": null,
            "url_proceso": "https://community.secop.gov.co/Public/Tendering/ContractNoticePhases/View?PPI=CO1.PPI.40683615&isFromPublicArea=True&isModal=False",
            "bpin": 202476000000000000,
            "estado": "En alistamiento",
            "tipo_intervencion": "Adecuaciones",
            "fuente_financiacion": "Empréstito",
            "presupuesto_base": 301743567,
            "ano": 2025,
            "avance_obra": 0.0,
            "fecha_inicio": "1/11/2025",
            "fecha_fin": "2026-03-02T00:00:00",
            "fecha_inicio_std": "2025-01-11T00:00:00",
            "fecha_fin_std": "2026-03-02T00:00:00",
            "frente_activo": "No aplica",
            "fuera_rango": null
          }
        ],
        "presupuesto_base": 869458208,
        "avance_obra": 7.85
      }
    },
    {
      "type": "Feature",
      "geometry": null,
      "properties": {
        "upid": "UNP-49",
        "n_intervenciones": 16,
        "nombre_up": "Cancha Múltiple Comuneros I Sector el Faro",
        "nombre_up_detalle": "Adecuacion Cancha Multiple - Adecuacion de Juegos Infantiles",
        "nombre_centro_gestor": "Secretaría del Deporte y la Recreación",
        "direccion": "Carrera 26j3 y Carrera 26l entre Calles 116 y 118",
        "tipo_equipamiento": "Infraestructura recreo deportiva",
        "clase_up": "Obras equipamientos",
        "comuna_corregimiento": "COMUNA 10",
        "comuna_corregimiento_2": null,
        "barrio_vereda": "QUINTAS DEL REFUGIO",
        "barrio_vereda_2": null,
        "identificador": "Grupo Licitación 2",
        "bpin": 202476000000000000,
        "lat": null,
        "lon": null,
        "intervenciones": [
          {
            "intervencion_id": "UNP-49-01",
            "referencia_proceso": "4162.010.32.1.1059-2025",
            "referencia_contrato": null,
            "url_proceso": "https://community.secop.gov.co/Public/Tendering/ContractNoticePhases/View?PPI=CO1.PPI.40683615&isFromPublicArea=True&isModal=False",
            "bpin": 202476000000000000,
            "estado": "En alistamiento",
            "tipo_intervencion": "Adecuaciones",
            "fuente_financiacion": "Empréstito",
            "presupuesto_base": 348248344,
            "ano": 2025,
            "avance_obra": 0.0,
            "fecha_inicio": "1/11/2025",
            "fecha_fin": "2026-03-02T00:00:00",
            "fecha_inicio_std": "2025-01-11T00:00:00",
            "fecha_fin_std": "2026-03-02T00:00:00",
            "frente_activo": "No aplica",
            "fuera_rango": null
          },
          {
            "intervencion_id": "UNP-49-02",
            "referencia_proceso": "4162.010.32.1.1059-2025",
            "referencia_contrato": null,
            "url_proceso": "https://community.secop.gov.co/Public/Tendering/ContractNoticePhases/View?PPI=CO1.PPI.40683615&isFromPublicArea=True&isModal=False",
            "bpin": 202476000000000000,
            "estado": "En alistamiento",
            "tipo_intervencion": "Adecuaciones",
            "fuente_financiacion": "Empréstito",
            "presupuesto_base": 364686075,
            "ano": 2025,
            "avance_obra": 0.0,
            "fecha_inicio": "1/11/2025",
            "fecha_fin": "2026-03-02T00:00:00",
            "fecha_inicio_std": "2025-01-11T00:00:00",
            "fecha_fin_std": "2026-03-02T00:00:00",
            "frente_activo": "No aplica",
            "fuera_rango": null
          },
          {
            "intervencion_id": "UNP-49-03",
            "referencia_proceso": "4162.010.32.1.1059-2025",
            "referencia_contrato": null,
            "url_proceso": "https://community.secop.gov.co/Public/Tendering/ContractNoticePhases/View?PPI=CO1.PPI.40683615&isFromPublicArea=True&isModal=False",
            "bpin": 202476000000000000,
            "estado": "En alistamiento",
            "tipo_intervencion": "Adecuaciones",
            "fuente_financiacion": "Empréstito",
            "presupuesto_base": 182526964,
            "ano": 2025,
            "avance_obra": 0.0,
            "fecha_inicio": "1/11/2025",
            "fecha_fin": "2026-03-02T00:00:00",
            "fecha_inicio_std": "2025-01-11T00:00:00",
            "fecha_fin_std": "2026-03-02T00:00:00",
            "frente_activo": "No aplica",
            "fuera_rango": null
          },
          {
            "intervencion_id": "UNP-49-04",
            "referencia_proceso": "4162.010.32.1.1059-2025",
            "referencia_contrato": null,
            "url_proceso": "https://community.secop.gov.co/Public/Tendering/ContractNoticePhases/View?PPI=CO1.PPI.40683615&isFromPublicArea=True&isModal=False",
            "bpin": 202476000000000000,
            "estado": "En alistamiento",
            "tipo_intervencion": "Adecuaciones",
            "fuente_financiacion": "Empréstito",
            "presupuesto_base": 371848149,
            "ano": 2025,
            "avance_obra": 0.0,
            "fecha_inicio": "1/11/2025",
            "fecha_fin": "2026-03-02T00:00:00",
            "fecha_inicio_std": "2025-01-11T00:00:00",
            "fecha_fin_std": "2026-03-02T00:00:00",
            "frente_activo": "No aplica",
            "fuera_rango": null
          },
          {
            "intervencion_id": "UNP-49-05",
            "referencia_proceso": "4162.010.32.1.1058-2025",
            "referencia_contrato": "4162.010.26.1.3229-2025",
            "url_proceso": "https://community.secop.gov.co/Public/Tendering/ContractNoticePhases/View?PPI=CO1.PPI.40365146&isFromPublicArea=True&isModal=False",
            "bpin": 202476000000000000,
            "estado": "Terminado",
            "tipo_intervencion": "Mantenimiento",
            "fuente_financiacion": "Empréstito",
            "presupuesto_base": 119029132,
            "ano": 2025,
            "avance_obra": 100.0,
            "fecha_inicio": "10/10/2025",
            "fecha_fin": "2025-12-15T00:00:00",
            "fecha_inicio_std": "2025-10-10T00:00:00",
            "fecha_fin_std": "2025-12-15T00:00:00",
            "frente_activo": "No aplica",
            "fuera_rango": null
          },
          {
            "intervencion_id": "UNP-49-06",
            "referencia_proceso": "4162.010.32.1.1058-2025",
            "referencia_contrato": "4162.010.26.1.3229-2025",
            "url_proceso": "https://community.secop.gov.co/Public/Tendering/ContractNoticePhases/View?PPI=CO1.PPI.40365146&isFromPublicArea=True&isModal=False",
            "bpin": 202476000000000000,
            "estado": "En alistamiento",
            "tipo_intervencion": "Mantenimiento",
            "fuente_financiacion": "Empréstito",
            "presupuesto_base": 141991416,
            "ano": 2025,
            "avance_obra": 0.0,
            "fecha_inicio": "10/10/2025",
            "fecha_fin": "2025-12-15T00:00:00",
            "fecha_inicio_std": "2025-10-10T00:00:00",
            "fecha_fin_std": "2025-12-15T00:00:00",
            "frente_activo": "No aplica",
            "fuera_rango": null
          },
          {
            "intervencion_id": "UNP-49-07",
            "referencia_proceso": "4162.010.32.1.1059-2025",
            "referencia_contrato": null,
            "url_proceso": "https://community.secop.gov.co/Public/Tendering/ContractNoticePhases/View?PPI=CO1.PPI.40683615&isFromPublicArea=True&isModal=False",
            "bpin": 202476000000000000,
            "estado": "En alistamiento",
            "tipo_intervencion": "Adecuaciones",
            "fuente_financiacion": "Empréstito",
            "presupuesto_base": 371848149,
            "ano": 2025,
            "avance_obra": 0.0,
            "fecha_inicio": "10/10/2025",
            "fecha_fin": "2025-12-15T00:00:00",
            "fecha_inicio_std": "2025-10-10T00:00:00",
            "fecha_fin_std": "2025-12-15T00:00:00",
            "frente_activo": "No aplica",
            "fuera_rango": null
          },
          {
            "intervencion_id": "UNP-49-08",
            "referencia_proceso": "4162.010.32.1.1059-2025",
            "referencia_contrato": null,
            "url_proceso": "https://community.secop.gov.co/Public/Tendering/ContractNoticePhases/View?PPI=CO1.PPI.40683615&isFromPublicArea=True&isModal=False",
            "bpin": 202476000000000000,
            "estado": "En alistamiento",
            "tipo_intervencion": "Adecuaciones",
            "fuente_financiacion": "Empréstito",
            "presupuesto_base": 351053716,
            "ano": 2025,
            "avance_obra": 0.0,
            "fecha_inicio": "1/11/2025",
            "fecha_fin": "2026-03-02T00:00:00",
            "fecha_inicio_std": "2025-01-11T00:00:00",
            "fecha_fin_std": "2026-03-02T00:00:00",
            "frente_activo": "No aplica",
            "fuera_rango": null
          },
          {
            "intervencion_id": "UNP-49-09",
            "referencia_proceso": "4162.010.32.1.1059-2025",
            "referencia_contrato": null,
            "url_proceso": "https://community.secop.gov.co/Public/Tendering/ContractNoticePhases/View?PPI=CO1.PPI.40683615&isFromPublicArea=True&isModal=False",
            "bpin": 202476000000000000,
            "estado": "En alistamiento",
            "tipo_intervencion": "Adecuaciones",
            "fuente_financiacion": "Empréstito",
            "presupuesto_base": 182526965,
            "ano": 2025,
            "avance_obra": 0.0,
            "fecha_inicio": "1/11/2025",
            "fecha_fin": "2026-03-02T00:00:00",
            "fecha_inicio_std": "2025-01-11T00:00:00",
            "fecha_fin_std": "2026-03-02T00:00:00",
            "frente_activo": "No aplica",
            "fuera_rango": null
          },
          {
            "intervencion_id": "UNP-49-10",
            "referencia_proceso": "4162.010.32.1.1059-2025",
            "referencia_contrato": null,
            "url_proceso": "https://community.secop.gov.co/Public/Tendering/ContractNoticePhases/View?PPI=CO1.PPI.40683615&isFromPublicArea=True&isModal=False",
            "bpin": 202476000000000000,
            "estado": "En alistamiento",
            "tipo_intervencion": "Adecuaciones",
            "fuente_financiacion": "Empréstito",
            "presupuesto_base": 344909035,
            "ano": 2025,
            "avance_obra": 0.0,
            "fecha_inicio": "1/11/2025",
            "fecha_fin": "2026-03-02T00:00:00",
            "fecha_inicio_std": "2025-01-11T00:00:00",
            "fecha_fin_std": "2026-03-02T00:00:00",
            "frente_activo": "No aplica",
            "fuera_rango": null
          },
          {
            "intervencion_id": "UNP-49-11",
            "referencia_proceso": "4162.010.32.1.1059-2025",
            "referencia_contrato": null,
            "url_proceso": "https://community.secop.gov.co/Public/Tendering/ContractNoticePhases/View?PPI=CO1.PPI.40683615&isFromPublicArea=True&isModal=False",
            "bpin": 202476000000000000,
            "estado": "En alistamiento",
            "tipo_intervencion": "Adecuaciones",
            "fuente_financiacion": "Empréstito",
            "presupuesto_base": 454126747,
            "ano": 2025,
            "avance_obra": 0.0,
            "fecha_inicio": "1/11/2025",
            "fecha_fin": "2026-03-02T00:00:00",
            "fecha_inicio_std": "2025-01-11T00:00:00",
            "fecha_fin_std": "2026-03-02T00:00:00",
            "frente_activo": "No aplica",
            "fuera_rango": null
          },
          {
            "intervencion_id": "UNP-49-12",
            "referencia_proceso": "4162.010.32.1.0717-2025",
            "referencia_contrato": "4162.010.26.1.2481-2025",
            "url_proceso": "https://community.secop.gov.co/Public/Tendering/OpportunityDetail/Index?noticeUID=CO1.NTC.8223550&isFromPublicArea=True&isModal=False",
            "bpin": 202476000000000000,
            "estado": "En ejecución",
            "tipo_intervencion": "Adecuaciones",
            "fuente_financiacion": "Ingresos con destinación específica",
            "presupuesto_base": 247515375,
            "ano": 2025,
            "avance_obra": 39.39,
            "fecha_inicio": "45896",
            "fecha_fin": 46006,
            "fecha_inicio_std": "2025-08-27T00:00:00",
            "fecha_fin_std": "2025-12-15T00:00:00",
            "frente_activo": "Frente activo",
            "fuera_rango": null
          },
          {
            "intervencion_id": "UNP-49-13",
            "referencia_proceso": "4162.010.32.1.0717-2025",
            "referencia_contrato": "4162.010.26.1.2481-2025",
            "url_proceso": "https://community.secop.gov.co/Public/Tendering/OpportunityDetail/Index?noticeUID=CO1.NTC.8223550&isFromPublicArea=True&isModal=False",
            "bpin": 202476000000000000,
            "estado": "En ejecución",
            "tipo_intervencion": "Adecuaciones",
            "fuente_financiacion": "Ingresos con destinación específica",
            "presupuesto_base": 259345333,
            "ano": 2025,
            "avance_obra": 26.87,
            "fecha_inicio": "45896",
            "fecha_fin": 46006,
            "fecha_inicio_std": "2025-08-27T00:00:00",
            "fecha_fin_std": "2025-12-15T00:00:00",
            "frente_activo": "Frente activo",
            "fuera_rango": null
          },
          {
            "intervencion_id": "UNP-49-14",
            "referencia_proceso": "4162.010.32.1.0717-2025",
            "referencia_contrato": "4162.010.26.1.2481-2025",
            "url_proceso": "https://community.secop.gov.co/Public/Tendering/OpportunityDetail/Index?noticeUID=CO1.NTC.8223550&isFromPublicArea=True&isModal=False",
            "bpin": 202476000000000000,
            "estado": "En alistamiento",
            "tipo_intervencion": "Adecuaciones",
            "fuente_financiacion": "Ingresos con destinación específica",
            "presupuesto_base": 227547008,
            "ano": 2025,
            "avance_obra": 0.0,
            "fecha_inicio": "45896",
            "fecha_fin": 46006,
            "fecha_inicio_std": "2025-08-27T00:00:00",
            "fecha_fin_std": "2025-12-15T00:00:00",
            "frente_activo": "No aplica",
            "fuera_rango": null
          },
          {
            "intervencion_id": "UNP-49-15",
            "referencia_proceso": "4162.010.32.1.0717-2025",
            "referencia_contrato": "4162.010.26.1.2481-2025",
            "url_proceso": "https://community.secop.gov.co/Public/Tendering/OpportunityDetail/Index?noticeUID=CO1.NTC.8223550&isFromPublicArea=True&isModal=False",
            "bpin": 202476000000000000,
            "estado": "En ejecución",
            "tipo_intervencion": "Adecuaciones",
            "fuente_financiacion": "Ingresos con destinación específica",
            "presupuesto_base": 264662901,
            "ano": 2025,
            "avance_obra": 7.0,
            "fecha_inicio": "45896",
            "fecha_fin": 46006,
            "fecha_inicio_std": "2025-08-27T00:00:00",
            "fecha_fin_std": "2025-12-15T00:00:00",
            "frente_activo": "Frente activo",
            "fuera_rango": null
          },
          {
            "intervencion_id": "UNP-49-16",
            "referencia_proceso": "4162.010.32.1.0717-2025",
            "referencia_contrato": "4162.010.26.1.2481-2025",
            "url_proceso": "https://community.secop.gov.co/Public/Tendering/OpportunityDetail/Index?noticeUID=CO1.NTC.8223550&isFromPublicArea=True&isModal=False",
            "bpin": 202476000000000000,
            "estado": "En ejecución",
            "tipo_intervencion": "Adecuaciones",
            "fuente_financiacion": "Ingresos con destinación específica",
            "presupuesto_base": 234978714,
            "ano": 2025,
            "avance_obra": 28.0,
            "fecha_inicio": "45896",
            "fecha_fin": 46006,
            "fecha_inicio_std": "2025-08-27T00:00:00",
            "fecha_fin_std": "2025-12-15T00:00:00",
            "frente_activo": "Frente activo",
            "fuera_rango": null
          }
        ],
        "presupuesto_base": 4466844023,
        "avance_obra": 8.3
      }
    },
    {
      "type": "Feature",
      "geometry": null,
      "properties": {
        "upid": "UNP-50",
        "n_intervenciones": 14,
        "nombre_up": "Parque Recreativo la Nueva Base (cancha de Colores)",
        "nombre_up_detalle": "Recuperacion de Superficie de Cancha Multiple",
        "nombre_centro_gestor": "Secretaría del Deporte y la Recreación",
        "direccion": "Carrera 4c y 4d Bis entre Calles 60d y 61b",
        "tipo_equipamiento": "Infraestructura recreo deportiva",
        "clase_up": "Obras equipamientos",
        "comuna_corregimiento": "COMUNA 13",
        "comuna_corregimiento_2": null,
        "barrio_vereda": "VILLA DEL PRADO SECTOR 6",
        "barrio_vereda_2": null,
        "identificador": "Grupo Licitación 2",
        "bpin": 202476000000000000,
        "lat": null,
        "lon": null,
        "intervenciones": [
          {
            "intervencion_id": "UNP-50-01",
            "referencia_proceso": "4162.010.32.1.1058-2025",
            "referencia_contrato": "4162.010.26.1.3229-2025",
            "url_proceso": "https://community.secop.gov.co/Public/Tendering/ContractNoticePhases/View?PPI=CO1.PPI.40365146&isFromPublicArea=True&isModal=False",
            "bpin": 202476000000000000,
            "estado": "En alistamiento",
            "tipo_intervencion": "Adecuaciones",
            "fuente_financiacion": "Empréstito",
            "presupuesto_base": 22343773,
            "ano": 2025,
            "avance_obra": 0.0,
            "fecha_inicio": "10/10/2025",
            "fecha_fin": "2025-12-15T00:00:00",
            "fecha_inicio_std": "2025-10-10T00:00:00",
            "fecha_fin_std": "2025-12-15T00:00:00",
            "frente_activo": "No aplica",
            "fuera_rango": null
          },
          {
            "intervencion_id": "UNP-50-02",
            "referencia_proceso": "4162.010.32.1.1058-2025",
            "referencia_contrato": "4162.010.26.1.3229-2025",
            "url_proceso": "https://community.secop.gov.co/Public/Tendering/ContractNoticePhases/View?PPI=CO1.PPI.40365146&isFromPublicArea=True&isModal=False",
            "bpin": 202476000000000000,
            "estado": "En alistamiento",
            "tipo_intervencion": "Adecuaciones",
            "fuente_financiacion": "Empréstito",
            "presupuesto_base": 38274470,
            "ano": 2025,
            "avance_obra": 0.0,
            "fecha_inicio": "10/10/2025",
            "fecha_fin": "2025-12-15T00:00:00",
            "fecha_inicio_std": "2025-10-10T00:00:00",
            "fecha_fin_std": "2025-12-15T00:00:00",
            "frente_activo": "No aplica",
            "fuera_rango": null
          },
          {
            "intervencion_id": "UNP-50-03",
            "referencia_proceso": "4162.010.32.1.1058-2025",
            "referencia_contrato": "4162.010.26.1.3229-2025",
            "url_proceso": "https://community.secop.gov.co/Public/Tendering/ContractNoticePhases/View?PPI=CO1.PPI.40365146&isFromPublicArea=True&isModal=False",
            "bpin": 202476000000000000,
            "estado": "En alistamiento",
            "tipo_intervencion": "Adecuaciones",
            "fuente_financiacion": "Empréstito",
            "presupuesto_base": 36720638,
            "ano": 2025,
            "avance_obra": 0.0,
            "fecha_inicio": "10/10/2025",
            "fecha_fin": "2025-12-15T00:00:00",
            "fecha_inicio_std": "2025-10-10T00:00:00",
            "fecha_fin_std": "2025-12-15T00:00:00",
            "frente_activo": "No aplica",
            "fuera_rango": null
          },
          {
            "intervencion_id": "UNP-50-04",
            "referencia_proceso": "4162.010.32.1.1058-2025",
            "referencia_contrato": "4162.010.26.1.3229-2025",
            "url_proceso": "https://community.secop.gov.co/Public/Tendering/ContractNoticePhases/View?PPI=CO1.PPI.40365146&isFromPublicArea=True&isModal=False",
            "bpin": 202476000000000000,
            "estado": "En alistamiento",
            "tipo_intervencion": "Adecuaciones",
            "fuente_financiacion": "Empréstito",
            "presupuesto_base": 45203677,
            "ano": 2025,
            "avance_obra": 0.0,
            "fecha_inicio": "10/10/2025",
            "fecha_fin": "2025-12-15T00:00:00",
            "fecha_inicio_std": "2025-10-10T00:00:00",
            "fecha_fin_std": "2025-12-15T00:00:00",
            "frente_activo": "No aplica",
            "fuera_rango": null
          },
          {
            "intervencion_id": "UNP-50-05",
            "referencia_proceso": "4162.010.32.1.1058-2025",
            "referencia_contrato": "4162.010.26.1.3229-2025",
            "url_proceso": "https://community.secop.gov.co/Public/Tendering/ContractNoticePhases/View?PPI=CO1.PPI.40365146&isFromPublicArea=True&isModal=False",
            "bpin": 202476000000000000,
            "estado": "En alistamiento",
            "tipo_intervencion": "Adecuaciones",
            "fuente_financiacion": "Empréstito",
            "presupuesto_base": 97325519,
            "ano": 2025,
            "avance_obra": 0.0,
            "fecha_inicio": "10/10/2025",
            "fecha_fin": "2025-12-15T00:00:00",
            "fecha_inicio_std": "2025-10-10T00:00:00",
            "fecha_fin_std": "2025-12-15T00:00:00",
            "frente_activo": "No aplica",
            "fuera_rango": null
          },
          {
            "intervencion_id": "UNP-50-06",
            "referencia_proceso": "4162.010.32.1.1058-2025",
            "referencia_contrato": "4162.010.26.1.3229-2025",
            "url_proceso": "https://community.secop.gov.co/Public/Tendering/ContractNoticePhases/View?PPI=CO1.PPI.40365146&isFromPublicArea=True&isModal=False",
            "bpin": 202476000000000000,
            "estado": "En alistamiento",
            "tipo_intervencion": "Adecuaciones",
            "fuente_financiacion": "Empréstito",
            "presupuesto_base": 40053057,
            "ano": 2025,
            "avance_obra": 0.0,
            "fecha_inicio": "10/10/2025",
            "fecha_fin": "2025-12-15T00:00:00",
            "fecha_inicio_std": "2025-10-10T00:00:00",
            "fecha_fin_std": "2025-12-15T00:00:00",
            "frente_activo": "No aplica",
            "fuera_rango": null
          },
          {
            "intervencion_id": "UNP-50-07",
            "referencia_proceso": "4162.010.32.1.1058-2025",
            "referencia_contrato": "4162.010.26.1.3229-2025",
            "url_proceso": "https://community.secop.gov.co/Public/Tendering/ContractNoticePhases/View?PPI=CO1.PPI.40365146&isFromPublicArea=True&isModal=False",
            "bpin": 202476000000000000,
            "estado": "En ejecución",
            "tipo_intervencion": "Adecuaciones",
            "fuente_financiacion": "Empréstito",
            "presupuesto_base": 36784286,
            "ano": 2025,
            "avance_obra": 60.0,
            "fecha_inicio": "10/10/2025",
            "fecha_fin": "2025-12-15T00:00:00",
            "fecha_inicio_std": "2025-10-10T00:00:00",
            "fecha_fin_std": "2025-12-15T00:00:00",
            "frente_activo": "Frente activo",
            "fuera_rango": null
          },
          {
            "intervencion_id": "UNP-50-08",
            "referencia_proceso": "4162.010.32.1.1058-2025",
            "referencia_contrato": "4162.010.26.1.3229-2025",
            "url_proceso": "https://community.secop.gov.co/Public/Tendering/ContractNoticePhases/View?PPI=CO1.PPI.40365146&isFromPublicArea=True&isModal=False",
            "bpin": 202476000000000000,
            "estado": "Terminado",
            "tipo_intervencion": "Adecuaciones",
            "fuente_financiacion": "Empréstito",
            "presupuesto_base": 34336391,
            "ano": 2025,
            "avance_obra": 100.0,
            "fecha_inicio": "10/10/2025",
            "fecha_fin": "2025-12-15T00:00:00",
            "fecha_inicio_std": "2025-10-10T00:00:00",
            "fecha_fin_std": "2025-12-15T00:00:00",
            "frente_activo": "No aplica",
            "fuera_rango": null
          },
          {
            "intervencion_id": "UNP-50-09",
            "referencia_proceso": "4162.010.32.1.1058-2025",
            "referencia_contrato": "4162.010.26.1.3229-2025",
            "url_proceso": "https://community.secop.gov.co/Public/Tendering/ContractNoticePhases/View?PPI=CO1.PPI.40365146&isFromPublicArea=True&isModal=False",
            "bpin": 202476000000000000,
            "estado": "En ejecución",
            "tipo_intervencion": "Adecuaciones",
            "fuente_financiacion": "Empréstito",
            "presupuesto_base": 36184055,
            "ano": 2025,
            "avance_obra": 5.0,
            "fecha_inicio": "10/10/2025",
            "fecha_fin": "2025-12-15T00:00:00",
            "fecha_inicio_std": "2025-10-10T00:00:00",
            "fecha_fin_std": "2025-12-15T00:00:00",
            "frente_activo": "Frente activo",
            "fuera_rango": null
          },
          {
            "intervencion_id": "UNP-50-10",
            "referencia_proceso": "4162.010.32.1.1058-2025",
            "referencia_contrato": "4162.010.26.1.3229-2025",
            "url_proceso": "https://community.secop.gov.co/Public/Tendering/ContractNoticePhases/View?PPI=CO1.PPI.40365146&isFromPublicArea=True&isModal=False",
            "bpin": 202476000000000000,
            "estado": "En alistamiento",
            "tipo_intervencion": "Adecuaciones",
            "fuente_financiacion": "Empréstito",
            "presupuesto_base": 43211023,
            "ano": 2025,
            "avance_obra": 0.0,
            "fecha_inicio": "10/10/2025",
            "fecha_fin": "2025-12-15T00:00:00",
            "fecha_inicio_std": "2025-10-10T00:00:00",
            "fecha_fin_std": "2025-12-15T00:00:00",
            "frente_activo": "No aplica",
            "fuera_rango": null
          },
          {
            "intervencion_id": "UNP-50-11",
            "referencia_proceso": "4162.010.32.1.1058-2025",
            "referencia_contrato": "4162.010.26.1.3229-2025",
            "url_proceso": "https://community.secop.gov.co/Public/Tendering/ContractNoticePhases/View?PPI=CO1.PPI.40365146&isFromPublicArea=True&isModal=False",
            "bpin": 202476000000000000,
            "estado": "Terminado",
            "tipo_intervencion": "Adecuaciones",
            "fuente_financiacion": "Empréstito",
            "presupuesto_base": 43695707,
            "ano": 2025,
            "avance_obra": 100.0,
            "fecha_inicio": "10/10/2025",
            "fecha_fin": "2025-12-15T00:00:00",
            "fecha_inicio_std": "2025-10-10T00:00:00",
            "fecha_fin_std": "2025-12-15T00:00:00",
            "frente_activo": "No aplica",
            "fuera_rango": null
          },
          {
            "intervencion_id": "UNP-50-12",
            "referencia_proceso": "4162.010.32.1.1058-2025",
            "referencia_contrato": "4162.010.26.1.3229-2025",
            "url_proceso": "https://community.secop.gov.co/Public/Tendering/ContractNoticePhases/View?PPI=CO1.PPI.40365146&isFromPublicArea=True&isModal=False",
            "bpin": 202476000000000000,
            "estado": "En alistamiento",
            "tipo_intervencion": "Adecuaciones",
            "fuente_financiacion": "Empréstito",
            "presupuesto_base": 30774108,
            "ano": 2025,
            "avance_obra": 0.0,
            "fecha_inicio": "10/10/2025",
            "fecha_fin": "2025-12-15T00:00:00",
            "fecha_inicio_std": "2025-10-10T00:00:00",
            "fecha_fin_std": "2025-12-15T00:00:00",
            "frente_activo": "No aplica",
            "fuera_rango": null
          },
          {
            "intervencion_id": "UNP-50-13",
            "referencia_proceso": "4162.010.32.1.1058-2025",
            "referencia_contrato": "4162.010.26.1.3229-2025",
            "url_proceso": "https://community.secop.gov.co/Public/Tendering/ContractNoticePhases/View?PPI=CO1.PPI.40365146&isFromPublicArea=True&isModal=False",
            "bpin": 202476000000000000,
            "estado": "Terminado",
            "tipo_intervencion": "Adecuaciones",
            "fuente_financiacion": "Empréstito",
            "presupuesto_base": 37639511,
            "ano": 2025,
            "avance_obra": 100.0,
            "fecha_inicio": "10/10/2025",
            "fecha_fin": "2025-12-15T00:00:00",
            "fecha_inicio_std": "2025-10-10T00:00:00",
            "fecha_fin_std": "2025-12-15T00:00:00",
            "frente_activo": "No aplica",
            "fuera_rango": null
          },
          {
            "intervencion_id": "UNP-50-14",
            "referencia_proceso": "4162.010.32.1.0717-2025",
            "referencia_contrato": "4162.010.26.1.2481-2025",
            "url_proceso": "https://community.secop.gov.co/Public/Tendering/OpportunityDetail/Index?noticeUID=CO1.NTC.8223550&isFromPublicArea=True&isModal=False",
            "bpin": 202476000000000000,
            "estado": "En ejecución",
            "tipo_intervencion": "Adecuaciones",
            "fuente_financiacion": "Ingresos con destinación específica",
            "presupuesto_base": 166713013,
            "ano": 2025,
            "avance_obra": 2.43,
            "fecha_inicio": "45896",
            "fecha_fin": 46006,
            "fecha_inicio_std": "2025-08-27T00:00:00",
            "fecha_fin_std": "2025-12-15T00:00:00",
            "frente_activo": "Frente activo",
            "fuera_rango": null
          }
        ],
        "presupuesto_base": 709259228,
        "avance_obra": 20.25
      }
    },
    {
      "type": "Feature",
      "geometry": null,
      "properties": {
        "upid": "UNP-51",
        "n_intervenciones": 7,
        "nombre_up": "Parque Recreativo Floralia I -la Virgen",
        "nombre_up_detalle": "Adecuacion Cancha Multiple - Mantenimiento de Cancha Sintetica",
        "nombre_centro_gestor": "Secretaría del Deporte y la Recreación",
        "direccion": "Carrera 5n y 9n entre Calles 83 F y 84",
        "tipo_equipamiento": "Infraestructura recreo deportiva",
        "clase_up": "Obras equipamientos",
        "comuna_corregimiento": "COMUNA 18",
        "comuna_corregimiento_2": null,
        "barrio_vereda": "Belisario Caicedo",
        "barrio_vereda_2": null,
        "identificador": "Grupo Licitación 2",
        "bpin": 202476000000000000,
        "lat": null,
        "lon": null,
        "intervenciones": [
          {
            "intervencion_id": "UNP-51-01",
            "referencia_proceso": "4162.010.32.1.1059-2025",
            "referencia_contrato": null,
            "url_proceso": "https://community.secop.gov.co/Public/Tendering/ContractNoticePhases/View?PPI=CO1.PPI.40683615&isFromPublicArea=True&isModal=False",
            "bpin": 202476000000000000,
            "estado": "En alistamiento",
            "tipo_intervencion": "Adecuaciones",
            "fuente_financiacion": "Empréstito",
            "presupuesto_base": 653111415,
            "ano": 2025,
            "avance_obra": 0.0,
            "fecha_inicio": "1/11/2025",
            "fecha_fin": "2026-03-02T00:00:00",
            "fecha_inicio_std": "2025-01-11T00:00:00",
            "fecha_fin_std": "2026-03-02T00:00:00",
            "frente_activo": "No aplica",
            "fuera_rango": null
          },
          {
            "intervencion_id": "UNP-51-02",
            "referencia_proceso": "4162.010.32.1.1059-2025",
            "referencia_contrato": null,
            "url_proceso": "https://community.secop.gov.co/Public/Tendering/ContractNoticePhases/View?PPI=CO1.PPI.40683615&isFromPublicArea=True&isModal=False",
            "bpin": 202476000000000000,
            "estado": "En alistamiento",
            "tipo_intervencion": "Adecuaciones",
            "fuente_financiacion": "Empréstito",
            "presupuesto_base": 634518790,
            "ano": 2025,
            "avance_obra": 0.0,
            "fecha_inicio": "1/11/2025",
            "fecha_fin": "2026-03-02T00:00:00",
            "fecha_inicio_std": "2025-01-11T00:00:00",
            "fecha_fin_std": "2026-03-02T00:00:00",
            "frente_activo": "No aplica",
            "fuera_rango": null
          },
          {
            "intervencion_id": "UNP-51-03",
            "referencia_proceso": "4162.010.32.1.1059-2025",
            "referencia_contrato": null,
            "url_proceso": "https://community.secop.gov.co/Public/Tendering/ContractNoticePhases/View?PPI=CO1.PPI.40683615&isFromPublicArea=True&isModal=False",
            "bpin": 202476000000000000,
            "estado": "En alistamiento",
            "tipo_intervencion": "Adecuaciones",
            "fuente_financiacion": "Empréstito",
            "presupuesto_base": 510010003,
            "ano": 2025,
            "avance_obra": 0.0,
            "fecha_inicio": "1/11/2025",
            "fecha_fin": "2026-03-02T00:00:00",
            "fecha_inicio_std": "2025-01-11T00:00:00",
            "fecha_fin_std": "2026-03-02T00:00:00",
            "frente_activo": "No aplica",
            "fuera_rango": null
          },
          {
            "intervencion_id": "UNP-51-04",
            "referencia_proceso": "4162.010.32.1.1059-2025",
            "referencia_contrato": null,
            "url_proceso": "https://community.secop.gov.co/Public/Tendering/ContractNoticePhases/View?PPI=CO1.PPI.40683615&isFromPublicArea=True&isModal=False",
            "bpin": 202476000000000000,
            "estado": "En alistamiento",
            "tipo_intervencion": "Adecuaciones",
            "fuente_financiacion": "Empréstito",
            "presupuesto_base": 604672467,
            "ano": 2025,
            "avance_obra": 0.0,
            "fecha_inicio": "1/11/2025",
            "fecha_fin": "2026-03-02T00:00:00",
            "fecha_inicio_std": "2025-01-11T00:00:00",
            "fecha_fin_std": "2026-03-02T00:00:00",
            "frente_activo": "No aplica",
            "fuera_rango": null
          },
          {
            "intervencion_id": "UNP-51-05",
            "referencia_proceso": "4162.010.32.1.1059-2025",
            "referencia_contrato": null,
            "url_proceso": "https://community.secop.gov.co/Public/Tendering/ContractNoticePhases/View?PPI=CO1.PPI.40683615&isFromPublicArea=True&isModal=False",
            "bpin": 202476000000000000,
            "estado": "En alistamiento",
            "tipo_intervencion": "Adecuaciones",
            "fuente_financiacion": "Empréstito",
            "presupuesto_base": 367154214,
            "ano": 2025,
            "avance_obra": 0.0,
            "fecha_inicio": "1/11/2025",
            "fecha_fin": "2026-03-02T00:00:00",
            "fecha_inicio_std": "2025-01-11T00:00:00",
            "fecha_fin_std": "2026-03-02T00:00:00",
            "frente_activo": "No aplica",
            "fuera_rango": null
          },
          {
            "intervencion_id": "UNP-51-06",
            "referencia_proceso": "4162.010.32.1.1059-2025",
            "referencia_contrato": null,
            "url_proceso": "https://community.secop.gov.co/Public/Tendering/ContractNoticePhases/View?PPI=CO1.PPI.40683615&isFromPublicArea=True&isModal=False",
            "bpin": 202476000000000000,
            "estado": "En alistamiento",
            "tipo_intervencion": "Adecuaciones",
            "fuente_financiacion": "Empréstito",
            "presupuesto_base": 454175822,
            "ano": 2025,
            "avance_obra": 0.0,
            "fecha_inicio": "1/11/2025",
            "fecha_fin": "2026-03-02T00:00:00",
            "fecha_inicio_std": "2025-01-11T00:00:00",
            "fecha_fin_std": "2026-03-02T00:00:00",
            "frente_activo": "No aplica",
            "fuera_rango": null
          },
          {
            "intervencion_id": "UNP-51-07",
            "referencia_proceso": "4162.010.32.1.0717-2025",
            "referencia_contrato": "4162.010.26.1.2481-2025",
            "url_proceso": "https://community.secop.gov.co/Public/Tendering/OpportunityDetail/Index?noticeUID=CO1.NTC.8223550&isFromPublicArea=True&isModal=False",
            "bpin": 202476000000000000,
            "estado": "En ejecución",
            "tipo_intervencion": "Adecuaciones",
            "fuente_financiacion": "Ingresos con destinación específica",
            "presupuesto_base": 145804206,
            "ano": 2025,
            "avance_obra": 2.08,
            "fecha_inicio": "45896",
            "fecha_fin": 46006,
            "fecha_inicio_std": "2025-08-27T00:00:00",
            "fecha_fin_std": "2025-12-15T00:00:00",
            "frente_activo": "Frente activo",
            "fuera_rango": null
          }
        ],
        "presupuesto_base": 3369446917,
        "avance_obra": 0.09
      }
    },
    {
      "type": "Feature",
      "geometry": null,
      "properties": {
        "upid": "UNP-52",
        "n_intervenciones": 5,
        "nombre_up": "Cancha Sintética República de Israel",
        "nombre_up_detalle": "Mantenimiento de Cancha Sintetica",
        "nombre_centro_gestor": "Secretaría del Deporte y la Recreación",
        "direccion": "Calle 57 y 58 entre Carrera 25b y 26",
        "tipo_equipamiento": "Infraestructura recreo deportiva",
        "clase_up": "Obras equipamientos",
        "comuna_corregimiento": "COMUNA 12",
        "comuna_corregimiento_2": null,
        "barrio_vereda": "República de Israel",
        "barrio_vereda_2": null,
        "identificador": "Grupo Licitación 2",
        "bpin": 202476000000000000,
        "lat": null,
        "lon": null,
        "intervenciones": [
          {
            "intervencion_id": "UNP-52-01",
            "referencia_proceso": "4162.010.32.1.1058-2025",
            "referencia_contrato": "4162.010.26.1.3229-2025",
            "url_proceso": "https://community.secop.gov.co/Public/Tendering/ContractNoticePhases/View?PPI=CO1.PPI.40365146&isFromPublicArea=True&isModal=False",
            "bpin": 202476000000000000,
            "estado": "Terminado",
            "tipo_intervencion": "Adecuaciones",
            "fuente_financiacion": "Empréstito",
            "presupuesto_base": 117061228,
            "ano": 2025,
            "avance_obra": 100.0,
            "fecha_inicio": "10/10/2025",
            "fecha_fin": "2025-12-15T00:00:00",
            "fecha_inicio_std": "2025-10-10T00:00:00",
            "fecha_fin_std": "2025-12-15T00:00:00",
            "frente_activo": "No aplica",
            "fuera_rango": null
          },
          {
            "intervencion_id": "UNP-52-02",
            "referencia_proceso": "4162.010.32.1.1058-2025",
            "referencia_contrato": "4162.010.26.1.3229-2025",
            "url_proceso": "https://community.secop.gov.co/Public/Tendering/ContractNoticePhases/View?PPI=CO1.PPI.40365146&isFromPublicArea=True&isModal=False",
            "bpin": 202476000000000000,
            "estado": "En alistamiento",
            "tipo_intervencion": "Adecuaciones",
            "fuente_financiacion": "Empréstito",
            "presupuesto_base": 135937332,
            "ano": 2025,
            "avance_obra": 0.0,
            "fecha_inicio": "10/10/2025",
            "fecha_fin": "2025-12-15T00:00:00",
            "fecha_inicio_std": "2025-10-10T00:00:00",
            "fecha_fin_std": "2025-12-15T00:00:00",
            "frente_activo": "No aplica",
            "fuera_rango": null
          },
          {
            "intervencion_id": "UNP-52-03",
            "referencia_proceso": "4162.010.32.1.1058-2025",
            "referencia_contrato": "4162.010.26.1.3229-2025",
            "url_proceso": "https://community.secop.gov.co/Public/Tendering/ContractNoticePhases/View?PPI=CO1.PPI.40365146&isFromPublicArea=True&isModal=False",
            "bpin": 202476000000000000,
            "estado": "En ejecución",
            "tipo_intervencion": "Mantenimiento",
            "fuente_financiacion": "Empréstito",
            "presupuesto_base": 119422845,
            "ano": 2025,
            "avance_obra": 67.0,
            "fecha_inicio": "1/11/2025",
            "fecha_fin": "2026-03-02T00:00:00",
            "fecha_inicio_std": "2025-01-11T00:00:00",
            "fecha_fin_std": "2026-03-02T00:00:00",
            "frente_activo": "No aplica",
            "fuera_rango": null
          },
          {
            "intervencion_id": "UNP-52-04",
            "referencia_proceso": "4162.010.32.1.1058-2025",
            "referencia_contrato": "4162.010.26.1.3229-2025",
            "url_proceso": "https://community.secop.gov.co/Public/Tendering/ContractNoticePhases/View?PPI=CO1.PPI.40365146&isFromPublicArea=True&isModal=False",
            "bpin": 202476000000000000,
            "estado": "En ejecución",
            "tipo_intervencion": "Mantenimiento",
            "fuente_financiacion": "Empréstito",
            "presupuesto_base": 127031240,
            "ano": 2025,
            "avance_obra": 15.0,
            "fecha_inicio": "1/11/2025",
            "fecha_fin": "2026-03-02T00:00:00",
            "fecha_inicio_std": "2025-01-11T00:00:00",
            "fecha_fin_std": "2026-03-02T00:00:00",
            "frente_activo": "No aplica",
            "fuera_rango": null
          },
          {
            "intervencion_id": "UNP-52-05",
            "referencia_proceso": "4162.010.32.1.1058-2025",
            "referencia_contrato": "4162.010.26.1.3229-2025",
            "url_proceso": "https://community.secop.gov.co/Public/Tendering/ContractNoticePhases/View?PPI=CO1.PPI.40365146&isFromPublicArea=True&isModal=False",
            "bpin": 202476000000000000,
            "estado": "En alistamiento",
            "tipo_intervencion": "Mantenimiento",
            "fuente_financiacion": "Empréstito",
            "presupuesto_base": 128661199,
            "ano": 2025,
            "avance_obra": 0.0,
            "fecha_inicio": "10/10/2025",
            "fecha_fin": "2025-12-15T00:00:00",
            "fecha_inicio_std": "2025-10-10T00:00:00",
            "fecha_fin_std": "2025-12-15T00:00:00",
            "frente_activo": "No aplica",
            "fuera_rango": null
          }
        ],
        "presupuesto_base": 628113844,
        "avance_obra": 34.41
      }
    },
    {
      "type": "Feature",
      "geometry": null,
      "properties": {
        "upid": "UNP-53",
        "n_intervenciones": 15,
        "nombre_up": "Polideportivo Canchas las Gemelas Mojica",
        "nombre_up_detalle": "Mantenimiento de Cancha Sintetica - Adecuacion de Juegos Infantiles",
        "nombre_centro_gestor": "Secretaría del Deporte y la Recreación",
        "direccion": "Carreras 40c y 41b con Calle 50 y 51",
        "tipo_equipamiento": "Infraestructura recreo deportiva",
        "clase_up": "Obras equipamientos",
        "comuna_corregimiento": "COMUNA 11",
        "comuna_corregimiento_2": null,
        "barrio_vereda": "Alfonso Bonilla Aragón",
        "barrio_vereda_2": null,
        "identificador": "Grupo Licitación 2",
        "bpin": 202476000000000000,
        "lat": null,
        "lon": null,
        "intervenciones": [
          {
            "intervencion_id": "UNP-53-01",
            "referencia_proceso": "4162.010.32.1.1058-2025",
            "referencia_contrato": "4162.010.26.1.3229-2025",
            "url_proceso": "https://community.secop.gov.co/Public/Tendering/ContractNoticePhases/View?PPI=CO1.PPI.40365146&isFromPublicArea=True&isModal=False",
            "bpin": 202476000000000000,
            "estado": "En alistamiento",
            "tipo_intervencion": "Adecuaciones",
            "fuente_financiacion": "Empréstito",
            "presupuesto_base": 131426661,
            "ano": 2025,
            "avance_obra": 0.0,
            "fecha_inicio": "10/10/2025",
            "fecha_fin": "2025-12-15T00:00:00",
            "fecha_inicio_std": "2025-10-10T00:00:00",
            "fecha_fin_std": "2025-12-15T00:00:00",
            "frente_activo": "No aplica",
            "fuera_rango": null
          },
          {
            "intervencion_id": "UNP-53-02",
            "referencia_proceso": "4162.010.32.1.1058-2025",
            "referencia_contrato": "4162.010.26.1.3229-2025",
            "url_proceso": "https://community.secop.gov.co/Public/Tendering/ContractNoticePhases/View?PPI=CO1.PPI.40365146&isFromPublicArea=True&isModal=False",
            "bpin": 202476000000000000,
            "estado": "En alistamiento",
            "tipo_intervencion": "Mantenimiento",
            "fuente_financiacion": "Empréstito",
            "presupuesto_base": 124822333,
            "ano": 2025,
            "avance_obra": 0.0,
            "fecha_inicio": "10/10/2025",
            "fecha_fin": "2025-12-15T00:00:00",
            "fecha_inicio_std": "2025-10-10T00:00:00",
            "fecha_fin_std": "2025-12-15T00:00:00",
            "frente_activo": "No aplica",
            "fuera_rango": null
          },
          {
            "intervencion_id": "UNP-53-03",
            "referencia_proceso": "4162.010.32.1.1058-2025",
            "referencia_contrato": "4162.010.26.1.3229-2025",
            "url_proceso": "https://community.secop.gov.co/Public/Tendering/ContractNoticePhases/View?PPI=CO1.PPI.40365146&isFromPublicArea=True&isModal=False",
            "bpin": 202476000000000000,
            "estado": "En ejecución",
            "tipo_intervencion": "Mantenimiento",
            "fuente_financiacion": "Empréstito",
            "presupuesto_base": 100517920,
            "ano": 2025,
            "avance_obra": 81.0,
            "fecha_inicio": "10/10/2025",
            "fecha_fin": "2025-12-15T00:00:00",
            "fecha_inicio_std": "2025-10-10T00:00:00",
            "fecha_fin_std": "2025-12-15T00:00:00",
            "frente_activo": "No aplica",
            "fuera_rango": null
          },
          {
            "intervencion_id": "UNP-53-04",
            "referencia_proceso": "4162.010.32.1.1058-2025",
            "referencia_contrato": "4162.010.26.1.3229-2025",
            "url_proceso": "https://community.secop.gov.co/Public/Tendering/ContractNoticePhases/View?PPI=CO1.PPI.40365146&isFromPublicArea=True&isModal=False",
            "bpin": 202476000000000000,
            "estado": "En ejecución",
            "tipo_intervencion": "Mantenimiento",
            "fuente_financiacion": "Empréstito",
            "presupuesto_base": 143166806,
            "ano": 2025,
            "avance_obra": 45.0,
            "fecha_inicio": "10/10/2025",
            "fecha_fin": "2025-12-15T00:00:00",
            "fecha_inicio_std": "2025-10-10T00:00:00",
            "fecha_fin_std": "2025-12-15T00:00:00",
            "frente_activo": "No aplica",
            "fuera_rango": null
          },
          {
            "intervencion_id": "UNP-53-05",
            "referencia_proceso": "4162.010.32.1.1058-2025",
            "referencia_contrato": "4162.010.26.1.3229-2025",
            "url_proceso": "https://community.secop.gov.co/Public/Tendering/ContractNoticePhases/View?PPI=CO1.PPI.40365146&isFromPublicArea=True&isModal=False",
            "bpin": 202476000000000000,
            "estado": "En alistamiento",
            "tipo_intervencion": "Mantenimiento",
            "fuente_financiacion": "Empréstito",
            "presupuesto_base": 114759832,
            "ano": 2025,
            "avance_obra": 0.0,
            "fecha_inicio": "10/10/2025",
            "fecha_fin": "2025-12-15T00:00:00",
            "fecha_inicio_std": "2025-10-10T00:00:00",
            "fecha_fin_std": "2025-12-15T00:00:00",
            "frente_activo": "No aplica",
            "fuera_rango": null
          },
          {
            "intervencion_id": "UNP-53-06",
            "referencia_proceso": "4162.010.32.1.1059-2025",
            "referencia_contrato": null,
            "url_proceso": "https://community.secop.gov.co/Public/Tendering/ContractNoticePhases/View?PPI=CO1.PPI.40683615&isFromPublicArea=True&isModal=False",
            "bpin": 202476000000000000,
            "estado": "En alistamiento",
            "tipo_intervencion": "Mantenimiento",
            "fuente_financiacion": "Empréstito",
            "presupuesto_base": 355771528,
            "ano": 2025,
            "avance_obra": 0.0,
            "fecha_inicio": "1/11/2025",
            "fecha_fin": "2026-03-02T00:00:00",
            "fecha_inicio_std": "2025-01-11T00:00:00",
            "fecha_fin_std": "2026-03-02T00:00:00",
            "frente_activo": "No aplica",
            "fuera_rango": null
          },
          {
            "intervencion_id": "UNP-53-07",
            "referencia_proceso": "4162.010.32.1.1058-2025",
            "referencia_contrato": "4162.010.26.1.3229-2025",
            "url_proceso": "https://community.secop.gov.co/Public/Tendering/ContractNoticePhases/View?PPI=CO1.PPI.40365146&isFromPublicArea=True&isModal=False",
            "bpin": 202476000000000000,
            "estado": "En alistamiento",
            "tipo_intervencion": "Mantenimiento",
            "fuente_financiacion": "Empréstito",
            "presupuesto_base": 99708280,
            "ano": 2025,
            "avance_obra": 0.0,
            "fecha_inicio": "10/10/2025",
            "fecha_fin": "2025-12-15T00:00:00",
            "fecha_inicio_std": "2025-10-10T00:00:00",
            "fecha_fin_std": "2025-12-15T00:00:00",
            "frente_activo": "No aplica",
            "fuera_rango": null
          },
          {
            "intervencion_id": "UNP-53-08",
            "referencia_proceso": "4162.010.32.1.1059-2025",
            "referencia_contrato": null,
            "url_proceso": "https://community.secop.gov.co/Public/Tendering/ContractNoticePhases/View?PPI=CO1.PPI.40683615&isFromPublicArea=True&isModal=False",
            "bpin": 202476000000000000,
            "estado": "En ejecución",
            "tipo_intervencion": "Mantenimiento",
            "fuente_financiacion": "Empréstito",
            "presupuesto_base": 417317467,
            "ano": 2025,
            "avance_obra": 0.0,
            "fecha_inicio": "10/10/2025",
            "fecha_fin": "2025-12-15T00:00:00",
            "fecha_inicio_std": "2025-10-10T00:00:00",
            "fecha_fin_std": "2025-12-15T00:00:00",
            "frente_activo": "No aplica",
            "fuera_rango": null
          },
          {
            "intervencion_id": "UNP-53-09",
            "referencia_proceso": "4162.010.32.1.1058-2025",
            "referencia_contrato": "4162.010.26.1.3229-2025",
            "url_proceso": "https://community.secop.gov.co/Public/Tendering/ContractNoticePhases/View?PPI=CO1.PPI.40365146&isFromPublicArea=True&isModal=False",
            "bpin": 202476000000000000,
            "estado": "En ejecución",
            "tipo_intervencion": "Mantenimiento",
            "fuente_financiacion": "Empréstito",
            "presupuesto_base": 110664112,
            "ano": 2025,
            "avance_obra": 15.0,
            "fecha_inicio": "10/10/2025",
            "fecha_fin": "2025-12-15T00:00:00",
            "fecha_inicio_std": "2025-10-10T00:00:00",
            "fecha_fin_std": "2025-12-15T00:00:00",
            "frente_activo": "No aplica",
            "fuera_rango": null
          },
          {
            "intervencion_id": "UNP-53-10",
            "referencia_proceso": "4162.010.32.1.1058-2025",
            "referencia_contrato": "4162.010.26.1.3229-2025",
            "url_proceso": "https://community.secop.gov.co/Public/Tendering/ContractNoticePhases/View?PPI=CO1.PPI.40365146&isFromPublicArea=True&isModal=False",
            "bpin": 202476000000000000,
            "estado": "En alistamiento",
            "tipo_intervencion": "Mantenimiento",
            "fuente_financiacion": "Empréstito",
            "presupuesto_base": 130325686,
            "ano": 2025,
            "avance_obra": 0.0,
            "fecha_inicio": "10/10/2025",
            "fecha_fin": "2025-12-15T00:00:00",
            "fecha_inicio_std": "2025-10-10T00:00:00",
            "fecha_fin_std": "2025-12-15T00:00:00",
            "frente_activo": "No aplica",
            "fuera_rango": null
          },
          {
            "intervencion_id": "UNP-53-11",
            "referencia_proceso": "4162.010.32.1.0717-2025",
            "referencia_contrato": "4162.010.26.1.2481-2025",
            "url_proceso": "https://community.secop.gov.co/Public/Tendering/OpportunityDetail/Index?noticeUID=CO1.NTC.8223550&isFromPublicArea=True&isModal=False",
            "bpin": 202476000000000000,
            "estado": "En ejecución",
            "tipo_intervencion": "Mantenimiento",
            "fuente_financiacion": "Ingresos con destinación específica",
            "presupuesto_base": 76346522,
            "ano": 2025,
            "avance_obra": 4.0,
            "fecha_inicio": "45896",
            "fecha_fin": 46006,
            "fecha_inicio_std": "2025-08-27T00:00:00",
            "fecha_fin_std": "2025-12-15T00:00:00",
            "frente_activo": "No aplica",
            "fuera_rango": null
          },
          {
            "intervencion_id": "UNP-53-12",
            "referencia_proceso": "4162.010.32.1.0717-2025",
            "referencia_contrato": "4162.010.26.1.2481-2025",
            "url_proceso": "https://community.secop.gov.co/Public/Tendering/OpportunityDetail/Index?noticeUID=CO1.NTC.8223550&isFromPublicArea=True&isModal=False",
            "bpin": 202476000000000000,
            "estado": "En alistamiento",
            "tipo_intervencion": "Adecuaciones",
            "fuente_financiacion": "Ingresos con destinación específica",
            "presupuesto_base": 685457484,
            "ano": 2025,
            "avance_obra": 0.0,
            "fecha_inicio": "45896",
            "fecha_fin": 46006,
            "fecha_inicio_std": "2025-08-27T00:00:00",
            "fecha_fin_std": "2025-12-15T00:00:00",
            "frente_activo": "No aplica",
            "fuera_rango": null
          },
          {
            "intervencion_id": "UNP-53-13",
            "referencia_proceso": "4162.010.32.1.0717-2025",
            "referencia_contrato": "4162.010.26.1.2481-2025",
            "url_proceso": "https://community.secop.gov.co/Public/Tendering/OpportunityDetail/Index?noticeUID=CO1.NTC.8223550&isFromPublicArea=True&isModal=False",
            "bpin": 202476000000000000,
            "estado": "En alistamiento",
            "tipo_intervencion": "Mantenimiento",
            "fuente_financiacion": "Ingresos con destinación específica",
            "presupuesto_base": 99914433,
            "ano": 2025,
            "avance_obra": 0.0,
            "fecha_inicio": "45896",
            "fecha_fin": 46006,
            "fecha_inicio_std": "2025-08-27T00:00:00",
            "fecha_fin_std": "2025-12-15T00:00:00",
            "frente_activo": "No aplica",
            "fuera_rango": null
          },
          {
            "intervencion_id": "UNP-53-14",
            "referencia_proceso": "4162.010.32.1.0717-2025",
            "referencia_contrato": "4162.010.26.1.2481-2025",
            "url_proceso": "https://community.secop.gov.co/Public/Tendering/OpportunityDetail/Index?noticeUID=CO1.NTC.8223550&isFromPublicArea=True&isModal=False",
            "bpin": 202476000000000000,
            "estado": "En ejecución",
            "tipo_intervencion": "Mantenimiento",
            "fuente_financiacion": "Ingresos con destinación específica",
            "presupuesto_base": 226334818,
            "ano": 2025,
            "avance_obra": 47.0,
            "fecha_inicio": "45896",
            "fecha_fin": 46006,
            "fecha_inicio_std": "2025-08-27T00:00:00",
            "fecha_fin_std": "2025-12-15T00:00:00",
            "frente_activo": "No aplica",
            "fuera_rango": null
          },
          {
            "intervencion_id": "UNP-53-15",
            "referencia_proceso": "4181.010.26.1.434-2024",
            "referencia_contrato": "4181.010.26.1.434-2024",
            "url_proceso": "https://community.secop.gov.co/Public/Tendering/OpportunityDetail/Index?noticeUID=CO1.NTC.6853262&isFromPublicArea=True&isModal=False",
            "bpin": 0,
            "estado": "Terminado",
            "tipo_intervencion": "Mantenimiento",
            "fuente_financiacion": "Ingresos libre destinación",
            "presupuesto_base": 1285200,
            "ano": 2024,
            "avance_obra": 100.0,
            "fecha_inicio": "30/09/2024",
            "fecha_fin": "25/10/2024",
            "fecha_inicio_std": "2024-09-30T00:00:00",
            "fecha_fin_std": "2024-10-25T00:00:00",
            "frente_activo": "No aplica",
            "fuera_rango": null
          }
        ],
        "presupuesto_base": 2817819082,
        "avance_obra": 9.69
      }
    },
    {
      "type": "Feature",
      "geometry": null,
      "properties": {
        "upid": "UNP-54",
        "n_intervenciones": 3,
        "nombre_up": "Parque Recreativo Urbanizacion Napoles",
        "nombre_up_detalle": "Recuperacion de Superficie de Cancha Multiple",
        "nombre_centro_gestor": "Secretaría del Deporte y la Recreación",
        "direccion": "Carrera 7h Bis # 81 - 00",
        "tipo_equipamiento": "Infraestructura recreo deportiva",
        "clase_up": "Obras equipamientos",
        "comuna_corregimiento": "COMUNA 12",
        "comuna_corregimiento_2": null,
        "barrio_vereda": "URBANIZACION NAPOLES",
        "barrio_vereda_2": null,
        "identificador": "Grupo Licitación 2",
        "bpin": 202476000000000000,
        "lat": null,
        "lon": null,
        "intervenciones": [
          {
            "intervencion_id": "UNP-54-01",
            "referencia_proceso": "4162.010.32.1.1058-2025",
            "referencia_contrato": "4162.010.26.1.3229-2025",
            "url_proceso": "https://community.secop.gov.co/Public/Tendering/ContractNoticePhases/View?PPI=CO1.PPI.40365146&isFromPublicArea=True&isModal=False",
            "bpin": 202476000000000000,
            "estado": "Terminado",
            "tipo_intervencion": "Adecuaciones",
            "fuente_financiacion": "Empréstito",
            "presupuesto_base": 40958871,
            "ano": 2025,
            "avance_obra": 100.0,
            "fecha_inicio": "10/10/2025",
            "fecha_fin": "2025-12-15T00:00:00",
            "fecha_inicio_std": "2025-10-10T00:00:00",
            "fecha_fin_std": "2025-12-15T00:00:00",
            "frente_activo": "No aplica",
            "fuera_rango": null
          },
          {
            "intervencion_id": "UNP-54-02",
            "referencia_proceso": "4162.010.32.1.1058-2025",
            "referencia_contrato": "4162.010.26.1.3229-2025",
            "url_proceso": "https://community.secop.gov.co/Public/Tendering/ContractNoticePhases/View?PPI=CO1.PPI.40365146&isFromPublicArea=True&isModal=False",
            "bpin": 202476000000000000,
            "estado": "En ejecución",
            "tipo_intervencion": "Adecuaciones",
            "fuente_financiacion": "Empréstito",
            "presupuesto_base": 35339647,
            "ano": 2025,
            "avance_obra": 35.0,
            "fecha_inicio": "1/11/2025",
            "fecha_fin": "2026-03-02T00:00:00",
            "fecha_inicio_std": "2025-01-11T00:00:00",
            "fecha_fin_std": "2026-03-02T00:00:00",
            "frente_activo": "Frente activo",
            "fuera_rango": null
          },
          {
            "intervencion_id": "UNP-54-03",
            "referencia_proceso": "4162.010.32.1.1058-2025",
            "referencia_contrato": "4162.010.26.1.3229-2025",
            "url_proceso": "https://community.secop.gov.co/Public/Tendering/ContractNoticePhases/View?PPI=CO1.PPI.40365146&isFromPublicArea=True&isModal=False",
            "bpin": 202476000000000000,
            "estado": "Terminado",
            "tipo_intervencion": "Adecuaciones",
            "fuente_financiacion": "Empréstito",
            "presupuesto_base": 27620658,
            "ano": 2025,
            "avance_obra": 100.0,
            "fecha_inicio": "10/10/2025",
            "fecha_fin": "2025-12-15T00:00:00",
            "fecha_inicio_std": "2025-10-10T00:00:00",
            "fecha_fin_std": "2025-12-15T00:00:00",
            "frente_activo": "No aplica",
            "fuera_rango": null
          }
        ],
        "presupuesto_base": 103919176,
        "avance_obra": 77.9
      }
    },
    {
      "type": "Feature",
      "geometry": null,
      "properties": {
        "upid": "UNP-55",
        "n_intervenciones": 24,
        "nombre_up": "Parque Parroquia Santa Teresa de Jesús",
        "nombre_up_detalle": "• Intervención en Obra Civil • Implementación del Componente Ambiental. • Amoblamiento • Limpieza Final • Adecuación Paisajística • Estrategia Educativa",
        "nombre_centro_gestor": "Departamento Administrativo de Gestión del Medio Ambiente",
        "direccion": "Carrera 28d6 hasta la Carrera 28e con Calle 120b",
        "tipo_equipamiento": "Parques y zonas verdes",
        "clase_up": "Espacio Público",
        "comuna_corregimiento": "COMUNA 03",
        "comuna_corregimiento_2": null,
        "barrio_vereda": "Metropolitano del Norte",
        "barrio_vereda_2": null,
        "identificador": "Parques",
        "bpin": 2022760010111,
        "lat": null,
        "lon": null,
        "intervenciones": [
          {
            "intervencion_id": "UNP-55-01",
            "referencia_proceso": "4133.010.27.1.010-2024",
            "referencia_contrato": "4133.010.27.1.010-2024",
            "url_proceso": "https://community.secop.gov.co/Public/Tendering/OpportunityDetail/Index?noticeUID=CO1.NTC.6354287&isFromPublicArea=True&isModal=Falsev",
            "bpin": 2022760010111,
            "estado": "En ejecución",
            "tipo_intervencion": "Adecuaciones",
            "fuente_financiacion": "Ingresos libre destinación",
            "presupuesto_base": 182827800,
            "ano": 2024,
            "avance_obra": 98.0,
            "fecha_inicio": "12-7-2024",
            "fecha_fin": "2026-01-05T00:00:00",
            "fecha_inicio_std": "2024-12-07T00:00:00",
            "fecha_fin_std": "2026-01-05T00:00:00",
            "frente_activo": "Frente activo",
            "fuera_rango": null
          },
          {
            "intervencion_id": "UNP-55-02",
            "referencia_proceso": "4133.010.27.1.010-2024",
            "referencia_contrato": "4133.010.27.1.010-2024",
            "url_proceso": "https://community.secop.gov.co/Public/Tendering/OpportunityDetail/Index?noticeUID=CO1.NTC.6354287&isFromPublicArea=True&isModal=Falsev",
            "bpin": 2022760010111,
            "estado": "En ejecución",
            "tipo_intervencion": "Adecuaciones",
            "fuente_financiacion": "Ingresos libre destinación",
            "presupuesto_base": 131868873,
            "ano": 2024,
            "avance_obra": 98.0,
            "fecha_inicio": "12-7-2024",
            "fecha_fin": "2026-01-05T00:00:00",
            "fecha_inicio_std": "2024-12-07T00:00:00",
            "fecha_fin_std": "2026-01-05T00:00:00",
            "frente_activo": "Frente activo",
            "fuera_rango": null
          },
          {
            "intervencion_id": "UNP-55-03",
            "referencia_proceso": "4133.010.27.1.010-2024",
            "referencia_contrato": "4133.010.27.1.010-2024",
            "url_proceso": "https://community.secop.gov.co/Public/Tendering/OpportunityDetail/Index?noticeUID=CO1.NTC.6354287&isFromPublicArea=True&isModal=Falsev",
            "bpin": 2022760010113,
            "estado": "En ejecución",
            "tipo_intervencion": "Adecuaciones",
            "fuente_financiacion": "Ingresos libre destinación",
            "presupuesto_base": 542044700,
            "ano": 2024,
            "avance_obra": 98.0,
            "fecha_inicio": "12-7-2024",
            "fecha_fin": "2026-01-05T00:00:00",
            "fecha_inicio_std": "2024-12-07T00:00:00",
            "fecha_fin_std": "2026-01-05T00:00:00",
            "frente_activo": "Frente activo",
            "fuera_rango": null
          },
          {
            "intervencion_id": "UNP-55-04",
            "referencia_proceso": "4133.010.27.1.010-2024",
            "referencia_contrato": "4133.010.27.1.010-2024",
            "url_proceso": "https://community.secop.gov.co/Public/Tendering/OpportunityDetail/Index?noticeUID=CO1.NTC.6354287&isFromPublicArea=True&isModal=Falsev",
            "bpin": 2020760010422,
            "estado": "En ejecución",
            "tipo_intervencion": "Adecuaciones",
            "fuente_financiacion": "Ingresos libre destinación",
            "presupuesto_base": 205203819,
            "ano": 2024,
            "avance_obra": 98.0,
            "fecha_inicio": "12-7-2024",
            "fecha_fin": "2026-01-05T00:00:00",
            "fecha_inicio_std": "2024-12-07T00:00:00",
            "fecha_fin_std": "2026-01-05T00:00:00",
            "frente_activo": "Frente activo",
            "fuera_rango": null
          },
          {
            "intervencion_id": "UNP-55-05",
            "referencia_proceso": "4133.010.27.1.010-2024",
            "referencia_contrato": "4133.010.27.1.010-2024",
            "url_proceso": "https://community.secop.gov.co/Public/Tendering/OpportunityDetail/Index?noticeUID=CO1.NTC.6354287&isFromPublicArea=True&isModal=Falsev",
            "bpin": 2022760010112,
            "estado": "En ejecución",
            "tipo_intervencion": "Adecuaciones",
            "fuente_financiacion": "Ingresos libre destinación",
            "presupuesto_base": 209032215,
            "ano": 2024,
            "avance_obra": 98.0,
            "fecha_inicio": "12-7-2024",
            "fecha_fin": "2026-01-05T00:00:00",
            "fecha_inicio_std": "2024-12-07T00:00:00",
            "fecha_fin_std": "2026-01-05T00:00:00",
            "frente_activo": "Frente activo",
            "fuera_rango": null
          },
          {
            "intervencion_id": "UNP-55-06",
            "referencia_proceso": "4133.010.27.1.010-2024",
            "referencia_contrato": "4133.010.27.1.010-2024",
            "url_proceso": "https://community.secop.gov.co/Public/Tendering/OpportunityDetail/Index?noticeUID=CO1.NTC.6354287&isFromPublicArea=True&isModal=Falsev",
            "bpin": 2022760010112,
            "estado": "En ejecución",
            "tipo_intervencion": "Adecuaciones",
            "fuente_financiacion": "Ingresos libre destinación",
            "presupuesto_base": 258188159,
            "ano": 2024,
            "avance_obra": 98.0,
            "fecha_inicio": "12-7-2024",
            "fecha_fin": "2026-01-05T00:00:00",
            "fecha_inicio_std": "2024-12-07T00:00:00",
            "fecha_fin_std": "2026-01-05T00:00:00",
            "frente_activo": "Frente activo",
            "fuera_rango": null
          },
          {
            "intervencion_id": "UNP-55-07",
            "referencia_proceso": "4133.010.32.1.1601-2025",
            "referencia_contrato": "4133.010.27.1.021-2025",
            "url_proceso": "https://community.secop.gov.co/Public/Tendering/OpportunityDetail/Index?noticeUID=CO1.NTC.8535730&isFromPublicArea=True&isModal=False",
            "bpin": 2024760010306,
            "estado": "Suspendido",
            "tipo_intervencion": "Adecuaciones",
            "fuente_financiacion": "Ingresos libre destinación",
            "presupuesto_base": 259587089,
            "ano": 2025,
            "avance_obra": 0.0,
            "fecha_inicio": "2025-08-01T00:00:00",
            "fecha_fin": "2025-12-15T00:00:00",
            "fecha_inicio_std": "2025-08-01T00:00:00",
            "fecha_fin_std": "2025-12-15T00:00:00",
            "frente_activo": "Inactivo",
            "fuera_rango": null
          },
          {
            "intervencion_id": "UNP-55-08",
            "referencia_proceso": "4133.010.32.1.1601-2025",
            "referencia_contrato": "4133.010.27.1.021-2025",
            "url_proceso": "https://community.secop.gov.co/Public/Tendering/OpportunityDetail/Index?noticeUID=CO1.NTC.8535730&isFromPublicArea=True&isModal=False",
            "bpin": 2024760010306,
            "estado": "Suspendido",
            "tipo_intervencion": "Adecuaciones",
            "fuente_financiacion": "Ingresos libre destinación",
            "presupuesto_base": 162473651,
            "ano": 2025,
            "avance_obra": 0.0,
            "fecha_inicio": "2025-08-01T00:00:00",
            "fecha_fin": "2025-12-15T00:00:00",
            "fecha_inicio_std": "2025-08-01T00:00:00",
            "fecha_fin_std": "2025-12-15T00:00:00",
            "frente_activo": "Inactivo",
            "fuera_rango": null
          },
          {
            "intervencion_id": "UNP-55-09",
            "referencia_proceso": "4133.010.32.1.1601-2025",
            "referencia_contrato": "4133.010.27.1.021-2025",
            "url_proceso": "https://community.secop.gov.co/Public/Tendering/OpportunityDetail/Index?noticeUID=CO1.NTC.8535730&isFromPublicArea=True&isModal=False",
            "bpin": 2024760010278,
            "estado": "Suspendido",
            "tipo_intervencion": "Adecuaciones",
            "fuente_financiacion": "Ingresos libre destinación",
            "presupuesto_base": 254452814,
            "ano": 2025,
            "avance_obra": 0.0,
            "fecha_inicio": "2025-08-01T00:00:00",
            "fecha_fin": "2025-12-15T00:00:00",
            "fecha_inicio_std": "2025-08-01T00:00:00",
            "fecha_fin_std": "2025-12-15T00:00:00",
            "frente_activo": "Inactivo",
            "fuera_rango": null
          },
          {
            "intervencion_id": "UNP-55-10",
            "referencia_proceso": "4133.010.32.1.1601-2025",
            "referencia_contrato": "4133.010.27.1.021-2025",
            "url_proceso": "https://community.secop.gov.co/Public/Tendering/OpportunityDetail/Index?noticeUID=CO1.NTC.8535730&isFromPublicArea=True&isModal=False",
            "bpin": 2024760010278,
            "estado": "Suspendido",
            "tipo_intervencion": "Adecuaciones",
            "fuente_financiacion": "Ingresos libre destinación",
            "presupuesto_base": 127948607,
            "ano": 2025,
            "avance_obra": 0.0,
            "fecha_inicio": "2025-08-01T00:00:00",
            "fecha_fin": "2025-12-15T00:00:00",
            "fecha_inicio_std": "2025-08-01T00:00:00",
            "fecha_fin_std": "2025-12-15T00:00:00",
            "frente_activo": "Inactivo",
            "fuera_rango": null
          },
          {
            "intervencion_id": "UNP-55-11",
            "referencia_proceso": "4133.010.32.1.1601-2027",
            "referencia_contrato": "4133.010.27.1.021-2027",
            "url_proceso": "https://community.secop.gov.co/Public/Tendering/OpportunityDetail/Index?noticeUID=CO1.NTC.8535730&isFromPublicArea=True&isModal=False",
            "bpin": 2024760010277,
            "estado": "Suspendido",
            "tipo_intervencion": "Adecuaciones",
            "fuente_financiacion": "Ingresos libre destinación",
            "presupuesto_base": 152082485,
            "ano": 2025,
            "avance_obra": 0.0,
            "fecha_inicio": "2025-08-01T00:00:00",
            "fecha_fin": "2025-12-15T00:00:00",
            "fecha_inicio_std": "2025-08-01T00:00:00",
            "fecha_fin_std": "2025-12-15T00:00:00",
            "frente_activo": "Inactivo",
            "fuera_rango": null
          },
          {
            "intervencion_id": "UNP-55-12",
            "referencia_proceso": "4133.010.32.1.1651-2028",
            "referencia_contrato": "4133.010.27.1.035-2028",
            "url_proceso": "https://community.secop.gov.co/Public/Tendering/OpportunityDetail/Index?noticeUID=CO1.NTC.8535730&isFromPublicArea=True&isModal=False",
            "bpin": 2024760010125,
            "estado": "Suspendido",
            "tipo_intervencion": "Mantenimiento",
            "fuente_financiacion": "Ingresos libre destinación",
            "presupuesto_base": 77823158,
            "ano": 2025,
            "avance_obra": 0.0,
            "fecha_inicio": "2025-08-01T00:00:00",
            "fecha_fin": "2025-12-15T00:00:00",
            "fecha_inicio_std": "2025-08-01T00:00:00",
            "fecha_fin_std": "2025-12-15T00:00:00",
            "frente_activo": "No aplica",
            "fuera_rango": null
          },
          {
            "intervencion_id": "UNP-55-13",
            "referencia_proceso": "4133.010.32.1.1651-2029",
            "referencia_contrato": "4133.010.27.1.035-2029",
            "url_proceso": "https://community.secop.gov.co/Public/Tendering/OpportunityDetail/Index?noticeUID=CO1.NTC.8535730&isFromPublicArea=True&isModal=False",
            "bpin": 2024760010125,
            "estado": "Suspendido",
            "tipo_intervencion": "Adecuaciones",
            "fuente_financiacion": "Ingresos libre destinación",
            "presupuesto_base": 77823158,
            "ano": 2025,
            "avance_obra": 0.0,
            "fecha_inicio": "2025-08-01T00:00:00",
            "fecha_fin": "2025-12-15T00:00:00",
            "fecha_inicio_std": "2025-08-01T00:00:00",
            "fecha_fin_std": "2025-12-15T00:00:00",
            "frente_activo": "Inactivo",
            "fuera_rango": null
          },
          {
            "intervencion_id": "UNP-55-14",
            "referencia_proceso": "4133.010.32.1.1651-2030",
            "referencia_contrato": "4133.010.27.1.035-2030",
            "url_proceso": "https://community.secop.gov.co/Public/Tendering/OpportunityDetail/Index?noticeUID=CO1.NTC.8535730&isFromPublicArea=True&isModal=False",
            "bpin": 2024760010125,
            "estado": "Suspendido",
            "tipo_intervencion": "Adecuaciones",
            "fuente_financiacion": "Ingresos libre destinación",
            "presupuesto_base": 77823158,
            "ano": 2025,
            "avance_obra": 0.0,
            "fecha_inicio": "2025-08-01T00:00:00",
            "fecha_fin": "2025-12-15T00:00:00",
            "fecha_inicio_std": "2025-08-01T00:00:00",
            "fecha_fin_std": "2025-12-15T00:00:00",
            "frente_activo": "Inactivo",
            "fuera_rango": null
          },
          {
            "intervencion_id": "UNP-55-15",
            "referencia_proceso": "4133.010.32.1.1651-2031",
            "referencia_contrato": "4133.010.27.1.035-2031",
            "url_proceso": "https://community.secop.gov.co/Public/Tendering/OpportunityDetail/Index?noticeUID=CO1.NTC.8535730&isFromPublicArea=True&isModal=False",
            "bpin": 2024760010125,
            "estado": "Suspendido",
            "tipo_intervencion": "Adecuaciones",
            "fuente_financiacion": "Ingresos libre destinación",
            "presupuesto_base": 77823158,
            "ano": 2025,
            "avance_obra": 0.0,
            "fecha_inicio": "2025-08-01T00:00:00",
            "fecha_fin": "2025-12-15T00:00:00",
            "fecha_inicio_std": "2025-08-01T00:00:00",
            "fecha_fin_std": "2025-12-15T00:00:00",
            "frente_activo": "Inactivo",
            "fuera_rango": null
          },
          {
            "intervencion_id": "UNP-55-16",
            "referencia_proceso": "4133.010.32.1.1651-2033",
            "referencia_contrato": "4133.010.27.1.035-2033",
            "url_proceso": "https://community.secop.gov.co/Public/Tendering/OpportunityDetail/Index?noticeUID=CO1.NTC.8535730&isFromPublicArea=True&isModal=False",
            "bpin": 2024760010125,
            "estado": "Suspendido",
            "tipo_intervencion": "Adecuaciones",
            "fuente_financiacion": "Ingresos libre destinación",
            "presupuesto_base": 77823158,
            "ano": 2025,
            "avance_obra": 0.0,
            "fecha_inicio": "2025-08-01T00:00:00",
            "fecha_fin": "2025-12-15T00:00:00",
            "fecha_inicio_std": "2025-08-01T00:00:00",
            "fecha_fin_std": "2025-12-15T00:00:00",
            "frente_activo": "Inactivo",
            "fuera_rango": null
          },
          {
            "intervencion_id": "UNP-55-17",
            "referencia_proceso": "4133.010.32.1.1651-2036",
            "referencia_contrato": "4133.010.27.1.035-2036",
            "url_proceso": "https://community.secop.gov.co/Public/Tendering/OpportunityDetail/Index?noticeUID=CO1.NTC.8535730&isFromPublicArea=True&isModal=False",
            "bpin": 2024760010125,
            "estado": "Suspendido",
            "tipo_intervencion": "Adecuaciones",
            "fuente_financiacion": "Ingresos libre destinación",
            "presupuesto_base": 77823158,
            "ano": 2025,
            "avance_obra": 0.0,
            "fecha_inicio": "2025-08-01T00:00:00",
            "fecha_fin": "2025-12-15T00:00:00",
            "fecha_inicio_std": "2025-08-01T00:00:00",
            "fecha_fin_std": "2025-12-15T00:00:00",
            "frente_activo": "Inactivo",
            "fuera_rango": null
          },
          {
            "intervencion_id": "UNP-55-18",
            "referencia_proceso": "4133.010.32.1.1651-2037",
            "referencia_contrato": "4133.010.27.1.035-2037",
            "url_proceso": "https://community.secop.gov.co/Public/Tendering/OpportunityDetail/Index?noticeUID=CO1.NTC.8535730&isFromPublicArea=True&isModal=False",
            "bpin": 2024760010125,
            "estado": "Suspendido",
            "tipo_intervencion": "Adecuaciones",
            "fuente_financiacion": "Ingresos libre destinación",
            "presupuesto_base": 77823158,
            "ano": 2025,
            "avance_obra": 0.0,
            "fecha_inicio": "2025-08-01T00:00:00",
            "fecha_fin": "2025-12-15T00:00:00",
            "fecha_inicio_std": "2025-08-01T00:00:00",
            "fecha_fin_std": "2025-12-15T00:00:00",
            "frente_activo": "Inactivo",
            "fuera_rango": null
          },
          {
            "intervencion_id": "UNP-55-19",
            "referencia_proceso": "4133.010.32.1.1651-2039",
            "referencia_contrato": "4133.010.27.1.035-2039",
            "url_proceso": "https://community.secop.gov.co/Public/Tendering/OpportunityDetail/Index?noticeUID=CO1.NTC.8535730&isFromPublicArea=True&isModal=False",
            "bpin": 2024760010125,
            "estado": "Suspendido",
            "tipo_intervencion": "Adecuaciones",
            "fuente_financiacion": "Ingresos libre destinación",
            "presupuesto_base": 77823158,
            "ano": 2025,
            "avance_obra": 0.0,
            "fecha_inicio": "2025-08-01T00:00:00",
            "fecha_fin": "2025-12-15T00:00:00",
            "fecha_inicio_std": "2025-08-01T00:00:00",
            "fecha_fin_std": "2025-12-15T00:00:00",
            "frente_activo": "Inactivo",
            "fuera_rango": null
          },
          {
            "intervencion_id": "UNP-55-20",
            "referencia_proceso": "4133.010.32.1.1651-2040",
            "referencia_contrato": "4133.010.27.1.035-2040",
            "url_proceso": "https://community.secop.gov.co/Public/Tendering/OpportunityDetail/Index?noticeUID=CO1.NTC.8535730&isFromPublicArea=True&isModal=False",
            "bpin": 2024760010125,
            "estado": "Suspendido",
            "tipo_intervencion": "Mantenimiento",
            "fuente_financiacion": "Ingresos libre destinación",
            "presupuesto_base": 77823158,
            "ano": 2025,
            "avance_obra": 0.0,
            "fecha_inicio": "2025-08-01T00:00:00",
            "fecha_fin": "2025-12-15T00:00:00",
            "fecha_inicio_std": "2025-08-01T00:00:00",
            "fecha_fin_std": "2025-12-15T00:00:00",
            "frente_activo": "No aplica",
            "fuera_rango": null
          },
          {
            "intervencion_id": "UNP-55-21",
            "referencia_proceso": "4133.010.32.1.1651-2041",
            "referencia_contrato": "4133.010.27.1.035-2041",
            "url_proceso": "https://community.secop.gov.co/Public/Tendering/OpportunityDetail/Index?noticeUID=CO1.NTC.8535730&isFromPublicArea=True&isModal=False",
            "bpin": 2024760010125,
            "estado": "Suspendido",
            "tipo_intervencion": "Mantenimiento",
            "fuente_financiacion": "Ingresos libre destinación",
            "presupuesto_base": 77823158,
            "ano": 2025,
            "avance_obra": 0.0,
            "fecha_inicio": "2025-08-01T00:00:00",
            "fecha_fin": "2025-12-15T00:00:00",
            "fecha_inicio_std": "2025-08-01T00:00:00",
            "fecha_fin_std": "2025-12-15T00:00:00",
            "frente_activo": "No aplica",
            "fuera_rango": null
          },
          {
            "intervencion_id": "UNP-55-22",
            "referencia_proceso": "4133.010.32.1.1651-2044",
            "referencia_contrato": "4133.010.27.1.035-2044",
            "url_proceso": "https://community.secop.gov.co/Public/Tendering/OpportunityDetail/Index?noticeUID=CO1.NTC.8535730&isFromPublicArea=True&isModal=False",
            "bpin": 2024760010125,
            "estado": "Suspendido",
            "tipo_intervencion": "Adecuaciones",
            "fuente_financiacion": "Ingresos libre destinación",
            "presupuesto_base": 77823158,
            "ano": 2025,
            "avance_obra": 0.0,
            "fecha_inicio": "2025-08-01T00:00:00",
            "fecha_fin": "2025-12-15T00:00:00",
            "fecha_inicio_std": "2025-08-01T00:00:00",
            "fecha_fin_std": "2025-12-15T00:00:00",
            "frente_activo": "Inactivo",
            "fuera_rango": null
          },
          {
            "intervencion_id": "UNP-55-23",
            "referencia_proceso": "4133.010.32.1.1651-2045",
            "referencia_contrato": "4133.010.27.1.035-2045",
            "url_proceso": "https://community.secop.gov.co/Public/Tendering/OpportunityDetail/Index?noticeUID=CO1.NTC.8535730&isFromPublicArea=True&isModal=False",
            "bpin": 2024760010125,
            "estado": "Suspendido",
            "tipo_intervencion": "Adecuaciones",
            "fuente_financiacion": "Ingresos libre destinación",
            "presupuesto_base": 77823158,
            "ano": 2025,
            "avance_obra": 0.0,
            "fecha_inicio": "2025-08-01T00:00:00",
            "fecha_fin": "2025-12-15T00:00:00",
            "fecha_inicio_std": "2025-08-01T00:00:00",
            "fecha_fin_std": "2025-12-15T00:00:00",
            "frente_activo": "Inactivo",
            "fuera_rango": null
          },
          {
            "intervencion_id": "UNP-55-24",
            "referencia_proceso": "4133.010.32.1.1651-2025",
            "referencia_contrato": "4133.010.27.1.035-2025",
            "url_proceso": "https://community.secop.gov.co/Public/Tendering/OpportunityDetail/Index?noticeUID=CO1.NTC.8535730&isFromPublicArea=True&isModal=False",
            "bpin": 2024760010125,
            "estado": "Suspendido",
            "tipo_intervencion": "Mantenimiento",
            "fuente_financiacion": "Ingresos libre destinación",
            "presupuesto_base": 1765000000,
            "ano": 2025,
            "avance_obra": 0.0,
            "fecha_inicio": "2025-08-01T00:00:00",
            "fecha_fin": "2025-12-15T00:00:00",
            "fecha_inicio_std": "2025-08-01T00:00:00",
            "fecha_fin_std": "2025-12-15T00:00:00",
            "frente_activo": "No aplica",
            "fuera_rango": null
          }
        ],
        "presupuesto_base": 5184588108,
        "avance_obra": 28.9
      }
    },
    {
      "type": "Feature",
      "geometry": null,
      "properties": {
        "upid": "UNP-56",
        "n_intervenciones": 2,
        "nombre_up": "Cancha Multiple Barrio la Riviera",
        "nombre_up_detalle": "Adecuación de Cancha Múltiple",
        "nombre_centro_gestor": "Secretaría del Deporte y la Recreación",
        "direccion": "Carrera 3 con Calle 58 y 59",
        "tipo_equipamiento": "Infraestructura recreo deportiva",
        "clase_up": "Obras equipamientos",
        "comuna_corregimiento": "COMUNA 12",
        "comuna_corregimiento_2": null,
        "barrio_vereda": "Nueva Floresta",
        "barrio_vereda_2": null,
        "identificador": "Grupo Licitación 2",
        "bpin": 202476000000000000,
        "lat": null,
        "lon": null,
        "intervenciones": [
          {
            "intervencion_id": "UNP-56-01",
            "referencia_proceso": "4162.010.32.1.1059-2025",
            "referencia_contrato": null,
            "url_proceso": "https://community.secop.gov.co/Public/Tendering/ContractNoticePhases/View?PPI=CO1.PPI.40683615&isFromPublicArea=True&isModal=False",
            "bpin": 202476000000000000,
            "estado": "En ejecución",
            "tipo_intervencion": "Adecuaciones",
            "fuente_financiacion": "Empréstito",
            "presupuesto_base": 304248837,
            "ano": 2025,
            "avance_obra": 2.0,
            "fecha_inicio": "10/10/2025",
            "fecha_fin": "2025-12-15T00:00:00",
            "fecha_inicio_std": "2025-10-10T00:00:00",
            "fecha_fin_std": "2025-12-15T00:00:00",
            "frente_activo": "Frente activo",
            "fuera_rango": null
          },
          {
            "intervencion_id": "UNP-56-02",
            "referencia_proceso": "4162.010.32.1.0717-2025",
            "referencia_contrato": "4162.010.26.1.2481-2025",
            "url_proceso": "https://community.secop.gov.co/Public/Tendering/OpportunityDetail/Index?noticeUID=CO1.NTC.8223550&isFromPublicArea=True&isModal=False",
            "bpin": 202476000000000000,
            "estado": "En ejecución",
            "tipo_intervencion": "Adecuaciones",
            "fuente_financiacion": "Ingresos con destinación específica",
            "presupuesto_base": 307689848,
            "ano": 2025,
            "avance_obra": 30.92,
            "fecha_inicio": "45896",
            "fecha_fin": 46006,
            "fecha_inicio_std": "2025-08-27T00:00:00",
            "fecha_fin_std": "2025-12-15T00:00:00",
            "frente_activo": "Frente activo",
            "fuera_rango": null
          }
        ],
        "presupuesto_base": 611938685,
        "avance_obra": 16.54
      }
    },
    {
      "type": "Feature",
      "geometry": null,
      "properties": {
        "upid": "UNP-57",
        "n_intervenciones": 1,
        "nombre_up": "Parque Recreativo y Cancha Múltiple Julio Rincón",
        "nombre_up_detalle": "Recuperacion de Superficie de Cancha Multiple",
        "nombre_centro_gestor": "Secretaría del Deporte y la Recreación",
        "direccion": "Trasversal 54 entre Diagonal 28e y Calle 70 entre Calle 55 y Calle 56",
        "tipo_equipamiento": "Infraestructura recreo deportiva",
        "clase_up": "Obras equipamientos",
        "comuna_corregimiento": "COMUNA 12",
        "comuna_corregimiento_2": null,
        "barrio_vereda": "Julio Rincón",
        "barrio_vereda_2": null,
        "identificador": "Grupo Licitación 2",
        "bpin": 202476000000000000,
        "lat": null,
        "lon": null,
        "intervenciones": [
          {
            "intervencion_id": "UNP-57-01",
            "referencia_proceso": "4162.010.32.1.1058-2025",
            "referencia_contrato": "4162.010.26.1.3229-2025",
            "url_proceso": "https://community.secop.gov.co/Public/Tendering/ContractNoticePhases/View?PPI=CO1.PPI.40365146&isFromPublicArea=True&isModal=False",
            "bpin": 202476000000000000,
            "estado": "Terminado",
            "tipo_intervencion": "Adecuaciones",
            "fuente_financiacion": "Empréstito",
            "presupuesto_base": 32345785,
            "ano": 2025,
            "avance_obra": 100.0,
            "fecha_inicio": "1/11/2025",
            "fecha_fin": "2026-03-02T00:00:00",
            "fecha_inicio_std": "2025-01-11T00:00:00",
            "fecha_fin_std": "2026-03-02T00:00:00",
            "frente_activo": "No aplica",
            "fuera_rango": null
          }
        ],
        "presupuesto_base": 32345785,
        "avance_obra": 100.0
      }
    },
    {
      "type": "Feature",
      "geometry": null,
      "properties": {
        "upid": "UNP-58",
        "n_intervenciones": 1,
        "nombre_up": "Unidad Recreativa Villa del Lago",
        "nombre_up_detalle": "Adecuacion de Cancha Sintetica",
        "nombre_centro_gestor": "Secretaría del Deporte y la Recreación",
        "direccion": "Diagonal 71a1 # 25c - 01",
        "tipo_equipamiento": "Infraestructura recreo deportiva",
        "clase_up": "Obras equipamientos",
        "comuna_corregimiento": "COMUNA 13",
        "comuna_corregimiento_2": null,
        "barrio_vereda": "Villa del Lago",
        "barrio_vereda_2": null,
        "identificador": "Grupo Licitación 2",
        "bpin": 202476000000000000,
        "lat": null,
        "lon": null,
        "intervenciones": [
          {
            "intervencion_id": "UNP-58-01",
            "referencia_proceso": "4162.010.32.1.1059-2025",
            "referencia_contrato": null,
            "url_proceso": "https://community.secop.gov.co/Public/Tendering/ContractNoticePhases/View?PPI=CO1.PPI.40683615&isFromPublicArea=True&isModal=False",
            "bpin": 202476000000000000,
            "estado": "En alistamiento",
            "tipo_intervencion": "Adecuaciones",
            "fuente_financiacion": "Empréstito",
            "presupuesto_base": 1089645207,
            "ano": 2025,
            "avance_obra": 0.0,
            "fecha_inicio": "1/11/2025",
            "fecha_fin": "2026-03-02T00:00:00",
            "fecha_inicio_std": "2025-01-11T00:00:00",
            "fecha_fin_std": "2026-03-02T00:00:00",
            "frente_activo": "No aplica",
            "fuera_rango": null
          }
        ],
        "presupuesto_base": 1089645207,
        "avance_obra": 0.0
      }
    },
    {
      "type": "Feature",
      "geometry": null,
      "properties": {
        "upid": "UNP-59",
        "n_intervenciones": 1,
        "nombre_up": "Parque Recreativo Candelaria",
        "nombre_up_detalle": "Recuperacion de Superficie de Cancha Multiple - Adecuacion de Juegos Infantiles",
        "nombre_centro_gestor": "Secretaría del Deporte y la Recreación",
        "direccion": "Kr 26a3 y Kr 26b1 entre Cl 79 y Cl 80",
        "tipo_equipamiento": "Infraestructura recreo deportiva",
        "clase_up": "Obras equipamientos",
        "comuna_corregimiento": "COMUNA 14",
        "comuna_corregimiento_2": null,
        "barrio_vereda": "Alfonso Bonilla Aragón",
        "barrio_vereda_2": null,
        "identificador": "Grupo Licitación 2",
        "bpin": 202476000000000000,
        "lat": null,
        "lon": null,
        "intervenciones": [
          {
            "intervencion_id": "UNP-59-01",
            "referencia_proceso": "4162.010.32.1.1059-2025",
            "referencia_contrato": null,
            "url_proceso": "https://community.secop.gov.co/Public/Tendering/ContractNoticePhases/View?PPI=CO1.PPI.40683615&isFromPublicArea=True&isModal=False",
            "bpin": 202476000000000000,
            "estado": "En alistamiento",
            "tipo_intervencion": "Adecuaciones",
            "fuente_financiacion": "Empréstito",
            "presupuesto_base": 223104557,
            "ano": 2025,
            "avance_obra": 0.0,
            "fecha_inicio": "1/11/2025",
            "fecha_fin": "2026-03-02T00:00:00",
            "fecha_inicio_std": "2025-01-11T00:00:00",
            "fecha_fin_std": "2026-03-02T00:00:00",
            "frente_activo": "No aplica",
            "fuera_rango": null
          }
        ],
        "presupuesto_base": 223104557,
        "avance_obra": 0.0
      }
    },
    {
      "type": "Feature",
      "geometry": null,
      "properties": {
        "upid": "UNP-60",
        "n_intervenciones": 1,
        "nombre_up": "Unidad Recreativa el Vallado",
        "nombre_up_detalle": "Adecuacion Cancha Multiple - Adecuacion de Juegos Infantiles",
        "nombre_centro_gestor": "Secretaría del Deporte y la Recreación",
        "direccion": "Carrera 41 #54-55",
        "tipo_equipamiento": "Infraestructura recreo deportiva",
        "clase_up": "Obras equipamientos",
        "comuna_corregimiento": "COMUNA 15",
        "comuna_corregimiento_2": null,
        "barrio_vereda": "El Vallado",
        "barrio_vereda_2": null,
        "identificador": "Grupo Licitación 2",
        "bpin": 202476000000000000,
        "lat": null,
        "lon": null,
        "intervenciones": [
          {
            "intervencion_id": "UNP-60-01",
            "referencia_proceso": "4162.010.32.1.1059-2025",
            "referencia_contrato": null,
            "url_proceso": "https://community.secop.gov.co/Public/Tendering/ContractNoticePhases/View?PPI=CO1.PPI.40683615&isFromPublicArea=True&isModal=False",
            "bpin": 202476000000000000,
            "estado": "En alistamiento",
            "tipo_intervencion": "Adecuaciones",
            "fuente_financiacion": "Empréstito",
            "presupuesto_base": 554375114,
            "ano": 2025,
            "avance_obra": 0.0,
            "fecha_inicio": "1/11/2025",
            "fecha_fin": "2026-03-02T00:00:00",
            "fecha_inicio_std": "2025-01-11T00:00:00",
            "fecha_fin_std": "2026-03-02T00:00:00",
            "frente_activo": "No aplica",
            "fuera_rango": null
          }
        ],
        "presupuesto_base": 554375114,
        "avance_obra": 0.0
      }
    },
    {
      "type": "Feature",
      "geometry": null,
      "properties": {
        "upid": "UNP-61",
        "n_intervenciones": 2,
        "nombre_up": "Cancha Sintetica bajo Ciudad Cordoba 1",
        "nombre_up_detalle": "Mantenimiento de Cancha Sintetica - Adecuacion de Juegos Infantiles",
        "nombre_centro_gestor": "Secretaría del Deporte y la Recreación",
        "direccion": "Carrera 33a y 33c entre Calles 35 y 35 a",
        "tipo_equipamiento": "Infraestructura recreo deportiva",
        "clase_up": "Obras equipamientos",
        "comuna_corregimiento": "COMUNA 15",
        "comuna_corregimiento_2": null,
        "barrio_vereda": "BAJOS DE CIUDAD CORDOBA I",
        "barrio_vereda_2": null,
        "identificador": "Grupo Licitación 2",
        "bpin": 202476000000000000,
        "lat": null,
        "lon": null,
        "intervenciones": [
          {
            "intervencion_id": "UNP-61-01",
            "referencia_proceso": "4162.010.32.1.1058-2025",
            "referencia_contrato": "4162.010.26.1.3229-2025",
            "url_proceso": "https://community.secop.gov.co/Public/Tendering/ContractNoticePhases/View?PPI=CO1.PPI.40365146&isFromPublicArea=True&isModal=False",
            "bpin": 202476000000000000,
            "estado": "En ejecución",
            "tipo_intervencion": "Mantenimiento",
            "fuente_financiacion": "Empréstito",
            "presupuesto_base": 491930037,
            "ano": 2025,
            "avance_obra": 0.0,
            "fecha_inicio": "10/10/2025",
            "fecha_fin": "2025-12-15T00:00:00",
            "fecha_inicio_std": "2025-10-10T00:00:00",
            "fecha_fin_std": "2025-12-15T00:00:00",
            "frente_activo": "No aplica",
            "fuera_rango": null
          },
          {
            "intervencion_id": "UNP-61-02",
            "referencia_proceso": "4162.010.32.1.0717-2025",
            "referencia_contrato": "4162.010.26.1.2481-2025",
            "url_proceso": "https://community.secop.gov.co/Public/Tendering/OpportunityDetail/Index?noticeUID=CO1.NTC.8223550&isFromPublicArea=True&isModal=False",
            "bpin": 202476000000000000,
            "estado": "En alistamiento",
            "tipo_intervencion": "Adecuaciones",
            "fuente_financiacion": "Ingresos con destinación específica",
            "presupuesto_base": 222276372,
            "ano": 2025,
            "avance_obra": 0.0,
            "fecha_inicio": "45896",
            "fecha_fin": 46006,
            "fecha_inicio_std": "2025-08-27T00:00:00",
            "fecha_fin_std": "2025-12-15T00:00:00",
            "frente_activo": "No aplica",
            "fuera_rango": null
          }
        ],
        "presupuesto_base": 714206409,
        "avance_obra": 0.0
      }
    },
    {
      "type": "Feature",
      "geometry": null,
      "properties": {
        "upid": "UNP-62",
        "n_intervenciones": 1,
        "nombre_up": "Polideportivo Ciudad 2000",
        "nombre_up_detalle": "Mantenimiento de Cancha Sintetica-adecuacion de Juegos Infantiles",
        "nombre_centro_gestor": "Secretaría del Deporte y la Recreación",
        "direccion": "Cra. 68 con Calle 34",
        "tipo_equipamiento": "Infraestructura recreo deportiva",
        "clase_up": "Obras equipamientos",
        "comuna_corregimiento": "COMUNA 16",
        "comuna_corregimiento_2": null,
        "barrio_vereda": "Ciudad 2000",
        "barrio_vereda_2": null,
        "identificador": "Grupo Licitación 2",
        "bpin": 202476000000000000,
        "lat": null,
        "lon": null,
        "intervenciones": [
          {
            "intervencion_id": "UNP-62-01",
            "referencia_proceso": "4162.010.32.1.1059-2025",
            "referencia_contrato": null,
            "url_proceso": "https://community.secop.gov.co/Public/Tendering/ContractNoticePhases/View?PPI=CO1.PPI.40683615&isFromPublicArea=True&isModal=False",
            "bpin": 202476000000000000,
            "estado": "En ejecución",
            "tipo_intervencion": "Mantenimiento",
            "fuente_financiacion": "Empréstito",
            "presupuesto_base": 168873207,
            "ano": 2025,
            "avance_obra": 0.0,
            "fecha_inicio": "10/10/2025",
            "fecha_fin": "2025-12-15T00:00:00",
            "fecha_inicio_std": "2025-10-10T00:00:00",
            "fecha_fin_std": "2025-12-15T00:00:00",
            "frente_activo": "No aplica",
            "fuera_rango": null
          }
        ],
        "presupuesto_base": 168873207,
        "avance_obra": 0.0
      }
    },
    {
      "type": "Feature",
      "geometry": null,
      "properties": {
        "upid": "UNP-63",
        "n_intervenciones": 1,
        "nombre_up": "Parque Recreativo Santa Anita",
        "nombre_up_detalle": "Adecuacion Cancha Multiple",
        "nombre_centro_gestor": "Secretaría del Deporte y la Recreación",
        "direccion": "K 51 # 11 - 00",
        "tipo_equipamiento": "Infraestructura recreo deportiva",
        "clase_up": "Obras equipamientos",
        "comuna_corregimiento": "COMUNA 17",
        "comuna_corregimiento_2": null,
        "barrio_vereda": "Santa Anita - La Selva",
        "barrio_vereda_2": null,
        "identificador": "Grupo Licitación 2",
        "bpin": 202476000000000000,
        "lat": null,
        "lon": null,
        "intervenciones": [
          {
            "intervencion_id": "UNP-63-01",
            "referencia_proceso": "4162.010.32.1.1059-2025",
            "referencia_contrato": null,
            "url_proceso": "https://community.secop.gov.co/Public/Tendering/ContractNoticePhases/View?PPI=CO1.PPI.40683615&isFromPublicArea=True&isModal=False",
            "bpin": 202476000000000000,
            "estado": "En alistamiento",
            "tipo_intervencion": "Adecuaciones",
            "fuente_financiacion": "Empréstito",
            "presupuesto_base": 308249760,
            "ano": 2025,
            "avance_obra": 0.0,
            "fecha_inicio": "1/11/2025",
            "fecha_fin": "2026-03-02T00:00:00",
            "fecha_inicio_std": "2025-01-11T00:00:00",
            "fecha_fin_std": "2026-03-02T00:00:00",
            "frente_activo": "No aplica",
            "fuera_rango": null
          }
        ],
        "presupuesto_base": 308249760,
        "avance_obra": 0.0
      }
    },
    {
      "type": "Feature",
      "geometry": null,
      "properties": {
        "upid": "UNP-64",
        "n_intervenciones": 3,
        "nombre_up": "Polideportivo Francisco Eladio Ramirez",
        "nombre_up_detalle": "Mantenimiento de Cancha Sintetica",
        "nombre_centro_gestor": "Secretaría del Deporte y la Recreación",
        "direccion": "Carrera 77 # 3a - 21",
        "tipo_equipamiento": "Infraestructura recreo deportiva",
        "clase_up": "Obras equipamientos",
        "comuna_corregimiento": "COMUNA 17",
        "comuna_corregimiento_2": null,
        "barrio_vereda": "Francisco Eladio Ramírez",
        "barrio_vereda_2": null,
        "identificador": "Grupo Licitación 2",
        "bpin": 202476000000000000,
        "lat": null,
        "lon": null,
        "intervenciones": [
          {
            "intervencion_id": "UNP-64-01",
            "referencia_proceso": "4162.010.32.1.1058-2025",
            "referencia_contrato": "4162.010.26.1.3229-2025",
            "url_proceso": "https://community.secop.gov.co/Public/Tendering/ContractNoticePhases/View?PPI=CO1.PPI.40365146&isFromPublicArea=True&isModal=False",
            "bpin": 202476000000000000,
            "estado": "En ejecución",
            "tipo_intervencion": "Mantenimiento",
            "fuente_financiacion": "Empréstito",
            "presupuesto_base": 96853337,
            "ano": 2025,
            "avance_obra": 71.0,
            "fecha_inicio": "10/10/2025",
            "fecha_fin": "2025-12-15T00:00:00",
            "fecha_inicio_std": "2025-10-10T00:00:00",
            "fecha_fin_std": "2025-12-15T00:00:00",
            "frente_activo": "No aplica",
            "fuera_rango": null
          },
          {
            "intervencion_id": "UNP-64-02",
            "referencia_proceso": "4162.010.32.1.1058-2025",
            "referencia_contrato": "4162.010.26.1.3229-2025",
            "url_proceso": "https://community.secop.gov.co/Public/Tendering/ContractNoticePhases/View?PPI=CO1.PPI.40365146&isFromPublicArea=True&isModal=False",
            "bpin": 202476000000000000,
            "estado": "En alistamiento",
            "tipo_intervencion": "Mantenimiento",
            "fuente_financiacion": "Empréstito",
            "presupuesto_base": 128457852,
            "ano": 2025,
            "avance_obra": 0.0,
            "fecha_inicio": "10/10/2025",
            "fecha_fin": "2025-12-15T00:00:00",
            "fecha_inicio_std": "2025-10-10T00:00:00",
            "fecha_fin_std": "2025-12-15T00:00:00",
            "frente_activo": "No aplica",
            "fuera_rango": null
          },
          {
            "intervencion_id": "UNP-64-03",
            "referencia_proceso": "4162.010.32.1.1058-2025",
            "referencia_contrato": "4162.010.26.1.3229-2025",
            "url_proceso": "https://community.secop.gov.co/Public/Tendering/ContractNoticePhases/View?PPI=CO1.PPI.40365146&isFromPublicArea=True&isModal=False",
            "bpin": 202476000000000000,
            "estado": "En alistamiento",
            "tipo_intervencion": "Mantenimiento",
            "fuente_financiacion": "Empréstito",
            "presupuesto_base": 128661199,
            "ano": 2025,
            "avance_obra": 0.0,
            "fecha_inicio": "10/10/2025",
            "fecha_fin": "2025-12-15T00:00:00",
            "fecha_inicio_std": "2025-10-10T00:00:00",
            "fecha_fin_std": "2025-12-15T00:00:00",
            "frente_activo": "No aplica",
            "fuera_rango": null
          }
        ],
        "presupuesto_base": 353972388,
        "avance_obra": 19.43
      }
    },
    {
      "type": "Feature",
      "geometry": null,
      "properties": {
        "upid": "UNP-65",
        "n_intervenciones": 1,
        "nombre_up": "Unidad Recreativa la Estrella",
        "nombre_up_detalle": "Mantenimiento de Cancha Sintetica-adecuacion Cancha Multiple",
        "nombre_centro_gestor": "Secretaría del Deporte y la Recreación",
        "direccion": "Calle 8 Oe #42-02",
        "tipo_equipamiento": "Infraestructura recreo deportiva",
        "clase_up": "Obras equipamientos",
        "comuna_corregimiento": "COMUNA 20",
        "comuna_corregimiento_2": null,
        "barrio_vereda": "Siloé",
        "barrio_vereda_2": null,
        "identificador": "Grupo Licitación 2",
        "bpin": 202476000000000000,
        "lat": null,
        "lon": null,
        "intervenciones": [
          {
            "intervencion_id": "UNP-65-01",
            "referencia_proceso": "4162.010.32.1.1058-2025",
            "referencia_contrato": "4162.010.26.1.3229-2025",
            "url_proceso": "https://community.secop.gov.co/Public/Tendering/ContractNoticePhases/View?PPI=CO1.PPI.40365146&isFromPublicArea=True&isModal=False",
            "bpin": 202476000000000000,
            "estado": "En alistamiento",
            "tipo_intervencion": "Mantenimiento",
            "fuente_financiacion": "Empréstito",
            "presupuesto_base": 361622421,
            "ano": 2025,
            "avance_obra": 0.0,
            "fecha_inicio": "10/10/2025",
            "fecha_fin": "2025-12-15T00:00:00",
            "fecha_inicio_std": "2025-10-10T00:00:00",
            "fecha_fin_std": "2025-12-15T00:00:00",
            "frente_activo": "No aplica",
            "fuera_rango": null
          }
        ],
        "presupuesto_base": 361622421,
        "avance_obra": 0.0
      }
    },
    {
      "type": "Feature",
      "geometry": null,
      "properties": {
        "upid": "UNP-66",
        "n_intervenciones": 5,
        "nombre_up": "Zona Verde Cañaveralejo Seguros Patria Niza",
        "nombre_up_detalle": "• Obras Civiles • Construcción Bordillos • Amoblamiento • Paisajismo • Señalética • Estrategia Educativa",
        "nombre_centro_gestor": "Departamento Administrativo de Gestión del Medio Ambiente",
        "direccion": "Calle 6a entre Carreras 63b y 64",
        "tipo_equipamiento": "Parques y zonas verdes",
        "clase_up": "Espacio Público",
        "comuna_corregimiento": "COMUNA 05",
        "comuna_corregimiento_2": null,
        "barrio_vereda": "Valle del Lili",
        "barrio_vereda_2": null,
        "identificador": "Zona Verde",
        "bpin": 2022760010112,
        "lat": null,
        "lon": null,
        "intervenciones": [
          {
            "intervencion_id": "UNP-66-01",
            "referencia_proceso": "4133.010.27.1.010-2024",
            "referencia_contrato": "4133.010.27.1.010-2024",
            "url_proceso": "https://community.secop.gov.co/Public/Tendering/OpportunityDetail/Index?noticeUID=CO1.NTC.6354287&isFromPublicArea=True&isModal=Falsev",
            "bpin": 2022760010112,
            "estado": "En ejecución",
            "tipo_intervencion": "Adecuaciones",
            "fuente_financiacion": "Ingresos libre destinación",
            "presupuesto_base": 133725549,
            "ano": 2024,
            "avance_obra": 98.0,
            "fecha_inicio": "12-7-2024",
            "fecha_fin": "2026-01-05T00:00:00",
            "fecha_inicio_std": "2024-12-07T00:00:00",
            "fecha_fin_std": "2026-01-05T00:00:00",
            "frente_activo": "Frente activo",
            "fuera_rango": null
          },
          {
            "intervencion_id": "UNP-66-02",
            "referencia_proceso": "4133.010.27.1.010-2024",
            "referencia_contrato": "4133.010.27.1.010-2024",
            "url_proceso": "https://community.secop.gov.co/Public/Tendering/OpportunityDetail/Index?noticeUID=CO1.NTC.6354287&isFromPublicArea=True&isModal=Falsev",
            "bpin": 2023760010137,
            "estado": "En ejecución",
            "tipo_intervencion": "Adecuaciones",
            "fuente_financiacion": "Ingresos libre destinación",
            "presupuesto_base": 483126957,
            "ano": 2024,
            "avance_obra": 98.0,
            "fecha_inicio": "12-7-2024",
            "fecha_fin": "2026-01-05T00:00:00",
            "fecha_inicio_std": "2024-12-07T00:00:00",
            "fecha_fin_std": "2026-01-05T00:00:00",
            "frente_activo": "Frente activo",
            "fuera_rango": null
          },
          {
            "intervencion_id": "UNP-66-03",
            "referencia_proceso": "4133.010.27.1.010-2024",
            "referencia_contrato": "4133.010.27.1.010-2024",
            "url_proceso": "https://community.secop.gov.co/Public/Tendering/OpportunityDetail/Index?noticeUID=CO1.NTC.6354287&isFromPublicArea=True&isModal=Falsev",
            "bpin": 2022760010116,
            "estado": "En ejecución",
            "tipo_intervencion": "Adecuaciones",
            "fuente_financiacion": "Ingresos libre destinación",
            "presupuesto_base": 277566300,
            "ano": 2024,
            "avance_obra": 98.0,
            "fecha_inicio": "12-7-2024",
            "fecha_fin": "2026-01-05T00:00:00",
            "fecha_inicio_std": "2024-12-07T00:00:00",
            "fecha_fin_std": "2026-01-05T00:00:00",
            "frente_activo": "Frente activo",
            "fuera_rango": null
          },
          {
            "intervencion_id": "UNP-66-04",
            "referencia_proceso": "4133.010.27.1.010-2024",
            "referencia_contrato": "4133.010.27.1.010-2024",
            "url_proceso": "https://community.secop.gov.co/Public/Tendering/OpportunityDetail/Index?noticeUID=CO1.NTC.6354287&isFromPublicArea=True&isModal=Falsev",
            "bpin": 2022760010116,
            "estado": "En ejecución",
            "tipo_intervencion": "Adecuaciones",
            "fuente_financiacion": "Ingresos libre destinación",
            "presupuesto_base": 293897649,
            "ano": 2024,
            "avance_obra": 98.0,
            "fecha_inicio": "12-7-2024",
            "fecha_fin": "2026-01-05T00:00:00",
            "fecha_inicio_std": "2024-12-07T00:00:00",
            "fecha_fin_std": "2026-01-05T00:00:00",
            "frente_activo": "Frente activo",
            "fuera_rango": null
          },
          {
            "intervencion_id": "UNP-66-05",
            "referencia_proceso": "4133.010.27.1.010-2024",
            "referencia_contrato": "4133.010.27.1.010-2024",
            "url_proceso": "https://community.secop.gov.co/Public/Tendering/OpportunityDetail/Index?noticeUID=CO1.NTC.6354287&isFromPublicArea=True&isModal=Falsev",
            "bpin": 2022760010116,
            "estado": "En ejecución",
            "tipo_intervencion": "Adecuaciones",
            "fuente_financiacion": "Ingresos libre destinación",
            "presupuesto_base": 241497106,
            "ano": 2024,
            "avance_obra": 98.0,
            "fecha_inicio": "12-7-2024",
            "fecha_fin": "2026-01-05T00:00:00",
            "fecha_inicio_std": "2024-12-07T00:00:00",
            "fecha_fin_std": "2026-01-05T00:00:00",
            "frente_activo": "Frente activo",
            "fuera_rango": null
          }
        ],
        "presupuesto_base": 1429813561,
        "avance_obra": 98.0
      }
    },
    {
      "type": "Feature",
      "geometry": null,
      "properties": {
        "upid": "UNP-67",
        "n_intervenciones": 2,
        "nombre_up": "Escenario Deportivo Olaya Herrera",
        "nombre_up_detalle": "Mantenimiento de Kiosco, Construccion de Sendero, Demolicion de Cerramiento",
        "nombre_centro_gestor": "Secretaría del Deporte y la Recreación",
        "direccion": "Carrera 8 N entre Calle 48 N y 50 N B",
        "tipo_equipamiento": "Infraestructura recreo deportiva",
        "clase_up": "Obras equipamientos",
        "comuna_corregimiento": "COMUNA 21",
        "comuna_corregimiento_2": null,
        "barrio_vereda": "Olaya Herrera",
        "barrio_vereda_2": null,
        "identificador": "Proyectos de Presupuesto Participativo Vigencia 2025",
        "bpin": 202476000000000000,
        "lat": null,
        "lon": null,
        "intervenciones": [
          {
            "intervencion_id": "UNP-67-01",
            "referencia_proceso": "4162.010.32.1.0717-2025",
            "referencia_contrato": "4162.010.26.1.2481-2025",
            "url_proceso": "https://community.secop.gov.co/Public/Tendering/OpportunityDetail/Index?noticeUID=CO1.NTC.8223550&isFromPublicArea=True&isModal=False",
            "bpin": 202476000000000000,
            "estado": "En ejecución",
            "tipo_intervencion": "Mantenimiento",
            "fuente_financiacion": "Ingresos con destinación específica",
            "presupuesto_base": 63896153,
            "ano": 2025,
            "avance_obra": 40.43,
            "fecha_inicio": "45896",
            "fecha_fin": 46006,
            "fecha_inicio_std": "2025-08-27T00:00:00",
            "fecha_fin_std": "2025-12-15T00:00:00",
            "frente_activo": "No aplica",
            "fuera_rango": null
          },
          {
            "intervencion_id": "UNP-67-02",
            "referencia_proceso": "4162.010.32.1.0717-2025",
            "referencia_contrato": "4162.010.26.1.2481-2025",
            "url_proceso": "https://community.secop.gov.co/Public/Tendering/OpportunityDetail/Index?noticeUID=CO1.NTC.8223550&isFromPublicArea=True&isModal=False",
            "bpin": 202476000000000000,
            "estado": "En alistamiento",
            "tipo_intervencion": "Mantenimiento",
            "fuente_financiacion": "Ingresos con destinación específica",
            "presupuesto_base": 165267454,
            "ano": 2025,
            "avance_obra": 0.0,
            "fecha_inicio": "45896",
            "fecha_fin": 46006,
            "fecha_inicio_std": "2025-08-27T00:00:00",
            "fecha_fin_std": "2025-12-15T00:00:00",
            "frente_activo": "No aplica",
            "fuera_rango": null
          }
        ],
        "presupuesto_base": 229163607,
        "avance_obra": 11.27
      }
    },
    {
      "type": "Feature",
      "geometry": null,
      "properties": {
        "upid": "UNP-68",
        "n_intervenciones": 1,
        "nombre_up": "Parque Recreativo Villa del Sol",
        "nombre_up_detalle": "Adecuación de Superficies Seguras en Juegos Infantiles",
        "nombre_centro_gestor": "Secretaría del Deporte y la Recreación",
        "direccion": "Carrera 1 a 6 entre Calles 62 y 62a",
        "tipo_equipamiento": "Infraestructura recreo deportiva",
        "clase_up": "Obras equipamientos",
        "comuna_corregimiento": "COMUNA 05",
        "comuna_corregimiento_2": null,
        "barrio_vereda": "Villa del Sol",
        "barrio_vereda_2": null,
        "identificador": "Proyectos de Presupuesto Participativo Vigencia 2025",
        "bpin": 202476000000000000,
        "lat": null,
        "lon": null,
        "intervenciones": [
          {
            "intervencion_id": "UNP-68-01",
            "referencia_proceso": "4162.010.32.1.0717-2025",
            "referencia_contrato": "4162.010.26.1.2481-2025",
            "url_proceso": "https://community.secop.gov.co/Public/Tendering/OpportunityDetail/Index?noticeUID=CO1.NTC.8223550&isFromPublicArea=True&isModal=False",
            "bpin": 202476000000000000,
            "estado": "En ejecución",
            "tipo_intervencion": "Adecuaciones",
            "fuente_financiacion": "Ingresos con destinación específica",
            "presupuesto_base": 285497545,
            "ano": 2025,
            "avance_obra": 1.18,
            "fecha_inicio": "45896",
            "fecha_fin": 46006,
            "fecha_inicio_std": "2025-08-27T00:00:00",
            "fecha_fin_std": "2025-12-15T00:00:00",
            "frente_activo": "Frente activo",
            "fuera_rango": null
          }
        ],
        "presupuesto_base": 285497545,
        "avance_obra": 1.18
      }
    },
    {
      "type": "Feature",
      "geometry": null,
      "properties": {
        "upid": "UNP-69",
        "n_intervenciones": 1,
        "nombre_up": "Escenario Alfonso Lopez Ii",
        "nombre_up_detalle": "Instalación de Graderías y Juegos Infatiles",
        "nombre_centro_gestor": "Secretaría del Deporte y la Recreación",
        "direccion": "Calle 81 entre Carreras 7d3 y Carrera 7h Bis",
        "tipo_equipamiento": "Infraestructura recreo deportiva",
        "clase_up": "Obras equipamientos",
        "comuna_corregimiento": "COMUNA 07",
        "comuna_corregimiento_2": null,
        "barrio_vereda": "ALFONSO LOPEZ",
        "barrio_vereda_2": null,
        "identificador": "Proyectos de Presupuesto Participativo Vigencia 2025",
        "bpin": 202476000000000000,
        "lat": null,
        "lon": null,
        "intervenciones": [
          {
            "intervencion_id": "UNP-69-01",
            "referencia_proceso": "4162.010.32.1.0717-2025",
            "referencia_contrato": "4162.010.26.1.2481-2025",
            "url_proceso": "https://community.secop.gov.co/Public/Tendering/OpportunityDetail/Index?noticeUID=CO1.NTC.8223550&isFromPublicArea=True&isModal=False",
            "bpin": 202476000000000000,
            "estado": "En alistamiento",
            "tipo_intervencion": "Adecuaciones",
            "fuente_financiacion": "Ingresos con destinación específica",
            "presupuesto_base": 92353581,
            "ano": 2025,
            "avance_obra": 0.0,
            "fecha_inicio": "45896",
            "fecha_fin": 46006,
            "fecha_inicio_std": "2025-08-27T00:00:00",
            "fecha_fin_std": "2025-12-15T00:00:00",
            "frente_activo": "No aplica",
            "fuera_rango": null
          }
        ],
        "presupuesto_base": 92353581,
        "avance_obra": 0.0
      }
    },
    {
      "type": "Feature",
      "geometry": null,
      "properties": {
        "upid": "UNP-70",
        "n_intervenciones": 2,
        "nombre_up": "Escenario Prados de Oriente",
        "nombre_up_detalle": "Adecuacion de Pista de Trote",
        "nombre_centro_gestor": "Secretaría del Deporte y la Recreación",
        "direccion": "Carrera 81a 1 y Carrera 81 entre Calles 49 y 48a",
        "tipo_equipamiento": "Infraestructura recreo deportiva",
        "clase_up": "Obras equipamientos",
        "comuna_corregimiento": "COMUNA 11",
        "comuna_corregimiento_2": null,
        "barrio_vereda": "Prados de Oriente",
        "barrio_vereda_2": null,
        "identificador": "Proyectos de Presupuesto Participativo Vigencia 2025",
        "bpin": 202476000000000000,
        "lat": null,
        "lon": null,
        "intervenciones": [
          {
            "intervencion_id": "UNP-70-01",
            "referencia_proceso": "4162.010.32.1.0717-2025",
            "referencia_contrato": "4162.010.26.1.2481-2025",
            "url_proceso": "https://community.secop.gov.co/Public/Tendering/OpportunityDetail/Index?noticeUID=CO1.NTC.8223550&isFromPublicArea=True&isModal=False",
            "bpin": 202476000000000000,
            "estado": "Terminado",
            "tipo_intervencion": "Adecuaciones",
            "fuente_financiacion": "Ingresos con destinación específica",
            "presupuesto_base": 273434948,
            "ano": 2025,
            "avance_obra": 100.0,
            "fecha_inicio": "45896",
            "fecha_fin": 46006,
            "fecha_inicio_std": "2025-08-27T00:00:00",
            "fecha_fin_std": "2025-12-15T00:00:00",
            "frente_activo": "No aplica",
            "fuera_rango": null
          },
          {
            "intervencion_id": "UNP-70-02",
            "referencia_proceso": "4162.010.32.1.0717-2025",
            "referencia_contrato": "4162.010.26.1.2481-2025",
            "url_proceso": "https://community.secop.gov.co/Public/Tendering/OpportunityDetail/Index?noticeUID=CO1.NTC.8223550&isFromPublicArea=True&isModal=False",
            "bpin": 202476000000000000,
            "estado": "En ejecución",
            "tipo_intervencion": "Adecuaciones",
            "fuente_financiacion": "Ingresos con destinación específica",
            "presupuesto_base": 112227793,
            "ano": 2025,
            "avance_obra": 77.0,
            "fecha_inicio": "45896",
            "fecha_fin": 46006,
            "fecha_inicio_std": "2025-08-27T00:00:00",
            "fecha_fin_std": "2025-12-15T00:00:00",
            "frente_activo": "Frente activo",
            "fuera_rango": null
          }
        ],
        "presupuesto_base": 385662741,
        "avance_obra": 93.31
      }
    },
    {
      "type": "Feature",
      "geometry": null,
      "properties": {
        "upid": "UNP-71",
        "n_intervenciones": 2,
        "nombre_up": "Cancha Multiple Valle del Lili",
        "nombre_up_detalle": "Construcción de Pantalla Protectora Cancha Multiple",
        "nombre_centro_gestor": "Secretaría del Deporte y la Recreación",
        "direccion": "Calle 34 entre Carreras 94 y 96",
        "tipo_equipamiento": "Infraestructura recreo deportiva",
        "clase_up": "Obras equipamientos",
        "comuna_corregimiento": "COMUNA 14",
        "comuna_corregimiento_2": null,
        "barrio_vereda": "Valle del Lili",
        "barrio_vereda_2": null,
        "identificador": "Proyectos de Presupuesto Participativo Vigencia 2025",
        "bpin": 202476000000000000,
        "lat": null,
        "lon": null,
        "intervenciones": [
          {
            "intervencion_id": "UNP-71-01",
            "referencia_proceso": "4162.010.32.1.0717-2025",
            "referencia_contrato": "4162.010.26.1.2481-2025",
            "url_proceso": "https://community.secop.gov.co/Public/Tendering/OpportunityDetail/Index?noticeUID=CO1.NTC.8223550&isFromPublicArea=True&isModal=False",
            "bpin": 202476000000000000,
            "estado": "En alistamiento",
            "tipo_intervencion": "Adecuaciones",
            "fuente_financiacion": "Ingresos con destinación específica",
            "presupuesto_base": 81338152,
            "ano": 2025,
            "avance_obra": 0.0,
            "fecha_inicio": "45896",
            "fecha_fin": 46006,
            "fecha_inicio_std": "2025-08-27T00:00:00",
            "fecha_fin_std": "2025-12-15T00:00:00",
            "frente_activo": "No aplica",
            "fuera_rango": null
          },
          {
            "intervencion_id": "UNP-71-02",
            "referencia_proceso": "4162.010.32.1.0717-2025",
            "referencia_contrato": "4162.010.26.1.2481-2025",
            "url_proceso": "https://community.secop.gov.co/Public/Tendering/OpportunityDetail/Index?noticeUID=CO1.NTC.8223550&isFromPublicArea=True&isModal=False",
            "bpin": 202476000000000000,
            "estado": "En ejecución",
            "tipo_intervencion": "Adecuaciones",
            "fuente_financiacion": "Ingresos con destinación específica",
            "presupuesto_base": 131522053,
            "ano": 2025,
            "avance_obra": 64.0,
            "fecha_inicio": "45896",
            "fecha_fin": 46006,
            "fecha_inicio_std": "2025-08-27T00:00:00",
            "fecha_fin_std": "2025-12-15T00:00:00",
            "frente_activo": "Frente activo",
            "fuera_rango": null
          }
        ],
        "presupuesto_base": 212860205,
        "avance_obra": 39.54
      }
    },
    {
      "type": "Feature",
      "geometry": null,
      "properties": {
        "upid": "UNP-72",
        "n_intervenciones": 1,
        "nombre_up": "Cancha Multiple Marroquin I - Villa Fatima",
        "nombre_up_detalle": "Mantenimiento Al Equipamiento Deportivo del Escenario",
        "nombre_centro_gestor": "Secretaría del Deporte y la Recreación",
        "direccion": "Transverssal 103 y Calle 95 entre Carreras 26p15 y 26p16",
        "tipo_equipamiento": "Infraestructura recreo deportiva",
        "clase_up": "Obras equipamientos",
        "comuna_corregimiento": "COMUNA 14",
        "comuna_corregimiento_2": null,
        "barrio_vereda": "Marroquín III",
        "barrio_vereda_2": null,
        "identificador": "Proyectos de Presupuesto Participativo Vigencia 2025",
        "bpin": 202476000000000000,
        "lat": null,
        "lon": null,
        "intervenciones": [
          {
            "intervencion_id": "UNP-72-01",
            "referencia_proceso": "4162.010.32.1.0717-2025",
            "referencia_contrato": "4162.010.26.1.2481-2025",
            "url_proceso": "https://community.secop.gov.co/Public/Tendering/OpportunityDetail/Index?noticeUID=CO1.NTC.8223550&isFromPublicArea=True&isModal=False",
            "bpin": 202476000000000000,
            "estado": "En alistamiento",
            "tipo_intervencion": "Mantenimiento",
            "fuente_financiacion": "Ingresos con destinación específica",
            "presupuesto_base": 47362536,
            "ano": 2025,
            "avance_obra": 0.0,
            "fecha_inicio": "45896",
            "fecha_fin": 46006,
            "fecha_inicio_std": "2025-08-27T00:00:00",
            "fecha_fin_std": "2025-12-15T00:00:00",
            "frente_activo": "No aplica",
            "fuera_rango": null
          }
        ],
        "presupuesto_base": 47362536,
        "avance_obra": 0.0
      }
    },
    {
      "type": "Feature",
      "geometry": null,
      "properties": {
        "upid": "UNP-73",
        "n_intervenciones": 1,
        "nombre_up": "Cancha Multiple Pueblo Joven",
        "nombre_up_detalle": "Adecuación de Cerramiento",
        "nombre_centro_gestor": "Secretaría del Deporte y la Recreación",
        "direccion": "Diagonal 48 Oeste entre Carreras 54a y 54b",
        "tipo_equipamiento": "Infraestructura recreo deportiva",
        "clase_up": "Obras equipamientos",
        "comuna_corregimiento": "COMUNA 20",
        "comuna_corregimiento_2": null,
        "barrio_vereda": "Pueblo Joven",
        "barrio_vereda_2": null,
        "identificador": "Proyectos de Presupuesto Participativo Vigencia 2025",
        "bpin": 202476000000000000,
        "lat": null,
        "lon": null,
        "intervenciones": [
          {
            "intervencion_id": "UNP-73-01",
            "referencia_proceso": "4162.010.32.1.0717-2025",
            "referencia_contrato": "4162.010.26.1.2481-2025",
            "url_proceso": "https://community.secop.gov.co/Public/Tendering/OpportunityDetail/Index?noticeUID=CO1.NTC.8223550&isFromPublicArea=True&isModal=False",
            "bpin": 202476000000000000,
            "estado": "En alistamiento",
            "tipo_intervencion": "Adecuaciones",
            "fuente_financiacion": "Ingresos con destinación específica",
            "presupuesto_base": 39642435,
            "ano": 2025,
            "avance_obra": 0.0,
            "fecha_inicio": "45896",
            "fecha_fin": 46006,
            "fecha_inicio_std": "2025-08-27T00:00:00",
            "fecha_fin_std": "2025-12-15T00:00:00",
            "frente_activo": "No aplica",
            "fuera_rango": null
          }
        ],
        "presupuesto_base": 39642435,
        "avance_obra": 0.0
      }
    },
    {
      "type": "Feature",
      "geometry": null,
      "properties": {
        "upid": "UNP-74",
        "n_intervenciones": 1,
        "nombre_up": "Parque Recreativo Pizamos I",
        "nombre_up_detalle": "Construcción de Graderías en Concreto",
        "nombre_centro_gestor": "Secretaría del Deporte y la Recreación",
        "direccion": "Calle 122 D entre Carreras 28q y 29",
        "tipo_equipamiento": "Infraestructura recreo deportiva",
        "clase_up": "Obras equipamientos",
        "comuna_corregimiento": "COMUNA 21",
        "comuna_corregimiento_2": null,
        "barrio_vereda": "Pizamos I",
        "barrio_vereda_2": null,
        "identificador": "Proyectos de Presupuesto Participativo Vigencia 2025",
        "bpin": 202476000000000000,
        "lat": null,
        "lon": null,
        "intervenciones": [
          {
            "intervencion_id": "UNP-74-01",
            "referencia_proceso": "4162.010.32.1.0717-2025",
            "referencia_contrato": "4162.010.26.1.2481-2025",
            "url_proceso": "https://community.secop.gov.co/Public/Tendering/OpportunityDetail/Index?noticeUID=CO1.NTC.8223550&isFromPublicArea=True&isModal=False",
            "bpin": 202476000000000000,
            "estado": "En alistamiento",
            "tipo_intervencion": "Adecuaciones",
            "fuente_financiacion": "Ingresos con destinación específica",
            "presupuesto_base": 136059784,
            "ano": 2025,
            "avance_obra": 0.0,
            "fecha_inicio": "45896",
            "fecha_fin": 46006,
            "fecha_inicio_std": "2025-08-27T00:00:00",
            "fecha_fin_std": "2025-12-15T00:00:00",
            "frente_activo": "No aplica",
            "fuera_rango": null
          }
        ],
        "presupuesto_base": 136059784,
        "avance_obra": 0.0
      }
    },
    {
      "type": "Feature",
      "geometry": null,
      "properties": {
        "upid": "UNP-75",
        "n_intervenciones": 1,
        "nombre_up": "Cancha Multiple Compartir Iii",
        "nombre_up_detalle": "Recuperación de Superficie Cancha Multiple Graderias - Andenes",
        "nombre_centro_gestor": "Secretaría del Deporte y la Recreación",
        "direccion": "Carrera 22a y 22b entre Calles 101b y 101 D",
        "tipo_equipamiento": "Infraestructura recreo deportiva",
        "clase_up": "Obras equipamientos",
        "comuna_corregimiento": "COMUNA 21",
        "comuna_corregimiento_2": null,
        "barrio_vereda": "Compartir",
        "barrio_vereda_2": null,
        "identificador": "Proyectos de Presupuesto Participativo Vigencia 2025",
        "bpin": 202476000000000000,
        "lat": null,
        "lon": null,
        "intervenciones": [
          {
            "intervencion_id": "UNP-75-01",
            "referencia_proceso": "4162.010.32.1.0717-2025",
            "referencia_contrato": "4162.010.26.1.2481-2025",
            "url_proceso": "https://community.secop.gov.co/Public/Tendering/OpportunityDetail/Index?noticeUID=CO1.NTC.8223550&isFromPublicArea=True&isModal=False",
            "bpin": 202476000000000000,
            "estado": "En alistamiento",
            "tipo_intervencion": "Adecuaciones",
            "fuente_financiacion": "Ingresos con destinación específica",
            "presupuesto_base": 97837864,
            "ano": 2025,
            "avance_obra": 0.0,
            "fecha_inicio": "45896",
            "fecha_fin": 46006,
            "fecha_inicio_std": "2025-08-27T00:00:00",
            "fecha_fin_std": "2025-12-15T00:00:00",
            "frente_activo": "No aplica",
            "fuera_rango": null
          }
        ],
        "presupuesto_base": 97837864,
        "avance_obra": 0.0
      }
    },
    {
      "type": "Feature",
      "geometry": null,
      "properties": {
        "upid": "UNP-76",
        "n_intervenciones": 1,
        "nombre_up": "Parque Recreativo Navarro la Esmeralda",
        "nombre_up_detalle": "Mantenimientos Biosaludables - Cancha Multiple y Tableros",
        "nombre_centro_gestor": "Secretaría del Deporte y la Recreación",
        "direccion": "Frente a la Iglesia Señora del Carmen, Sector Navarro la Esmeralda. ( Rural)",
        "tipo_equipamiento": "Infraestructura recreo deportiva",
        "clase_up": "Obras equipamientos",
        "comuna_corregimiento": "Navarro",
        "comuna_corregimiento_2": null,
        "barrio_vereda": "SECTOR LA ESMERALDA",
        "barrio_vereda_2": null,
        "identificador": "Proyectos de Presupuesto Participativo Vigencia 2025",
        "bpin": 202476000000000000,
        "lat": null,
        "lon": null,
        "intervenciones": [
          {
            "intervencion_id": "UNP-76-01",
            "referencia_proceso": "4162.010.32.1.0717-2025",
            "referencia_contrato": "4162.010.26.1.2481-2025",
            "url_proceso": "https://community.secop.gov.co/Public/Tendering/OpportunityDetail/Index?noticeUID=CO1.NTC.8223550&isFromPublicArea=True&isModal=False",
            "bpin": 202476000000000000,
            "estado": "En ejecución",
            "tipo_intervencion": "Mantenimiento",
            "fuente_financiacion": "Ingresos con destinación específica",
            "presupuesto_base": 36307230,
            "ano": 2025,
            "avance_obra": 13.0,
            "fecha_inicio": "45896",
            "fecha_fin": 46006,
            "fecha_inicio_std": "2025-08-27T00:00:00",
            "fecha_fin_std": "2025-12-15T00:00:00",
            "frente_activo": "No aplica",
            "fuera_rango": null
          }
        ],
        "presupuesto_base": 36307230,
        "avance_obra": 13.0
      }
    },
    {
      "type": "Feature",
      "geometry": null,
      "properties": {
        "upid": "UNP-77",
        "n_intervenciones": 2,
        "nombre_up": "Parque del Barrio Manuela Beltran",
        "nombre_up_detalle": "• Intervención en Obra Civil • Implementación del Componente Ambiental. • Limpieza Final • Adecuación Paisajística • Estrategia Educativa",
        "nombre_centro_gestor": "Departamento Administrativo de Gestión del Medio Ambiente",
        "direccion": "Carrera 61 con Calle 11b",
        "tipo_equipamiento": "Parques y zonas verdes",
        "clase_up": "Espacio Público",
        "comuna_corregimiento": "COMUNA 17",
        "comuna_corregimiento_2": null,
        "barrio_vereda": "Manuela Beltrán",
        "barrio_vereda_2": null,
        "identificador": "Parques",
        "bpin": 2023760010137,
        "lat": null,
        "lon": null,
        "intervenciones": [
          {
            "intervencion_id": "UNP-77-01",
            "referencia_proceso": "4133.010.27.1.010-2024",
            "referencia_contrato": "4133.010.27.1.010-2024",
            "url_proceso": "https://community.secop.gov.co/Public/Tendering/OpportunityDetail/Index?noticeUID=CO1.NTC.6354287&isFromPublicArea=True&isModal=Falsev",
            "bpin": 2023760010137,
            "estado": "En ejecución",
            "tipo_intervencion": "Adecuaciones",
            "fuente_financiacion": "Ingresos libre destinación",
            "presupuesto_base": 551286404,
            "ano": 2024,
            "avance_obra": 98.0,
            "fecha_inicio": "12-7-2024",
            "fecha_fin": "2026-01-05T00:00:00",
            "fecha_inicio_std": "2024-12-07T00:00:00",
            "fecha_fin_std": "2026-01-05T00:00:00",
            "frente_activo": "Frente activo",
            "fuera_rango": null
          },
          {
            "intervencion_id": "UNP-77-02",
            "referencia_proceso": "4133.010.32.1.1651-2046",
            "referencia_contrato": "4133.010.27.1.035-2046",
            "url_proceso": "https://community.secop.gov.co/Public/Tendering/OpportunityDetail/Index?noticeUID=CO1.NTC.8535730&isFromPublicArea=True&isModal=False",
            "bpin": 2024760010125,
            "estado": "Suspendido",
            "tipo_intervencion": "Mantenimiento",
            "fuente_financiacion": "Ingresos libre destinación",
            "presupuesto_base": 77823158,
            "ano": 2025,
            "avance_obra": 0.0,
            "fecha_inicio": "2025-08-01T00:00:00",
            "fecha_fin": "2025-12-15T00:00:00",
            "fecha_inicio_std": "2025-08-01T00:00:00",
            "fecha_fin_std": "2025-12-15T00:00:00",
            "frente_activo": "No aplica",
            "fuera_rango": null
          }
        ],
        "presupuesto_base": 629109562,
        "avance_obra": 85.88
      }
    },
    {
      "type": "Feature",
      "geometry": null,
      "properties": {
        "upid": "UNP-78",
        "n_intervenciones": 1,
        "nombre_up": "Parque Recreativo Navarro -la Coquera",
        "nombre_up_detalle": "Mantenimiento Demarcaion Cancha Multiple y Pantalla Proteccion",
        "nombre_centro_gestor": "Secretaría del Deporte y la Recreación",
        "direccion": "Cabecera Via Navarro , Sector la Coquera (rural)",
        "tipo_equipamiento": "Infraestructura recreo deportiva",
        "clase_up": "Obras equipamientos",
        "comuna_corregimiento": "Navarro",
        "comuna_corregimiento_2": null,
        "barrio_vereda": "SECTOR LA COQUERA",
        "barrio_vereda_2": null,
        "identificador": "Proyectos de Presupuesto Participativo Vigencia 2025",
        "bpin": 202476000000000000,
        "lat": null,
        "lon": null,
        "intervenciones": [
          {
            "intervencion_id": "UNP-78-01",
            "referencia_proceso": "4162.010.32.1.0717-2025",
            "referencia_contrato": "4162.010.26.1.2481-2025",
            "url_proceso": "https://community.secop.gov.co/Public/Tendering/OpportunityDetail/Index?noticeUID=CO1.NTC.8223550&isFromPublicArea=True&isModal=False",
            "bpin": 202476000000000000,
            "estado": "En ejecución",
            "tipo_intervencion": "Mantenimiento",
            "fuente_financiacion": "Ingresos con destinación específica",
            "presupuesto_base": 20494257,
            "ano": 2025,
            "avance_obra": 23.0,
            "fecha_inicio": "45896",
            "fecha_fin": 46006,
            "fecha_inicio_std": "2025-08-27T00:00:00",
            "fecha_fin_std": "2025-12-15T00:00:00",
            "frente_activo": "No aplica",
            "fuera_rango": null
          }
        ],
        "presupuesto_base": 20494257,
        "avance_obra": 23.0
      }
    },
    {
      "type": "Feature",
      "geometry": null,
      "properties": {
        "upid": "UNP-79",
        "n_intervenciones": 1,
        "nombre_up": "Parque Principal Pichinde",
        "nombre_up_detalle": "Instalación de Pantalla de Proteccion",
        "nombre_centro_gestor": "Secretaría del Deporte y la Recreación",
        "direccion": "Corregimiento Pichinde (rural)",
        "tipo_equipamiento": "Infraestructura recreo deportiva",
        "clase_up": "Obras equipamientos",
        "comuna_corregimiento": "Pichinde",
        "comuna_corregimiento_2": null,
        "barrio_vereda": "CABECERA",
        "barrio_vereda_2": null,
        "identificador": "Proyectos de Presupuesto Participativo Vigencia 2025",
        "bpin": 202476000000000000,
        "lat": null,
        "lon": null,
        "intervenciones": [
          {
            "intervencion_id": "UNP-79-01",
            "referencia_proceso": "4162.010.32.1.0717-2025",
            "referencia_contrato": "4162.010.26.1.2481-2025",
            "url_proceso": "https://community.secop.gov.co/Public/Tendering/OpportunityDetail/Index?noticeUID=CO1.NTC.8223550&isFromPublicArea=True&isModal=False",
            "bpin": 202476000000000000,
            "estado": "En alistamiento",
            "tipo_intervencion": "Adecuaciones",
            "fuente_financiacion": "Ingresos con destinación específica",
            "presupuesto_base": 77456940,
            "ano": 2025,
            "avance_obra": 0.0,
            "fecha_inicio": "45896",
            "fecha_fin": 46006,
            "fecha_inicio_std": "2025-08-27T00:00:00",
            "fecha_fin_std": "2025-12-15T00:00:00",
            "frente_activo": "No aplica",
            "fuera_rango": null
          }
        ],
        "presupuesto_base": 77456940,
        "avance_obra": 0.0
      }
    },
    {
      "type": "Feature",
      "geometry": null,
      "properties": {
        "upid": "UNP-80",
        "n_intervenciones": 1,
        "nombre_up": "Graderia Cancha la Leonera",
        "nombre_up_detalle": "Graderias - Ampliacion de las Existentes",
        "nombre_centro_gestor": "Secretaría del Deporte y la Recreación",
        "direccion": "Corregimiento la Leonera (rural)",
        "tipo_equipamiento": "Infraestructura recreo deportiva",
        "clase_up": "Obras equipamientos",
        "comuna_corregimiento": "La Leonera",
        "comuna_corregimiento_2": null,
        "barrio_vereda": "CABECERA",
        "barrio_vereda_2": null,
        "identificador": "Proyectos de Presupuesto Participativo Vigencia 2025",
        "bpin": 202476000000000000,
        "lat": null,
        "lon": null,
        "intervenciones": [
          {
            "intervencion_id": "UNP-80-01",
            "referencia_proceso": "4162.010.32.1.0717-2025",
            "referencia_contrato": "4162.010.26.1.2481-2025",
            "url_proceso": "https://community.secop.gov.co/Public/Tendering/OpportunityDetail/Index?noticeUID=CO1.NTC.8223550&isFromPublicArea=True&isModal=False",
            "bpin": 202476000000000000,
            "estado": "En alistamiento",
            "tipo_intervencion": "Adecuaciones",
            "fuente_financiacion": "Ingresos con destinación específica",
            "presupuesto_base": 82363740,
            "ano": 2025,
            "avance_obra": 0.0,
            "fecha_inicio": "45896",
            "fecha_fin": 46006,
            "fecha_inicio_std": "2025-08-27T00:00:00",
            "fecha_fin_std": "2025-12-15T00:00:00",
            "frente_activo": "No aplica",
            "fuera_rango": null
          }
        ],
        "presupuesto_base": 82363740,
        "avance_obra": 0.0
      }
    },
    {
      "type": "Feature",
      "geometry": null,
      "properties": {
        "upid": "UNP-81",
        "n_intervenciones": 1,
        "nombre_up": "Parque San Joaquin",
        "nombre_up_detalle": "Construcción de Bowl y Pumptrack",
        "nombre_centro_gestor": "Secretaría del Deporte y la Recreación",
        "direccion": "Entre Calle 16, Carrera 98 y 94",
        "tipo_equipamiento": "Infraestructura recreo deportiva",
        "clase_up": "Obras equipamientos",
        "comuna_corregimiento": "COMUNA 17",
        "comuna_corregimiento_2": null,
        "barrio_vereda": "Urbanización San Joaquin",
        "barrio_vereda_2": null,
        "identificador": "Proyectos Dependencia",
        "bpin": 2024760010079,
        "lat": null,
        "lon": null,
        "intervenciones": [
          {
            "intervencion_id": "UNP-81-01",
            "referencia_proceso": "4162.010.32.1.0665-2024",
            "referencia_contrato": "4162.010.26.1774-2024",
            "url_proceso": "https://community.secop.gov.co/Public/Tendering/ContractNoticePhases/View?PPI=CO1.PPI.32658155&isFromPublicArea=True&isModal=False",
            "bpin": 2024760010079,
            "estado": "Terminado",
            "tipo_intervencion": "Adecuaciones",
            "fuente_financiacion": "Ingresos libre destinación",
            "presupuesto_base": 545872098,
            "ano": 2024,
            "avance_obra": 100.0,
            "fecha_inicio": "04/09/2024",
            "fecha_fin": "2025-04-25T00:00:00",
            "fecha_inicio_std": "2024-09-04T00:00:00",
            "fecha_fin_std": "2025-04-25T00:00:00",
            "frente_activo": "No aplica",
            "fuera_rango": null
          }
        ],
        "presupuesto_base": 545872098,
        "avance_obra": 100.0
      }
    },
    {
      "type": "Feature",
      "geometry": null,
      "properties": {
        "upid": "UNP-82",
        "n_intervenciones": 1,
        "nombre_up": "Casa de las Memorias",
        "nombre_up_detalle": "Casa de las Memorias",
        "nombre_centro_gestor": "Secretaría de Paz y Cultura Ciudadana",
        "direccion": "Cra. 4 #calle 6 - 56",
        "tipo_equipamiento": "Infraestructura cultural",
        "clase_up": "Obras equipamientos",
        "comuna_corregimiento": "COMUNA 03",
        "comuna_corregimiento_2": null,
        "barrio_vereda": "La Merced",
        "barrio_vereda_2": null,
        "identificador": "Casa de las Memorias",
        "bpin": 2024760010015,
        "lat": null,
        "lon": null,
        "intervenciones": [
          {
            "intervencion_id": "UNP-82-01",
            "referencia_proceso": "4164.010.32.1.571-2024",
            "referencia_contrato": "4164.010.26.1.578-2024",
            "url_proceso": "https://community.secop.gov.co/Public/Tendering/OpportunityDetail/Index?noticeUID=CO1.NTC.6935431&isFromPublicArea=True&isModal=true&asPopupView=true",
            "bpin": 2024760010015,
            "estado": "Terminado",
            "tipo_intervencion": "Obras equipamientos",
            "fuente_financiacion": "Recursos propios",
            "presupuesto_base": 65943371,
            "ano": 2024,
            "avance_obra": 100.0,
            "fecha_inicio": "12-nov-24",
            "fecha_fin": "2024-12-12T00:00:00",
            "fecha_inicio_std": "2024-11-12T00:00:00",
            "fecha_fin_std": "2024-12-12T00:00:00",
            "frente_activo": "No aplica",
            "fuera_rango": null
          }
        ],
        "presupuesto_base": 65943371,
        "avance_obra": 100.0
      }
    },
    {
      "type": "Feature",
      "geometry": null,
      "properties": {
        "upid": "UNP-83",
        "n_intervenciones": 4,
        "nombre_up": "Gato de Tejada",
        "nombre_up_detalle": "Mantenimiento de Banderas",
        "nombre_centro_gestor": "Unidad Administrativa Especial de Gestión de Bienes y Servicios",
        "direccion": "Av. 6n y Av. 4n con Calle 70",
        "tipo_equipamiento": "Fuentes y monumentos",
        "clase_up": "Obras de Arte (civil)",
        "comuna_corregimiento": "COMUNA 02",
        "comuna_corregimiento_2": null,
        "barrio_vereda": "Zona rural de Cali",
        "barrio_vereda_2": null,
        "identificador": "Mantenimiento de Banderas",
        "bpin": 0,
        "lat": null,
        "lon": null,
        "intervenciones": [
          {
            "intervencion_id": "UNP-83-01",
            "referencia_proceso": "4181.010.26.1.434-2024",
            "referencia_contrato": "4181.010.26.1.434-2024",
            "url_proceso": "https://community.secop.gov.co/Public/Tendering/OpportunityDetail/Index?noticeUID=CO1.NTC.6853262&isFromPublicArea=True&isModal=False",
            "bpin": 0,
            "estado": "Terminado",
            "tipo_intervencion": "Mantenimiento",
            "fuente_financiacion": "Ingresos libre destinación",
            "presupuesto_base": 1285200,
            "ano": 2024,
            "avance_obra": 100.0,
            "fecha_inicio": "30/09/2024 ",
            "fecha_fin": "25/10/2024",
            "fecha_inicio_std": "2024-09-30T00:00:00",
            "fecha_fin_std": "2024-10-25T00:00:00",
            "frente_activo": "No aplica",
            "fuera_rango": null
          },
          {
            "intervencion_id": "UNP-83-02",
            "referencia_proceso": "4181.010.26.1.434-2024",
            "referencia_contrato": "4181.010.26.1.434-2024",
            "url_proceso": "https://community.secop.gov.co/Public/Tendering/OpportunityDetail/Index?noticeUID=CO1.NTC.6853262&isFromPublicArea=True&isModal=False",
            "bpin": 0,
            "estado": "Terminado",
            "tipo_intervencion": "Mantenimiento",
            "fuente_financiacion": "Ingresos libre destinación",
            "presupuesto_base": 1249500,
            "ano": 2024,
            "avance_obra": 100.0,
            "fecha_inicio": "30/09/2024 ",
            "fecha_fin": "25/10/2024",
            "fecha_inicio_std": "2024-09-30T00:00:00",
            "fecha_fin_std": "2024-10-25T00:00:00",
            "frente_activo": "No aplica",
            "fuera_rango": null
          },
          {
            "intervencion_id": "UNP-83-03",
            "referencia_proceso": "4181.010.26.1.434-2024",
            "referencia_contrato": "4181.010.26.1.434-2024",
            "url_proceso": "https://community.secop.gov.co/Public/Tendering/OpportunityDetail/Index?noticeUID=CO1.NTC.6853262&isFromPublicArea=True&isModal=False",
            "bpin": 0,
            "estado": "Terminado",
            "tipo_intervencion": "Mantenimiento",
            "fuente_financiacion": "Ingresos libre destinación",
            "presupuesto_base": 1285200,
            "ano": 2024,
            "avance_obra": 100.0,
            "fecha_inicio": "30/09/2024 ",
            "fecha_fin": "25/10/2024",
            "fecha_inicio_std": "2024-09-30T00:00:00",
            "fecha_fin_std": "2024-10-25T00:00:00",
            "frente_activo": "No aplica",
            "fuera_rango": null
          },
          {
            "intervencion_id": "UNP-83-04",
            "referencia_proceso": "4181.010.26.1.434-2024",
            "referencia_contrato": "4181.010.26.1.434-2024",
            "url_proceso": "https://community.secop.gov.co/Public/Tendering/OpportunityDetail/Index?noticeUID=CO1.NTC.6853262&isFromPublicArea=True&isModal=False",
            "bpin": 0,
            "estado": "Terminado",
            "tipo_intervencion": "Mantenimiento",
            "fuente_financiacion": "Ingresos libre destinación",
            "presupuesto_base": 1356600,
            "ano": 2024,
            "avance_obra": 100.0,
            "fecha_inicio": "30/09/2024",
            "fecha_fin": "25/10/2024",
            "fecha_inicio_std": "2024-09-30T00:00:00",
            "fecha_fin_std": "2024-10-25T00:00:00",
            "frente_activo": "No aplica",
            "fuera_rango": null
          }
        ],
        "presupuesto_base": 5176500,
        "avance_obra": 100.0
      }
    },
    {
      "type": "Feature",
      "geometry": null,
      "properties": {
        "upid": "UNP-84",
        "n_intervenciones": 2,
        "nombre_up": "Monumento Sebastian de Belalcazar",
        "nombre_up_detalle": "Mantenimiento de Banderas",
        "nombre_centro_gestor": "Unidad Administrativa Especial de Gestión de Bienes y Servicios",
        "direccion": "Av. 4 Oeste #2 Oeste Calle 2 Oeste #30 - 2ª",
        "tipo_equipamiento": "Fuentes y monumentos",
        "clase_up": "Obras de Arte (civil)",
        "comuna_corregimiento": "COMUNA 01",
        "comuna_corregimiento_2": null,
        "barrio_vereda": "Portada al mar",
        "barrio_vereda_2": null,
        "identificador": "Mantenimiento de Banderas",
        "bpin": 0,
        "lat": null,
        "lon": null,
        "intervenciones": [
          {
            "intervencion_id": "UNP-84-01",
            "referencia_proceso": "4181.010.26.1.434-2024",
            "referencia_contrato": "4181.010.26.1.434-2024",
            "url_proceso": "https://community.secop.gov.co/Public/Tendering/OpportunityDetail/Index?noticeUID=CO1.NTC.6853262&isFromPublicArea=True&isModal=False",
            "bpin": 0,
            "estado": "Terminado",
            "tipo_intervencion": "Mantenimiento",
            "fuente_financiacion": "Ingresos libre destinación",
            "presupuesto_base": 1285200,
            "ano": 2024,
            "avance_obra": 100.0,
            "fecha_inicio": "30/09/2024 ",
            "fecha_fin": "25/10/2024",
            "fecha_inicio_std": "2024-09-30T00:00:00",
            "fecha_fin_std": "2024-10-25T00:00:00",
            "frente_activo": "No aplica",
            "fuera_rango": null
          },
          {
            "intervencion_id": "UNP-84-02",
            "referencia_proceso": "4181.010.26.1.434-2024",
            "referencia_contrato": "4181.010.26.1.434-2024",
            "url_proceso": "https://community.secop.gov.co/Public/Tendering/OpportunityDetail/Index?noticeUID=CO1.NTC.6853262&isFromPublicArea=True&isModal=False",
            "bpin": 0,
            "estado": "Terminado",
            "tipo_intervencion": "Mantenimiento",
            "fuente_financiacion": "Ingresos libre destinación",
            "presupuesto_base": 1285200,
            "ano": 2024,
            "avance_obra": 100.0,
            "fecha_inicio": "30/09/2024 ",
            "fecha_fin": "25/10/2024",
            "fecha_inicio_std": "2024-09-30T00:00:00",
            "fecha_fin_std": "2024-10-25T00:00:00",
            "frente_activo": "No aplica",
            "fuera_rango": null
          }
        ],
        "presupuesto_base": 2570400,
        "avance_obra": 100.0
      }
    },
    {
      "type": "Feature",
      "geometry": null,
      "properties": {
        "upid": "UNP-85",
        "n_intervenciones": 2,
        "nombre_up": "Centro Administrativo Distrital - CAD",
        "nombre_up_detalle": "Mantenimiento de Banderas",
        "nombre_centro_gestor": "Unidad Administrativa Especial de Gestión de Bienes y Servicios",
        "direccion": "Avenida 2 Norte #10 - 70",
        "tipo_equipamiento": "Fuentes y monumentos",
        "clase_up": "Obras de Arte (civil)",
        "comuna_corregimiento": "COMUNA 02",
        "comuna_corregimiento_2": null,
        "barrio_vereda": "Centenario",
        "barrio_vereda_2": null,
        "identificador": "Mantenimiento de Banderas",
        "bpin": 0,
        "lat": null,
        "lon": null,
        "intervenciones": [
          {
            "intervencion_id": "UNP-85-01",
            "referencia_proceso": "4181.010.26.1.434-2024",
            "referencia_contrato": "4181.010.26.1.434-2024",
            "url_proceso": "https://community.secop.gov.co/Public/Tendering/OpportunityDetail/Index?noticeUID=CO1.NTC.6853262&isFromPublicArea=True&isModal=False",
            "bpin": 0,
            "estado": "Terminado",
            "tipo_intervencion": "Mantenimiento",
            "fuente_financiacion": "Ingresos libre destinación",
            "presupuesto_base": 1356600,
            "ano": 2024,
            "avance_obra": 100.0,
            "fecha_inicio": "30/09/2024 ",
            "fecha_fin": "25/10/2024",
            "fecha_inicio_std": "2024-09-30T00:00:00",
            "fecha_fin_std": "2024-10-25T00:00:00",
            "frente_activo": "No aplica",
            "fuera_rango": null
          },
          {
            "intervencion_id": "UNP-85-02",
            "referencia_proceso": "4181.010.26.1.539-2024",
            "referencia_contrato": "4181.010.26.1.539-2024",
            "url_proceso": "https://community.secop.gov.co/Public/Tendering/OpportunityDetail/Index?noticeUID=CO1.NTC.6476969&isFromPublicArea=True&isModal=False",
            "bpin": 0,
            "estado": "Terminado",
            "tipo_intervencion": "Mantenimiento",
            "fuente_financiacion": "Ingresos libre destinación",
            "presupuesto_base": 66687600,
            "ano": 2024,
            "avance_obra": 100.0,
            "fecha_inicio": "08/10/2024",
            "fecha_fin": "30/10/2024",
            "fecha_inicio_std": "2024-10-08T00:00:00",
            "fecha_fin_std": "2024-10-30T00:00:00",
            "frente_activo": "No aplica",
            "fuera_rango": null
          }
        ],
        "presupuesto_base": 68044200,
        "avance_obra": 100.0
      }
    },
    {
      "type": "Feature",
      "geometry": null,
      "properties": {
        "upid": "UNP-86",
        "n_intervenciones": 1,
        "nombre_up": "Edificio San Marino",
        "nombre_up_detalle": "Impermeabilización e Instalación de Techos",
        "nombre_centro_gestor": "Unidad Administrativa Especial de Gestión de Bienes y Servicios",
        "direccion": "Calle 14n #6n-23",
        "tipo_equipamiento": "Edificios Institucionales",
        "clase_up": "Obras equipamientos",
        "comuna_corregimiento": "COMUNA 02",
        "comuna_corregimiento_2": null,
        "barrio_vereda": "Granada",
        "barrio_vereda_2": null,
        "identificador": "Edificios Institucionales",
        "bpin": 0,
        "lat": null,
        "lon": null,
        "intervenciones": [
          {
            "intervencion_id": "UNP-86-01",
            "referencia_proceso": "4181.010.26.1.500-2024",
            "referencia_contrato": "4181.010.26.1.500-2024",
            "url_proceso": "https://community.secop.gov.co/Public/Tendering/OpportunityDetail/Index?noticeUID=CO1.NTC.6611979&isFromPublicArea=True&isModal=False",
            "bpin": 0,
            "estado": "Terminado",
            "tipo_intervencion": "Mantenimiento",
            "fuente_financiacion": "Ingresos libre destinación",
            "presupuesto_base": 214142024,
            "ano": 2024,
            "avance_obra": 100.0,
            "fecha_inicio": "24/10/2024",
            "fecha_fin": "23/12/2024",
            "fecha_inicio_std": "2024-10-24T00:00:00",
            "fecha_fin_std": "2024-12-23T00:00:00",
            "frente_activo": "No aplica",
            "fuera_rango": null
          }
        ],
        "presupuesto_base": 214142024,
        "avance_obra": 100.0
      }
    },
    {
      "type": "Feature",
      "geometry": null,
      "properties": {
        "upid": "UNP-87",
        "n_intervenciones": 1,
        "nombre_up": "Centro Administrativo Distrital - CAD",
        "nombre_up_detalle": "Adecuación de Oficinas y Zonas de Servicio",
        "nombre_centro_gestor": "Unidad Administrativa Especial de Gestión de Bienes y Servicios",
        "direccion": "Avenida 2 Norte #10 - 70",
        "tipo_equipamiento": "Edificios Institucionales",
        "clase_up": "Obras equipamientos",
        "comuna_corregimiento": "COMUNA 02",
        "comuna_corregimiento_2": null,
        "barrio_vereda": "Centenario",
        "barrio_vereda_2": null,
        "identificador": "Edificios Institucionales",
        "bpin": 0,
        "lat": null,
        "lon": null,
        "intervenciones": [
          {
            "intervencion_id": "UNP-87-01",
            "referencia_proceso": "4181.010.26.1.446 -2025",
            "referencia_contrato": "4181.010.26.1.446 -2025",
            "url_proceso": "https://community.secop.gov.co/Public/Tendering/OpportunityDetail/Index?noticeUID=CO1.NTC.8532560&isFromPublicArea=True&isModal=False",
            "bpin": 0,
            "estado": "Terminado",
            "tipo_intervencion": "Adecuaciones",
            "fuente_financiacion": "Ingresos libre destinación",
            "presupuesto_base": 177042414,
            "ano": 2025,
            "avance_obra": 100.0,
            "fecha_inicio": "28/08/2025",
            "fecha_fin": "15/12/2025",
            "fecha_inicio_std": "2025-08-28T00:00:00",
            "fecha_fin_std": "2025-12-15T00:00:00",
            "frente_activo": "No aplica",
            "fuera_rango": null
          }
        ],
        "presupuesto_base": 177042414,
        "avance_obra": 100.0
      }
    },
    {
      "type": "Feature",
      "geometry": null,
      "properties": {
        "upid": "UNP-88",
        "n_intervenciones": 3,
        "nombre_up": "Separador Asturias, Kenedy, Nueva Floresta, Rodeo, Sindical",
        "nombre_up_detalle": "• Obras Civiles • Amoblamiento • Limpieza Final • Adecuación Paisajistica y Manejo Ambiental • Componente Educativo",
        "nombre_centro_gestor": "Departamento Administrativo de Gestión del Medio Ambiente",
        "direccion": "Calles 13 D y 13e entre Carreras 35a y 35",
        "tipo_equipamiento": "Parques y zonas verdes",
        "clase_up": "Espacio Público",
        "comuna_corregimiento": "COMUNA 12",
        "comuna_corregimiento_2": null,
        "barrio_vereda": "Cristóbal Colón",
        "barrio_vereda_2": null,
        "identificador": "Separador Vial",
        "bpin": 2023760010139,
        "lat": null,
        "lon": null,
        "intervenciones": [
          {
            "intervencion_id": "UNP-88-01",
            "referencia_proceso": "4133.010.27.1.010-2024",
            "referencia_contrato": "4133.010.27.1.010-2024",
            "url_proceso": "https://community.secop.gov.co/Public/Tendering/OpportunityDetail/Index?noticeUID=CO1.NTC.6354287&isFromPublicArea=True&isModal=Falsev",
            "bpin": 2023760010139,
            "estado": "En ejecución",
            "tipo_intervencion": "Adecuaciones",
            "fuente_financiacion": "Ingresos libre destinación",
            "presupuesto_base": 842407577,
            "ano": 2024,
            "avance_obra": 98.0,
            "fecha_inicio": "12-7-2024",
            "fecha_fin": "2026-01-05T00:00:00",
            "fecha_inicio_std": "2024-12-07T00:00:00",
            "fecha_fin_std": "2026-01-05T00:00:00",
            "frente_activo": "Frente activo",
            "fuera_rango": null
          },
          {
            "intervencion_id": "UNP-88-02",
            "referencia_proceso": "4133.010.32.1.1651-2035",
            "referencia_contrato": "4133.010.27.1.035-2035",
            "url_proceso": "https://community.secop.gov.co/Public/Tendering/OpportunityDetail/Index?noticeUID=CO1.NTC.8535730&isFromPublicArea=True&isModal=False",
            "bpin": 2024760010125,
            "estado": "Suspendido",
            "tipo_intervencion": "Adecuaciones",
            "fuente_financiacion": "Ingresos libre destinación",
            "presupuesto_base": 77823158,
            "ano": 2025,
            "avance_obra": 0.0,
            "fecha_inicio": "2025-08-01T00:00:00",
            "fecha_fin": "2025-12-15T00:00:00",
            "fecha_inicio_std": "2025-08-01T00:00:00",
            "fecha_fin_std": "2025-12-15T00:00:00",
            "frente_activo": "Inactivo",
            "fuera_rango": null
          },
          {
            "intervencion_id": "UNP-88-03",
            "referencia_proceso": "4133.010.32.1.1651-2043",
            "referencia_contrato": "4133.010.27.1.035-2043",
            "url_proceso": "https://community.secop.gov.co/Public/Tendering/OpportunityDetail/Index?noticeUID=CO1.NTC.8535730&isFromPublicArea=True&isModal=False",
            "bpin": 2024760010125,
            "estado": "Suspendido",
            "tipo_intervencion": "Adecuaciones",
            "fuente_financiacion": "Ingresos libre destinación",
            "presupuesto_base": 77823158,
            "ano": 2025,
            "avance_obra": 0.0,
            "fecha_inicio": "2025-08-01T00:00:00",
            "fecha_fin": "2025-12-15T00:00:00",
            "fecha_inicio_std": "2025-08-01T00:00:00",
            "fecha_fin_std": "2025-12-15T00:00:00",
            "frente_activo": "Inactivo",
            "fuera_rango": null
          }
        ],
        "presupuesto_base": 998053893,
        "avance_obra": 82.72
      }
    },
    {
      "type": "Feature",
      "geometry": null,
      "properties": {
        "upid": "UNP-89",
        "n_intervenciones": 2,
        "nombre_up": "Avenida las Américas",
        "nombre_up_detalle": "Mantenimiento de Escudos sobre la Avenida.",
        "nombre_centro_gestor": "Unidad Administrativa Especial de Gestión de Bienes y Servicios",
        "direccion": "Av. de las Americas #17 Norte-58 a 17 Norte-98",
        "tipo_equipamiento": "Fuentes y monumentos",
        "clase_up": "Obras de Arte (civil)",
        "comuna_corregimiento": "COMUNA 03",
        "comuna_corregimiento_2": null,
        "barrio_vereda": "El Piloto",
        "barrio_vereda_2": null,
        "identificador": "Mantenimiento de Banderas",
        "bpin": 0,
        "lat": null,
        "lon": null,
        "intervenciones": [
          {
            "intervencion_id": "UNP-89-01",
            "referencia_proceso": "4181.010.26.1.434-2024",
            "referencia_contrato": "4181.010.26.1.434-2024",
            "url_proceso": "https://community.secop.gov.co/Public/Tendering/OpportunityDetail/Index?noticeUID=CO1.NTC.6853262&isFromPublicArea=True&isModal=False",
            "bpin": 0,
            "estado": "Terminado",
            "tipo_intervencion": "Mantenimiento",
            "fuente_financiacion": "Ingresos libre destinación",
            "presupuesto_base": 19635000,
            "ano": 2024,
            "avance_obra": 100.0,
            "fecha_inicio": "30/09/2024",
            "fecha_fin": "25/10/2024",
            "fecha_inicio_std": "2024-09-30T00:00:00",
            "fecha_fin_std": "2024-10-25T00:00:00",
            "frente_activo": "No aplica",
            "fuera_rango": null
          },
          {
            "intervencion_id": "UNP-89-02",
            "referencia_proceso": "4181.010.26.1.539-2024",
            "referencia_contrato": "4181.010.26.1.539-2024",
            "url_proceso": "https://community.secop.gov.co/Public/Tendering/OpportunityDetail/Index?noticeUID=CO1.NTC.6476969&isFromPublicArea=True&isModal=False",
            "bpin": 0,
            "estado": "Terminado",
            "tipo_intervencion": "Mantenimiento",
            "fuente_financiacion": "Ingresos libre destinación",
            "presupuesto_base": 29200000,
            "ano": 2024,
            "avance_obra": 100.0,
            "fecha_inicio": "08/10/2024",
            "fecha_fin": "30/10/2024",
            "fecha_inicio_std": "2024-10-08T00:00:00",
            "fecha_fin_std": "2024-10-30T00:00:00",
            "frente_activo": "No aplica",
            "fuera_rango": null
          }
        ],
        "presupuesto_base": 48835000,
        "avance_obra": 100.0
      }
    },
    {
      "type": "Feature",
      "geometry": null,
      "properties": {
        "upid": "UNP-90",
        "n_intervenciones": 1,
        "nombre_up": "Parque San Antonio",
        "nombre_up_detalle": "Mantenimiento de Banderas",
        "nombre_centro_gestor": "Unidad Administrativa Especial de Gestión de Bienes y Servicios",
        "direccion": "Carrera 10, Esquina Calle 1 Oeste",
        "tipo_equipamiento": "Fuentes y monumentos",
        "clase_up": "Obras de Arte (civil)",
        "comuna_corregimiento": "COMUNA 03",
        "comuna_corregimiento_2": null,
        "barrio_vereda": "San Antonio",
        "barrio_vereda_2": null,
        "identificador": "Mantenimiento de Banderas",
        "bpin": 0,
        "lat": null,
        "lon": null,
        "intervenciones": [
          {
            "intervencion_id": "UNP-90-01",
            "referencia_proceso": "4181.010.26.1.434-2024",
            "referencia_contrato": "4181.010.26.1.434-2024",
            "url_proceso": "https://community.secop.gov.co/Public/Tendering/OpportunityDetail/Index?noticeUID=CO1.NTC.6853262&isFromPublicArea=True&isModal=False",
            "bpin": 0,
            "estado": "Terminado",
            "tipo_intervencion": "Mantenimiento",
            "fuente_financiacion": "Ingresos libre destinación",
            "presupuesto_base": 1713600,
            "ano": 2024,
            "avance_obra": 100.0,
            "fecha_inicio": "30/09/2024",
            "fecha_fin": "25/10/2024",
            "fecha_inicio_std": "2024-09-30T00:00:00",
            "fecha_fin_std": "2024-10-25T00:00:00",
            "frente_activo": "No aplica",
            "fuera_rango": null
          }
        ],
        "presupuesto_base": 1713600,
        "avance_obra": 100.0
      }
    },
    {
      "type": "Feature",
      "geometry": null,
      "properties": {
        "upid": "UNP-91",
        "n_intervenciones": 1,
        "nombre_up": "Glorieta Seguro Social",
        "nombre_up_detalle": "Mantenimiento de Banderas de la Glorieta",
        "nombre_centro_gestor": "Unidad Administrativa Especial de Gestión de Bienes y Servicios",
        "direccion": "Av. 3 Bis Norte #23 Cn-37",
        "tipo_equipamiento": "Fuentes y monumentos",
        "clase_up": "Obras de Arte (civil)",
        "comuna_corregimiento": "COMUNA 02",
        "comuna_corregimiento_2": null,
        "barrio_vereda": "Barrio San Vicente",
        "barrio_vereda_2": null,
        "identificador": "Mantenimiento de Banderas",
        "bpin": 0,
        "lat": null,
        "lon": null,
        "intervenciones": [
          {
            "intervencion_id": "UNP-91-01",
            "referencia_proceso": "4181.010.26.1.434-2024",
            "referencia_contrato": "4181.010.26.1.434-2024",
            "url_proceso": "https://community.secop.gov.co/Public/Tendering/OpportunityDetail/Index?noticeUID=CO1.NTC.6853262&isFromPublicArea=True&isModal=False",
            "bpin": 0,
            "estado": "Terminado",
            "tipo_intervencion": "Mantenimiento",
            "fuente_financiacion": "Ingresos libre destinación",
            "presupuesto_base": 16731400,
            "ano": 2024,
            "avance_obra": 100.0,
            "fecha_inicio": "30/09/2024",
            "fecha_fin": "25/10/2024",
            "fecha_inicio_std": "2024-09-30T00:00:00",
            "fecha_fin_std": "2024-10-25T00:00:00",
            "frente_activo": "No aplica",
            "fuera_rango": null
          }
        ],
        "presupuesto_base": 16731400,
        "avance_obra": 100.0
      }
    },
    {
      "type": "Feature",
      "geometry": null,
      "properties": {
        "upid": "UNP-92",
        "n_intervenciones": 1,
        "nombre_up": "Plaza de Mercado el Porvenir",
        "nombre_up_detalle": "Ampliación de Red Sanitaria, Modernización de Red Eléctica y Uar.",
        "nombre_centro_gestor": "Unidad Administrativa Especial de Gestión de Bienes y Servicios",
        "direccion": "Carrera 5 # 31a-20",
        "tipo_equipamiento": "Fuentes y monumentos",
        "clase_up": "Obras equipamientos",
        "comuna_corregimiento": "COMUNA 04",
        "comuna_corregimiento_2": null,
        "barrio_vereda": "El Porvenir",
        "barrio_vereda_2": null,
        "identificador": "Mantenimiento Y/o Adecuación de las Plazas de Mercado Propiedad del Distrito Santiago",
        "bpin": 0,
        "lat": null,
        "lon": null,
        "intervenciones": [
          {
            "intervencion_id": "UNP-92-01",
            "referencia_proceso": "4186.010.26.1.355-2025",
            "referencia_contrato": "4186.010.26.1.355-2025",
            "url_proceso": "https://community.secop.gov.co/Public/Tendering/OpportunityDetail/Index?noticeUID=CO1.NTC.7893003&isFromPublicArea=True&isModal=False",
            "bpin": 0,
            "estado": "Terminado",
            "tipo_intervencion": "Mantenimiento",
            "fuente_financiacion": "Ingresos libre destinación",
            "presupuesto_base": 173467031,
            "ano": 2025,
            "avance_obra": 100.0,
            "fecha_inicio": "27/06/2025",
            "fecha_fin": "10/12/2025",
            "fecha_inicio_std": "2025-06-27T00:00:00",
            "fecha_fin_std": "2025-12-10T00:00:00",
            "frente_activo": "No aplica",
            "fuera_rango": null
          }
        ],
        "presupuesto_base": 173467031,
        "avance_obra": 100.0
      }
    },
    {
      "type": "Feature",
      "geometry": null,
      "properties": {
        "upid": "UNP-93",
        "n_intervenciones": 2,
        "nombre_up": "Autopista Cali - Palmira",
        "nombre_up_detalle": "Mantenimiento de Bandera",
        "nombre_centro_gestor": "Unidad Administrativa Especial de Gestión de Bienes y Servicios",
        "direccion": "Autopista Cali - Jamundí Km 25",
        "tipo_equipamiento": "Fuentes y monumentos",
        "clase_up": "Obras de Arte (civil)",
        "comuna_corregimiento": "COMUNA 06",
        "comuna_corregimiento_2": null,
        "barrio_vereda": "Zona rural de Cali",
        "barrio_vereda_2": null,
        "identificador": "Mantenimiento de Banderas",
        "bpin": 0,
        "lat": null,
        "lon": null,
        "intervenciones": [
          {
            "intervencion_id": "UNP-93-01",
            "referencia_proceso": "4181.010.26.1.434-2024",
            "referencia_contrato": "4181.010.26.1.434-2024",
            "url_proceso": "https://community.secop.gov.co/Public/Tendering/OpportunityDetail/Index?noticeUID=CO1.NTC.6853262&isFromPublicArea=True&isModal=False",
            "bpin": 0,
            "estado": "Terminado",
            "tipo_intervencion": "Mantenimiento",
            "fuente_financiacion": "Ingresos libre destinación",
            "presupuesto_base": 1547000,
            "ano": 2024,
            "avance_obra": 100.0,
            "fecha_inicio": "30/09/2024",
            "fecha_fin": "25/10/2024",
            "fecha_inicio_std": "2024-09-30T00:00:00",
            "fecha_fin_std": "2024-10-25T00:00:00",
            "frente_activo": "No aplica",
            "fuera_rango": null
          },
          {
            "intervencion_id": "UNP-93-02",
            "referencia_proceso": "4181.010.26.1.434-2024",
            "referencia_contrato": "4181.010.26.1.434-2024",
            "url_proceso": "https://community.secop.gov.co/Public/Tendering/OpportunityDetail/Index?noticeUID=CO1.NTC.6853262&isFromPublicArea=True&isModal=False",
            "bpin": 0,
            "estado": "Terminado",
            "tipo_intervencion": "Mantenimiento",
            "fuente_financiacion": "Ingresos libre destinación",
            "presupuesto_base": 1547000,
            "ano": 2024,
            "avance_obra": 100.0,
            "fecha_inicio": "30/09/2024",
            "fecha_fin": "25/10/2024",
            "fecha_inicio_std": "2024-09-30T00:00:00",
            "fecha_fin_std": "2024-10-25T00:00:00",
            "frente_activo": "No aplica",
            "fuera_rango": null
          }
        ],
        "presupuesto_base": 3094000,
        "avance_obra": 100.0
      }
    },
    {
      "type": "Feature",
      "geometry": null,
      "properties": {
        "upid": "UNP-94",
        "n_intervenciones": 1,
        "nombre_up": "Plaza de Mercado Alfonso López",
        "nombre_up_detalle": "Mantenimiento Pabellón Número Uno y Reparación de Baños",
        "nombre_centro_gestor": "Unidad Administrativa Especial de Gestión de Bienes y Servicios",
        "direccion": "Carrera 8 #78 – 81",
        "tipo_equipamiento": "Fuentes y monumentos",
        "clase_up": "Obras de Arte (civil)",
        "comuna_corregimiento": "COMUNA 07",
        "comuna_corregimiento_2": null,
        "barrio_vereda": "Alfonso López",
        "barrio_vereda_2": null,
        "identificador": "Mantenimiento Y/o Adecuación de las Plazas de Mercado Propiedad del Distrito Santiago",
        "bpin": 0,
        "lat": null,
        "lon": null,
        "intervenciones": [
          {
            "intervencion_id": "UNP-94-01",
            "referencia_proceso": "4186.010.26.1.355-2025",
            "referencia_contrato": "4186.010.26.1.355-2025",
            "url_proceso": "https://community.secop.gov.co/Public/Tendering/OpportunityDetail/Index?noticeUID=CO1.NTC.7893003&isFromPublicArea=True&isModal=False",
            "bpin": 0,
            "estado": "Terminado",
            "tipo_intervencion": "Mantenimiento",
            "fuente_financiacion": "Ingresos libre destinación",
            "presupuesto_base": 805991760,
            "ano": 2025,
            "avance_obra": 100.0,
            "fecha_inicio": "27/06/2025",
            "fecha_fin": "10/12/2025",
            "fecha_inicio_std": "2025-06-27T00:00:00",
            "fecha_fin_std": "2025-12-10T00:00:00",
            "frente_activo": "No aplica",
            "fuera_rango": null
          }
        ],
        "presupuesto_base": 805991760,
        "avance_obra": 100.0
      }
    },
    {
      "type": "Feature",
      "geometry": null,
      "properties": {
        "upid": "UNP-95",
        "n_intervenciones": 1,
        "nombre_up": "Parque Panamericano (parque de las Banderas)",
        "nombre_up_detalle": "Mantenimiento de Banderas",
        "nombre_centro_gestor": "Unidad Administrativa Especial de Gestión de Bienes y Servicios",
        "direccion": "Calle 5 entre Carreras 34 y 36",
        "tipo_equipamiento": "Fuentes y monumentos",
        "clase_up": "Obras de Arte (civil)",
        "comuna_corregimiento": "COMUNA 10",
        "comuna_corregimiento_2": null,
        "barrio_vereda": "San Fernando",
        "barrio_vereda_2": null,
        "identificador": "Mantenimiento de Banderas",
        "bpin": 0,
        "lat": null,
        "lon": null,
        "intervenciones": [
          {
            "intervencion_id": "UNP-95-01",
            "referencia_proceso": "4181.010.26.1.434-2024",
            "referencia_contrato": "4181.010.26.1.434-2024",
            "url_proceso": "https://community.secop.gov.co/Public/Tendering/OpportunityDetail/Index?noticeUID=CO1.NTC.6853262&isFromPublicArea=True&isModal=False",
            "bpin": 0,
            "estado": "Terminado",
            "tipo_intervencion": "Mantenimiento",
            "fuente_financiacion": "Ingresos libre destinación",
            "presupuesto_base": 18540200,
            "ano": 2024,
            "avance_obra": 100.0,
            "fecha_inicio": "30/09/2024",
            "fecha_fin": "25/10/2024",
            "fecha_inicio_std": "2024-09-30T00:00:00",
            "fecha_fin_std": "2024-10-25T00:00:00",
            "frente_activo": "No aplica",
            "fuera_rango": null
          }
        ],
        "presupuesto_base": 18540200,
        "avance_obra": 100.0
      }
    },
    {
      "type": "Feature",
      "geometry": null,
      "properties": {
        "upid": "UNP-96",
        "n_intervenciones": 1,
        "nombre_up": "Bodega",
        "nombre_up_detalle": "Mantenimiento de Cubierta, Redes Eléctricas y Sanitarias",
        "nombre_centro_gestor": "Unidad Administrativa Especial de Gestión de Bienes y Servicios",
        "direccion": "Carrera 28e # 34c - 39",
        "tipo_equipamiento": "Adecuaciones y Mantenimientos",
        "clase_up": "Obras de Arte (civil)",
        "comuna_corregimiento": "COMUNA 12",
        "comuna_corregimiento_2": null,
        "barrio_vereda": "Eduardo Santos",
        "barrio_vereda_2": null,
        "identificador": "Bodega Institucional",
        "bpin": 0,
        "lat": null,
        "lon": null,
        "intervenciones": [
          {
            "intervencion_id": "UNP-96-01",
            "referencia_proceso": "4181.010.26.1.711-2025",
            "referencia_contrato": "4181.010.26.1.711-2025",
            "url_proceso": "https://community.secop.gov.co/Public/Tendering/OpportunityDetail/Index?noticeUID=CO1.NTC.8708346&isFromPublicArea=True&isModal=False",
            "bpin": 0,
            "estado": "Terminado",
            "tipo_intervencion": "Mantenimiento",
            "fuente_financiacion": "Ingresos libre destinación",
            "presupuesto_base": 473365855,
            "ano": 2025,
            "avance_obra": 100.0,
            "fecha_inicio": "25/09/2025",
            "fecha_fin": "30/11/2025",
            "fecha_inicio_std": "2025-09-25T00:00:00",
            "fecha_fin_std": "2025-11-30T00:00:00",
            "frente_activo": "No aplica",
            "fuera_rango": null
          }
        ],
        "presupuesto_base": 473365855,
        "avance_obra": 100.0
      }
    },
    {
      "type": "Feature",
      "geometry": null,
      "properties": {
        "upid": "UNP-97",
        "n_intervenciones": 1,
        "nombre_up": "Coliseo del Pueblo",
        "nombre_up_detalle": "Mantenimiento de Banderas",
        "nombre_centro_gestor": "Unidad Administrativa Especial de Gestión de Bienes y Servicios",
        "direccion": "Cra. 53 #1ª 50",
        "tipo_equipamiento": "Fuentes y monumentos",
        "clase_up": "Obras de Arte (civil)",
        "comuna_corregimiento": "COMUNA 19",
        "comuna_corregimiento_2": null,
        "barrio_vereda": "Cuarto de legua",
        "barrio_vereda_2": null,
        "identificador": "Mantenimiento de Banderas",
        "bpin": 0,
        "lat": null,
        "lon": null,
        "intervenciones": [
          {
            "intervencion_id": "UNP-97-01",
            "referencia_proceso": "4181.010.26.1.434-2024",
            "referencia_contrato": "4181.010.26.1.434-2024",
            "url_proceso": "https://community.secop.gov.co/Public/Tendering/OpportunityDetail/Index?noticeUID=CO1.NTC.6853262&isFromPublicArea=True&isModal=False",
            "bpin": 0,
            "estado": "Terminado",
            "tipo_intervencion": "Mantenimiento",
            "fuente_financiacion": "Ingresos libre destinación",
            "presupuesto_base": 1356600,
            "ano": 2024,
            "avance_obra": 100.0,
            "fecha_inicio": "30/09/2024",
            "fecha_fin": "25/10/2024",
            "fecha_inicio_std": "2024-09-30T00:00:00",
            "fecha_fin_std": "2024-10-25T00:00:00",
            "frente_activo": "No aplica",
            "fuera_rango": null
          }
        ],
        "presupuesto_base": 1356600,
        "avance_obra": 100.0
      }
    },
    {
      "type": "Feature",
      "geometry": null,
      "properties": {
        "upid": "UNP-98",
        "n_intervenciones": 1,
        "nombre_up": "Siloé",
        "nombre_up_detalle": "Mantenimiento de Bandera",
        "nombre_centro_gestor": "Unidad Administrativa Especial de Gestión de Bienes y Servicios",
        "direccion": "Calle 6h Oeste # 49a-79",
        "tipo_equipamiento": "Fuentes y monumentos",
        "clase_up": "Obras de Arte (civil)",
        "comuna_corregimiento": "COMUNA 20",
        "comuna_corregimiento_2": null,
        "barrio_vereda": "Zona rural de Cali",
        "barrio_vereda_2": null,
        "identificador": "Mantenimiento de Banderas",
        "bpin": 0,
        "lat": null,
        "lon": null,
        "intervenciones": [
          {
            "intervencion_id": "UNP-98-01",
            "referencia_proceso": "4181.010.26.1.434-2024",
            "referencia_contrato": "4181.010.26.1.434-2024",
            "url_proceso": "https://community.secop.gov.co/Public/Tendering/OpportunityDetail/Index?noticeUID=CO1.NTC.6853262&isFromPublicArea=True&isModal=False",
            "bpin": 0,
            "estado": "Terminado",
            "tipo_intervencion": "Mantenimiento",
            "fuente_financiacion": "Ingresos libre destinación",
            "presupuesto_base": 1547000,
            "ano": 2024,
            "avance_obra": 100.0,
            "fecha_inicio": "30/09/2024",
            "fecha_fin": "25/10/2024",
            "fecha_inicio_std": "2024-09-30T00:00:00",
            "fecha_fin_std": "2024-10-25T00:00:00",
            "frente_activo": "No aplica",
            "fuera_rango": null
          }
        ],
        "presupuesto_base": 1547000,
        "avance_obra": 100.0
      }
    },
    {
      "type": "Feature",
      "geometry": null,
      "properties": {
        "upid": "UNP-99",
        "n_intervenciones": 6,
        "nombre_up": "Parque Puerto Mallarino",
        "nombre_up_detalle": "• Intervención en Obra Civil • Implementación del Componente Ambiental. • Amoblamiento • Limpieza Final • Adecuación Paisajística • Estrategia Educativa",
        "nombre_centro_gestor": "Departamento Administrativo de Gestión del Medio Ambiente",
        "direccion": "Avenida 6a Oeste entre Calle 17 y 18",
        "tipo_equipamiento": "Parques y zonas verdes",
        "clase_up": "Espacio Público",
        "comuna_corregimiento": "COMUNA 01",
        "comuna_corregimiento_2": null,
        "barrio_vereda": "Puerto Mallarino",
        "barrio_vereda_2": null,
        "identificador": "Parque",
        "bpin": 2024760010307,
        "lat": null,
        "lon": null,
        "intervenciones": [
          {
            "intervencion_id": "UNP-99-01",
            "referencia_proceso": "4133.010.32.1.1601-2025",
            "referencia_contrato": "4133.010.27.1.021-2025",
            "url_proceso": "https://community.secop.gov.co/Public/Tendering/OpportunityDetail/Index?noticeUID=CO1.NTC.8535730&isFromPublicArea=True&isModal=False",
            "bpin": 2024760010307,
            "estado": "Suspendido",
            "tipo_intervencion": "Adecuaciones",
            "fuente_financiacion": "Ingresos libre destinación",
            "presupuesto_base": 231246388,
            "ano": 2025,
            "avance_obra": 0.0,
            "fecha_inicio": "2025-08-01T00:00:00",
            "fecha_fin": "2025-12-15T00:00:00",
            "fecha_inicio_std": "2025-08-01T00:00:00",
            "fecha_fin_std": "2025-12-15T00:00:00",
            "frente_activo": "Inactivo",
            "fuera_rango": null
          },
          {
            "intervencion_id": "UNP-99-02",
            "referencia_proceso": "4133.010.32.1.1651-2026",
            "referencia_contrato": "4133.010.27.1.035-2026",
            "url_proceso": "https://community.secop.gov.co/Public/Tendering/OpportunityDetail/Index?noticeUID=CO1.NTC.8535730&isFromPublicArea=True&isModal=False",
            "bpin": 2024760010125,
            "estado": "Suspendido",
            "tipo_intervencion": "Mantenimiento",
            "fuente_financiacion": "Ingresos libre destinación",
            "presupuesto_base": 77823158,
            "ano": 2025,
            "avance_obra": 0.0,
            "fecha_inicio": "2025-08-01T00:00:00",
            "fecha_fin": "2025-12-15T00:00:00",
            "fecha_inicio_std": "2025-08-01T00:00:00",
            "fecha_fin_std": "2025-12-15T00:00:00",
            "frente_activo": "No aplica",
            "fuera_rango": null
          },
          {
            "intervencion_id": "UNP-99-03",
            "referencia_proceso": "4133.010.32.1.1651-2027",
            "referencia_contrato": "4133.010.27.1.035-2027",
            "url_proceso": "https://community.secop.gov.co/Public/Tendering/OpportunityDetail/Index?noticeUID=CO1.NTC.8535730&isFromPublicArea=True&isModal=False",
            "bpin": 2024760010125,
            "estado": "Suspendido",
            "tipo_intervencion": "Mantenimiento",
            "fuente_financiacion": "Ingresos libre destinación",
            "presupuesto_base": 77823158,
            "ano": 2025,
            "avance_obra": 0.0,
            "fecha_inicio": "2025-08-01T00:00:00",
            "fecha_fin": "2025-12-15T00:00:00",
            "fecha_inicio_std": "2025-08-01T00:00:00",
            "fecha_fin_std": "2025-12-15T00:00:00",
            "frente_activo": "No aplica",
            "fuera_rango": null
          },
          {
            "intervencion_id": "UNP-99-04",
            "referencia_proceso": "4133.010.32.1.1651-2032",
            "referencia_contrato": "4133.010.27.1.035-2032",
            "url_proceso": "https://community.secop.gov.co/Public/Tendering/OpportunityDetail/Index?noticeUID=CO1.NTC.8535730&isFromPublicArea=True&isModal=False",
            "bpin": 2024760010125,
            "estado": "Suspendido",
            "tipo_intervencion": "Adecuaciones",
            "fuente_financiacion": "Ingresos libre destinación",
            "presupuesto_base": 77823158,
            "ano": 2025,
            "avance_obra": 0.0,
            "fecha_inicio": "2025-08-01T00:00:00",
            "fecha_fin": "2025-12-15T00:00:00",
            "fecha_inicio_std": "2025-08-01T00:00:00",
            "fecha_fin_std": "2025-12-15T00:00:00",
            "frente_activo": "Inactivo",
            "fuera_rango": null
          },
          {
            "intervencion_id": "UNP-99-05",
            "referencia_proceso": "4133.010.32.1.1651-2034",
            "referencia_contrato": "4133.010.27.1.035-2034",
            "url_proceso": "https://community.secop.gov.co/Public/Tendering/OpportunityDetail/Index?noticeUID=CO1.NTC.8535730&isFromPublicArea=True&isModal=False",
            "bpin": 2024760010125,
            "estado": "Suspendido",
            "tipo_intervencion": "Adecuaciones",
            "fuente_financiacion": "Ingresos libre destinación",
            "presupuesto_base": 77823158,
            "ano": 2025,
            "avance_obra": 0.0,
            "fecha_inicio": "2025-08-01T00:00:00",
            "fecha_fin": "2025-12-15T00:00:00",
            "fecha_inicio_std": "2025-08-01T00:00:00",
            "fecha_fin_std": "2025-12-15T00:00:00",
            "frente_activo": "Inactivo",
            "fuera_rango": null
          },
          {
            "intervencion_id": "UNP-99-06",
            "referencia_proceso": "4133.010.32.1.1651-2038",
            "referencia_contrato": "4133.010.27.1.035-2038",
            "url_proceso": "https://community.secop.gov.co/Public/Tendering/OpportunityDetail/Index?noticeUID=CO1.NTC.8535730&isFromPublicArea=True&isModal=False",
            "bpin": 2024760010125,
            "estado": "Suspendido",
            "tipo_intervencion": "Adecuaciones",
            "fuente_financiacion": "Ingresos libre destinación",
            "presupuesto_base": 77823158,
            "ano": 2025,
            "avance_obra": 0.0,
            "fecha_inicio": "2025-08-01T00:00:00",
            "fecha_fin": "2025-12-15T00:00:00",
            "fecha_inicio_std": "2025-08-01T00:00:00",
            "fecha_fin_std": "2025-12-15T00:00:00",
            "frente_activo": "Inactivo",
            "fuera_rango": null
          }
        ],
        "presupuesto_base": 620362178,
        "avance_obra": 0.0
      }
    },
    {
      "type": "Feature",
      "geometry": null,
      "properties": {
        "upid": "UNP-100",
        "n_intervenciones": 1,
        "nombre_up": "Cerro de la Bandera",
        "nombre_up_detalle": "Mantenimiento de Bandera",
        "nombre_centro_gestor": "Unidad Administrativa Especial de Gestión de Bienes y Servicios",
        "direccion": "Cra. 56, Guadalupe",
        "tipo_equipamiento": "Fuentes y monumentos",
        "clase_up": "Obras de Arte (civil)",
        "comuna_corregimiento": "COMUNA 19",
        "comuna_corregimiento_2": null,
        "barrio_vereda": "Zona rural de Cali",
        "barrio_vereda_2": null,
        "identificador": "Mantenimiento de Banderas",
        "bpin": 0,
        "lat": null,
        "lon": null,
        "intervenciones": [
          {
            "intervencion_id": "UNP-100-01",
            "referencia_proceso": "4181.010.26.1.434-2024",
            "referencia_contrato": "4181.010.26.1.434-2024",
            "url_proceso": "https://community.secop.gov.co/Public/Tendering/OpportunityDetail/Index?noticeUID=CO1.NTC.6853262&isFromPublicArea=True&isModal=False",
            "bpin": 0,
            "estado": "Terminado",
            "tipo_intervencion": "Mantenimiento",
            "fuente_financiacion": "Ingresos libre destinación",
            "presupuesto_base": 1249500,
            "ano": 2024,
            "avance_obra": 100.0,
            "fecha_inicio": "30/09/2024",
            "fecha_fin": "25/10/2024",
            "fecha_inicio_std": "2024-09-30T00:00:00",
            "fecha_fin_std": "2024-10-25T00:00:00",
            "frente_activo": "No aplica",
            "fuera_rango": null
          }
        ],
        "presupuesto_base": 1249500,
        "avance_obra": 100.0
      }
    },
    {
      "type": "Feature",
      "geometry": null,
      "properties": {
        "upid": "UNP-101",
        "n_intervenciones": 1,
        "nombre_up": "Monumento a la Solidaridad",
        "nombre_up_detalle": "Mantenimiento de Bandera",
        "nombre_centro_gestor": "Unidad Administrativa Especial de Gestión de Bienes y Servicios",
        "direccion": "Avenida 3 Calle 34 Nte. #4-44",
        "tipo_equipamiento": "Fuentes y monumentos",
        "clase_up": "Obras de Arte (civil)",
        "comuna_corregimiento": "COMUNA 02",
        "comuna_corregimiento_2": null,
        "barrio_vereda": "Prados del Norte",
        "barrio_vereda_2": null,
        "identificador": "Mantenimiento de Banderas",
        "bpin": 0,
        "lat": null,
        "lon": null,
        "intervenciones": [
          {
            "intervencion_id": "UNP-101-01",
            "referencia_proceso": "4181.010.26.1.434-2024",
            "referencia_contrato": "4181.010.26.1.434-2024",
            "url_proceso": "https://community.secop.gov.co/Public/Tendering/OpportunityDetail/Index?noticeUID=CO1.NTC.6853262&isFromPublicArea=True&isModal=False",
            "bpin": 0,
            "estado": "Terminado",
            "tipo_intervencion": "Mantenimiento",
            "fuente_financiacion": "Ingresos libre destinación",
            "presupuesto_base": 1808800,
            "ano": 2024,
            "avance_obra": 100.0,
            "fecha_inicio": "30/09/2024",
            "fecha_fin": "25/10/2024",
            "fecha_inicio_std": "2024-09-30T00:00:00",
            "fecha_fin_std": "2024-10-25T00:00:00",
            "frente_activo": "No aplica",
            "fuera_rango": null
          }
        ],
        "presupuesto_base": 1808800,
        "avance_obra": 100.0
      }
    },
    {
      "type": "Feature",
      "geometry": null,
      "properties": {
        "upid": "UNP-102",
        "n_intervenciones": 1,
        "nombre_up": "Galería la Floresta",
        "nombre_up_detalle": "Adecuaciones Locativas en Redes Hidrosanitarias, Pisos y Uar",
        "nombre_centro_gestor": "Unidad Administrativa Especial de Gestión de Bienes y Servicios",
        "direccion": "Calle 33a #31-2",
        "tipo_equipamiento": "Fuentes y monumentos",
        "clase_up": "Obras equipamientos",
        "comuna_corregimiento": "COMUNA 08",
        "comuna_corregimiento_2": null,
        "barrio_vereda": "La Floresta",
        "barrio_vereda_2": null,
        "identificador": "Mantenimiento Y/o Adecuación de las Plazas de Mercado Propiedad del Distrito Santiago",
        "bpin": 0,
        "lat": null,
        "lon": null,
        "intervenciones": [
          {
            "intervencion_id": "UNP-102-01",
            "referencia_proceso": "4181.010.26.1.883-2025",
            "referencia_contrato": "4181.010.26.1.883-2025",
            "url_proceso": "https://community.secop.gov.co/Public/Tendering/OpportunityDetail/Index?noticeUID=CO1.NTC.8789680&isFromPublicArea=True&isModal=False",
            "bpin": 0,
            "estado": "Suspendido",
            "tipo_intervencion": "Adecuaciones",
            "fuente_financiacion": "Ingresos libre destinación",
            "presupuesto_base": 546381462,
            "ano": 2025,
            "avance_obra": 9.0,
            "fecha_inicio": "2025-10-29T00:00:00",
            "fecha_fin": "2025-12-15T00:00:00",
            "fecha_inicio_std": "2025-10-29T00:00:00",
            "fecha_fin_std": "2025-12-15T00:00:00",
            "frente_activo": "Inactivo",
            "fuera_rango": null
          }
        ],
        "presupuesto_base": 546381462,
        "avance_obra": 9.0
      }
    },
    {
      "type": "Feature",
      "geometry": null,
      "properties": {
        "upid": "UNP-103",
        "n_intervenciones": 22,
        "nombre_up": "Teatro Municipal Enrique Buenaventura",
        "nombre_up_detalle": "Sede Principal",
        "nombre_centro_gestor": "Secretaría de Cultura",
        "direccion": "Carrera 5 No. 6-05",
        "tipo_equipamiento": "Infraestructura cultural",
        "clase_up": "Obras equipamientos",
        "comuna_corregimiento": "COMUNA 03",
        "comuna_corregimiento_2": null,
        "barrio_vereda": "La Merced",
        "barrio_vereda_2": null,
        "identificador": "Mantenimiento Teatro Municipal Enrique Buenaventura",
        "bpin": 2024760010224,
        "lat": null,
        "lon": null,
        "intervenciones": [
          {
            "intervencion_id": "UNP-103-01",
            "referencia_proceso": "4148.010.32.1.0860-2024",
            "referencia_contrato": "4148.010.26.1.0869-2024",
            "url_proceso": "https://community.secop.gov.co/Public/Tendering/OpportunityDetail/Index?noticeUID=CO1.NTC.6213413&isFromPublicArea=True&isModal=False",
            "bpin": 2024760010224,
            "estado": "Terminado",
            "tipo_intervencion": "Mantenimiento",
            "fuente_financiacion": "Ingresos libre destinación",
            "presupuesto_base": 82446108,
            "ano": 2024,
            "avance_obra": 100.0,
            "fecha_inicio": "04-07-2024",
            "fecha_fin": "14-09-2024",
            "fecha_inicio_std": "2024-07-04T00:00:00",
            "fecha_fin_std": "2024-09-14T00:00:00",
            "frente_activo": "No aplica",
            "fuera_rango": null
          },
          {
            "intervencion_id": "UNP-103-02",
            "referencia_proceso": "4148.010.32.1.0867-2024",
            "referencia_contrato": "4148.010.26.1.0905-2024",
            "url_proceso": "https://community.secop.gov.co/Public/Tendering/OpportunityDetail/Index?noticeUID=CO1.NTC.6403254&isFromPublicArea=True&isModal=False",
            "bpin": 2020760010788,
            "estado": "Terminado",
            "tipo_intervencion": "Mantenimiento",
            "fuente_financiacion": "Ingresos libre destinación",
            "presupuesto_base": 48739253,
            "ano": 2024,
            "avance_obra": 100.0,
            "fecha_inicio": "13-09-2024",
            "fecha_fin": "15-12-2024",
            "fecha_inicio_std": "2024-09-13T00:00:00",
            "fecha_fin_std": "2024-12-15T00:00:00",
            "frente_activo": "No aplica",
            "fuera_rango": null
          },
          {
            "intervencion_id": "UNP-103-03",
            "referencia_proceso": "4148.010.32.1.0867-2024",
            "referencia_contrato": "4148.010.26.1.0905-2024",
            "url_proceso": "https://community.secop.gov.co/Public/Tendering/OpportunityDetail/Index?noticeUID=CO1.NTC.6403254&isFromPublicArea=True&isModal=False",
            "bpin": 2020760010788,
            "estado": "Terminado",
            "tipo_intervencion": "Mantenimiento",
            "fuente_financiacion": "Ingresos libre destinación",
            "presupuesto_base": 38127582,
            "ano": 2024,
            "avance_obra": 100.0,
            "fecha_inicio": "13-09-2024",
            "fecha_fin": "15-12-2024",
            "fecha_inicio_std": "2024-09-13T00:00:00",
            "fecha_fin_std": "2024-12-15T00:00:00",
            "frente_activo": "No aplica",
            "fuera_rango": null
          },
          {
            "intervencion_id": "UNP-103-04",
            "referencia_proceso": "4148.010.32.1.0398-2024",
            "referencia_contrato": "4148.010.26.1.0394-2024",
            "url_proceso": "https://community.secop.gov.co/Public/Tendering/OpportunityDetail/Index?noticeUID=CO1.NTC.5891498&isFromPublicArea=True&isModal=False",
            "bpin": 2020760010771,
            "estado": "Terminado",
            "tipo_intervencion": "Mantenimiento",
            "fuente_financiacion": "Ingresos libre destinación",
            "presupuesto_base": 39667257,
            "ano": 2024,
            "avance_obra": 100.0,
            "fecha_inicio": "06-06-2024",
            "fecha_fin": "31-12-2024",
            "fecha_inicio_std": "2024-06-06T00:00:00",
            "fecha_fin_std": "2024-12-31T00:00:00",
            "frente_activo": "No aplica",
            "fuera_rango": null
          },
          {
            "intervencion_id": "UNP-103-05",
            "referencia_proceso": "4148.010.32.1.1077-2024",
            "referencia_contrato": "4148.010.26.1.0995-2024",
            "url_proceso": "https://community.secop.gov.co/Public/Tendering/OpportunityDetail/Index?noticeUID=CO1.NTC.6982248&isFromPublicArea=True&isModal=False",
            "bpin": 2020760010771,
            "estado": "Terminado",
            "tipo_intervencion": "Mantenimiento",
            "fuente_financiacion": "Ingresos libre destinación",
            "presupuesto_base": 47150112,
            "ano": 2024,
            "avance_obra": 100.0,
            "fecha_inicio": "25-11-2024",
            "fecha_fin": "15-12-2024",
            "fecha_inicio_std": "2024-11-25T00:00:00",
            "fecha_fin_std": "2024-12-15T00:00:00",
            "frente_activo": "No aplica",
            "fuera_rango": null
          },
          {
            "intervencion_id": "UNP-103-06",
            "referencia_proceso": "4148.010.32.1.0911-2024",
            "referencia_contrato": "4148.010.26.1.0901-2024",
            "url_proceso": "https://community.secop.gov.co/Public/Tendering/OpportunityDetail/Index?noticeUID=CO1.NTC.6330536&isFromPublicArea=True&isModal=False",
            "bpin": 2024760010224,
            "estado": "Terminado",
            "tipo_intervencion": "Mantenimiento",
            "fuente_financiacion": "Ingresos libre destinación",
            "presupuesto_base": 55040907,
            "ano": 2024,
            "avance_obra": 100.0,
            "fecha_inicio": "06-09-2024",
            "fecha_fin": "09-10-2024",
            "fecha_inicio_std": "2024-09-06T00:00:00",
            "fecha_fin_std": "2024-10-09T00:00:00",
            "frente_activo": "No aplica",
            "fuera_rango": null
          },
          {
            "intervencion_id": "UNP-103-07",
            "referencia_proceso": "4148.010.32.1.0912-2024",
            "referencia_contrato": "4148.010.26.1.0904-2024",
            "url_proceso": "https://community.secop.gov.co/Public/Tendering/OpportunityDetail/Index?noticeUID=CO1.NTC.6402772&isFromPublicArea=True&isModal=False",
            "bpin": 2020760010771,
            "estado": "Terminado",
            "tipo_intervencion": "Mantenimiento",
            "fuente_financiacion": "Ingresos libre destinación",
            "presupuesto_base": 540715000,
            "ano": 2024,
            "avance_obra": 100.0,
            "fecha_inicio": "09-09-2024",
            "fecha_fin": "15-12-2024",
            "fecha_inicio_std": "2024-09-09T00:00:00",
            "fecha_fin_std": "2024-12-15T00:00:00",
            "frente_activo": "No aplica",
            "fuera_rango": null
          },
          {
            "intervencion_id": "UNP-103-08",
            "referencia_proceso": "4148.010.32.1.0903-2024",
            "referencia_contrato": "4148.010.26.1.0902-2024",
            "url_proceso": "https://community.secop.gov.co/Public/Tendering/ContractNoticePhases/View?PPI=CO1.PPI.32721821&isFromPublicArea=True&isModal=False",
            "bpin": 2024760010215,
            "estado": "Terminado",
            "tipo_intervencion": "Mantenimiento",
            "fuente_financiacion": "Ingresos libre destinación",
            "presupuesto_base": 69158815,
            "ano": 2024,
            "avance_obra": 100.0,
            "fecha_inicio": "06-09-2024",
            "fecha_fin": "25-12-2024",
            "fecha_inicio_std": "2024-09-06T00:00:00",
            "fecha_fin_std": "2024-12-25T00:00:00",
            "frente_activo": "No aplica",
            "fuera_rango": null
          },
          {
            "intervencion_id": "UNP-103-09",
            "referencia_proceso": null,
            "referencia_contrato": null,
            "url_proceso": "Pendiente",
            "bpin": 2024760010224,
            "estado": "En alistamiento",
            "tipo_intervencion": "Rehabilitación / Reforzamiento",
            "fuente_financiacion": "Empréstito",
            "presupuesto_base": 36000000000,
            "ano": 2026,
            "avance_obra": 0.0,
            "fecha_inicio": "01-03-2026",
            "fecha_fin": "2027-12-31T00:00:00",
            "fecha_inicio_std": "2026-03-01T00:00:00",
            "fecha_fin_std": "2027-12-31T00:00:00",
            "frente_activo": "No aplica",
            "fuera_rango": null
          },
          {
            "intervencion_id": "UNP-103-10",
            "referencia_proceso": "4148.010.32.1.0543-2025",
            "referencia_contrato": "4148.010.26.1.0870-2025",
            "url_proceso": "https://community.secop.gov.co/Public/Tendering/OpportunityDetail/Index?noticeUID=CO1.NTC.8058354&isFromPublicArea=True&isModal=False",
            "bpin": 2024760010224,
            "estado": "Terminado",
            "tipo_intervencion": "Mantenimiento",
            "fuente_financiacion": "Ingresos libre destinación",
            "presupuesto_base": 215066655,
            "ano": 2025,
            "avance_obra": 100.0,
            "fecha_inicio": "15-07-2025",
            "fecha_fin": "15-12-2025",
            "fecha_inicio_std": "2025-07-15T00:00:00",
            "fecha_fin_std": "2025-12-15T00:00:00",
            "frente_activo": "No aplica",
            "fuera_rango": null
          },
          {
            "intervencion_id": "UNP-103-11",
            "referencia_proceso": "4148.010.32.1.0543-2025",
            "referencia_contrato": "4148.010.26.1.0870-2025",
            "url_proceso": "https://community.secop.gov.co/Public/Tendering/OpportunityDetail/Index?noticeUID=CO1.NTC.8058354&isFromPublicArea=True&isModal=False",
            "bpin": 2024760010224,
            "estado": "Terminado",
            "tipo_intervencion": "Mantenimiento",
            "fuente_financiacion": "Ingresos libre destinación",
            "presupuesto_base": 271460589,
            "ano": 2025,
            "avance_obra": 100.0,
            "fecha_inicio": "15-07-2025",
            "fecha_fin": "15-12-2025",
            "fecha_inicio_std": "2025-07-15T00:00:00",
            "fecha_fin_std": "2025-12-15T00:00:00",
            "frente_activo": "No aplica",
            "fuera_rango": null
          },
          {
            "intervencion_id": "UNP-103-12",
            "referencia_proceso": "4148.010.32.1.0412-2025",
            "referencia_contrato": "4148.010.26.1.0411-2025",
            "url_proceso": "https://community.secop.gov.co/Public/Tendering/OpportunityDetail/Index?noticeUID=CO1.NTC.7736347&isFromPublicArea=True&isModal=False",
            "bpin": 2024760010224,
            "estado": "Terminado",
            "tipo_intervencion": "Mantenimiento",
            "fuente_financiacion": "Ingresos libre destinación",
            "presupuesto_base": 22333920,
            "ano": 2025,
            "avance_obra": 100.0,
            "fecha_inicio": "14-03-2025",
            "fecha_fin": "15-12-2025",
            "fecha_inicio_std": "2025-03-14T00:00:00",
            "fecha_fin_std": "2025-12-15T00:00:00",
            "frente_activo": "No aplica",
            "fuera_rango": null
          },
          {
            "intervencion_id": "UNP-103-13",
            "referencia_proceso": "4148.010.32.1.0924-2025",
            "referencia_contrato": "4148.010.26.1.0912-2025",
            "url_proceso": "https://community.secop.gov.co/Public/Tendering/OpportunityDetail/Index?noticeUID=CO1.NTC.8222732&isFromPublicArea=True&isModal=False",
            "bpin": 2024760010215,
            "estado": "Terminado",
            "tipo_intervencion": "Mantenimiento",
            "fuente_financiacion": "Ingresos libre destinación",
            "presupuesto_base": 3021429,
            "ano": 2025,
            "avance_obra": 100.0,
            "fecha_inicio": "24-07-2025",
            "fecha_fin": "15-12-2025",
            "fecha_inicio_std": "2025-07-24T00:00:00",
            "fecha_fin_std": "2025-12-15T00:00:00",
            "frente_activo": "No aplica",
            "fuera_rango": null
          },
          {
            "intervencion_id": "UNP-103-14",
            "referencia_proceso": "4148.010.32.1.0424-2025",
            "referencia_contrato": "4148.010.26.1.0522-2025",
            "url_proceso": "https://community.secop.gov.co/Public/Tendering/OpportunityDetail/Index?noticeUID=CO1.NTC.7857151&isFromPublicArea=True&isModal=False",
            "bpin": 2024760010215,
            "estado": "Terminado",
            "tipo_intervencion": "Mantenimiento",
            "fuente_financiacion": "Ingresos libre destinación",
            "presupuesto_base": 41352803,
            "ano": 2025,
            "avance_obra": 100.0,
            "fecha_inicio": "13-05-2025",
            "fecha_fin": "15-12-2025",
            "fecha_inicio_std": "2025-05-13T00:00:00",
            "fecha_fin_std": "2025-12-15T00:00:00",
            "frente_activo": "No aplica",
            "fuera_rango": null
          },
          {
            "intervencion_id": "UNP-103-15",
            "referencia_proceso": "4148.010.32.1.0534-2025",
            "referencia_contrato": "4148.010.26.1.0867-2025",
            "url_proceso": "https://community.secop.gov.co/Public/Tendering/OpportunityDetail/Index?noticeUID=CO1.NTC.8020863&isFromPublicArea=True&isModal=False",
            "bpin": 2024760010224,
            "estado": "Terminado",
            "tipo_intervencion": "Mantenimiento",
            "fuente_financiacion": "Ingresos libre destinación",
            "presupuesto_base": 580318649,
            "ano": 2025,
            "avance_obra": 100.0,
            "fecha_inicio": "19-06-2025",
            "fecha_fin": "15-12-2025",
            "fecha_inicio_std": "2025-06-19T00:00:00",
            "fecha_fin_std": "2025-12-15T00:00:00",
            "frente_activo": "No aplica",
            "fuera_rango": null
          },
          {
            "intervencion_id": "UNP-103-16",
            "referencia_proceso": "4148.010.32.1.0864-2024",
            "referencia_contrato": "4148.010.26.1.0900-2024",
            "url_proceso": "https://community.secop.gov.co/Public/Tendering/OpportunityDetail/Index?noticeUID=CO1.NTC.6340585&isFromPublicArea=True&isModal=False",
            "bpin": 2024760010215,
            "estado": "Terminado",
            "tipo_intervencion": "Mantenimiento",
            "fuente_financiacion": "Ingresos libre destinación",
            "presupuesto_base": 2161764,
            "ano": 2024,
            "avance_obra": 100.0,
            "fecha_inicio": "26-09-2024",
            "fecha_fin": "30-01-2025",
            "fecha_inicio_std": "2024-09-26T00:00:00",
            "fecha_fin_std": "2025-01-30T00:00:00",
            "frente_activo": "No aplica",
            "fuera_rango": null
          },
          {
            "intervencion_id": "UNP-103-17",
            "referencia_proceso": "4148.010.32.1.0864-2024",
            "referencia_contrato": "4148.010.26.1.0900-2024",
            "url_proceso": "https://community.secop.gov.co/Public/Tendering/OpportunityDetail/Index?noticeUID=CO1.NTC.6340585&isFromPublicArea=True&isModal=False",
            "bpin": 2024760010215,
            "estado": "Terminado",
            "tipo_intervencion": "Mantenimiento",
            "fuente_financiacion": "Ingresos libre destinación",
            "presupuesto_base": 2161764,
            "ano": 2024,
            "avance_obra": 100.0,
            "fecha_inicio": "26-09-2024",
            "fecha_fin": "30-01-2025",
            "fecha_inicio_std": "2024-09-26T00:00:00",
            "fecha_fin_std": "2025-01-30T00:00:00",
            "frente_activo": "No aplica",
            "fuera_rango": null
          },
          {
            "intervencion_id": "UNP-103-18",
            "referencia_proceso": "4148.010.32.1.0442-2025",
            "referencia_contrato": "4148.010.26.1.0519-2025",
            "url_proceso": "https://community.secop.gov.co/Public/Tendering/OpportunityDetail/Index?noticeUID=CO1.NTC.7813144&isFromPublicArea=True&isModal=False",
            "bpin": 2024760010215,
            "estado": "Terminado",
            "tipo_intervencion": "Mantenimiento",
            "fuente_financiacion": "Ingresos libre destinación",
            "presupuesto_base": 4838709,
            "ano": 2025,
            "avance_obra": 100.0,
            "fecha_inicio": "03-04-2025",
            "fecha_fin": "30-11-2025",
            "fecha_inicio_std": "2025-04-03T00:00:00",
            "fecha_fin_std": "2025-11-30T00:00:00",
            "frente_activo": "No aplica",
            "fuera_rango": null
          },
          {
            "intervencion_id": "UNP-103-19",
            "referencia_proceso": "4148.010.32.1.0442-2025",
            "referencia_contrato": "4148.010.26.1.0519-2025",
            "url_proceso": "https://community.secop.gov.co/Public/Tendering/OpportunityDetail/Index?noticeUID=CO1.NTC.7813144&isFromPublicArea=True&isModal=False",
            "bpin": 2024760010215,
            "estado": "Terminado",
            "tipo_intervencion": "Mantenimiento",
            "fuente_financiacion": "Ingresos libre destinación",
            "presupuesto_base": 4838709,
            "ano": 2025,
            "avance_obra": 100.0,
            "fecha_inicio": "03-04-2025",
            "fecha_fin": "30-11-2025",
            "fecha_inicio_std": "2025-04-03T00:00:00",
            "fecha_fin_std": "2025-11-30T00:00:00",
            "frente_activo": "No aplica",
            "fuera_rango": null
          },
          {
            "intervencion_id": "UNP-103-20",
            "referencia_proceso": "4148.010.32.1.0924-2025",
            "referencia_contrato": "4148.010.26.1.0912-2025",
            "url_proceso": "https://community.secop.gov.co/Public/Tendering/OpportunityDetail/Index?noticeUID=CO1.NTC.8222732&isFromPublicArea=True&isModal=False",
            "bpin": 2024760010215,
            "estado": "Terminado",
            "tipo_intervencion": "Mantenimiento",
            "fuente_financiacion": "Ingresos libre destinación",
            "presupuesto_base": 3021429,
            "ano": 2025,
            "avance_obra": 100.0,
            "fecha_inicio": "24-07-2025",
            "fecha_fin": "15-12-2025",
            "fecha_inicio_std": "2025-07-24T00:00:00",
            "fecha_fin_std": "2025-12-15T00:00:00",
            "frente_activo": "No aplica",
            "fuera_rango": null
          },
          {
            "intervencion_id": "UNP-103-21",
            "referencia_proceso": "4148.010.32.1.0924-2025",
            "referencia_contrato": "4148.010.26.1.0912-2025",
            "url_proceso": "https://community.secop.gov.co/Public/Tendering/OpportunityDetail/Index?noticeUID=CO1.NTC.8222732&isFromPublicArea=True&isModal=False",
            "bpin": 2024760010215,
            "estado": "Terminado",
            "tipo_intervencion": "Mantenimiento",
            "fuente_financiacion": "Ingresos libre destinación",
            "presupuesto_base": 14500000,
            "ano": 2025,
            "avance_obra": 100.0,
            "fecha_inicio": "24-07-2025",
            "fecha_fin": "15-12-2025",
            "fecha_inicio_std": "2025-07-24T00:00:00",
            "fecha_fin_std": "2025-12-15T00:00:00",
            "frente_activo": "No aplica",
            "fuera_rango": null
          },
          {
            "intervencion_id": "UNP-103-22",
            "referencia_proceso": "4148.010.32.1.0924-2025",
            "referencia_contrato": "4148.010.26.1.0912-2025",
            "url_proceso": "https://community.secop.gov.co/Public/Tendering/OpportunityDetail/Index?noticeUID=CO1.NTC.8222732&isFromPublicArea=True&isModal=False",
            "bpin": 2024760010215,
            "estado": "Terminado",
            "tipo_intervencion": "Mantenimiento",
            "fuente_financiacion": "Ingresos libre destinación",
            "presupuesto_base": 3400000,
            "ano": 2025,
            "avance_obra": 100.0,
            "fecha_inicio": "24-07-2025",
            "fecha_fin": "15-12-2025",
            "fecha_inicio_std": "2025-07-24T00:00:00",
            "fecha_fin_std": "2025-12-15T00:00:00",
            "frente_activo": "No aplica",
            "fuera_rango": null
          }
        ],
        "presupuesto_base": 38089521454,
        "avance_obra": 5.49
      }
    },
    {
      "type": "Feature",
      "geometry": null,
      "properties": {
        "upid": "UNP-104",
        "n_intervenciones": 4,
        "nombre_up": "Parque Artesanal Loma de la Cruz",
        "nombre_up_detalle": "Sede Principal",
        "nombre_centro_gestor": "Secretaría de Cultura",
        "direccion": "Calle 22 No. 11d62",
        "tipo_equipamiento": "Parques y zonas verdes",
        "clase_up": "Obras equipamientos",
        "comuna_corregimiento": "COMUNA 03",
        "comuna_corregimiento_2": null,
        "barrio_vereda": "San Cayetano",
        "barrio_vereda_2": null,
        "identificador": "Mantenimiento Bienes de Interes Cultural",
        "bpin": 2020760010788,
        "lat": null,
        "lon": null,
        "intervenciones": [
          {
            "intervencion_id": "UNP-104-01",
            "referencia_proceso": "4148.010.32.1.0867-2024",
            "referencia_contrato": "4148.010.26.1.0905-2024",
            "url_proceso": "https://community.secop.gov.co/Public/Tendering/OpportunityDetail/Index?noticeUID=CO1.NTC.6403254&isFromPublicArea=True&isModal=False",
            "bpin": 2020760010788,
            "estado": "Terminado",
            "tipo_intervencion": "Mantenimiento",
            "fuente_financiacion": "Ingresos libre destinación",
            "presupuesto_base": 75440008,
            "ano": 2024,
            "avance_obra": 100.0,
            "fecha_inicio": "13-09-2024",
            "fecha_fin": "15-12-2024",
            "fecha_inicio_std": "2024-09-13T00:00:00",
            "fecha_fin_std": "2024-12-15T00:00:00",
            "frente_activo": "No aplica",
            "fuera_rango": null
          },
          {
            "intervencion_id": "UNP-104-02",
            "referencia_proceso": "4148.010.32.1.0979-2025",
            "referencia_contrato": "4148.010.26.1.1418-2025",
            "url_proceso": "https://community.secop.gov.co/Public/Tendering/OpportunityDetail/Index?noticeUID=CO1.NTC.8534337&isFromPublicArea=True&isModal=False",
            "bpin": 2024760010215,
            "estado": "En alistamiento",
            "tipo_intervencion": "Mantenimiento",
            "fuente_financiacion": "Empréstito",
            "presupuesto_base": 143827665,
            "ano": 2025,
            "avance_obra": 0.0,
            "fecha_inicio": "15-11-2025",
            "fecha_fin": "28-02-2026",
            "fecha_inicio_std": "2025-11-15T00:00:00",
            "fecha_fin_std": "2026-02-28T00:00:00",
            "frente_activo": "No aplica",
            "fuera_rango": null
          },
          {
            "intervencion_id": "UNP-104-03",
            "referencia_proceso": "4148.010.32.1.0543-2025",
            "referencia_contrato": "4148.010.26.1.0870-2025",
            "url_proceso": "https://community.secop.gov.co/Public/Tendering/OpportunityDetail/Index?noticeUID=CO1.NTC.8058354&isFromPublicArea=True&isModal=False",
            "bpin": 2024760010224,
            "estado": "Terminado",
            "tipo_intervencion": "Mantenimiento",
            "fuente_financiacion": "Ingresos libre destinación",
            "presupuesto_base": 94659420,
            "ano": 2025,
            "avance_obra": 100.0,
            "fecha_inicio": "15-07-2025",
            "fecha_fin": "15-12-2025",
            "fecha_inicio_std": "2025-07-15T00:00:00",
            "fecha_fin_std": "2025-12-15T00:00:00",
            "frente_activo": "No aplica",
            "fuera_rango": null
          },
          {
            "intervencion_id": "UNP-104-04",
            "referencia_proceso": "4148.010.32.1.0424-2025",
            "referencia_contrato": "4148.010.26.1.0522-2025",
            "url_proceso": "https://community.secop.gov.co/Public/Tendering/OpportunityDetail/Index?noticeUID=CO1.NTC.7857151&isFromPublicArea=True&isModal=False",
            "bpin": 2024760010215,
            "estado": "Terminado",
            "tipo_intervencion": "Mantenimiento",
            "fuente_financiacion": "Ingresos libre destinación",
            "presupuesto_base": 26173927,
            "ano": 2025,
            "avance_obra": 100.0,
            "fecha_inicio": "13-05-2025",
            "fecha_fin": "15-12-2025",
            "fecha_inicio_std": "2025-05-13T00:00:00",
            "fecha_fin_std": "2025-12-15T00:00:00",
            "frente_activo": "No aplica",
            "fuera_rango": null
          }
        ],
        "presupuesto_base": 340101020,
        "avance_obra": 57.71
      }
    },
    {
      "type": "Feature",
      "geometry": null,
      "properties": {
        "upid": "UNP-105",
        "n_intervenciones": 20,
        "nombre_up": "Biblioteca Pública Centro Cultural Comuna 01 - Certificada",
        "nombre_up_detalle": "Sede Principal",
        "nombre_centro_gestor": "Secretaría de Cultura",
        "direccion": "Calle 4 Oeste No. 1-16",
        "tipo_equipamiento": "Bibliotecas",
        "clase_up": "Obras equipamientos",
        "comuna_corregimiento": "Montebello",
        "comuna_corregimiento_2": null,
        "barrio_vereda": "Corregimiento Montebello",
        "barrio_vereda_2": null,
        "identificador": "Mantenimiento Bienes de Interes Cultural",
        "bpin": 2020760010788,
        "lat": null,
        "lon": null,
        "intervenciones": [
          {
            "intervencion_id": "UNP-105-01",
            "referencia_proceso": "4148.010.32.1.0867-2024",
            "referencia_contrato": "4148.010.26.1.0905-2024",
            "url_proceso": "https://community.secop.gov.co/Public/Tendering/OpportunityDetail/Index?noticeUID=CO1.NTC.6403254&isFromPublicArea=True&isModal=False",
            "bpin": 2020760010788,
            "estado": "Terminado",
            "tipo_intervencion": "Mantenimiento",
            "fuente_financiacion": "Ingresos libre destinación",
            "presupuesto_base": 35336615,
            "ano": 2024,
            "avance_obra": 100.0,
            "fecha_inicio": "13-09-2024",
            "fecha_fin": "15-12-2024",
            "fecha_inicio_std": "2024-09-13T00:00:00",
            "fecha_fin_std": "2024-12-15T00:00:00",
            "frente_activo": "No aplica",
            "fuera_rango": null
          },
          {
            "intervencion_id": "UNP-105-02",
            "referencia_proceso": "4148.010.32.1.0864-2024",
            "referencia_contrato": "4148.010.26.1.0900-2024",
            "url_proceso": "https://community.secop.gov.co/Public/Tendering/OpportunityDetail/Index?noticeUID=CO1.NTC.6340585&isFromPublicArea=True&isModal=False",
            "bpin": 2024760010215,
            "estado": "Terminado",
            "tipo_intervencion": "Mantenimiento",
            "fuente_financiacion": "Ingresos libre destinación",
            "presupuesto_base": 195027413,
            "ano": 2024,
            "avance_obra": 100.0,
            "fecha_inicio": "26-09-2024",
            "fecha_fin": "30-01-2025",
            "fecha_inicio_std": "2024-09-26T00:00:00",
            "fecha_fin_std": "2025-01-30T00:00:00",
            "frente_activo": "No aplica",
            "fuera_rango": null
          },
          {
            "intervencion_id": "UNP-105-03",
            "referencia_proceso": "4148.010.32.1.1055-2024",
            "referencia_contrato": "4148.010.26.1.0948-2024",
            "url_proceso": "https://community.secop.gov.co/Public/Tendering/OpportunityDetail/Index?noticeUID=CO1.NTC.6811409&isFromPublicArea=True&isModal=False",
            "bpin": 2024760010215,
            "estado": "Terminado",
            "tipo_intervencion": "Mantenimiento",
            "fuente_financiacion": "Ingresos libre destinación",
            "presupuesto_base": 55853279,
            "ano": 2024,
            "avance_obra": 100.0,
            "fecha_inicio": "06-11-2024",
            "fecha_fin": "15-12-2024",
            "fecha_inicio_std": "2024-11-06T00:00:00",
            "fecha_fin_std": "2024-12-15T00:00:00",
            "frente_activo": "No aplica",
            "fuera_rango": null
          },
          {
            "intervencion_id": "UNP-105-04",
            "referencia_proceso": "4148.010.32.1.0979-2025",
            "referencia_contrato": "4148.010.26.1.1418-2025",
            "url_proceso": "https://community.secop.gov.co/Public/Tendering/OpportunityDetail/Index?noticeUID=CO1.NTC.8534337&isFromPublicArea=True&isModal=False",
            "bpin": 2024760010215,
            "estado": "En alistamiento",
            "tipo_intervencion": "Mantenimiento",
            "fuente_financiacion": "Empréstito",
            "presupuesto_base": 390982618,
            "ano": 2025,
            "avance_obra": 0.0,
            "fecha_inicio": "15-11-2025",
            "fecha_fin": "28-02-2026",
            "fecha_inicio_std": "2025-11-15T00:00:00",
            "fecha_fin_std": "2026-02-28T00:00:00",
            "frente_activo": "No aplica",
            "fuera_rango": null
          },
          {
            "intervencion_id": "UNP-105-05",
            "referencia_proceso": "4148.010.32.1.0543-2025",
            "referencia_contrato": "4148.010.26.1.0870-2025",
            "url_proceso": "https://community.secop.gov.co/Public/Tendering/OpportunityDetail/Index?noticeUID=CO1.NTC.8058354&isFromPublicArea=True&isModal=False",
            "bpin": 2024760010224,
            "estado": "Terminado",
            "tipo_intervencion": "Mantenimiento",
            "fuente_financiacion": "Ingresos libre destinación",
            "presupuesto_base": 43550375,
            "ano": 2025,
            "avance_obra": 100.0,
            "fecha_inicio": "15-07-2025",
            "fecha_fin": "15-12-2025",
            "fecha_inicio_std": "2025-07-15T00:00:00",
            "fecha_fin_std": "2025-12-15T00:00:00",
            "frente_activo": "No aplica",
            "fuera_rango": null
          },
          {
            "intervencion_id": "UNP-105-06",
            "referencia_proceso": "4148.010.32.1.0424-2025",
            "referencia_contrato": "4148.010.26.1.0522-2025",
            "url_proceso": "https://community.secop.gov.co/Public/Tendering/OpportunityDetail/Index?noticeUID=CO1.NTC.7857151&isFromPublicArea=True&isModal=False",
            "bpin": 2024760010215,
            "estado": "Terminado",
            "tipo_intervencion": "Mantenimiento",
            "fuente_financiacion": "Ingresos libre destinación",
            "presupuesto_base": 224143205,
            "ano": 2025,
            "avance_obra": 100.0,
            "fecha_inicio": "13-05-2025",
            "fecha_fin": "15-12-2025",
            "fecha_inicio_std": "2025-05-13T00:00:00",
            "fecha_fin_std": "2025-12-15T00:00:00",
            "frente_activo": "No aplica",
            "fuera_rango": null
          },
          {
            "intervencion_id": "UNP-105-07",
            "referencia_proceso": "4148.010.32.1.0424-2025",
            "referencia_contrato": "4148.010.26.1.0522-2025",
            "url_proceso": "https://community.secop.gov.co/Public/Tendering/OpportunityDetail/Index?noticeUID=CO1.NTC.7857151&isFromPublicArea=True&isModal=False",
            "bpin": 2024760010215,
            "estado": "Terminado",
            "tipo_intervencion": "Mantenimiento",
            "fuente_financiacion": "Ingresos libre destinación",
            "presupuesto_base": 31838913,
            "ano": 2025,
            "avance_obra": 100.0,
            "fecha_inicio": "13-05-2025",
            "fecha_fin": "15-12-2025",
            "fecha_inicio_std": "2025-05-13T00:00:00",
            "fecha_fin_std": "2025-12-15T00:00:00",
            "frente_activo": "No aplica",
            "fuera_rango": null
          },
          {
            "intervencion_id": "UNP-105-08",
            "referencia_proceso": "4148.010.32.1.0424-2025",
            "referencia_contrato": "4148.010.26.1.0522-2025",
            "url_proceso": "https://community.secop.gov.co/Public/Tendering/OpportunityDetail/Index?noticeUID=CO1.NTC.7857151&isFromPublicArea=True&isModal=False",
            "bpin": 2024760010215,
            "estado": "Terminado",
            "tipo_intervencion": "Mantenimiento",
            "fuente_financiacion": "Ingresos libre destinación",
            "presupuesto_base": 5367370,
            "ano": 2025,
            "avance_obra": 100.0,
            "fecha_inicio": "13-05-2025",
            "fecha_fin": "15-12-2025",
            "fecha_inicio_std": "2025-05-13T00:00:00",
            "fecha_fin_std": "2025-12-15T00:00:00",
            "frente_activo": "No aplica",
            "fuera_rango": null
          },
          {
            "intervencion_id": "UNP-105-09",
            "referencia_proceso": "4148.010.32.1.0424-2025",
            "referencia_contrato": "4148.010.26.1.0522-2025",
            "url_proceso": "https://community.secop.gov.co/Public/Tendering/OpportunityDetail/Index?noticeUID=CO1.NTC.7857151&isFromPublicArea=True&isModal=False",
            "bpin": 2024760010215,
            "estado": "Terminado",
            "tipo_intervencion": "Mantenimiento",
            "fuente_financiacion": "Ingresos libre destinación",
            "presupuesto_base": 39368150,
            "ano": 2025,
            "avance_obra": 100.0,
            "fecha_inicio": "13-05-2025",
            "fecha_fin": "15-12-2025",
            "fecha_inicio_std": "2025-05-13T00:00:00",
            "fecha_fin_std": "2025-12-15T00:00:00",
            "frente_activo": "No aplica",
            "fuera_rango": null
          },
          {
            "intervencion_id": "UNP-105-10",
            "referencia_proceso": "4148.010.32.1.0864-2024",
            "referencia_contrato": "4148.010.26.1.0900-2024",
            "url_proceso": "https://community.secop.gov.co/Public/Tendering/OpportunityDetail/Index?noticeUID=CO1.NTC.6340585&isFromPublicArea=True&isModal=False",
            "bpin": 2024760010215,
            "estado": "Terminado",
            "tipo_intervencion": "Mantenimiento",
            "fuente_financiacion": "Ingresos libre destinación",
            "presupuesto_base": 2161764,
            "ano": 2024,
            "avance_obra": 100.0,
            "fecha_inicio": "26-09-2024",
            "fecha_fin": "30-01-2025",
            "fecha_inicio_std": "2024-09-26T00:00:00",
            "fecha_fin_std": "2025-01-30T00:00:00",
            "frente_activo": "No aplica",
            "fuera_rango": null
          },
          {
            "intervencion_id": "UNP-105-11",
            "referencia_proceso": "4148.010.32.1.0442-2025",
            "referencia_contrato": "4148.010.26.1.0519-2025",
            "url_proceso": "https://community.secop.gov.co/Public/Tendering/OpportunityDetail/Index?noticeUID=CO1.NTC.7813144&isFromPublicArea=True&isModal=False",
            "bpin": 2024760010215,
            "estado": "Terminado",
            "tipo_intervencion": "Mantenimiento",
            "fuente_financiacion": "Ingresos libre destinación",
            "presupuesto_base": 3225806,
            "ano": 2025,
            "avance_obra": 100.0,
            "fecha_inicio": "03-04-2025",
            "fecha_fin": "30-11-2025",
            "fecha_inicio_std": "2025-04-03T00:00:00",
            "fecha_fin_std": "2025-11-30T00:00:00",
            "frente_activo": "No aplica",
            "fuera_rango": null
          },
          {
            "intervencion_id": "UNP-105-12",
            "referencia_proceso": "4148.010.32.1.0442-2025",
            "referencia_contrato": "4148.010.26.1.0519-2025",
            "url_proceso": "https://community.secop.gov.co/Public/Tendering/OpportunityDetail/Index?noticeUID=CO1.NTC.7813144&isFromPublicArea=True&isModal=False",
            "bpin": 2024760010215,
            "estado": "Terminado",
            "tipo_intervencion": "Mantenimiento",
            "fuente_financiacion": "Ingresos libre destinación",
            "presupuesto_base": 3225806,
            "ano": 2025,
            "avance_obra": 100.0,
            "fecha_inicio": "03-04-2025",
            "fecha_fin": "30-11-2025",
            "fecha_inicio_std": "2025-04-03T00:00:00",
            "fecha_fin_std": "2025-11-30T00:00:00",
            "frente_activo": "No aplica",
            "fuera_rango": null
          },
          {
            "intervencion_id": "UNP-105-13",
            "referencia_proceso": "4148.010.32.1.0442-2025",
            "referencia_contrato": "4148.010.26.1.0519-2025",
            "url_proceso": "https://community.secop.gov.co/Public/Tendering/OpportunityDetail/Index?noticeUID=CO1.NTC.7813144&isFromPublicArea=True&isModal=False",
            "bpin": 2024760010215,
            "estado": "Terminado",
            "tipo_intervencion": "Mantenimiento",
            "fuente_financiacion": "Ingresos libre destinación",
            "presupuesto_base": 6451612,
            "ano": 2025,
            "avance_obra": 100.0,
            "fecha_inicio": "03-04-2025",
            "fecha_fin": "30-11-2025",
            "fecha_inicio_std": "2025-04-03T00:00:00",
            "fecha_fin_std": "2025-11-30T00:00:00",
            "frente_activo": "No aplica",
            "fuera_rango": null
          },
          {
            "intervencion_id": "UNP-105-14",
            "referencia_proceso": "4148.010.32.1.0442-2025",
            "referencia_contrato": "4148.010.26.1.0519-2025",
            "url_proceso": "https://community.secop.gov.co/Public/Tendering/OpportunityDetail/Index?noticeUID=CO1.NTC.7813144&isFromPublicArea=True&isModal=False",
            "bpin": 2024760010215,
            "estado": "Terminado",
            "tipo_intervencion": "Mantenimiento",
            "fuente_financiacion": "Ingresos libre destinación",
            "presupuesto_base": 6451612,
            "ano": 2025,
            "avance_obra": 100.0,
            "fecha_inicio": "03-04-2025",
            "fecha_fin": "30-11-2025",
            "fecha_inicio_std": "2025-04-03T00:00:00",
            "fecha_fin_std": "2025-11-30T00:00:00",
            "frente_activo": "No aplica",
            "fuera_rango": null
          },
          {
            "intervencion_id": "UNP-105-15",
            "referencia_proceso": "4148.010.32.1.0924-2025",
            "referencia_contrato": "4148.010.26.1.0912-2025",
            "url_proceso": "https://community.secop.gov.co/Public/Tendering/OpportunityDetail/Index?noticeUID=CO1.NTC.8222732&isFromPublicArea=True&isModal=False",
            "bpin": 2024760010215,
            "estado": "Terminado",
            "tipo_intervencion": "Mantenimiento",
            "fuente_financiacion": "Ingresos libre destinación",
            "presupuesto_base": 3021429,
            "ano": 2025,
            "avance_obra": 100.0,
            "fecha_inicio": "24-07-2025",
            "fecha_fin": "15-12-2025",
            "fecha_inicio_std": "2025-07-24T00:00:00",
            "fecha_fin_std": "2025-12-15T00:00:00",
            "frente_activo": "No aplica",
            "fuera_rango": null
          },
          {
            "intervencion_id": "UNP-105-16",
            "referencia_proceso": "4148.010.32.1.0924-2025",
            "referencia_contrato": "4148.010.26.1.0912-2025",
            "url_proceso": "https://community.secop.gov.co/Public/Tendering/OpportunityDetail/Index?noticeUID=CO1.NTC.8222732&isFromPublicArea=True&isModal=False",
            "bpin": 2024760010215,
            "estado": "Terminado",
            "tipo_intervencion": "Mantenimiento",
            "fuente_financiacion": "Ingresos libre destinación",
            "presupuesto_base": 3021429,
            "ano": 2025,
            "avance_obra": 100.0,
            "fecha_inicio": "24-07-2025",
            "fecha_fin": "15-12-2025",
            "fecha_inicio_std": "2025-07-24T00:00:00",
            "fecha_fin_std": "2025-12-15T00:00:00",
            "frente_activo": "No aplica",
            "fuera_rango": null
          },
          {
            "intervencion_id": "UNP-105-17",
            "referencia_proceso": "4148.010.32.1.0924-2025",
            "referencia_contrato": "4148.010.26.1.0912-2025",
            "url_proceso": "https://community.secop.gov.co/Public/Tendering/OpportunityDetail/Index?noticeUID=CO1.NTC.8222732&isFromPublicArea=True&isModal=False",
            "bpin": 2024760010215,
            "estado": "Terminado",
            "tipo_intervencion": "Mantenimiento",
            "fuente_financiacion": "Ingresos libre destinación",
            "presupuesto_base": 3021429,
            "ano": 2025,
            "avance_obra": 100.0,
            "fecha_inicio": "24-07-2025",
            "fecha_fin": "15-12-2025",
            "fecha_inicio_std": "2025-07-24T00:00:00",
            "fecha_fin_std": "2025-12-15T00:00:00",
            "frente_activo": "No aplica",
            "fuera_rango": null
          },
          {
            "intervencion_id": "UNP-105-18",
            "referencia_proceso": "4148.010.32.1.0924-2025",
            "referencia_contrato": "4148.010.26.1.0912-2025",
            "url_proceso": "https://community.secop.gov.co/Public/Tendering/OpportunityDetail/Index?noticeUID=CO1.NTC.8222732&isFromPublicArea=True&isModal=False",
            "bpin": 2024760010215,
            "estado": "Terminado",
            "tipo_intervencion": "Mantenimiento",
            "fuente_financiacion": "Ingresos libre destinación",
            "presupuesto_base": 1200000,
            "ano": 2025,
            "avance_obra": 100.0,
            "fecha_inicio": "24-07-2025",
            "fecha_fin": "15-12-2025",
            "fecha_inicio_std": "2025-07-24T00:00:00",
            "fecha_fin_std": "2025-12-15T00:00:00",
            "frente_activo": "No aplica",
            "fuera_rango": null
          },
          {
            "intervencion_id": "UNP-105-19",
            "referencia_proceso": "4148.010.32.1.0924-2025",
            "referencia_contrato": "4148.010.26.1.0912-2025",
            "url_proceso": "https://community.secop.gov.co/Public/Tendering/OpportunityDetail/Index?noticeUID=CO1.NTC.8222732&isFromPublicArea=True&isModal=False",
            "bpin": 2024760010215,
            "estado": "Terminado",
            "tipo_intervencion": "Mantenimiento",
            "fuente_financiacion": "Ingresos libre destinación",
            "presupuesto_base": 2300000,
            "ano": 2025,
            "avance_obra": 100.0,
            "fecha_inicio": "24-07-2025",
            "fecha_fin": "15-12-2025",
            "fecha_inicio_std": "2025-07-24T00:00:00",
            "fecha_fin_std": "2025-12-15T00:00:00",
            "frente_activo": "No aplica",
            "fuera_rango": null
          },
          {
            "intervencion_id": "UNP-105-20",
            "referencia_proceso": "4148.010.32.1.0924-2025",
            "referencia_contrato": "4148.010.26.1.0912-2025",
            "url_proceso": "https://community.secop.gov.co/Public/Tendering/OpportunityDetail/Index?noticeUID=CO1.NTC.8222732&isFromPublicArea=True&isModal=False",
            "bpin": 2024760010215,
            "estado": "Terminado",
            "tipo_intervencion": "Mantenimiento",
            "fuente_financiacion": "Ingresos libre destinación",
            "presupuesto_base": 3800000,
            "ano": 2025,
            "avance_obra": 100.0,
            "fecha_inicio": "24-07-2025",
            "fecha_fin": "15-12-2025",
            "fecha_inicio_std": "2025-07-24T00:00:00",
            "fecha_fin_std": "2025-12-15T00:00:00",
            "frente_activo": "No aplica",
            "fuera_rango": null
          }
        ],
        "presupuesto_base": 1059348825,
        "avance_obra": 63.09
      }
    },
    {
      "type": "Feature",
      "geometry": null,
      "properties": {
        "upid": "UNP-106",
        "n_intervenciones": 26,
        "nombre_up": "Bibliotecas Públicas y Centro Cultural de Cali",
        "nombre_up_detalle": "Sede Principal",
        "nombre_centro_gestor": "Secretaría de Cultura",
        "direccion": "Cl. 1b Oeste No. 93-24 hasta 29",
        "tipo_equipamiento": "Bibliotecas",
        "clase_up": "Obras equipamientos",
        "comuna_corregimiento": "COMUNAS DE CALI",
        "comuna_corregimiento_2": null,
        "barrio_vereda": "Unión de Vivienda Popular",
        "barrio_vereda_2": null,
        "identificador": "Mantenimiento Transporte Vertical y Ascensor Centenario",
        "bpin": 2024760010215,
        "lat": null,
        "lon": null,
        "intervenciones": [
          {
            "intervencion_id": "UNP-106-01",
            "referencia_proceso": "4148.010.32.1.0864-2024",
            "referencia_contrato": "4148.010.26.1.0900-2024",
            "url_proceso": "https://community.secop.gov.co/Public/Tendering/OpportunityDetail/Index?noticeUID=CO1.NTC.6340585&isFromPublicArea=True&isModal=False",
            "bpin": 2024760010215,
            "estado": "Terminado",
            "tipo_intervencion": "Mantenimiento",
            "fuente_financiacion": "Ingresos libre destinación",
            "presupuesto_base": 2161764,
            "ano": 2024,
            "avance_obra": 100.0,
            "fecha_inicio": "26-09-2024",
            "fecha_fin": "30-01-2025",
            "fecha_inicio_std": "2024-09-26T00:00:00",
            "fecha_fin_std": "2025-01-30T00:00:00",
            "frente_activo": "No aplica",
            "fuera_rango": null
          },
          {
            "intervencion_id": "UNP-106-02",
            "referencia_proceso": "4148.010.32.1.0859-2024",
            "referencia_contrato": "4148.010.26.1.0874-2024",
            "url_proceso": "https://community.secop.gov.co/Public/Tendering/OpportunityDetail/Index?noticeUID=CO1.NTC.6287152&isFromPublicArea=True&isModal=False",
            "bpin": 2024760010215,
            "estado": "Terminado",
            "tipo_intervencion": "Mantenimiento",
            "fuente_financiacion": "Ingresos libre destinación",
            "presupuesto_base": 21150000,
            "ano": 2024,
            "avance_obra": 100.0,
            "fecha_inicio": "08-07-2024",
            "fecha_fin": "08-12-2024",
            "fecha_inicio_std": "2024-07-08T00:00:00",
            "fecha_fin_std": "2024-12-08T00:00:00",
            "frente_activo": "No aplica",
            "fuera_rango": null
          },
          {
            "intervencion_id": "UNP-106-03",
            "referencia_proceso": "4148.010.32.1.0979-2025",
            "referencia_contrato": "4148.010.26.1.1418-2025",
            "url_proceso": "https://community.secop.gov.co/Public/Tendering/OpportunityDetail/Index?noticeUID=CO1.NTC.8534337&isFromPublicArea=True&isModal=False",
            "bpin": 2024760010215,
            "estado": "En ejecución",
            "tipo_intervencion": "Mantenimiento",
            "fuente_financiacion": "Empréstito",
            "presupuesto_base": 651777804,
            "ano": 2025,
            "avance_obra": 30.0,
            "fecha_inicio": "15-11-2025",
            "fecha_fin": "28-02-2026",
            "fecha_inicio_std": "2025-11-15T00:00:00",
            "fecha_fin_std": "2026-02-28T00:00:00",
            "frente_activo": "No aplica",
            "fuera_rango": null
          },
          {
            "intervencion_id": "UNP-106-04",
            "referencia_proceso": "4148.010.32.1.0532-2025",
            "referencia_contrato": "4148.010.26.1.0526-2025",
            "url_proceso": "https://community.secop.gov.co/Public/Tendering/OpportunityDetail/Index?noticeUID=CO1.NTC.7924730&isFromPublicArea=True&isModal=False",
            "bpin": 2024760010215,
            "estado": "Terminado",
            "tipo_intervencion": "Mantenimiento",
            "fuente_financiacion": "Ingresos libre destinación",
            "presupuesto_base": 43647158,
            "ano": 2025,
            "avance_obra": 100.0,
            "fecha_inicio": "14-05-2025",
            "fecha_fin": "15-12-2025",
            "fecha_inicio_std": "2025-05-14T00:00:00",
            "fecha_fin_std": "2025-12-15T00:00:00",
            "frente_activo": "No aplica",
            "fuera_rango": null
          },
          {
            "intervencion_id": "UNP-106-05",
            "referencia_proceso": "4148.010.32.1.0424-2025",
            "referencia_contrato": "4148.010.26.1.0522-2025",
            "url_proceso": "https://community.secop.gov.co/Public/Tendering/OpportunityDetail/Index?noticeUID=CO1.NTC.7857151&isFromPublicArea=True&isModal=False",
            "bpin": 2024760010215,
            "estado": "Terminado",
            "tipo_intervencion": "Mantenimiento",
            "fuente_financiacion": "Ingresos libre destinación",
            "presupuesto_base": 12389947,
            "ano": 2025,
            "avance_obra": 100.0,
            "fecha_inicio": "13-05-2025",
            "fecha_fin": "15-12-2025",
            "fecha_inicio_std": "2025-05-13T00:00:00",
            "fecha_fin_std": "2025-12-15T00:00:00",
            "frente_activo": "No aplica",
            "fuera_rango": null
          },
          {
            "intervencion_id": "UNP-106-06",
            "referencia_proceso": "4148.010.32.1.0424-2025",
            "referencia_contrato": "4148.010.26.1.0522-2025",
            "url_proceso": "https://community.secop.gov.co/Public/Tendering/OpportunityDetail/Index?noticeUID=CO1.NTC.7857151&isFromPublicArea=True&isModal=False",
            "bpin": 2024760010215,
            "estado": "Terminado",
            "tipo_intervencion": "Mantenimiento",
            "fuente_financiacion": "Ingresos libre destinación",
            "presupuesto_base": 4061008,
            "ano": 2025,
            "avance_obra": 100.0,
            "fecha_inicio": "13-05-2025",
            "fecha_fin": "15-12-2025",
            "fecha_inicio_std": "2025-05-13T00:00:00",
            "fecha_fin_std": "2025-12-15T00:00:00",
            "frente_activo": "No aplica",
            "fuera_rango": null
          },
          {
            "intervencion_id": "UNP-106-07",
            "referencia_proceso": "4148.010.32.1.0424-2025",
            "referencia_contrato": "4148.010.26.1.0522-2025",
            "url_proceso": "https://community.secop.gov.co/Public/Tendering/OpportunityDetail/Index?noticeUID=CO1.NTC.7857151&isFromPublicArea=True&isModal=False",
            "bpin": 2024760010215,
            "estado": "Terminado",
            "tipo_intervencion": "Mantenimiento",
            "fuente_financiacion": "Ingresos libre destinación",
            "presupuesto_base": 31083832,
            "ano": 2025,
            "avance_obra": 100.0,
            "fecha_inicio": "13-05-2025",
            "fecha_fin": "15-12-2025",
            "fecha_inicio_std": "2025-05-13T00:00:00",
            "fecha_fin_std": "2025-12-15T00:00:00",
            "frente_activo": "No aplica",
            "fuera_rango": null
          },
          {
            "intervencion_id": "UNP-106-08",
            "referencia_proceso": "4148.010.32.1.0424-2025",
            "referencia_contrato": "4148.010.26.1.0522-2025",
            "url_proceso": "https://community.secop.gov.co/Public/Tendering/OpportunityDetail/Index?noticeUID=CO1.NTC.7857151&isFromPublicArea=True&isModal=False",
            "bpin": 2024760010215,
            "estado": "Terminado",
            "tipo_intervencion": "Mantenimiento",
            "fuente_financiacion": "Ingresos libre destinación",
            "presupuesto_base": 40470310,
            "ano": 2025,
            "avance_obra": 100.0,
            "fecha_inicio": "13-05-2025",
            "fecha_fin": "15-12-2025",
            "fecha_inicio_std": "2025-05-13T00:00:00",
            "fecha_fin_std": "2025-12-15T00:00:00",
            "frente_activo": "No aplica",
            "fuera_rango": null
          },
          {
            "intervencion_id": "UNP-106-09",
            "referencia_proceso": "4148.010.32.1.0424-2025",
            "referencia_contrato": "4148.010.26.1.0522-2025",
            "url_proceso": "https://community.secop.gov.co/Public/Tendering/OpportunityDetail/Index?noticeUID=CO1.NTC.7857151&isFromPublicArea=True&isModal=False",
            "bpin": 2024760010215,
            "estado": "Terminado",
            "tipo_intervencion": "Mantenimiento",
            "fuente_financiacion": "Ingresos libre destinación",
            "presupuesto_base": 14831645,
            "ano": 2025,
            "avance_obra": 100.0,
            "fecha_inicio": "13-05-2025",
            "fecha_fin": "15-12-2025",
            "fecha_inicio_std": "2025-05-13T00:00:00",
            "fecha_fin_std": "2025-12-15T00:00:00",
            "frente_activo": "No aplica",
            "fuera_rango": null
          },
          {
            "intervencion_id": "UNP-106-10",
            "referencia_proceso": "4148.010.32.1.0424-2025",
            "referencia_contrato": "4148.010.26.1.0522-2025",
            "url_proceso": "https://community.secop.gov.co/Public/Tendering/OpportunityDetail/Index?noticeUID=CO1.NTC.7857151&isFromPublicArea=True&isModal=False",
            "bpin": 2024760010215,
            "estado": "Terminado",
            "tipo_intervencion": "Mantenimiento",
            "fuente_financiacion": "Ingresos libre destinación",
            "presupuesto_base": 101516322,
            "ano": 2025,
            "avance_obra": 100.0,
            "fecha_inicio": "13-05-2025",
            "fecha_fin": "15-12-2025",
            "fecha_inicio_std": "2025-05-13T00:00:00",
            "fecha_fin_std": "2025-12-15T00:00:00",
            "frente_activo": "No aplica",
            "fuera_rango": null
          },
          {
            "intervencion_id": "UNP-106-11",
            "referencia_proceso": "4148.010.32.1.0424-2025",
            "referencia_contrato": "4148.010.26.1.0522-2025",
            "url_proceso": "https://community.secop.gov.co/Public/Tendering/OpportunityDetail/Index?noticeUID=CO1.NTC.7857151&isFromPublicArea=True&isModal=False",
            "bpin": 2024760010215,
            "estado": "Terminado",
            "tipo_intervencion": "Mantenimiento",
            "fuente_financiacion": "Ingresos libre destinación",
            "presupuesto_base": 15077676,
            "ano": 2025,
            "avance_obra": 100.0,
            "fecha_inicio": "13-05-2025",
            "fecha_fin": "15-12-2025",
            "fecha_inicio_std": "2025-05-13T00:00:00",
            "fecha_fin_std": "2025-12-15T00:00:00",
            "frente_activo": "No aplica",
            "fuera_rango": null
          },
          {
            "intervencion_id": "UNP-106-12",
            "referencia_proceso": "4148.010.32.1.0424-2025",
            "referencia_contrato": "4148.010.26.1.0522-2025",
            "url_proceso": "https://community.secop.gov.co/Public/Tendering/OpportunityDetail/Index?noticeUID=CO1.NTC.7857151&isFromPublicArea=True&isModal=False",
            "bpin": 2024760010215,
            "estado": "Terminado",
            "tipo_intervencion": "Mantenimiento",
            "fuente_financiacion": "Ingresos libre destinación",
            "presupuesto_base": 22320193,
            "ano": 2025,
            "avance_obra": 100.0,
            "fecha_inicio": "13-05-2025",
            "fecha_fin": "15-12-2025",
            "fecha_inicio_std": "2025-05-13T00:00:00",
            "fecha_fin_std": "2025-12-15T00:00:00",
            "frente_activo": "No aplica",
            "fuera_rango": null
          },
          {
            "intervencion_id": "UNP-106-13",
            "referencia_proceso": "4148.010.32.1.0424-2025",
            "referencia_contrato": "4148.010.26.1.0522-2025",
            "url_proceso": "https://community.secop.gov.co/Public/Tendering/OpportunityDetail/Index?noticeUID=CO1.NTC.7857151&isFromPublicArea=True&isModal=False",
            "bpin": 2024760010215,
            "estado": "Terminado",
            "tipo_intervencion": "Mantenimiento",
            "fuente_financiacion": "Ingresos libre destinación",
            "presupuesto_base": 26288754,
            "ano": 2025,
            "avance_obra": 100.0,
            "fecha_inicio": "13-05-2025",
            "fecha_fin": "15-12-2025",
            "fecha_inicio_std": "2025-05-13T00:00:00",
            "fecha_fin_std": "2025-12-15T00:00:00",
            "frente_activo": "No aplica",
            "fuera_rango": null
          },
          {
            "intervencion_id": "UNP-106-14",
            "referencia_proceso": "4148.010.32.1.0864-2024",
            "referencia_contrato": "4148.010.26.1.0900-2024",
            "url_proceso": "https://community.secop.gov.co/Public/Tendering/OpportunityDetail/Index?noticeUID=CO1.NTC.6340585&isFromPublicArea=True&isModal=False",
            "bpin": 2024760010215,
            "estado": "Terminado",
            "tipo_intervencion": "Mantenimiento",
            "fuente_financiacion": "Ingresos libre destinación",
            "presupuesto_base": 2161764,
            "ano": 2024,
            "avance_obra": 100.0,
            "fecha_inicio": "26-09-2024",
            "fecha_fin": "30-01-2025",
            "fecha_inicio_std": "2024-09-26T00:00:00",
            "fecha_fin_std": "2025-01-30T00:00:00",
            "frente_activo": "No aplica",
            "fuera_rango": null
          },
          {
            "intervencion_id": "UNP-106-15",
            "referencia_proceso": "4148.010.32.1.0864-2024",
            "referencia_contrato": "4148.010.26.1.0900-2024",
            "url_proceso": "https://community.secop.gov.co/Public/Tendering/OpportunityDetail/Index?noticeUID=CO1.NTC.6340585&isFromPublicArea=True&isModal=False",
            "bpin": 2024760010215,
            "estado": "Terminado",
            "tipo_intervencion": "Mantenimiento",
            "fuente_financiacion": "Ingresos libre destinación",
            "presupuesto_base": 2161764,
            "ano": 2024,
            "avance_obra": 100.0,
            "fecha_inicio": "26-09-2024",
            "fecha_fin": "30-01-2025",
            "fecha_inicio_std": "2024-09-26T00:00:00",
            "fecha_fin_std": "2025-01-30T00:00:00",
            "frente_activo": "No aplica",
            "fuera_rango": null
          },
          {
            "intervencion_id": "UNP-106-16",
            "referencia_proceso": "4148.010.32.1.0864-2024",
            "referencia_contrato": "4148.010.26.1.0900-2024",
            "url_proceso": "https://community.secop.gov.co/Public/Tendering/OpportunityDetail/Index?noticeUID=CO1.NTC.6340585&isFromPublicArea=True&isModal=False",
            "bpin": 2024760010215,
            "estado": "Terminado",
            "tipo_intervencion": "Mantenimiento",
            "fuente_financiacion": "Ingresos libre destinación",
            "presupuesto_base": 2161764,
            "ano": 2024,
            "avance_obra": 100.0,
            "fecha_inicio": "26-09-2024",
            "fecha_fin": "30-01-2025",
            "fecha_inicio_std": "2024-09-26T00:00:00",
            "fecha_fin_std": "2025-01-30T00:00:00",
            "frente_activo": "No aplica",
            "fuera_rango": null
          },
          {
            "intervencion_id": "UNP-106-17",
            "referencia_proceso": "4148.010.32.1.0864-2024",
            "referencia_contrato": "4148.010.26.1.0900-2024",
            "url_proceso": "https://community.secop.gov.co/Public/Tendering/OpportunityDetail/Index?noticeUID=CO1.NTC.6340585&isFromPublicArea=True&isModal=False",
            "bpin": 2024760010215,
            "estado": "Terminado",
            "tipo_intervencion": "Mantenimiento",
            "fuente_financiacion": "Ingresos libre destinación",
            "presupuesto_base": 2161764,
            "ano": 2024,
            "avance_obra": 100.0,
            "fecha_inicio": "26-09-2024",
            "fecha_fin": "30-01-2025",
            "fecha_inicio_std": "2024-09-26T00:00:00",
            "fecha_fin_std": "2025-01-30T00:00:00",
            "frente_activo": "No aplica",
            "fuera_rango": null
          },
          {
            "intervencion_id": "UNP-106-18",
            "referencia_proceso": "4148.010.32.1.0442-2025",
            "referencia_contrato": "4148.010.26.1.0519-2025",
            "url_proceso": "https://community.secop.gov.co/Public/Tendering/OpportunityDetail/Index?noticeUID=CO1.NTC.7813144&isFromPublicArea=True&isModal=False",
            "bpin": 2024760010215,
            "estado": "Terminado",
            "tipo_intervencion": "Mantenimiento",
            "fuente_financiacion": "Ingresos libre destinación",
            "presupuesto_base": 6451612,
            "ano": 2025,
            "avance_obra": 100.0,
            "fecha_inicio": "03-04-2025",
            "fecha_fin": "30-11-2025",
            "fecha_inicio_std": "2025-04-03T00:00:00",
            "fecha_fin_std": "2025-11-30T00:00:00",
            "frente_activo": "No aplica",
            "fuera_rango": null
          },
          {
            "intervencion_id": "UNP-106-19",
            "referencia_proceso": "4148.010.32.1.0442-2025",
            "referencia_contrato": "4148.010.26.1.0519-2025",
            "url_proceso": "https://community.secop.gov.co/Public/Tendering/OpportunityDetail/Index?noticeUID=CO1.NTC.7813144&isFromPublicArea=True&isModal=False",
            "bpin": 2024760010215,
            "estado": "Terminado",
            "tipo_intervencion": "Mantenimiento",
            "fuente_financiacion": "Ingresos libre destinación",
            "presupuesto_base": 6451612,
            "ano": 2025,
            "avance_obra": 100.0,
            "fecha_inicio": "03-04-2025",
            "fecha_fin": "30-11-2025",
            "fecha_inicio_std": "2025-04-03T00:00:00",
            "fecha_fin_std": "2025-11-30T00:00:00",
            "frente_activo": "No aplica",
            "fuera_rango": null
          },
          {
            "intervencion_id": "UNP-106-20",
            "referencia_proceso": "4148.010.32.1.0442-2025",
            "referencia_contrato": "4148.010.26.1.0519-2025",
            "url_proceso": "https://community.secop.gov.co/Public/Tendering/OpportunityDetail/Index?noticeUID=CO1.NTC.7813144&isFromPublicArea=True&isModal=False",
            "bpin": 2024760010215,
            "estado": "Terminado",
            "tipo_intervencion": "Mantenimiento",
            "fuente_financiacion": "Ingresos libre destinación",
            "presupuesto_base": 4838709,
            "ano": 2025,
            "avance_obra": 100.0,
            "fecha_inicio": "03-04-2025",
            "fecha_fin": "30-11-2025",
            "fecha_inicio_std": "2025-04-03T00:00:00",
            "fecha_fin_std": "2025-11-30T00:00:00",
            "frente_activo": "No aplica",
            "fuera_rango": null
          },
          {
            "intervencion_id": "UNP-106-21",
            "referencia_proceso": "4148.010.32.1.0442-2025",
            "referencia_contrato": "4148.010.26.1.0519-2025",
            "url_proceso": "https://community.secop.gov.co/Public/Tendering/OpportunityDetail/Index?noticeUID=CO1.NTC.7813144&isFromPublicArea=True&isModal=False",
            "bpin": 2024760010215,
            "estado": "Terminado",
            "tipo_intervencion": "Mantenimiento",
            "fuente_financiacion": "Ingresos libre destinación",
            "presupuesto_base": 3225806,
            "ano": 2025,
            "avance_obra": 100.0,
            "fecha_inicio": "03-04-2025",
            "fecha_fin": "30-11-2025",
            "fecha_inicio_std": "2025-04-03T00:00:00",
            "fecha_fin_std": "2025-11-30T00:00:00",
            "frente_activo": "No aplica",
            "fuera_rango": null
          },
          {
            "intervencion_id": "UNP-106-22",
            "referencia_proceso": "4148.010.32.1.0442-2025",
            "referencia_contrato": "4148.010.26.1.0519-2025",
            "url_proceso": "https://community.secop.gov.co/Public/Tendering/OpportunityDetail/Index?noticeUID=CO1.NTC.7813144&isFromPublicArea=True&isModal=False",
            "bpin": 2024760010215,
            "estado": "Terminado",
            "tipo_intervencion": "Mantenimiento",
            "fuente_financiacion": "Ingresos libre destinación",
            "presupuesto_base": 6451612,
            "ano": 2025,
            "avance_obra": 100.0,
            "fecha_inicio": "03-04-2025",
            "fecha_fin": "30-11-2025",
            "fecha_inicio_std": "2025-04-03T00:00:00",
            "fecha_fin_std": "2025-11-30T00:00:00",
            "frente_activo": "No aplica",
            "fuera_rango": null
          },
          {
            "intervencion_id": "UNP-106-23",
            "referencia_proceso": "4148.010.32.1.0442-2025",
            "referencia_contrato": "4148.010.26.1.0519-2025",
            "url_proceso": "https://community.secop.gov.co/Public/Tendering/OpportunityDetail/Index?noticeUID=CO1.NTC.7813144&isFromPublicArea=True&isModal=False",
            "bpin": 2024760010215,
            "estado": "Terminado",
            "tipo_intervencion": "Mantenimiento",
            "fuente_financiacion": "Ingresos libre destinación",
            "presupuesto_base": 6451612,
            "ano": 2025,
            "avance_obra": 100.0,
            "fecha_inicio": "03-04-2025",
            "fecha_fin": "30-11-2025",
            "fecha_inicio_std": "2025-04-03T00:00:00",
            "fecha_fin_std": "2025-11-30T00:00:00",
            "frente_activo": "No aplica",
            "fuera_rango": null
          },
          {
            "intervencion_id": "UNP-106-24",
            "referencia_proceso": "4148.010.32.1.0442-2025",
            "referencia_contrato": "4148.010.26.1.0519-2025",
            "url_proceso": "https://community.secop.gov.co/Public/Tendering/OpportunityDetail/Index?noticeUID=CO1.NTC.7813144&isFromPublicArea=True&isModal=False",
            "bpin": 2024760010215,
            "estado": "Terminado",
            "tipo_intervencion": "Mantenimiento",
            "fuente_financiacion": "Ingresos libre destinación",
            "presupuesto_base": 4838709,
            "ano": 2025,
            "avance_obra": 100.0,
            "fecha_inicio": "03-04-2025",
            "fecha_fin": "30-11-2025",
            "fecha_inicio_std": "2025-04-03T00:00:00",
            "fecha_fin_std": "2025-11-30T00:00:00",
            "frente_activo": "No aplica",
            "fuera_rango": null
          },
          {
            "intervencion_id": "UNP-106-25",
            "referencia_proceso": "4148.010.32.1.0442-2025",
            "referencia_contrato": "4148.010.26.1.0519-2025",
            "url_proceso": "https://community.secop.gov.co/Public/Tendering/OpportunityDetail/Index?noticeUID=CO1.NTC.7813144&isFromPublicArea=True&isModal=False",
            "bpin": 2024760010215,
            "estado": "Terminado",
            "tipo_intervencion": "Mantenimiento",
            "fuente_financiacion": "Ingresos libre destinación",
            "presupuesto_base": 1612903,
            "ano": 2025,
            "avance_obra": 100.0,
            "fecha_inicio": "03-04-2025",
            "fecha_fin": "30-11-2025",
            "fecha_inicio_std": "2025-04-03T00:00:00",
            "fecha_fin_std": "2025-11-30T00:00:00",
            "frente_activo": "No aplica",
            "fuera_rango": null
          },
          {
            "intervencion_id": "UNP-106-26",
            "referencia_proceso": "4148.010.32.1.0442-2025",
            "referencia_contrato": "4148.010.26.1.0519-2025",
            "url_proceso": "https://community.secop.gov.co/Public/Tendering/OpportunityDetail/Index?noticeUID=CO1.NTC.7813144&isFromPublicArea=True&isModal=False",
            "bpin": 2024760010215,
            "estado": "Terminado",
            "tipo_intervencion": "Mantenimiento",
            "fuente_financiacion": "Ingresos libre destinación",
            "presupuesto_base": 4838709,
            "ano": 2025,
            "avance_obra": 100.0,
            "fecha_inicio": "03-04-2025",
            "fecha_fin": "30-11-2025",
            "fecha_inicio_std": "2025-04-03T00:00:00",
            "fecha_fin_std": "2025-11-30T00:00:00",
            "frente_activo": "No aplica",
            "fuera_rango": null
          }
        ],
        "presupuesto_base": 1040584753,
        "avance_obra": 56.15
      }
    },
    {
      "type": "Feature",
      "geometry": null,
      "properties": {
        "upid": "UNP-107",
        "n_intervenciones": 4,
        "nombre_up": "Biblioteca Pública Centro Cultural la Leonera",
        "nombre_up_detalle": "Sede Principal",
        "nombre_centro_gestor": "Secretaría de Cultura",
        "direccion": "Cl. 1b Oeste No. 93-24 hasta 29",
        "tipo_equipamiento": "Bibliotecas",
        "clase_up": "Obras equipamientos",
        "comuna_corregimiento": "La Leonera",
        "comuna_corregimiento_2": null,
        "barrio_vereda": "Corregimiento La Leonera",
        "barrio_vereda_2": null,
        "identificador": "Mantenimiento Bibliotecas",
        "bpin": 2024760010215,
        "lat": null,
        "lon": null,
        "intervenciones": [
          {
            "intervencion_id": "UNP-107-01",
            "referencia_proceso": "4148.010.32.1.0979-2025",
            "referencia_contrato": "4148.010.26.1.1418-2025",
            "url_proceso": "https://community.secop.gov.co/Public/Tendering/OpportunityDetail/Index?noticeUID=CO1.NTC.8534337&isFromPublicArea=True&isModal=False",
            "bpin": 2024760010215,
            "estado": "En alistamiento",
            "tipo_intervencion": "Mantenimiento",
            "fuente_financiacion": "Empréstito",
            "presupuesto_base": 609043367,
            "ano": 2025,
            "avance_obra": 0.0,
            "fecha_inicio": "15-11-2025",
            "fecha_fin": "28-02-2026",
            "fecha_inicio_std": "2025-11-15T00:00:00",
            "fecha_fin_std": "2026-02-28T00:00:00",
            "frente_activo": "No aplica",
            "fuera_rango": null
          },
          {
            "intervencion_id": "UNP-107-02",
            "referencia_proceso": "4148.010.32.1.0979-2025",
            "referencia_contrato": "4148.010.26.1.1418-2025",
            "url_proceso": "https://community.secop.gov.co/Public/Tendering/OpportunityDetail/Index?noticeUID=CO1.NTC.8534337&isFromPublicArea=True&isModal=False",
            "bpin": 2024760010215,
            "estado": "En alistamiento",
            "tipo_intervencion": "Mantenimiento",
            "fuente_financiacion": "Empréstito",
            "presupuesto_base": 333194798,
            "ano": 2025,
            "avance_obra": 0.0,
            "fecha_inicio": "15-11-2025",
            "fecha_fin": "28-02-2026",
            "fecha_inicio_std": "2025-11-15T00:00:00",
            "fecha_fin_std": "2026-02-28T00:00:00",
            "frente_activo": "No aplica",
            "fuera_rango": null
          },
          {
            "intervencion_id": "UNP-107-03",
            "referencia_proceso": "4148.010.32.1.0864-2024",
            "referencia_contrato": "4148.010.26.1.0900-2024",
            "url_proceso": "https://community.secop.gov.co/Public/Tendering/OpportunityDetail/Index?noticeUID=CO1.NTC.6340585&isFromPublicArea=True&isModal=False",
            "bpin": 2024760010215,
            "estado": "Terminado",
            "tipo_intervencion": "Mantenimiento",
            "fuente_financiacion": "Ingresos libre destinación",
            "presupuesto_base": 2161764,
            "ano": 2024,
            "avance_obra": 100.0,
            "fecha_inicio": "26-09-2024",
            "fecha_fin": "30-01-2025",
            "fecha_inicio_std": "2024-09-26T00:00:00",
            "fecha_fin_std": "2025-01-30T00:00:00",
            "frente_activo": "No aplica",
            "fuera_rango": null
          },
          {
            "intervencion_id": "UNP-107-04",
            "referencia_proceso": "4148.010.32.1.0864-2024",
            "referencia_contrato": "4148.010.26.1.0900-2024",
            "url_proceso": "https://community.secop.gov.co/Public/Tendering/OpportunityDetail/Index?noticeUID=CO1.NTC.6340585&isFromPublicArea=True&isModal=False",
            "bpin": 2024760010215,
            "estado": "Terminado",
            "tipo_intervencion": "Mantenimiento",
            "fuente_financiacion": "Ingresos libre destinación",
            "presupuesto_base": 2161764,
            "ano": 2024,
            "avance_obra": 100.0,
            "fecha_inicio": "26-09-2024",
            "fecha_fin": "30-01-2025",
            "fecha_inicio_std": "2024-09-26T00:00:00",
            "fecha_fin_std": "2025-01-30T00:00:00",
            "frente_activo": "No aplica",
            "fuera_rango": null
          }
        ],
        "presupuesto_base": 946561693,
        "avance_obra": 0.46
      }
    },
    {
      "type": "Feature",
      "geometry": null,
      "properties": {
        "upid": "UNP-108",
        "n_intervenciones": 19,
        "nombre_up": "Biblioteca Pública Tecnocentro Somos Pacífico",
        "nombre_up_detalle": "Centro Cultural de Cali",
        "nombre_centro_gestor": "Secretaría de Cultura",
        "direccion": "Cra. 28b No. 21b-55",
        "tipo_equipamiento": "Bibliotecas",
        "clase_up": "Obras equipamientos",
        "comuna_corregimiento": "COMUNA 15",
        "comuna_corregimiento_2": null,
        "barrio_vereda": "Unión de Vivienda Popular",
        "barrio_vereda_2": null,
        "identificador": "Mantenimiento Bibliotecas",
        "bpin": 2024760010215,
        "lat": null,
        "lon": null,
        "intervenciones": [
          {
            "intervencion_id": "UNP-108-01",
            "referencia_proceso": "4148.010.32.1.0979-2025",
            "referencia_contrato": "4148.010.26.1.1418-2025",
            "url_proceso": "https://community.secop.gov.co/Public/Tendering/OpportunityDetail/Index?noticeUID=CO1.NTC.8534337&isFromPublicArea=True&isModal=False",
            "bpin": 2024760010215,
            "estado": "En ejecución",
            "tipo_intervencion": "Mantenimiento",
            "fuente_financiacion": "Empréstito",
            "presupuesto_base": 299666862,
            "ano": 2025,
            "avance_obra": 30.0,
            "fecha_inicio": "15-11-2025",
            "fecha_fin": "28-02-2026",
            "fecha_inicio_std": "2025-11-15T00:00:00",
            "fecha_fin_std": "2026-02-28T00:00:00",
            "frente_activo": "No aplica",
            "fuera_rango": null
          },
          {
            "intervencion_id": "UNP-108-02",
            "referencia_proceso": "4148.010.32.1.0979-2025",
            "referencia_contrato": "4148.010.26.1.1418-2025",
            "url_proceso": "https://community.secop.gov.co/Public/Tendering/OpportunityDetail/Index?noticeUID=CO1.NTC.8534337&isFromPublicArea=True&isModal=False",
            "bpin": 2024760010215,
            "estado": "En ejecución",
            "tipo_intervencion": "Mantenimiento",
            "fuente_financiacion": "Empréstito",
            "presupuesto_base": 391300679,
            "ano": 2025,
            "avance_obra": 30.0,
            "fecha_inicio": "15-11-2025",
            "fecha_fin": "28-02-2026",
            "fecha_inicio_std": "2025-11-15T00:00:00",
            "fecha_fin_std": "2026-02-28T00:00:00",
            "frente_activo": "No aplica",
            "fuera_rango": null
          },
          {
            "intervencion_id": "UNP-108-03",
            "referencia_proceso": "4148.010.32.1.0979-2025",
            "referencia_contrato": "4148.010.26.1.1418-2025",
            "url_proceso": "https://community.secop.gov.co/Public/Tendering/OpportunityDetail/Index?noticeUID=CO1.NTC.8534337&isFromPublicArea=True&isModal=False",
            "bpin": 2024760010215,
            "estado": "En ejecución",
            "tipo_intervencion": "Mantenimiento",
            "fuente_financiacion": "Empréstito",
            "presupuesto_base": 942046230,
            "ano": 2025,
            "avance_obra": 30.0,
            "fecha_inicio": "15-11-2025",
            "fecha_fin": "28-02-2026",
            "fecha_inicio_std": "2025-11-15T00:00:00",
            "fecha_fin_std": "2026-02-28T00:00:00",
            "frente_activo": "No aplica",
            "fuera_rango": null
          },
          {
            "intervencion_id": "UNP-108-04",
            "referencia_proceso": "4148.010.32.1.0424-2025",
            "referencia_contrato": "4148.010.26.1.0522-2025",
            "url_proceso": "https://community.secop.gov.co/Public/Tendering/OpportunityDetail/Index?noticeUID=CO1.NTC.7857151&isFromPublicArea=True&isModal=False",
            "bpin": 2024760010215,
            "estado": "Terminado",
            "tipo_intervencion": "Mantenimiento",
            "fuente_financiacion": "Ingresos libre destinación",
            "presupuesto_base": 9596028,
            "ano": 2025,
            "avance_obra": 100.0,
            "fecha_inicio": "13-05-2025",
            "fecha_fin": "15-12-2025",
            "fecha_inicio_std": "2025-05-13T00:00:00",
            "fecha_fin_std": "2025-12-15T00:00:00",
            "frente_activo": "No aplica",
            "fuera_rango": null
          },
          {
            "intervencion_id": "UNP-108-05",
            "referencia_proceso": "4148.010.32.1.0424-2025",
            "referencia_contrato": "4148.010.26.1.0522-2025",
            "url_proceso": "https://community.secop.gov.co/Public/Tendering/OpportunityDetail/Index?noticeUID=CO1.NTC.7857151&isFromPublicArea=True&isModal=False",
            "bpin": 2024760010215,
            "estado": "Terminado",
            "tipo_intervencion": "Mantenimiento",
            "fuente_financiacion": "Ingresos libre destinación",
            "presupuesto_base": 7609329,
            "ano": 2025,
            "avance_obra": 100.0,
            "fecha_inicio": "13-05-2025",
            "fecha_fin": "15-12-2025",
            "fecha_inicio_std": "2025-05-13T00:00:00",
            "fecha_fin_std": "2025-12-15T00:00:00",
            "frente_activo": "No aplica",
            "fuera_rango": null
          },
          {
            "intervencion_id": "UNP-108-06",
            "referencia_proceso": "4148.010.32.1.0424-2025",
            "referencia_contrato": "4148.010.26.1.0522-2025",
            "url_proceso": "https://community.secop.gov.co/Public/Tendering/OpportunityDetail/Index?noticeUID=CO1.NTC.7857151&isFromPublicArea=True&isModal=False",
            "bpin": 2024760010215,
            "estado": "Terminado",
            "tipo_intervencion": "Mantenimiento",
            "fuente_financiacion": "Ingresos libre destinación",
            "presupuesto_base": 6589039,
            "ano": 2025,
            "avance_obra": 100.0,
            "fecha_inicio": "13-05-2025",
            "fecha_fin": "15-12-2025",
            "fecha_inicio_std": "2025-05-13T00:00:00",
            "fecha_fin_std": "2025-12-15T00:00:00",
            "frente_activo": "No aplica",
            "fuera_rango": null
          },
          {
            "intervencion_id": "UNP-108-07",
            "referencia_proceso": "4148.010.32.1.0424-2025",
            "referencia_contrato": "4148.010.26.1.0522-2025",
            "url_proceso": "https://community.secop.gov.co/Public/Tendering/OpportunityDetail/Index?noticeUID=CO1.NTC.7857151&isFromPublicArea=True&isModal=False",
            "bpin": 2024760010215,
            "estado": "Terminado",
            "tipo_intervencion": "Mantenimiento",
            "fuente_financiacion": "Ingresos libre destinación",
            "presupuesto_base": 3697257,
            "ano": 2025,
            "avance_obra": 100.0,
            "fecha_inicio": "13-05-2025",
            "fecha_fin": "15-12-2025",
            "fecha_inicio_std": "2025-05-13T00:00:00",
            "fecha_fin_std": "2025-12-15T00:00:00",
            "frente_activo": "No aplica",
            "fuera_rango": null
          },
          {
            "intervencion_id": "UNP-108-08",
            "referencia_proceso": "4148.010.32.1.0424-2025",
            "referencia_contrato": "4148.010.26.1.0522-2025",
            "url_proceso": "https://community.secop.gov.co/Public/Tendering/OpportunityDetail/Index?noticeUID=CO1.NTC.7857151&isFromPublicArea=True&isModal=False",
            "bpin": 2024760010215,
            "estado": "Terminado",
            "tipo_intervencion": "Mantenimiento",
            "fuente_financiacion": "Ingresos libre destinación",
            "presupuesto_base": 1813656,
            "ano": 2025,
            "avance_obra": 100.0,
            "fecha_inicio": "13-05-2025",
            "fecha_fin": "15-12-2025",
            "fecha_inicio_std": "2025-05-13T00:00:00",
            "fecha_fin_std": "2025-12-15T00:00:00",
            "frente_activo": "No aplica",
            "fuera_rango": null
          },
          {
            "intervencion_id": "UNP-108-09",
            "referencia_proceso": "4148.010.32.1.0424-2025",
            "referencia_contrato": "4148.010.26.1.0522-2025",
            "url_proceso": "https://community.secop.gov.co/Public/Tendering/OpportunityDetail/Index?noticeUID=CO1.NTC.7857151&isFromPublicArea=True&isModal=False",
            "bpin": 2024760010215,
            "estado": "Terminado",
            "tipo_intervencion": "Mantenimiento",
            "fuente_financiacion": "Ingresos libre destinación",
            "presupuesto_base": 3027551,
            "ano": 2025,
            "avance_obra": 100.0,
            "fecha_inicio": "13-05-2025",
            "fecha_fin": "15-12-2025",
            "fecha_inicio_std": "2025-05-13T00:00:00",
            "fecha_fin_std": "2025-12-15T00:00:00",
            "frente_activo": "No aplica",
            "fuera_rango": null
          },
          {
            "intervencion_id": "UNP-108-10",
            "referencia_proceso": "4148.010.32.1.0424-2025",
            "referencia_contrato": "4148.010.26.1.0522-2025",
            "url_proceso": "https://community.secop.gov.co/Public/Tendering/OpportunityDetail/Index?noticeUID=CO1.NTC.7857151&isFromPublicArea=True&isModal=False",
            "bpin": 2024760010215,
            "estado": "Terminado",
            "tipo_intervencion": "Mantenimiento",
            "fuente_financiacion": "Ingresos libre destinación",
            "presupuesto_base": 697993,
            "ano": 2025,
            "avance_obra": 100.0,
            "fecha_inicio": "13-05-2025",
            "fecha_fin": "15-12-2025",
            "fecha_inicio_std": "2025-05-13T00:00:00",
            "fecha_fin_std": "2025-12-15T00:00:00",
            "frente_activo": "No aplica",
            "fuera_rango": null
          },
          {
            "intervencion_id": "UNP-108-11",
            "referencia_proceso": "4148.010.32.1.0442-2025",
            "referencia_contrato": "4148.010.26.1.0519-2025",
            "url_proceso": "https://community.secop.gov.co/Public/Tendering/OpportunityDetail/Index?noticeUID=CO1.NTC.7813144&isFromPublicArea=True&isModal=False",
            "bpin": 2024760010215,
            "estado": "Terminado",
            "tipo_intervencion": "Mantenimiento",
            "fuente_financiacion": "Ingresos libre destinación",
            "presupuesto_base": 6451612,
            "ano": 2025,
            "avance_obra": 100.0,
            "fecha_inicio": "03-04-2025",
            "fecha_fin": "30-11-2025",
            "fecha_inicio_std": "2025-04-03T00:00:00",
            "fecha_fin_std": "2025-11-30T00:00:00",
            "frente_activo": "No aplica",
            "fuera_rango": null
          },
          {
            "intervencion_id": "UNP-108-12",
            "referencia_proceso": "4148.010.32.1.0442-2025",
            "referencia_contrato": "4148.010.26.1.0519-2025",
            "url_proceso": "https://community.secop.gov.co/Public/Tendering/OpportunityDetail/Index?noticeUID=CO1.NTC.7813144&isFromPublicArea=True&isModal=False",
            "bpin": 2024760010215,
            "estado": "Terminado",
            "tipo_intervencion": "Mantenimiento",
            "fuente_financiacion": "Ingresos libre destinación",
            "presupuesto_base": 4838709,
            "ano": 2025,
            "avance_obra": 100.0,
            "fecha_inicio": "03-04-2025",
            "fecha_fin": "30-11-2025",
            "fecha_inicio_std": "2025-04-03T00:00:00",
            "fecha_fin_std": "2025-11-30T00:00:00",
            "frente_activo": "No aplica",
            "fuera_rango": null
          },
          {
            "intervencion_id": "UNP-108-13",
            "referencia_proceso": "4148.010.32.1.0442-2025",
            "referencia_contrato": "4148.010.26.1.0519-2025",
            "url_proceso": "https://community.secop.gov.co/Public/Tendering/OpportunityDetail/Index?noticeUID=CO1.NTC.7813144&isFromPublicArea=True&isModal=False",
            "bpin": 2024760010215,
            "estado": "Terminado",
            "tipo_intervencion": "Mantenimiento",
            "fuente_financiacion": "Ingresos libre destinación",
            "presupuesto_base": 4838709,
            "ano": 2025,
            "avance_obra": 100.0,
            "fecha_inicio": "03-04-2025",
            "fecha_fin": "30-11-2025",
            "fecha_inicio_std": "2025-04-03T00:00:00",
            "fecha_fin_std": "2025-11-30T00:00:00",
            "frente_activo": "No aplica",
            "fuera_rango": null
          },
          {
            "intervencion_id": "UNP-108-14",
            "referencia_proceso": "4148.010.32.1.0442-2025",
            "referencia_contrato": "4148.010.26.1.0519-2025",
            "url_proceso": "https://community.secop.gov.co/Public/Tendering/OpportunityDetail/Index?noticeUID=CO1.NTC.7813144&isFromPublicArea=True&isModal=False",
            "bpin": 2024760010215,
            "estado": "Terminado",
            "tipo_intervencion": "Mantenimiento",
            "fuente_financiacion": "Ingresos libre destinación",
            "presupuesto_base": 3225806,
            "ano": 2025,
            "avance_obra": 100.0,
            "fecha_inicio": "03-04-2025",
            "fecha_fin": "30-11-2025",
            "fecha_inicio_std": "2025-04-03T00:00:00",
            "fecha_fin_std": "2025-11-30T00:00:00",
            "frente_activo": "No aplica",
            "fuera_rango": null
          },
          {
            "intervencion_id": "UNP-108-15",
            "referencia_proceso": "4148.010.32.1.0442-2025",
            "referencia_contrato": "4148.010.26.1.0519-2025",
            "url_proceso": "https://community.secop.gov.co/Public/Tendering/OpportunityDetail/Index?noticeUID=CO1.NTC.7813144&isFromPublicArea=True&isModal=False",
            "bpin": 2024760010215,
            "estado": "Terminado",
            "tipo_intervencion": "Mantenimiento",
            "fuente_financiacion": "Ingresos libre destinación",
            "presupuesto_base": 4838709,
            "ano": 2025,
            "avance_obra": 100.0,
            "fecha_inicio": "03-04-2025",
            "fecha_fin": "30-11-2025",
            "fecha_inicio_std": "2025-04-03T00:00:00",
            "fecha_fin_std": "2025-11-30T00:00:00",
            "frente_activo": "No aplica",
            "fuera_rango": null
          },
          {
            "intervencion_id": "UNP-108-16",
            "referencia_proceso": "4148.010.32.1.0442-2025",
            "referencia_contrato": "4148.010.26.1.0519-2025",
            "url_proceso": "https://community.secop.gov.co/Public/Tendering/OpportunityDetail/Index?noticeUID=CO1.NTC.7813144&isFromPublicArea=True&isModal=False",
            "bpin": 2024760010215,
            "estado": "Terminado",
            "tipo_intervencion": "Mantenimiento",
            "fuente_financiacion": "Ingresos libre destinación",
            "presupuesto_base": 4838709,
            "ano": 2025,
            "avance_obra": 100.0,
            "fecha_inicio": "03-04-2025",
            "fecha_fin": "30-11-2025",
            "fecha_inicio_std": "2025-04-03T00:00:00",
            "fecha_fin_std": "2025-11-30T00:00:00",
            "frente_activo": "No aplica",
            "fuera_rango": null
          },
          {
            "intervencion_id": "UNP-108-17",
            "referencia_proceso": "4148.010.32.1.0442-2025",
            "referencia_contrato": "4148.010.26.1.0519-2025",
            "url_proceso": "https://community.secop.gov.co/Public/Tendering/OpportunityDetail/Index?noticeUID=CO1.NTC.7813144&isFromPublicArea=True&isModal=False",
            "bpin": 2024760010215,
            "estado": "Terminado",
            "tipo_intervencion": "Mantenimiento",
            "fuente_financiacion": "Ingresos libre destinación",
            "presupuesto_base": 3225806,
            "ano": 2025,
            "avance_obra": 100.0,
            "fecha_inicio": "03-04-2025",
            "fecha_fin": "30-11-2025",
            "fecha_inicio_std": "2025-04-03T00:00:00",
            "fecha_fin_std": "2025-11-30T00:00:00",
            "frente_activo": "No aplica",
            "fuera_rango": null
          },
          {
            "intervencion_id": "UNP-108-18",
            "referencia_proceso": "4148.010.32.1.0442-2025",
            "referencia_contrato": "4148.010.26.1.0519-2025",
            "url_proceso": "https://community.secop.gov.co/Public/Tendering/OpportunityDetail/Index?noticeUID=CO1.NTC.7813144&isFromPublicArea=True&isModal=False",
            "bpin": 2024760010215,
            "estado": "Terminado",
            "tipo_intervencion": "Mantenimiento",
            "fuente_financiacion": "Ingresos libre destinación",
            "presupuesto_base": 3225806,
            "ano": 2025,
            "avance_obra": 100.0,
            "fecha_inicio": "03-04-2025",
            "fecha_fin": "30-11-2025",
            "fecha_inicio_std": "2025-04-03T00:00:00",
            "fecha_fin_std": "2025-11-30T00:00:00",
            "frente_activo": "No aplica",
            "fuera_rango": null
          },
          {
            "intervencion_id": "UNP-108-19",
            "referencia_proceso": "4148.010.32.1.0442-2025",
            "referencia_contrato": "4148.010.26.1.0519-2025",
            "url_proceso": "https://community.secop.gov.co/Public/Tendering/OpportunityDetail/Index?noticeUID=CO1.NTC.7813144&isFromPublicArea=True&isModal=False",
            "bpin": 2024760010215,
            "estado": "Terminado",
            "tipo_intervencion": "Mantenimiento",
            "fuente_financiacion": "Ingresos libre destinación",
            "presupuesto_base": 1612903,
            "ano": 2025,
            "avance_obra": 100.0,
            "fecha_inicio": "03-04-2025",
            "fecha_fin": "30-11-2025",
            "fecha_inicio_std": "2025-04-03T00:00:00",
            "fecha_fin_std": "2025-11-30T00:00:00",
            "frente_activo": "No aplica",
            "fuera_rango": null
          }
        ],
        "presupuesto_base": 1703141393,
        "avance_obra": 32.88
      }
    },
    {
      "type": "Feature",
      "geometry": null,
      "properties": {
        "upid": "UNP-109",
        "n_intervenciones": 4,
        "nombre_up": "Biblioteca Pública Centro Cultural los Naranjos Ii",
        "nombre_up_detalle": "Sede Principal",
        "nombre_centro_gestor": "Secretaría de Cultura",
        "direccion": "Tv. 103 # 84",
        "tipo_equipamiento": "Bibliotecas",
        "clase_up": "Obras equipamientos",
        "comuna_corregimiento": "COMUNA 14",
        "comuna_corregimiento_2": null,
        "barrio_vereda": "Los Naranjos II",
        "barrio_vereda_2": null,
        "identificador": "Mantenimiento Bibliotecas",
        "bpin": 2024760010215,
        "lat": null,
        "lon": null,
        "intervenciones": [
          {
            "intervencion_id": "UNP-109-01",
            "referencia_proceso": "4148.010.32.1.0979-2025",
            "referencia_contrato": "4148.010.26.1.1418-2025",
            "url_proceso": "https://community.secop.gov.co/Public/Tendering/OpportunityDetail/Index?noticeUID=CO1.NTC.8534337&isFromPublicArea=True&isModal=False",
            "bpin": 2024760010215,
            "estado": "En alistamiento",
            "tipo_intervencion": "Mantenimiento",
            "fuente_financiacion": "Empréstito",
            "presupuesto_base": 771582153,
            "ano": 2025,
            "avance_obra": 0.0,
            "fecha_inicio": "15-11-2025",
            "fecha_fin": "28-02-2026",
            "fecha_inicio_std": "2025-11-15T00:00:00",
            "fecha_fin_std": "2026-02-28T00:00:00",
            "frente_activo": "No aplica",
            "fuera_rango": null
          },
          {
            "intervencion_id": "UNP-109-02",
            "referencia_proceso": "4148.010.32.1.0424-2025",
            "referencia_contrato": "4148.010.26.1.0522-2025",
            "url_proceso": "https://community.secop.gov.co/Public/Tendering/OpportunityDetail/Index?noticeUID=CO1.NTC.7857151&isFromPublicArea=True&isModal=False",
            "bpin": 2024760010215,
            "estado": "Terminado",
            "tipo_intervencion": "Mantenimiento",
            "fuente_financiacion": "Ingresos libre destinación",
            "presupuesto_base": 19845996,
            "ano": 2025,
            "avance_obra": 100.0,
            "fecha_inicio": "13-05-2025",
            "fecha_fin": "15-12-2025",
            "fecha_inicio_std": "2025-05-13T00:00:00",
            "fecha_fin_std": "2025-12-15T00:00:00",
            "frente_activo": "No aplica",
            "fuera_rango": null
          },
          {
            "intervencion_id": "UNP-109-03",
            "referencia_proceso": "4148.010.32.1.0924-2025",
            "referencia_contrato": "4148.010.26.1.0912-2025",
            "url_proceso": "https://community.secop.gov.co/Public/Tendering/OpportunityDetail/Index?noticeUID=CO1.NTC.8222732&isFromPublicArea=True&isModal=False",
            "bpin": 2024760010215,
            "estado": "Terminado",
            "tipo_intervencion": "Mantenimiento",
            "fuente_financiacion": "Ingresos libre destinación",
            "presupuesto_base": 3021429,
            "ano": 2025,
            "avance_obra": 100.0,
            "fecha_inicio": "24-07-2025",
            "fecha_fin": "15-12-2025",
            "fecha_inicio_std": "2025-07-24T00:00:00",
            "fecha_fin_std": "2025-12-15T00:00:00",
            "frente_activo": "No aplica",
            "fuera_rango": null
          },
          {
            "intervencion_id": "UNP-109-04",
            "referencia_proceso": "4148.010.32.1.0924-2025",
            "referencia_contrato": "4148.010.26.1.0912-2025",
            "url_proceso": "https://community.secop.gov.co/Public/Tendering/OpportunityDetail/Index?noticeUID=CO1.NTC.8222732&isFromPublicArea=True&isModal=False",
            "bpin": 2024760010215,
            "estado": "Terminado",
            "tipo_intervencion": "Mantenimiento",
            "fuente_financiacion": "Ingresos libre destinación",
            "presupuesto_base": 1500000,
            "ano": 2025,
            "avance_obra": 100.0,
            "fecha_inicio": "24-07-2025",
            "fecha_fin": "15-12-2025",
            "fecha_inicio_std": "2025-07-24T00:00:00",
            "fecha_fin_std": "2025-12-15T00:00:00",
            "frente_activo": "No aplica",
            "fuera_rango": null
          }
        ],
        "presupuesto_base": 795949578,
        "avance_obra": 3.06
      }
    },
    {
      "type": "Feature",
      "geometry": {
        "type": "Point",
        "coordinates": [
          -76.58951,
          3.464195
        ]
      },
      "properties": {
        "lat": 3.464195,
        "lon": -76.58951,
        "upid": "UNP-110",
        "n_intervenciones": 1,
        "nombre_up": "I.E. Luis Fernando Caicedo",
        "nombre_up_detalle": "Principal",
        "nombre_centro_gestor": "Secretaría de Educación",
        "direccion": "Av 5a Oeste # 47 -04",
        "tipo_equipamiento": "Instituciones Educativas",
        "clase_up": "Obras equipamientos",
        "comuna_corregimiento": "El Saladito",
        "comuna_corregimiento_2": "El Saladito",
        "barrio_vereda": "MontaÃ±uelas",
        "barrio_vereda_2": "MontaÃ±uelas",
        "identificador": "Grupo 22 Sedes (empréstito)",
        "bpin": 2023760010146,
        "intervenciones": [
          {
            "intervencion_id": "UNP-110-01",
            "referencia_proceso": "Obra: 4143.010.32.0876-2025\nInterventoria: 4143.010.32.1544-20252",
            "referencia_contrato": "Obra: 4143.010.26.1.1743-2025\nInterventoria: 4143.010.26.1.1741-2025",
            "url_proceso": "https://community.secop.gov.co/Public/Tendering/OpportunityDetail/Index?noticeUID=CO1.NTC.8657537&isFromPublicArea=True&isModal=False https://community.secop.gov.co/Public/Tendering/OpportunityDetail/Index?noticeUID=CO1.NTC.8725902&isFromPublicArea=True&isModal=False",
            "bpin": 2023760010146,
            "estado": "En ejecución",
            "tipo_intervencion": "Adecuaciones",
            "fuente_financiacion": "Empréstito",
            "presupuesto_base": 707333965,
            "ano": 2025,
            "avance_obra": 2.0,
            "fecha_inicio": "23-12-2025",
            "fecha_fin": "31-03-2026",
            "fecha_inicio_std": "2025-12-23T00:00:00",
            "fecha_fin_std": "2026-03-31T00:00:00",
            "frente_activo": "Frente activo",
            "fuera_rango": "ACEPTABLE",
            "lat": 3.464195,
            "lon": -76.58951
          }
        ],
        "presupuesto_base": 707333965,
        "avance_obra": 2.0
      }
    },
    {
      "type": "Feature",
      "geometry": {
        "type": "Point",
        "coordinates": [
          -76.555957,
          3.451589
        ]
      },
      "properties": {
        "lat": 3.451589,
        "lon": -76.555957,
        "upid": "UNP-111",
        "n_intervenciones": 1,
        "nombre_up": "I.E. Isaias Gamboa",
        "nombre_up_detalle": "Principal",
        "nombre_centro_gestor": "Secretaría de Educación",
        "direccion": "Av 4 Oeste 12 05",
        "tipo_equipamiento": "Instituciones Educativas",
        "clase_up": "Obras equipamientos",
        "comuna_corregimiento": "COMUNA 01",
        "comuna_corregimiento_2": "COMUNA 01",
        "barrio_vereda": "Terron Colorado",
        "barrio_vereda_2": "Terron Colorado",
        "identificador": "Grupo 22 Sedes (empréstito)",
        "bpin": 2023760010146,
        "intervenciones": [
          {
            "intervencion_id": "UNP-111-01",
            "referencia_proceso": "Obra: 4143.010.32.0876-2025\nInterventoria: 4143.010.32.1544-2025",
            "referencia_contrato": "Obra: 4143.010.26.1.1743-2025\nInterventoria: 4143.010.26.1.1741-2025",
            "url_proceso": "https://community.secop.gov.co/Public/Tendering/OpportunityDetail/Index?noticeUID=CO1.NTC.8657537&isFromPublicArea=True&isModal=False, https://community.secop.gov.co/Public/Tendering/OpportunityDetail/Index?noticeUID=CO1.NTC.8725902&isFromPublicArea=True&isModal=False",
            "bpin": 2023760010146,
            "estado": "En ejecución",
            "tipo_intervencion": "Adecuaciones",
            "fuente_financiacion": "Empréstito",
            "presupuesto_base": 410760582,
            "ano": 2025,
            "avance_obra": 24.0,
            "fecha_inicio": "15-12-2025",
            "fecha_fin": "31-03-2026",
            "fecha_inicio_std": "2025-12-15T00:00:00",
            "fecha_fin_std": "2026-03-31T00:00:00",
            "frente_activo": "Frente activo",
            "fuera_rango": "ACEPTABLE",
            "lat": 3.451589,
            "lon": -76.555957
          }
        ],
        "presupuesto_base": 410760582,
        "avance_obra": 24.0
      }
    },
    {
      "type": "Feature",
      "geometry": {
        "type": "Point",
        "coordinates": [
          -76.54293,
          3.442301
        ]
      },
      "properties": {
        "lat": 3.442301,
        "lon": -76.54293,
        "upid": "UNP-112",
        "n_intervenciones": 2,
        "nombre_up": "I.E. Normal Superior los Farallones",
        "nombre_up_detalle": "Martin Restrepo Mejia",
        "nombre_centro_gestor": "Secretaría de Educación",
        "direccion": "Kr 22 Oeste 2 65",
        "tipo_equipamiento": "Instituciones Educativas",
        "clase_up": "Obras equipamientos",
        "comuna_corregimiento": "COMUNA 03",
        "comuna_corregimiento_2": "COMUNA 03",
        "barrio_vereda": "Navarro - La Chanca",
        "barrio_vereda_2": "Navarro - La Chanca",
        "identificador": "Frente de Obra Ejecutada 2024 - P. Participativo 2024",
        "bpin": 2023760010035,
        "intervenciones": [
          {
            "intervencion_id": "UNP-112-01",
            "referencia_proceso": [
              "4143.010.32.0469-2024",
              "4143.010.32.0724-2024"
            ],
            "referencia_contrato": [
              "4143.010.26. 1314-2024",
              "4143.010.26.1.1317-2024"
            ],
            "url_proceso": "https://community.secop.gov.co/Public/Tendering/ContractNoticePhases/View?PPI=CO1.PPI.31482960&isFromPublicArea=True&isModal=False",
            "bpin": 2023760010035,
            "estado": "Terminado",
            "tipo_intervencion": "Adecuaciones",
            "fuente_financiacion": "Presupuesto Participativo",
            "presupuesto_base": 120000000,
            "ano": 2024,
            "avance_obra": 100.0,
            "fecha_inicio": "2024-05-09T00:00:00",
            "fecha_fin": "2025-01-15T00:00:00",
            "fecha_inicio_std": "2024-05-09T00:00:00",
            "fecha_fin_std": "2025-01-15T00:00:00",
            "frente_activo": "No aplica",
            "fuera_rango": "ACEPTABLE",
            "lat": 3.442301,
            "lon": -76.54293
          },
          {
            "intervencion_id": "UNP-112-02",
            "referencia_proceso": [
              "4143.010.32.1122-2024",
              "4143.010.32.1123-2024"
            ],
            "referencia_contrato": [
              "4143.010.26.1.1374-2024",
              "4143.010.26.1.1375-2024"
            ],
            "url_proceso": "https://community.secop.gov.co/Public/Tendering/OpportunityDetail/Index?noticeUID=CO1.NTC.6816743&isFromPublicArea=True&isModal=False\nhttps://community.secop.gov.co/Public/Tendering/OpportunityDetail/Index?noticeUID=CO1.NTC.6823364&isFromPublicArea=True&isModal=False",
            "bpin": 2023760010035,
            "estado": "Terminado",
            "tipo_intervencion": "Adecuaciones",
            "fuente_financiacion": "Presupuesto Participativo",
            "presupuesto_base": 100000000,
            "ano": 2024,
            "avance_obra": 100.0,
            "fecha_inicio": "2024-01-11T00:00:00",
            "fecha_fin": "31/12/2024",
            "fecha_inicio_std": "2024-01-11T00:00:00",
            "fecha_fin_std": "2024-12-31T00:00:00",
            "frente_activo": "No aplica",
            "fuera_rango": "ACEPTABLE",
            "lat": 3.442301,
            "lon": -76.54293
          }
        ],
        "presupuesto_base": 220000000,
        "avance_obra": 100.0
      }
    },
    {
      "type": "Feature",
      "geometry": {
        "type": "Point",
        "coordinates": [
          -76.58256,
          3.501153
        ]
      },
      "properties": {
        "lat": 3.501153,
        "lon": -76.58256,
        "upid": "UNP-113",
        "n_intervenciones": 1,
        "nombre_up": "I.E. la Paz",
        "nombre_up_detalle": "La Granja",
        "nombre_centro_gestor": "Secretaría de Educación",
        "direccion": "Ind Vereda la Granja",
        "tipo_equipamiento": "Instituciones Educativas",
        "clase_up": "Obras equipamientos",
        "comuna_corregimiento": "La Castilla",
        "comuna_corregimiento_2": "La Castilla",
        "barrio_vereda": "La Castilla",
        "barrio_vereda_2": "La Castilla (Cabecera)",
        "identificador": "Presupuesto Participativo 2025",
        "bpin": 2024760010263,
        "intervenciones": [
          {
            "intervencion_id": "UNP-113-01",
            "referencia_proceso": "Obra: 4143.010.32.0860-2025\nInterventoria: 4143.010.32.0856-2025",
            "referencia_contrato": "Obra: 4143.010.26.1.1647.2025\nInterventoria: 4143.010.26.1.1536.2025",
            "url_proceso": "https://community.secop.gov.co/Public/Common/GoogleReCaptcha/Index?previousUrl=https%3a%2f%2fcommunity.secop.gov.co%2fPublic%2fTendering%2fOpportunityDetail%2fIndex%3fnoticeUID%3dCO1.NTC.8297173%26isFromPublicArea%3dTrue%26isModal%3dFalse, https://community.secop.gov.co/Public/Tendering/OpportunityDetail/Index?noticeUID=CO1.NTC.8286364&isFromPublicArea=True&isModal=False",
            "bpin": 2024760010263,
            "estado": "Terminado",
            "tipo_intervencion": "Adecuaciones",
            "fuente_financiacion": "Presupuesto Participativo",
            "presupuesto_base": 56030947,
            "ano": 2025,
            "avance_obra": 100.0,
            "fecha_inicio": "2025-11-18T00:00:00",
            "fecha_fin": "2025-12-22T00:00:00",
            "fecha_inicio_std": "2025-11-18T00:00:00",
            "fecha_fin_std": "2025-12-22T00:00:00",
            "frente_activo": "No aplica",
            "fuera_rango": "ACEPTABLE",
            "lat": 3.501153,
            "lon": -76.58256
          }
        ],
        "presupuesto_base": 56030947,
        "avance_obra": 100.0
      }
    },
    {
      "type": "Feature",
      "geometry": {
        "type": "Point",
        "coordinates": [
          -76.619941,
          3.513169
        ]
      },
      "properties": {
        "lat": 3.513169,
        "lon": -76.619941,
        "upid": "UNP-114",
        "n_intervenciones": 1,
        "nombre_up": "I.E. Francisco Jose Lloreda Mera",
        "nombre_up_detalle": "Francisco Miranda",
        "nombre_centro_gestor": "Secretaría de Educación",
        "direccion": "Km 17 Via Al Mar Corregimiento la Elvira",
        "tipo_equipamiento": "Instituciones Educativas",
        "clase_up": "Obras equipamientos",
        "comuna_corregimiento": "La Elvira",
        "comuna_corregimiento_2": "La Elvira",
        "barrio_vereda": "Los Laureles",
        "barrio_vereda_2": "Km 18",
        "identificador": "Frente de Obra Contratada en 2024",
        "bpin": 2023760010146,
        "intervenciones": [
          {
            "intervencion_id": "UNP-114-01",
            "referencia_proceso": "4143.010.32.0829-2024",
            "referencia_contrato": "4143.010.26.1.1320-2024",
            "url_proceso": "https://community.secop.gov.co/Public/Tendering/OpportunityDetail/Index?noticeUID=CO1.NTC.6451024&isFromPublicArea=True&isModal=False",
            "bpin": 2023760010146,
            "estado": "Terminado",
            "tipo_intervencion": "Adecuaciones",
            "fuente_financiacion": "Ingresos libre destinación",
            "presupuesto_base": 14023788,
            "ano": 2024,
            "avance_obra": 100.0,
            "fecha_inicio": "2024-09-09T00:00:00",
            "fecha_fin": "15/05/2025",
            "fecha_inicio_std": "2024-09-09T00:00:00",
            "fecha_fin_std": "2025-05-15T00:00:00",
            "frente_activo": "No aplica",
            "fuera_rango": "ACEPTABLE",
            "lat": 3.513169,
            "lon": -76.619941
          }
        ],
        "presupuesto_base": 14023788,
        "avance_obra": 100.0
      }
    },
    {
      "type": "Feature",
      "geometry": {
        "type": "Point",
        "coordinates": [
          -76.60761,
          3.520391
        ]
      },
      "properties": {
        "lat": 3.520391,
        "lon": -76.60761,
        "upid": "UNP-115",
        "n_intervenciones": 1,
        "nombre_up": "I.E. Francisco Jose Lloreda Mera",
        "nombre_up_detalle": "Boyaca",
        "nombre_centro_gestor": "Secretaría de Educación",
        "direccion": "Corregimiento la Elvira",
        "tipo_equipamiento": "Instituciones Educativas",
        "clase_up": "Obras equipamientos",
        "comuna_corregimiento": "La Elvira",
        "comuna_corregimiento_2": "La Elvira",
        "barrio_vereda": "La Elvira",
        "barrio_vereda_2": "La Elvira (Cabecera)",
        "identificador": "Presupuesto Participativo 2025",
        "bpin": 2024760010265,
        "intervenciones": [
          {
            "intervencion_id": "UNP-115-01",
            "referencia_proceso": "Obra: 4143.010.32.0860-2025\nInterventoria: 4143.010.32.0856-2025",
            "referencia_contrato": "Obra: 4143.010.26.1.1647.2025\nInterventoria: 4143.010.26.1.1536.2025",
            "url_proceso": "https://community.secop.gov.co/Public/Common/GoogleReCaptcha/Index?previousUrl=https%3a%2f%2fcommunity.secop.gov.co%2fPublic%2fTendering%2fOpportunityDetail%2fIndex%3fnoticeUID%3dCO1.NTC.8297173%26isFromPublicArea%3dTrue%26isModal%3dFalse, https://community.secop.gov.co/Public/Tendering/OpportunityDetail/Index?noticeUID=CO1.NTC.8286364&isFromPublicArea=True&isModal=False",
            "bpin": 2024760010265,
            "estado": "En ejecución",
            "tipo_intervencion": "Adecuaciones",
            "fuente_financiacion": "Presupuesto Participativo",
            "presupuesto_base": 108262077,
            "ano": 2025,
            "avance_obra": 94.0,
            "fecha_inicio": "2025-10-27T00:00:00",
            "fecha_fin": "2026-01-31T00:00:00",
            "fecha_inicio_std": "2025-10-27T00:00:00",
            "fecha_fin_std": "2026-01-31T00:00:00",
            "frente_activo": "Frente activo",
            "fuera_rango": "ACEPTABLE",
            "lat": 3.520391,
            "lon": -76.60761
          }
        ],
        "presupuesto_base": 108262077,
        "avance_obra": 94.0
      }
    },
    {
      "type": "Feature",
      "geometry": {
        "type": "Point",
        "coordinates": [
          -76.632019,
          3.453399
        ]
      },
      "properties": {
        "lat": 3.453399,
        "lon": -76.632019,
        "upid": "UNP-116",
        "n_intervenciones": 1,
        "nombre_up": "I.E. la Leonera",
        "nombre_up_detalle": "Juan de los Barrios",
        "nombre_centro_gestor": "Secretaría de Educación",
        "direccion": "Km 17 Via Al Mar Corregimiento la Elvira",
        "tipo_equipamiento": "Instituciones Educativas",
        "clase_up": "Obras equipamientos",
        "comuna_corregimiento": "La Leonera",
        "comuna_corregimiento_2": "La Leonera",
        "barrio_vereda": "El Pajuil",
        "barrio_vereda_2": "El Pajuil",
        "identificador": "Presupuesto Participativo 2025",
        "bpin": 2024760010262,
        "intervenciones": [
          {
            "intervencion_id": "UNP-116-01",
            "referencia_proceso": "Obra: 4143.010.32.0860-2025\nInterventoria: 4143.010.32.0856-2025",
            "referencia_contrato": "Obra: 4143.010.26.1.1647.2025\nInterventoria: 4143.010.26.1.1536.2025",
            "url_proceso": "https://community.secop.gov.co/Public/Common/GoogleReCaptcha/Index?previousUrl=https%3a%2f%2fcommunity.secop.gov.co%2fPublic%2fTendering%2fOpportunityDetail%2fIndex%3fnoticeUID%3dCO1.NTC.8297173%26isFromPublicArea%3dTrue%26isModal%3dFalse, https://community.secop.gov.co/Public/Tendering/OpportunityDetail/Index?noticeUID=CO1.NTC.8286364&isFromPublicArea=True&isModal=False",
            "bpin": 2024760010262,
            "estado": "En ejecución",
            "tipo_intervencion": "Adecuaciones",
            "fuente_financiacion": "Presupuesto Participativo",
            "presupuesto_base": 150000000,
            "ano": 2025,
            "avance_obra": 93.0,
            "fecha_inicio": "2025-10-21T00:00:00",
            "fecha_fin": "2026-01-31T00:00:00",
            "fecha_inicio_std": "2025-10-21T00:00:00",
            "fecha_fin_std": "2026-01-31T00:00:00",
            "frente_activo": "Frente activo",
            "fuera_rango": "ACEPTABLE",
            "lat": 3.453399,
            "lon": -76.632019
          }
        ],
        "presupuesto_base": 150000000,
        "avance_obra": 93.0
      }
    },
    {
      "type": "Feature",
      "geometry": {
        "type": "Point",
        "coordinates": [
          -76.651118,
          3.42777
        ]
      },
      "properties": {
        "lat": 3.42777,
        "lon": -76.651118,
        "upid": "UNP-117",
        "n_intervenciones": 1,
        "nombre_up": "I.E. los Andes",
        "nombre_up_detalle": "Juan Pablo I",
        "nombre_centro_gestor": "Secretaría de Educación",
        "direccion": "Corregimiento los Andes Verede Peñas Blancas",
        "tipo_equipamiento": "Instituciones Educativas",
        "clase_up": "Obras equipamientos",
        "comuna_corregimiento": "Los Andes",
        "comuna_corregimiento_2": "Los Andes",
        "barrio_vereda": "Carpatos",
        "barrio_vereda_2": "Carpatos",
        "identificador": "Grupo 22 Sedes (empréstito)",
        "bpin": 2023760010146,
        "intervenciones": [
          {
            "intervencion_id": "UNP-117-01",
            "referencia_proceso": "Obra: 4143.010.32.0876-2025 \nInterventoria: 4143.010.32.1544-2025",
            "referencia_contrato": "Obra: 4143.010.26.1.1743.2025\nInterventoria: 4143.010.26.1.1741.2025",
            "url_proceso": "https://community.secop.gov.co/Public/Tendering/OpportunityDetail/Index?noticeUID=CO1.NTC.8657537&isFromPublicArea=True&isModal=False, https://community.secop.gov.co/Public/Tendering/OpportunityDetail/Index?noticeUID=CO1.NTC.8725902&isFromPublicArea=True&isModal=False",
            "bpin": 2023760010146,
            "estado": "En alistamiento",
            "tipo_intervencion": "Adecuaciones",
            "fuente_financiacion": "Empréstito",
            "presupuesto_base": 549999995,
            "ano": 2025,
            "avance_obra": 0.0,
            "fecha_inicio": null,
            "fecha_fin": "31-03-2026",
            "fecha_inicio_std": null,
            "fecha_fin_std": "2026-03-31T00:00:00",
            "frente_activo": "No aplica",
            "fuera_rango": "ACEPTABLE",
            "lat": 3.42777,
            "lon": -76.651118
          }
        ],
        "presupuesto_base": 549999995,
        "avance_obra": 0.0
      }
    },
    {
      "type": "Feature",
      "geometry": {
        "type": "Point",
        "coordinates": [
          -76.617004,
          3.424103
        ]
      },
      "properties": {
        "lat": 3.424103,
        "lon": -76.617004,
        "upid": "UNP-118",
        "n_intervenciones": 1,
        "nombre_up": "I.E. los Andes",
        "nombre_up_detalle": "Francisco Jose de Caldas",
        "nombre_centro_gestor": "Secretaría de Educación",
        "direccion": "Corregimiento los Andes Cabecera",
        "tipo_equipamiento": "Instituciones Educativas",
        "clase_up": "Obras equipamientos",
        "comuna_corregimiento": "Los Andes",
        "comuna_corregimiento_2": "Los Andes",
        "barrio_vereda": "Los Andes",
        "barrio_vereda_2": "Los Andes (Cabecera)",
        "identificador": "Frente de Obra Contratada en 2024",
        "bpin": 2023760010146,
        "intervenciones": [
          {
            "intervencion_id": "UNP-118-01",
            "referencia_proceso": "4143.010.32.0829-2024",
            "referencia_contrato": "4143.010.26.1.1320-2024",
            "url_proceso": "https://community.secop.gov.co/Public/Tendering/OpportunityDetail/Index?noticeUID=CO1.NTC.6451024&isFromPublicArea=True&isModal=False",
            "bpin": 2023760010146,
            "estado": "Terminado",
            "tipo_intervencion": "Adecuaciones",
            "fuente_financiacion": "Ingresos libre destinación",
            "presupuesto_base": 27991760,
            "ano": 2024,
            "avance_obra": 100.0,
            "fecha_inicio": "2024-09-09T00:00:00",
            "fecha_fin": "15/05/2025",
            "fecha_inicio_std": "2024-09-09T00:00:00",
            "fecha_fin_std": "2025-05-15T00:00:00",
            "frente_activo": "No aplica",
            "fuera_rango": "ACEPTABLE",
            "lat": 3.424103,
            "lon": -76.617004
          }
        ],
        "presupuesto_base": 27991760,
        "avance_obra": 100.0
      }
    },
    {
      "type": "Feature",
      "geometry": {
        "type": "Point",
        "coordinates": [
          -76.555299,
          3.471958
        ]
      },
      "properties": {
        "lat": 3.471958,
        "lon": -76.555299,
        "upid": "UNP-119",
        "n_intervenciones": 1,
        "nombre_up": "I.E. Montebello",
        "nombre_up_detalle": "Andrés Joaquin Lenis",
        "nombre_centro_gestor": "Secretaría de Educación",
        "direccion": "Vereda Campoalegre",
        "tipo_equipamiento": "Instituciones Educativas",
        "clase_up": "Obras equipamientos",
        "comuna_corregimiento": "Montebello",
        "comuna_corregimiento_2": "Montebello",
        "barrio_vereda": "Campoalegre",
        "barrio_vereda_2": "Campoalegre",
        "identificador": "Presupuesto Participativo 2025",
        "bpin": 2024760010266,
        "intervenciones": [
          {
            "intervencion_id": "UNP-119-01",
            "referencia_proceso": "Obra: 4143.010.32.0860-2025\nInterventoria: 4143.010.32.0856-2025",
            "referencia_contrato": "Obra: 4143.010.26.1.1645.2025\nInterventoria: 4143.010.26.1.1536.2025",
            "url_proceso": "https://community.secop.gov.co/Public/Common/GoogleReCaptcha/Index?previousUrl=https%3a%2f%2fcommunity.secop.gov.co%2fPublic%2fTendering%2fOpportunityDetail%2fIndex%3fnoticeUID%3dCO1.NTC.8297173%26isFromPublicArea%3dTrue%26isModal%3dFalse, https://community.secop.gov.co/Public/Tendering/OpportunityDetail/Index?noticeUID=CO1.NTC.8286364&isFromPublicArea=True&isModal=False",
            "bpin": 2024760010266,
            "estado": "En ejecución",
            "tipo_intervencion": "Adecuaciones",
            "fuente_financiacion": "Presupuesto Participativo",
            "presupuesto_base": 157977464,
            "ano": 2025,
            "avance_obra": 78.0,
            "fecha_inicio": "2025-10-23T00:00:00",
            "fecha_fin": "2026-01-31T00:00:00",
            "fecha_inicio_std": "2025-10-23T00:00:00",
            "fecha_fin_std": "2026-01-31T00:00:00",
            "frente_activo": "Frente activo",
            "fuera_rango": "ACEPTABLE",
            "lat": 3.471958,
            "lon": -76.555299
          }
        ],
        "presupuesto_base": 157977464,
        "avance_obra": 78.0
      }
    },
    {
      "type": "Feature",
      "geometry": {
        "type": "Point",
        "coordinates": [
          -76.516754,
          3.351577
        ]
      },
      "properties": {
        "lat": 3.351577,
        "lon": -76.516754,
        "upid": "UNP-120",
        "n_intervenciones": 1,
        "nombre_up": "I.E. Incolballet",
        "nombre_up_detalle": "Principal",
        "nombre_centro_gestor": "Secretaría de Educación",
        "direccion": "Km 4 Via Jamundi",
        "tipo_equipamiento": "Instituciones Educativas",
        "clase_up": "Obras equipamientos",
        "comuna_corregimiento": "Suelo Expansión",
        "comuna_corregimiento_2": null,
        "barrio_vereda": "Andalucía",
        "barrio_vereda_2": null,
        "identificador": "Frente de Obra Contratada en 2025",
        "bpin": 2023760010146,
        "intervenciones": [
          {
            "intervencion_id": "UNP-120-01",
            "referencia_proceso": [
              "4143.010.32.0829-2025",
              "4143.010.32.0863-2025"
            ],
            "referencia_contrato": [
              "4143.010.26.1.0943.2025",
              "4143.010.26.1.0952.2025"
            ],
            "url_proceso": null,
            "bpin": 2023760010146,
            "estado": "Terminado",
            "tipo_intervencion": "Adecuaciones",
            "fuente_financiacion": "Ingresos libre destinación",
            "presupuesto_base": 12124800,
            "ano": 2025,
            "avance_obra": 100.0,
            "fecha_inicio": "2025",
            "fecha_fin": "2025",
            "fecha_inicio_std": "2025-01-01T00:00:00",
            "fecha_fin_std": "2025-01-01T00:00:00",
            "frente_activo": "No aplica",
            "fuera_rango": "FUERA DE RANGO",
            "lat": 3.351577,
            "lon": -76.516754
          }
        ],
        "presupuesto_base": 12124800,
        "avance_obra": 100.0
      }
    },
    {
      "type": "Feature",
      "geometry": {
        "type": "Point",
        "coordinates": [
          -76.591968,
          3.391733
        ]
      },
      "properties": {
        "lat": 3.391733,
        "lon": -76.591968,
        "upid": "UNP-121",
        "n_intervenciones": 2,
        "nombre_up": "I.E. Villacarmelo",
        "nombre_up_detalle": "Principal",
        "nombre_centro_gestor": "Secretaría de Educación",
        "direccion": "Vereda la Fonda",
        "tipo_equipamiento": "Instituciones Educativas",
        "clase_up": "Obras equipamientos",
        "comuna_corregimiento": "Villacarmelo",
        "comuna_corregimiento_2": "Villacarmelo",
        "barrio_vereda": "La Fonda",
        "barrio_vereda_2": "La Fonda",
        "identificador": "Frente de Obra Contratada en 2024",
        "bpin": 2023760010146,
        "intervenciones": [
          {
            "intervencion_id": "UNP-121-01",
            "referencia_proceso": "4143.010.32.0829-2024",
            "referencia_contrato": "4143.010.26.1.1320-2024",
            "url_proceso": "https://community.secop.gov.co/Public/Tendering/OpportunityDetail/Index?noticeUID=CO1.NTC.6451024&isFromPublicArea=True&isModal=False",
            "bpin": 2023760010146,
            "estado": "Terminado",
            "tipo_intervencion": "Adecuaciones",
            "fuente_financiacion": "Ingresos libre destinación",
            "presupuesto_base": 12561356,
            "ano": 2024,
            "avance_obra": 100.0,
            "fecha_inicio": "2024-09-09T00:00:00",
            "fecha_fin": "15/05/2025",
            "fecha_inicio_std": "2024-09-09T00:00:00",
            "fecha_fin_std": "2025-05-15T00:00:00",
            "frente_activo": "No aplica",
            "fuera_rango": "ACEPTABLE",
            "lat": 3.391733,
            "lon": -76.591968
          },
          {
            "intervencion_id": "UNP-121-02",
            "referencia_proceso": null,
            "referencia_contrato": null,
            "url_proceso": null,
            "bpin": 26005338,
            "estado": "En alistamiento",
            "tipo_intervencion": "Adecuaciones",
            "fuente_financiacion": "Ingresos libre destinación",
            "presupuesto_base": 821120550,
            "ano": 2025,
            "avance_obra": 0.0,
            "fecha_inicio": 2025,
            "fecha_fin": "2025-12-31T00:00:00",
            "fecha_inicio_std": "2025-01-01T00:00:00",
            "fecha_fin_std": "2025-12-31T00:00:00",
            "frente_activo": "No aplica",
            "fuera_rango": "ACEPTABLE",
            "lat": 3.391733,
            "lon": -76.591968
          }
        ],
        "presupuesto_base": 833681906,
        "avance_obra": 1.51
      }
    },
    {
      "type": "Feature",
      "geometry": {
        "type": "Point",
        "coordinates": [
          -76.504067,
          3.470482
        ]
      },
      "properties": {
        "lat": 3.470482,
        "lon": -76.504067,
        "upid": "UNP-122",
        "n_intervenciones": 1,
        "nombre_up": "I.E. Simon Rodriguez",
        "nombre_up_detalle": "Principal",
        "nombre_centro_gestor": "Secretaría de Educación",
        "direccion": "Kr 1 D Bis 49 98",
        "tipo_equipamiento": "Instituciones Educativas",
        "clase_up": "Obras equipamientos",
        "comuna_corregimiento": "COMUNA 05",
        "comuna_corregimiento_2": "COMUNA 05",
        "barrio_vereda": "El Sena",
        "barrio_vereda_2": "El Sena",
        "identificador": "Salas de Bilingüismo",
        "bpin": 26005338,
        "intervenciones": [
          {
            "intervencion_id": "UNP-122-01",
            "referencia_proceso": null,
            "referencia_contrato": null,
            "url_proceso": null,
            "bpin": 26005338,
            "estado": "Terminado",
            "tipo_intervencion": "Adecuaciones",
            "fuente_financiacion": "Ingresos libre destinación",
            "presupuesto_base": 783082000,
            "ano": 2024,
            "avance_obra": 100.0,
            "fecha_inicio": "2024-07-16T00:00:00",
            "fecha_fin": "2024-12-20T00:00:00",
            "fecha_inicio_std": "2024-07-16T00:00:00",
            "fecha_fin_std": "2024-12-20T00:00:00",
            "frente_activo": "No aplica",
            "fuera_rango": "ACEPTABLE",
            "lat": 3.470482,
            "lon": -76.504067
          }
        ],
        "presupuesto_base": 783082000,
        "avance_obra": 100.0
      }
    },
    {
      "type": "Feature",
      "geometry": {
        "type": "Point",
        "coordinates": [
          -76.525132,
          3.454242
        ]
      },
      "properties": {
        "lat": 3.454242,
        "lon": -76.525132,
        "upid": "UNP-123",
        "n_intervenciones": 1,
        "nombre_up": "I.E. Santa Librada",
        "nombre_up_detalle": "República de México",
        "nombre_centro_gestor": "Secretaría de Educación",
        "direccion": "Cl 20 5 65",
        "tipo_equipamiento": "Instituciones Educativas",
        "clase_up": "Obras equipamientos",
        "comuna_corregimiento": "COMUNA 03",
        "comuna_corregimiento_2": "COMUNA 03",
        "barrio_vereda": "San Nicolás",
        "barrio_vereda_2": "San Nicolás",
        "identificador": "Presupuesto Participativo 2025",
        "bpin": 2024760010244,
        "intervenciones": [
          {
            "intervencion_id": "UNP-123-01",
            "referencia_proceso": "Obra: 4143.010.32.0860-2025\nInterventoria: 4143.010.32.0856-2025",
            "referencia_contrato": "Obra: 4143.010.26.1.1658.2025\nInterventoria: 4143.010.26.1.1536.2025",
            "url_proceso": "https://community.secop.gov.co/Public/Common/GoogleReCaptcha/Index?previousUrl=https%3a%2f%2fcommunity.secop.gov.co%2fPublic%2fTendering%2fOpportunityDetail%2fIndex%3fnoticeUID%3dCO1.NTC.8297173%26isFromPublicArea%3dTrue%26isModal%3dFalse, https://community.secop.gov.co/Public/Tendering/OpportunityDetail/Index?noticeUID=CO1.NTC.8286364&isFromPublicArea=True&isModal=False",
            "bpin": 2024760010244,
            "estado": "Terminado",
            "tipo_intervencion": "Adecuaciones",
            "fuente_financiacion": "Presupuesto Participativo",
            "presupuesto_base": 156196166,
            "ano": 2025,
            "avance_obra": 100.0,
            "fecha_inicio": "15-09-2025",
            "fecha_fin": "2025-12-22T00:00:00",
            "fecha_inicio_std": "2025-09-15T00:00:00",
            "fecha_fin_std": "2025-12-22T00:00:00",
            "frente_activo": "No aplica",
            "fuera_rango": "ACEPTABLE",
            "lat": 3.454242,
            "lon": -76.525132
          }
        ],
        "presupuesto_base": 156196166,
        "avance_obra": 100.0
      }
    },
    {
      "type": "Feature",
      "geometry": {
        "type": "Point",
        "coordinates": [
          -76.529833,
          3.409596
        ]
      },
      "properties": {
        "lat": 3.409596,
        "lon": -76.529833,
        "upid": "UNP-124",
        "n_intervenciones": 2,
        "nombre_up": "I.E. Jose Maria Vivas Balcazar",
        "nombre_up_detalle": "Principal",
        "nombre_centro_gestor": "Secretaría de Educación",
        "direccion": "Cl 14 48 a 32",
        "tipo_equipamiento": "Instituciones Educativas",
        "clase_up": "Obras equipamientos",
        "comuna_corregimiento": "COMUNA 10",
        "comuna_corregimiento_2": "COMUNA 10",
        "barrio_vereda": "La Selva",
        "barrio_vereda_2": "La Selva",
        "identificador": "Salas de Bilingüismo",
        "bpin": 26005338,
        "intervenciones": [
          {
            "intervencion_id": "UNP-124-01",
            "referencia_proceso": null,
            "referencia_contrato": null,
            "url_proceso": null,
            "bpin": 26005338,
            "estado": "Terminado",
            "tipo_intervencion": "Adecuaciones",
            "fuente_financiacion": "Ingresos libre destinación",
            "presupuesto_base": 783082000,
            "ano": 2024,
            "avance_obra": 100.0,
            "fecha_inicio": "2024-07-17T00:00:00",
            "fecha_fin": "2024-12-20T00:00:00",
            "fecha_inicio_std": "2024-07-17T00:00:00",
            "fecha_fin_std": "2024-12-20T00:00:00",
            "frente_activo": "No aplica",
            "fuera_rango": "ACEPTABLE",
            "lat": 3.409596,
            "lon": -76.529833
          },
          {
            "intervencion_id": "UNP-124-02",
            "referencia_proceso": null,
            "referencia_contrato": null,
            "url_proceso": null,
            "bpin": 0,
            "estado": "Terminado",
            "tipo_intervencion": "Adecuaciones",
            "fuente_financiacion": "Ingresos libre destinación",
            "presupuesto_base": 107039840,
            "ano": 2025,
            "avance_obra": 100.0,
            "fecha_inicio": null,
            "fecha_fin": null,
            "fecha_inicio_std": null,
            "fecha_fin_std": null,
            "frente_activo": "No aplica",
            "fuera_rango": "ACEPTABLE",
            "lat": 3.409596,
            "lon": -76.529833
          }
        ],
        "presupuesto_base": 890121840,
        "avance_obra": 100.0
      }
    },
    {
      "type": "Feature",
      "geometry": {
        "type": "Point",
        "coordinates": [
          -76.494879,
          3.444325
        ]
      },
      "properties": {
        "lat": 3.444325,
        "lon": -76.494879,
        "upid": "UNP-125",
        "n_intervenciones": 2,
        "nombre_up": "I.E. Alberto Carvajal Borrero",
        "nombre_up_detalle": "Principal",
        "nombre_centro_gestor": "Secretaría de Educación",
        "direccion": "Ind Kr 14 58 00",
        "tipo_equipamiento": "Instituciones Educativas",
        "clase_up": "Obras equipamientos",
        "comuna_corregimiento": "COMUNA 08",
        "comuna_corregimiento_2": "COMUNA 08",
        "barrio_vereda": "El Trébol",
        "barrio_vereda_2": "El Trébol",
        "identificador": "Salas de Bilingüismo",
        "bpin": 26005338,
        "intervenciones": [
          {
            "intervencion_id": "UNP-125-01",
            "referencia_proceso": null,
            "referencia_contrato": null,
            "url_proceso": null,
            "bpin": 26005338,
            "estado": "Terminado",
            "tipo_intervencion": "Adecuaciones",
            "fuente_financiacion": "Ingresos libre destinación",
            "presupuesto_base": 783082000,
            "ano": 2024,
            "avance_obra": 100.0,
            "fecha_inicio": "2024-07-18T00:00:00",
            "fecha_fin": "2024-12-20T00:00:00",
            "fecha_inicio_std": "2024-07-18T00:00:00",
            "fecha_fin_std": "2024-12-20T00:00:00",
            "frente_activo": "No aplica",
            "fuera_rango": "ACEPTABLE",
            "lat": 3.444325,
            "lon": -76.494879
          },
          {
            "intervencion_id": "UNP-125-02",
            "referencia_proceso": null,
            "referencia_contrato": null,
            "url_proceso": null,
            "bpin": 0,
            "estado": "Terminado",
            "tipo_intervencion": "Adecuaciones",
            "fuente_financiacion": "Ingresos libre destinación",
            "presupuesto_base": 49319840,
            "ano": 2025,
            "avance_obra": 100.0,
            "fecha_inicio": null,
            "fecha_fin": null,
            "fecha_inicio_std": null,
            "fecha_fin_std": null,
            "frente_activo": "No aplica",
            "fuera_rango": "ACEPTABLE",
            "lat": 3.444325,
            "lon": -76.494879
          }
        ],
        "presupuesto_base": 832401840,
        "avance_obra": 100.0
      }
    },
    {
      "type": "Feature",
      "geometry": {
        "type": "Point",
        "coordinates": [
          -76.525412,
          3.436632
        ]
      },
      "properties": {
        "lat": 3.436632,
        "lon": -76.525412,
        "upid": "UNP-126",
        "n_intervenciones": 1,
        "nombre_up": "I.E. General Alfredo Vásquez Cobo",
        "nombre_up_detalle": "Principal",
        "nombre_centro_gestor": "Secretaría de Educación",
        "direccion": "Cl 15 a 22 a 37",
        "tipo_equipamiento": "Instituciones Educativas",
        "clase_up": "Obras equipamientos",
        "comuna_corregimiento": "COMUNA 09",
        "comuna_corregimiento_2": "COMUNA 09",
        "barrio_vereda": "Guayaquil",
        "barrio_vereda_2": "Guayaquil",
        "identificador": "Salas de Bilingüismo",
        "bpin": 26005338,
        "intervenciones": [
          {
            "intervencion_id": "UNP-126-01",
            "referencia_proceso": null,
            "referencia_contrato": null,
            "url_proceso": null,
            "bpin": 26005338,
            "estado": "En alistamiento",
            "tipo_intervencion": "Adecuaciones",
            "fuente_financiacion": "Ingresos libre destinación",
            "presupuesto_base": 821120550,
            "ano": 2025,
            "avance_obra": 0.0,
            "fecha_inicio": 2025,
            "fecha_fin": "2025-12-31T00:00:00",
            "fecha_inicio_std": "2025-01-01T00:00:00",
            "fecha_fin_std": "2025-12-31T00:00:00",
            "frente_activo": "No aplica",
            "fuera_rango": "ACEPTABLE",
            "lat": 3.436632,
            "lon": -76.525412
          }
        ],
        "presupuesto_base": 821120550,
        "avance_obra": 0.0
      }
    },
    {
      "type": "Feature",
      "geometry": {
        "type": "Point",
        "coordinates": [
          -76.51353,
          3.442638
        ]
      },
      "properties": {
        "lat": 3.442638,
        "lon": -76.51353,
        "upid": "UNP-127",
        "n_intervenciones": 2,
        "nombre_up": "I.E. Evaristo García",
        "nombre_up_detalle": "Principal",
        "nombre_centro_gestor": "Secretaría de Educación",
        "direccion": "Cl 32 17 41",
        "tipo_equipamiento": "Instituciones Educativas",
        "clase_up": "Obras equipamientos",
        "comuna_corregimiento": "COMUNA 08",
        "comuna_corregimiento_2": "COMUNA 08",
        "barrio_vereda": "Saavedra Galindo",
        "barrio_vereda_2": "Saavedra Galindo",
        "identificador": "Salas de Bilingüismo",
        "bpin": 26005338,
        "intervenciones": [
          {
            "intervencion_id": "UNP-127-01",
            "referencia_proceso": null,
            "referencia_contrato": null,
            "url_proceso": null,
            "bpin": 26005338,
            "estado": "En alistamiento",
            "tipo_intervencion": "Adecuaciones",
            "fuente_financiacion": "Ingresos libre destinación",
            "presupuesto_base": 821120550,
            "ano": 2025,
            "avance_obra": 0.0,
            "fecha_inicio": 2025,
            "fecha_fin": "2025-12-31T00:00:00",
            "fecha_inicio_std": "2025-01-01T00:00:00",
            "fecha_fin_std": "2025-12-31T00:00:00",
            "frente_activo": "No aplica",
            "fuera_rango": "ACEPTABLE",
            "lat": 3.442638,
            "lon": -76.51353
          },
          {
            "intervencion_id": "UNP-127-02",
            "referencia_proceso": null,
            "referencia_contrato": null,
            "url_proceso": null,
            "bpin": 0,
            "estado": "Terminado",
            "tipo_intervencion": "Adecuaciones",
            "fuente_financiacion": "Ingresos libre destinación",
            "presupuesto_base": 49319840,
            "ano": 2025,
            "avance_obra": 100.0,
            "fecha_inicio": null,
            "fecha_fin": null,
            "fecha_inicio_std": null,
            "fecha_fin_std": null,
            "frente_activo": "No aplica",
            "fuera_rango": "ACEPTABLE",
            "lat": 3.442638,
            "lon": -76.51353
          }
        ],
        "presupuesto_base": 870440390,
        "avance_obra": 5.67
      }
    },
    {
      "type": "Feature",
      "geometry": {
        "type": "Point",
        "coordinates": [
          -76.567466,
          3.452215
        ]
      },
      "properties": {
        "lat": 3.452215,
        "lon": -76.567466,
        "upid": "UNP-128",
        "n_intervenciones": 1,
        "nombre_up": "I.E. Jose Holguin Garces",
        "nombre_up_detalle": "Principal",
        "nombre_centro_gestor": "Secretaría de Educación",
        "direccion": "Av 4 a Oeste 23 108",
        "tipo_equipamiento": "Instituciones Educativas",
        "clase_up": "Dotaciones",
        "comuna_corregimiento": "COMUNA 01",
        "comuna_corregimiento_2": "COMUNA 01",
        "barrio_vereda": "Terron Colorado",
        "barrio_vereda_2": "Terron Colorado",
        "identificador": "Sala de Lectura",
        "bpin": 0,
        "intervenciones": [
          {
            "intervencion_id": "UNP-128-01",
            "referencia_proceso": null,
            "referencia_contrato": null,
            "url_proceso": null,
            "bpin": 0,
            "estado": "Terminado",
            "tipo_intervencion": "Adecuaciones",
            "fuente_financiacion": "Ingresos libre destinación",
            "presupuesto_base": 30868000,
            "ano": 2024,
            "avance_obra": 100.0,
            "fecha_inicio": null,
            "fecha_fin": null,
            "fecha_inicio_std": null,
            "fecha_fin_std": null,
            "frente_activo": "No aplica",
            "fuera_rango": "ACEPTABLE",
            "lat": 3.452215,
            "lon": -76.567466
          }
        ],
        "presupuesto_base": 30868000,
        "avance_obra": 100.0
      }
    },
    {
      "type": "Feature",
      "geometry": {
        "type": "Point",
        "coordinates": [
          -76.547439,
          3.483882
        ]
      },
      "properties": {
        "lat": 3.483882,
        "lon": -76.547439,
        "upid": "UNP-129",
        "n_intervenciones": 1,
        "nombre_up": "I.E. Montebello",
        "nombre_up_detalle": "Principal",
        "nombre_centro_gestor": "Secretaría de Educación",
        "direccion": "Avenida 43 Oeste 5a 49",
        "tipo_equipamiento": "Instituciones Educativas",
        "clase_up": "Dotaciones",
        "comuna_corregimiento": "Montebello",
        "comuna_corregimiento_2": "Montebello",
        "barrio_vereda": "Montebello (Cabecera)",
        "barrio_vereda_2": "Montebello (Cabecera)",
        "identificador": "Biblioteca Escolar",
        "bpin": 0,
        "intervenciones": [
          {
            "intervencion_id": "UNP-129-01",
            "referencia_proceso": null,
            "referencia_contrato": null,
            "url_proceso": null,
            "bpin": 0,
            "estado": "Terminado",
            "tipo_intervencion": "Adecuaciones",
            "fuente_financiacion": "Ingresos libre destinación",
            "presupuesto_base": 107039840,
            "ano": 2025,
            "avance_obra": 100.0,
            "fecha_inicio": null,
            "fecha_fin": null,
            "fecha_inicio_std": null,
            "fecha_fin_std": null,
            "frente_activo": "No aplica",
            "fuera_rango": "ACEPTABLE",
            "lat": 3.483882,
            "lon": -76.547439
          }
        ],
        "presupuesto_base": 107039840,
        "avance_obra": 100.0
      }
    },
    {
      "type": "Feature",
      "geometry": {
        "type": "Point",
        "coordinates": [
          -76.637743,
          3.454543
        ]
      },
      "properties": {
        "lat": 3.454543,
        "lon": -76.637743,
        "upid": "UNP-130",
        "n_intervenciones": 1,
        "nombre_up": "I.E. la Leonera",
        "nombre_up_detalle": "Principal",
        "nombre_centro_gestor": "Secretaría de Educación",
        "direccion": "Corregimiento la Leonera",
        "tipo_equipamiento": "Instituciones Educativas",
        "clase_up": "Dotaciones",
        "comuna_corregimiento": "La Leonera",
        "comuna_corregimiento_2": "La Leonera",
        "barrio_vereda": "Correg. La Leonera",
        "barrio_vereda_2": "La Leonera (Cabecera)",
        "identificador": "Sala de Lectura",
        "bpin": 0,
        "intervenciones": [
          {
            "intervencion_id": "UNP-130-01",
            "referencia_proceso": null,
            "referencia_contrato": null,
            "url_proceso": null,
            "bpin": 0,
            "estado": "Terminado",
            "tipo_intervencion": "Adecuaciones",
            "fuente_financiacion": "Ingresos libre destinación",
            "presupuesto_base": 30868000,
            "ano": 2024,
            "avance_obra": 100.0,
            "fecha_inicio": null,
            "fecha_fin": null,
            "fecha_inicio_std": null,
            "fecha_fin_std": null,
            "frente_activo": "No aplica",
            "fuera_rango": "ACEPTABLE",
            "lat": 3.454543,
            "lon": -76.637743
          }
        ],
        "presupuesto_base": 30868000,
        "avance_obra": 100.0
      }
    },
    {
      "type": "Feature",
      "geometry": {
        "type": "Point",
        "coordinates": [
          -76.51253,
          3.46914
        ]
      },
      "properties": {
        "lat": 3.46914,
        "lon": -76.51253,
        "upid": "UNP-131",
        "n_intervenciones": 1,
        "nombre_up": "I.E. José Antonio Galán",
        "nombre_up_detalle": "Principal",
        "nombre_centro_gestor": "Secretaría de Educación",
        "direccion": "Ind Cl 41 3n - 11",
        "tipo_equipamiento": "Instituciones Educativas",
        "clase_up": "Dotaciones",
        "comuna_corregimiento": "COMUNA 04",
        "comuna_corregimiento_2": "COMUNA 04",
        "barrio_vereda": "Popular",
        "barrio_vereda_2": "Popular",
        "identificador": "Biblioteca Escolar",
        "bpin": 0,
        "intervenciones": [
          {
            "intervencion_id": "UNP-131-01",
            "referencia_proceso": null,
            "referencia_contrato": null,
            "url_proceso": null,
            "bpin": 0,
            "estado": "Terminado",
            "tipo_intervencion": "Adecuaciones",
            "fuente_financiacion": "Ingresos libre destinación",
            "presupuesto_base": 107039840,
            "ano": 2025,
            "avance_obra": 100.0,
            "fecha_inicio": null,
            "fecha_fin": null,
            "fecha_inicio_std": null,
            "fecha_fin_std": null,
            "frente_activo": "No aplica",
            "fuera_rango": "ACEPTABLE",
            "lat": 3.46914,
            "lon": -76.51253
          }
        ],
        "presupuesto_base": 107039840,
        "avance_obra": 100.0
      }
    },
    {
      "type": "Feature",
      "geometry": {
        "type": "Point",
        "coordinates": [
          -76.485877,
          3.478716
        ]
      },
      "properties": {
        "lat": 3.478716,
        "lon": -76.485877,
        "upid": "UNP-132",
        "n_intervenciones": 1,
        "nombre_up": "I.E. Pedro Antonio Molina",
        "nombre_up_detalle": "San Luis",
        "nombre_centro_gestor": "Secretaría de Educación",
        "direccion": "Cl 72 1 B 03",
        "tipo_equipamiento": "Instituciones Educativas",
        "clase_up": "Dotaciones",
        "comuna_corregimiento": "COMUNA 06",
        "comuna_corregimiento_2": "COMUNA 06",
        "barrio_vereda": "San Luis",
        "barrio_vereda_2": "San Luis",
        "identificador": "Sala de Lectura",
        "bpin": 0,
        "intervenciones": [
          {
            "intervencion_id": "UNP-132-01",
            "referencia_proceso": null,
            "referencia_contrato": null,
            "url_proceso": null,
            "bpin": 0,
            "estado": "Terminado",
            "tipo_intervencion": "Adecuaciones",
            "fuente_financiacion": "Ingresos libre destinación",
            "presupuesto_base": 23914000,
            "ano": 2024,
            "avance_obra": 100.0,
            "fecha_inicio": null,
            "fecha_fin": null,
            "fecha_inicio_std": null,
            "fecha_fin_std": null,
            "frente_activo": "No aplica",
            "fuera_rango": "ACEPTABLE",
            "lat": 3.478716,
            "lon": -76.485877
          }
        ],
        "presupuesto_base": 23914000,
        "avance_obra": 100.0
      }
    },
    {
      "type": "Feature",
      "geometry": {
        "type": "Point",
        "coordinates": [
          -76.488321,
          3.457409
        ]
      },
      "properties": {
        "lat": 3.457409,
        "lon": -76.488321,
        "upid": "UNP-133",
        "n_intervenciones": 1,
        "nombre_up": "I.E. Manuel Maria Mallarino",
        "nombre_up_detalle": "Principal",
        "nombre_centro_gestor": "Secretaría de Educación",
        "direccion": "Ind Calle 63 Cr 7 L Bis # 63-10",
        "tipo_equipamiento": "Instituciones Educativas",
        "clase_up": "Dotaciones",
        "comuna_corregimiento": "COMUNA 07",
        "comuna_corregimiento_2": "COMUNA 07",
        "barrio_vereda": "Las Ceibas",
        "barrio_vereda_2": "Las Ceibas",
        "identificador": "Biblioteca Escolar",
        "bpin": 0,
        "intervenciones": [
          {
            "intervencion_id": "UNP-133-01",
            "referencia_proceso": null,
            "referencia_contrato": null,
            "url_proceso": null,
            "bpin": 0,
            "estado": "Terminado",
            "tipo_intervencion": "Adecuaciones",
            "fuente_financiacion": "Ingresos libre destinación",
            "presupuesto_base": 95141000,
            "ano": 2024,
            "avance_obra": 100.0,
            "fecha_inicio": null,
            "fecha_fin": null,
            "fecha_inicio_std": null,
            "fecha_fin_std": null,
            "frente_activo": "No aplica",
            "fuera_rango": "ACEPTABLE",
            "lat": 3.457409,
            "lon": -76.488321
          }
        ],
        "presupuesto_base": 95141000,
        "avance_obra": 100.0
      }
    },
    {
      "type": "Feature",
      "geometry": {
        "type": "Point",
        "coordinates": [
          -76.543294,
          3.442413
        ]
      },
      "properties": {
        "lat": 3.442413,
        "lon": -76.543294,
        "upid": "UNP-134",
        "n_intervenciones": 2,
        "nombre_up": "I.E. Normal Superior los Farallones",
        "nombre_up_detalle": "Principal",
        "nombre_centro_gestor": "Secretaría de Educación",
        "direccion": "Kr 22 2 65 Oeste",
        "tipo_equipamiento": "Instituciones Educativas",
        "clase_up": "Obras equipamientos",
        "comuna_corregimiento": "COMUNA 03",
        "comuna_corregimiento_2": "COMUNA 03",
        "barrio_vereda": "Navarro - La Chanca",
        "barrio_vereda_2": "Navarro - La Chanca",
        "identificador": "Presupuesto Participativo 2025",
        "bpin": 2024760010244,
        "intervenciones": [
          {
            "intervencion_id": "UNP-134-01",
            "referencia_proceso": "Obra: 4143.010.32.0860-2025\nInterventoria: 4143.010.32.0856-2025",
            "referencia_contrato": "Obra: 4143.010.26.1.1658.2025\nInterventoria: 4143.010.26.1.1536.2025",
            "url_proceso": "https://community.secop.gov.co/Public/Common/GoogleReCaptcha/Index?previousUrl=https%3a%2f%2fcommunity.secop.gov.co%2fPublic%2fTendering%2fOpportunityDetail%2fIndex%3fnoticeUID%3dCO1.NTC.8297173%26isFromPublicArea%3dTrue%26isModal%3dFalse, https://community.secop.gov.co/Public/Tendering/OpportunityDetail/Index?noticeUID=CO1.NTC.8286364&isFromPublicArea=True&isModal=False",
            "bpin": 2024760010244,
            "estado": "En ejecución",
            "tipo_intervencion": "Adecuaciones",
            "fuente_financiacion": "Presupuesto Participativo",
            "presupuesto_base": 376529728,
            "ano": 2025,
            "avance_obra": 27.0,
            "fecha_inicio": "16-09-2025",
            "fecha_fin": "2026-01-31T00:00:00",
            "fecha_inicio_std": "2025-09-16T00:00:00",
            "fecha_fin_std": "2026-01-31T00:00:00",
            "frente_activo": "Frente activo",
            "fuera_rango": "ACEPTABLE",
            "lat": 3.442413,
            "lon": -76.543294
          },
          {
            "intervencion_id": "UNP-134-02",
            "referencia_proceso": null,
            "referencia_contrato": null,
            "url_proceso": null,
            "bpin": 0,
            "estado": "Terminado",
            "tipo_intervencion": "Adecuaciones",
            "fuente_financiacion": "Ingresos libre destinación",
            "presupuesto_base": 107039840,
            "ano": 2025,
            "avance_obra": 100.0,
            "fecha_inicio": null,
            "fecha_fin": null,
            "fecha_inicio_std": null,
            "fecha_fin_std": null,
            "frente_activo": "No aplica",
            "fuera_rango": "ACEPTABLE",
            "lat": 3.442378,
            "lon": -76.543308
          }
        ],
        "presupuesto_base": 483569568,
        "avance_obra": 43.16
      }
    },
    {
      "type": "Feature",
      "geometry": {
        "type": "Point",
        "coordinates": [
          -76.498363,
          3.445939
        ]
      },
      "properties": {
        "lat": 3.445939,
        "lon": -76.498363,
        "upid": "UNP-135",
        "n_intervenciones": 1,
        "nombre_up": "I.E. Villa Colombia",
        "nombre_up_detalle": "Republica de Colombia",
        "nombre_centro_gestor": "Secretaría de Educación",
        "direccion": "Cl 53 12 e 11",
        "tipo_equipamiento": "Instituciones Educativas",
        "clase_up": "Dotaciones",
        "comuna_corregimiento": "COMUNA 08",
        "comuna_corregimiento_2": "COMUNA 08",
        "barrio_vereda": "Villa Colombia",
        "barrio_vereda_2": "Villa Colombia",
        "identificador": "Sala de Lectura",
        "bpin": 0,
        "intervenciones": [
          {
            "intervencion_id": "UNP-135-01",
            "referencia_proceso": null,
            "referencia_contrato": null,
            "url_proceso": null,
            "bpin": 0,
            "estado": "Terminado",
            "tipo_intervencion": "Adecuaciones",
            "fuente_financiacion": "Ingresos libre destinación",
            "presupuesto_base": 49319840,
            "ano": 2025,
            "avance_obra": 100.0,
            "fecha_inicio": null,
            "fecha_fin": null,
            "fecha_inicio_std": null,
            "fecha_fin_std": null,
            "frente_activo": "No aplica",
            "fuera_rango": "ACEPTABLE",
            "lat": 3.445939,
            "lon": -76.498363
          }
        ],
        "presupuesto_base": 49319840,
        "avance_obra": 100.0
      }
    },
    {
      "type": "Feature",
      "geometry": {
        "type": "Point",
        "coordinates": [
          -76.521733,
          3.439754
        ]
      },
      "properties": {
        "lat": 3.439754,
        "lon": -76.521733,
        "upid": "UNP-136",
        "n_intervenciones": 1,
        "nombre_up": "I.E. General Alfredo Vásquez Cobo",
        "nombre_up_detalle": "Nuestra Señora de los Remedios",
        "nombre_centro_gestor": "Secretaría de Educación",
        "direccion": "Kr 17 D 18 46",
        "tipo_equipamiento": "Instituciones Educativas",
        "clase_up": "Dotaciones",
        "comuna_corregimiento": "COMUNA 09",
        "comuna_corregimiento_2": "COMUNA 09",
        "barrio_vereda": "Belalcázar",
        "barrio_vereda_2": "Belalcázar",
        "identificador": "Sala de Lectura",
        "bpin": 0,
        "intervenciones": [
          {
            "intervencion_id": "UNP-136-01",
            "referencia_proceso": null,
            "referencia_contrato": null,
            "url_proceso": null,
            "bpin": 0,
            "estado": "Terminado",
            "tipo_intervencion": "Adecuaciones",
            "fuente_financiacion": "Ingresos libre destinación",
            "presupuesto_base": 49319840,
            "ano": 2025,
            "avance_obra": 100.0,
            "fecha_inicio": null,
            "fecha_fin": null,
            "fecha_inicio_std": null,
            "fecha_fin_std": null,
            "frente_activo": "No aplica",
            "fuera_rango": "ACEPTABLE",
            "lat": 3.439754,
            "lon": -76.521733
          }
        ],
        "presupuesto_base": 49319840,
        "avance_obra": 100.0
      }
    },
    {
      "type": "Feature",
      "geometry": {
        "type": "Point",
        "coordinates": [
          -76.502146,
          3.430347
        ]
      },
      "properties": {
        "lat": 3.430347,
        "lon": -76.502146,
        "upid": "UNP-137",
        "n_intervenciones": 1,
        "nombre_up": "Juan Xx Iii",
        "nombre_up_detalle": "Niño de Jesus de Pagra",
        "nombre_centro_gestor": "Secretaría de Educación",
        "direccion": "Kr 28 C 44 90",
        "tipo_equipamiento": "Instituciones Educativas",
        "clase_up": "Dotaciones",
        "comuna_corregimiento": "COMUNA 12",
        "comuna_corregimiento_2": "COMUNA 12",
        "barrio_vereda": "Sindical",
        "barrio_vereda_2": "Sindical",
        "identificador": "Sala de Lectura",
        "bpin": 0,
        "intervenciones": [
          {
            "intervencion_id": "UNP-137-01",
            "referencia_proceso": null,
            "referencia_contrato": null,
            "url_proceso": null,
            "bpin": 0,
            "estado": "Terminado",
            "tipo_intervencion": "Adecuaciones",
            "fuente_financiacion": "Ingresos libre destinación",
            "presupuesto_base": 30868000,
            "ano": 2024,
            "avance_obra": 100.0,
            "fecha_inicio": null,
            "fecha_fin": null,
            "fecha_inicio_std": null,
            "fecha_fin_std": null,
            "frente_activo": "No aplica",
            "fuera_rango": "ACEPTABLE",
            "lat": 3.430347,
            "lon": -76.502146
          }
        ],
        "presupuesto_base": 30868000,
        "avance_obra": 100.0
      }
    },
    {
      "type": "Feature",
      "geometry": {
        "type": "Point",
        "coordinates": [
          -76.497537,
          3.436173
        ]
      },
      "properties": {
        "lat": 3.436173,
        "lon": -76.497537,
        "upid": "UNP-138",
        "n_intervenciones": 1,
        "nombre_up": "I.E. Julio Caicedo y Tellez",
        "nombre_up_detalle": "Francisco de Paula Santander",
        "nombre_centro_gestor": "Secretaría de Educación",
        "direccion": "Kr 26 H 50 53",
        "tipo_equipamiento": "Instituciones Educativas",
        "clase_up": "Dotaciones",
        "comuna_corregimiento": "COMUNA 12",
        "comuna_corregimiento_2": "COMUNA 12",
        "barrio_vereda": "Nueva Floresta",
        "barrio_vereda_2": "Nueva Floresta",
        "identificador": "Biblioteca Escolar",
        "bpin": 0,
        "intervenciones": [
          {
            "intervencion_id": "UNP-138-01",
            "referencia_proceso": null,
            "referencia_contrato": null,
            "url_proceso": null,
            "bpin": 0,
            "estado": "Terminado",
            "tipo_intervencion": "Adecuaciones",
            "fuente_financiacion": "Ingresos libre destinación",
            "presupuesto_base": 107039840,
            "ano": 2025,
            "avance_obra": 100.0,
            "fecha_inicio": null,
            "fecha_fin": null,
            "fecha_inicio_std": null,
            "fecha_fin_std": null,
            "frente_activo": "No aplica",
            "fuera_rango": "ACEPTABLE",
            "lat": 3.436173,
            "lon": -76.497537
          }
        ],
        "presupuesto_base": 107039840,
        "avance_obra": 100.0
      }
    },
    {
      "type": "Feature",
      "geometry": {
        "type": "Point",
        "coordinates": [
          -76.501595,
          3.438292
        ]
      },
      "properties": {
        "lat": 3.438292,
        "lon": -76.501595,
        "upid": "UNP-139",
        "n_intervenciones": 1,
        "nombre_up": "I.E. Marice Sinisterra",
        "nombre_up_detalle": "Asturias",
        "nombre_centro_gestor": "Secretaría de Educación",
        "direccion": "Kr 24 B 43 40",
        "tipo_equipamiento": "Instituciones Educativas",
        "clase_up": "Dotaciones",
        "comuna_corregimiento": "COMUNA 12",
        "comuna_corregimiento_2": "COMUNA 12",
        "barrio_vereda": "Asturias",
        "barrio_vereda_2": "Asturias",
        "identificador": "Sala de Lectura",
        "bpin": 0,
        "intervenciones": [
          {
            "intervencion_id": "UNP-139-01",
            "referencia_proceso": null,
            "referencia_contrato": null,
            "url_proceso": null,
            "bpin": 0,
            "estado": "Terminado",
            "tipo_intervencion": "Adecuaciones",
            "fuente_financiacion": "Ingresos libre destinación",
            "presupuesto_base": 49319840,
            "ano": 2025,
            "avance_obra": 100.0,
            "fecha_inicio": null,
            "fecha_fin": null,
            "fecha_inicio_std": null,
            "fecha_fin_std": null,
            "frente_activo": "No aplica",
            "fuera_rango": "ACEPTABLE",
            "lat": 3.438292,
            "lon": -76.501595
          }
        ],
        "presupuesto_base": 49319840,
        "avance_obra": 100.0
      }
    },
    {
      "type": "Feature",
      "geometry": {
        "type": "Point",
        "coordinates": [
          -76.527156,
          3.414696
        ]
      },
      "properties": {
        "lat": 3.414696,
        "lon": -76.527156,
        "upid": "UNP-140",
        "n_intervenciones": 1,
        "nombre_up": "I.E. Carlos Holguin Lloreda",
        "nombre_up_detalle": "Sd Jardin Infantil Nacional No. 2",
        "nombre_centro_gestor": "Secretaría de Educación",
        "direccion": "Kr 42 a 14 B 15",
        "tipo_equipamiento": "Instituciones Educativas",
        "clase_up": "Dotaciones",
        "comuna_corregimiento": "COMUNA 10",
        "comuna_corregimiento_2": "COMUNA 10",
        "barrio_vereda": "El Guabal",
        "barrio_vereda_2": "El Guabal",
        "identificador": "Sala de Lectura",
        "bpin": 0,
        "intervenciones": [
          {
            "intervencion_id": "UNP-140-01",
            "referencia_proceso": null,
            "referencia_contrato": null,
            "url_proceso": null,
            "bpin": 0,
            "estado": "Terminado",
            "tipo_intervencion": "Adecuaciones",
            "fuente_financiacion": "Ingresos libre destinación",
            "presupuesto_base": 49319840,
            "ano": 2025,
            "avance_obra": 100.0,
            "fecha_inicio": null,
            "fecha_fin": null,
            "fecha_inicio_std": null,
            "fecha_fin_std": null,
            "frente_activo": "No aplica",
            "fuera_rango": "ACEPTABLE",
            "lat": 3.414696,
            "lon": -76.527156
          }
        ],
        "presupuesto_base": 49319840,
        "avance_obra": 100.0
      }
    },
    {
      "type": "Feature",
      "geometry": {
        "type": "Point",
        "coordinates": [
          -76.520295,
          3.423383
        ]
      },
      "properties": {
        "lat": 3.423383,
        "lon": -76.520295,
        "upid": "UNP-141",
        "n_intervenciones": 1,
        "nombre_up": "I.E. Boyaca",
        "nombre_up_detalle": "Principal",
        "nombre_centro_gestor": "Secretaría de Educación",
        "direccion": "Kr 33 a 25 25",
        "tipo_equipamiento": "Instituciones Educativas",
        "clase_up": "Dotaciones",
        "comuna_corregimiento": "COMUNA 11",
        "comuna_corregimiento_2": "COMUNA 11",
        "barrio_vereda": "Urbanización Boyaca",
        "barrio_vereda_2": "Urbanización Boyaca",
        "identificador": "Biblioteca Escolar",
        "bpin": 0,
        "intervenciones": [
          {
            "intervencion_id": "UNP-141-01",
            "referencia_proceso": null,
            "referencia_contrato": null,
            "url_proceso": null,
            "bpin": 0,
            "estado": "Terminado",
            "tipo_intervencion": "Adecuaciones",
            "fuente_financiacion": "Ingresos libre destinación",
            "presupuesto_base": 107039840,
            "ano": 2025,
            "avance_obra": 100.0,
            "fecha_inicio": null,
            "fecha_fin": null,
            "fecha_inicio_std": null,
            "fecha_fin_std": null,
            "frente_activo": "No aplica",
            "fuera_rango": "ACEPTABLE",
            "lat": 3.423383,
            "lon": -76.520295
          }
        ],
        "presupuesto_base": 107039840,
        "avance_obra": 100.0
      }
    },
    {
      "type": "Feature",
      "geometry": {
        "type": "Point",
